keyword,caption_name,location,topic_id,ENTITY_LABEL,name,description,source,source_identifier,global_identifier
camp ashland ang,US National Guard installation Camp Ashland,a347,188258,ForeignMinistry,US National Guard installation Camp Ashland,,basementions_mentionee,4b516c9a3b16e906fa436cc9fdc6ac23,basementions_mentionee__4b516c9a3b16e906fa436cc9fdc6ac23
los alamos demolition range,Los Alamos National Laboratory,a299,188258,LegislativeCommittee,Los Alamos National Laboratory,,basementions_mentionee,29089c561edb9de8462f00ce27e13712,basementions_mentionee__29089c561edb9de8462f00ce27e13712
los alamos national laboratory,Los Alamos National Laboratory,a299,188258,Exec,Los Alamos National Laboratory,,basementions_mentionee,29089c561edb9de8462f00ce27e13712,basementions_mentionee__29089c561edb9de8462f00ce27e13712
camp butner training center,US Army installation Camp Butner,a348,188258,CompanyKeyword,US Army installation Camp Butner,,basementions_mentionee,86fd2f4cc46faa8c7374f4e548659373,basementions_mentionee__86fd2f4cc46faa8c7374f4e548659373
camp butner,US Army installation Camp Butner,a348,188258,DiplomaticFacilities,US Army installation Camp Butner,,basementions_mentionee,86fd2f4cc46faa8c7374f4e548659373,basementions_mentionee__86fd2f4cc46faa8c7374f4e548659373
camp davis mcolf,Marine Corps Outlying Field Camp Davis,a349,188258,Diplomat,Marine Corps Outlying Field Camp Davis,,basementions_mentionee,e3443efe4781e7c90e21317463072c97,basementions_mentionee__e3443efe4781e7c90e21317463072c97
camp davis,Marine Corps Outlying Field Camp Davis,a349,188258,Person,Marine Corps Outlying Field Camp Davis,,basementions_mentionee,e3443efe4781e7c90e21317463072c97,basementions_mentionee__e3443efe4781e7c90e21317463072c97
marine corps outlying field camp davis,Marine Corps Outlying Field Camp Davis,a349,188258,LegislativeCommittee,Marine Corps Outlying Field Camp Davis,,basementions_mentionee,e3443efe4781e7c90e21317463072c97,basementions_mentionee__e3443efe4781e7c90e21317463072c97
camp mackall,US Army installation Camp Mackall,a350,188258,space,US Army installation Camp Mackall,,basementions_mentionee,dbe8680c4ab748ba3a99b4baa39118f2,basementions_mentionee__dbe8680c4ab748ba3a99b4baa39118f2
mackall army air field,US Army installation Camp Mackall,a350,188258,Person,US Army installation Camp Mackall,,basementions_mentionee,dbe8680c4ab748ba3a99b4baa39118f2,basementions_mentionee__dbe8680c4ab748ba3a99b4baa39118f2
mackall aaf,US Army installation Camp Mackall,a350,188258,LegislativeCommittee,US Army installation Camp Mackall,,basementions_mentionee,dbe8680c4ab748ba3a99b4baa39118f2,basementions_mentionee__dbe8680c4ab748ba3a99b4baa39118f2
military ocean terminal sunny point,Military Ocean Terminal Sunny Point,a351,188258,Consulates,Military Ocean Terminal Sunny Point,,basementions_mentionee,fa357855c952d59717815278eaa876c1,basementions_mentionee__fa357855c952d59717815278eaa876c1
mot sunny point,Military Ocean Terminal Sunny Point,a351,188258,CompanyKeyword,Military Ocean Terminal Sunny Point,,basementions_mentionee,fa357855c952d59717815278eaa876c1,basementions_mentionee__fa357855c952d59717815278eaa876c1
camp grafton,US National Guard installation Camp Grafton,a352,188258,ForeignMinister,US National Guard installation Camp Grafton,,basementions_mentionee,bc797c647d9ec4f95d4bce8cbb81f932,basementions_mentionee__bc797c647d9ec4f95d4bce8cbb81f932
camp grafton training center,US National Guard installation Camp Grafton,a352,188258,DiplomaticFacilities,US National Guard installation Camp Grafton,,basementions_mentionee,bc797c647d9ec4f95d4bce8cbb81f932,basementions_mentionee__bc797c647d9ec4f95d4bce8cbb81f932
tc camp grafton,US National Guard installation Camp Grafton,a352,188258,LegislativeCommittee,US National Guard installation Camp Grafton,,basementions_mentionee,bc797c647d9ec4f95d4bce8cbb81f932,basementions_mentionee__bc797c647d9ec4f95d4bce8cbb81f932
camp perry,US National Guard installation Camp Perry,a353,188258,CompanyKeyword,US National Guard installation Camp Perry,,basementions_mentionee,ef6c1a40c6cc9131b4b5d6ed6cab1b07,basementions_mentionee__ef6c1a40c6cc9131b4b5d6ed6cab1b07
camp james a garfield,Camp James A Garfield Joint Military Training Center,a354,188258,Pipeline,Camp James A Garfield Joint Military Training Center,,basementions_mentionee,810d74b1e56d0c620177ea430514cb81,basementions_mentionee__810d74b1e56d0c620177ea430514cb81
camp ravenna,Camp James A Garfield Joint Military Training Center,a354,188258,CompanyKeyword,Camp James A Garfield Joint Military Training Center,,basementions_mentionee,810d74b1e56d0c620177ea430514cb81,basementions_mentionee__810d74b1e56d0c620177ea430514cb81
camp ja garfield,Camp James A Garfield Joint Military Training Center,a354,188258,LegislativeCommittee,Camp James A Garfield Joint Military Training Center,,basementions_mentionee,810d74b1e56d0c620177ea430514cb81,basementions_mentionee__810d74b1e56d0c620177ea430514cb81
camp garfield,Camp James A Garfield Joint Military Training Center,a354,188258,AAEntity,Camp James A Garfield Joint Military Training Center,,basementions_mentionee,810d74b1e56d0c620177ea430514cb81,basementions_mentionee__810d74b1e56d0c620177ea430514cb81
camp james garfield,Camp James A Garfield Joint Military Training Center,a354,188258,FTO,Camp James A Garfield Joint Military Training Center,,basementions_mentionee,810d74b1e56d0c620177ea430514cb81,basementions_mentionee__810d74b1e56d0c620177ea430514cb81
garfield jmtc,Camp James A Garfield Joint Military Training Center,a354,188258,Exec,Camp James A Garfield Joint Military Training Center,,basementions_mentionee,810d74b1e56d0c620177ea430514cb81,basementions_mentionee__810d74b1e56d0c620177ea430514cb81
camp sherman joint training center,Camp Sherman Joint Training Center,a355,188258,ForeignMinister,Camp Sherman Joint Training Center,,basementions_mentionee,6ac2d1554830a3679ca582779b65d918,basementions_mentionee__6ac2d1554830a3679ca582779b65d918
camp sherman,Camp Sherman Joint Training Center,a355,188258,Wells,Camp Sherman Joint Training Center,,basementions_mentionee,6ac2d1554830a3679ca582779b65d918,basementions_mentionee__6ac2d1554830a3679ca582779b65d918
jtc camp sherman,Camp Sherman Joint Training Center,a355,188258,Wells,Camp Sherman Joint Training Center,,basementions_mentionee,6ac2d1554830a3679ca582779b65d918,basementions_mentionee__6ac2d1554830a3679ca582779b65d918
harrisburg military post,Harrisburg Military Post,a356,188258,News,Harrisburg Military Post,,basementions_mentionee,a2476f9297d6830cf5f4659f88d11c74,basementions_mentionee__a2476f9297d6830cf5f4659f88d11c74
harrisburg mp,Harrisburg Military Post,a356,188258,ForeignMinister,Harrisburg Military Post,,basementions_mentionee,a2476f9297d6830cf5f4659f88d11c74,basementions_mentionee__a2476f9297d6830cf5f4659f88d11c74
new cumberland army depot,New Cumberland Defense Depot,a357,188258,Diplomat,New Cumberland Defense Depot,,basementions_mentionee,abe0c7097c2a95ca34f8a553e315a6d9,basementions_mentionee__abe0c7097c2a95ca34f8a553e315a6d9
new cumberland ap,New Cumberland Defense Depot,a357,188258,Pipeline,New Cumberland Defense Depot,,basementions_mentionee,abe0c7097c2a95ca34f8a553e315a6d9,basementions_mentionee__abe0c7097c2a95ca34f8a553e315a6d9
naval support activity mechanicsburg,Naval Support Activity Mechanicsburg,a358,188258,Media,Naval Support Activity Mechanicsburg,,basementions_mentionee,606fa07afa5b9c4634c50ead2a35fe71,basementions_mentionee__606fa07afa5b9c4634c50ead2a35fe71
nsa mechanicsburg,Naval Support Activity Mechanicsburg,a358,188258,Person,Naval Support Activity Mechanicsburg,,basementions_mentionee,606fa07afa5b9c4634c50ead2a35fe71,basementions_mentionee__606fa07afa5b9c4634c50ead2a35fe71
fort allen training center,US Army installation Fort Allen near Juana Diaz,a359,188258,IndustryTerm,US Army installation Fort Allen near Juana Diaz,,basementions_mentionee,a884e7a949bd863fdae972419f719e0e,basementions_mentionee__a884e7a949bd863fdae972419f719e0e
fort allen,US Army installation Fort Allen near Juana Diaz,a359,188258,Media,US Army installation Fort Allen near Juana Diaz,,basementions_mentionee,a884e7a949bd863fdae972419f719e0e,basementions_mentionee__a884e7a949bd863fdae972419f719e0e
ft allen,US Army installation Fort Allen near Juana Diaz,a359,188258,IndustryTerm,US Army installation Fort Allen near Juana Diaz,,basementions_mentionee,a884e7a949bd863fdae972419f719e0e,basementions_mentionee__a884e7a949bd863fdae972419f719e0e
camp varnum,US National Guard installation Camp Varnum,a360,188258,Person,US National Guard installation Camp Varnum,,basementions_mentionee,5d85e81baed639c72c74bf69a89f1056,basementions_mentionee__5d85e81baed639c72c74bf69a89f1056
milan army ammunition plant,Milan Army Ammunition Plant,a361,188258,Media,Milan Army Ammunition Plant,,basementions_mentionee,41443d5d6f4104f0d277b01efdc93215,basementions_mentionee__41443d5d6f4104f0d277b01efdc93215
milan aap,Milan Army Ammunition Plant,a361,188258,ForeignMinister,Milan Army Ammunition Plant,,basementions_mentionee,41443d5d6f4104f0d277b01efdc93215,basementions_mentionee__41443d5d6f4104f0d277b01efdc93215
martindale army air field,Martindale Army Air Field,a362,188258,IndustryTerm,Martindale Army Air Field,,basementions_mentionee,a57d64e3e10ec2d649f28d08652d7b48,basementions_mentionee__a57d64e3e10ec2d649f28d08652d7b48
martindale aaf,Martindale Army Air Field,a362,188258,space,Martindale Army Air Field,,basementions_mentionee,a57d64e3e10ec2d649f28d08652d7b48,basementions_mentionee__a57d64e3e10ec2d649f28d08652d7b48
naval air station kingsville,Naval Air Station Kingsville,a363,188258,Shipping,Naval Air Station Kingsville,,basementions_mentionee,9b55c633adf55aa1a6db315e1d4d9deb,basementions_mentionee__9b55c633adf55aa1a6db315e1d4d9deb
nas kingsville,Naval Air Station Kingsville,a363,188258,Media,Naval Air Station Kingsville,,basementions_mentionee,9b55c633adf55aa1a6db315e1d4d9deb,basementions_mentionee__9b55c633adf55aa1a6db315e1d4d9deb
dugway proving ground,Dugway Proving Ground,a364,188258,ForeignMinistry,Dugway Proving Ground,,basementions_mentionee,5753813903eedde99c7de9f70e6a992c,basementions_mentionee__5753813903eedde99c7de9f70e6a992c
tooele army depot,Tooele Army Depot,a365,188258,Shipping,Tooele Army Depot,,basementions_mentionee,1c7c68da939f4c39d86da25acdf30c9a,basementions_mentionee__1c7c68da939f4c39d86da25acdf30c9a
tooele ad,Tooele Army Depot,a365,188258,Exec,Tooele Army Depot,,basementions_mentionee,1c7c68da939f4c39d86da25acdf30c9a,basementions_mentionee__1c7c68da939f4c39d86da25acdf30c9a
camp ethan allen training site,US National Guard installation Camp Ethan Allen Training Site,a366,188258,CompanyKeyword,US National Guard installation Camp Ethan Allen Training Site,,basementions_mentionee,96b523ba5f358b5d306f331411471fe5,basementions_mentionee__96b523ba5f358b5d306f331411471fe5
camp ethan allen,US National Guard installation Camp Ethan Allen Training Site,a366,188258,Media,US National Guard installation Camp Ethan Allen Training Site,,basementions_mentionee,96b523ba5f358b5d306f331411471fe5,basementions_mentionee__96b523ba5f358b5d306f331411471fe5
joint base myer-henderson hall,Joint Base Myer-Henderson Hall,a367,188258,FTO,Joint Base Myer-Henderson Hall,,basementions_mentionee,777d104c858f86fa6639da508734c3ff,basementions_mentionee__777d104c858f86fa6639da508734c3ff
jbm myer-henderson hall,Joint Base Myer-Henderson Hall,a367,188258,Consulates,Joint Base Myer-Henderson Hall,,basementions_mentionee,777d104c858f86fa6639da508734c3ff,basementions_mentionee__777d104c858f86fa6639da508734c3ff
fort myer,Joint Base Myer-Henderson Hall,a367,188258,Person,Joint Base Myer-Henderson Hall,,basementions_mentionee,777d104c858f86fa6639da508734c3ff,basementions_mentionee__777d104c858f86fa6639da508734c3ff
ft myer,Joint Base Myer-Henderson Hall,a367,188258,Media,Joint Base Myer-Henderson Hall,,basementions_mentionee,777d104c858f86fa6639da508734c3ff,basementions_mentionee__777d104c858f86fa6639da508734c3ff
henderson hall,Joint Base Myer-Henderson Hall,a367,188258,CompanyKeyword,Joint Base Myer-Henderson Hall,,basementions_mentionee,777d104c858f86fa6639da508734c3ff,basementions_mentionee__777d104c858f86fa6639da508734c3ff
joint expeditionary base little creek–fort story,Joint Expeditionary Base Little Creek-Fort Story,a368,188258,Legislator,Joint Expeditionary Base Little Creek-Fort Story,,basementions_mentionee,b3422e2dda25d55b588181141db00150,basementions_mentionee__b3422e2dda25d55b588181141db00150
joint expeditionary base–little creek,Joint Expeditionary Base Little Creek-Fort Story,a368,188258,CompanyKeyword,Joint Expeditionary Base Little Creek-Fort Story,,basementions_mentionee,b3422e2dda25d55b588181141db00150,basementions_mentionee__b3422e2dda25d55b588181141db00150
jeb little creek,Joint Expeditionary Base Little Creek-Fort Story,a368,188258,Wells,Joint Expeditionary Base Little Creek-Fort Story,,basementions_mentionee,b3422e2dda25d55b588181141db00150,basementions_mentionee__b3422e2dda25d55b588181141db00150
jeb fort story,Joint Expeditionary Base Little Creek-Fort Story,a368,188258,CompanyKeyword,Joint Expeditionary Base Little Creek-Fort Story,,basementions_mentionee,b3422e2dda25d55b588181141db00150,basementions_mentionee__b3422e2dda25d55b588181141db00150
jeb little creek-fort story,Joint Expeditionary Base Little Creek-Fort Story,a368,188258,Legislator,Joint Expeditionary Base Little Creek-Fort Story,,basementions_mentionee,b3422e2dda25d55b588181141db00150,basementions_mentionee__b3422e2dda25d55b588181141db00150
fort story,Joint Expeditionary Base Little Creek-Fort Story,a368,188258,Organization,Joint Expeditionary Base Little Creek-Fort Story,,basementions_mentionee,b3422e2dda25d55b588181141db00150,basementions_mentionee__b3422e2dda25d55b588181141db00150
ft story,Joint Expeditionary Base Little Creek-Fort Story,a368,188258,ForeignMinister,Joint Expeditionary Base Little Creek-Fort Story,,basementions_mentionee,b3422e2dda25d55b588181141db00150,basementions_mentionee__b3422e2dda25d55b588181141db00150
joint base little creek,Joint Expeditionary Base Little Creek-Fort Story,a368,188258,News,Joint Expeditionary Base Little Creek-Fort Story,,basementions_mentionee,b3422e2dda25d55b588181141db00150,basementions_mentionee__b3422e2dda25d55b588181141db00150
navy little creek,Joint Expeditionary Base Little Creek-Fort Story,a368,188258,IndustryTerm,Joint Expeditionary Base Little Creek-Fort Story,,basementions_mentionee,b3422e2dda25d55b588181141db00150,basementions_mentionee__b3422e2dda25d55b588181141db00150
national ground intelligence center,National Ground Intelligence Center,a369,188258,Consulates,National Ground Intelligence Center,,basementions_mentionee,3c96da2340c0bfd197870ea0b5ca0de2,basementions_mentionee__3c96da2340c0bfd197870ea0b5ca0de2
naval support activity hampton roads,Naval Support Activity Hampton Roads,a370,188258,Refinery,Naval Support Activity Hampton Roads,,basementions_mentionee,3a99530bc7a5782f1990f3255f4aa1e7,basementions_mentionee__3a99530bc7a5782f1990f3255f4aa1e7
n s a hampton roads,Naval Support Activity Hampton Roads,a370,188258,News,Naval Support Activity Hampton Roads,,basementions_mentionee,3a99530bc7a5782f1990f3255f4aa1e7,basementions_mentionee__3a99530bc7a5782f1990f3255f4aa1e7
nsa hr,Naval Support Activity Hampton Roads,a370,188258,Refinery,Naval Support Activity Hampton Roads,,basementions_mentionee,3a99530bc7a5782f1990f3255f4aa1e7,basementions_mentionee__3a99530bc7a5782f1990f3255f4aa1e7
naval support activity northwest annex,Naval Support Activity Hampton Roads,a370,188258,space,Naval Support Activity Hampton Roads,,basementions_mentionee,3a99530bc7a5782f1990f3255f4aa1e7,basementions_mentionee__3a99530bc7a5782f1990f3255f4aa1e7
nsa hampton roads,Naval Support Activity Hampton Roads,a370,188258,Diplomat,Naval Support Activity Hampton Roads,,basementions_mentionee,3a99530bc7a5782f1990f3255f4aa1e7,basementions_mentionee__3a99530bc7a5782f1990f3255f4aa1e7
radford army ammunition plant,Radford Army Ammunition Plant,a371,188258,DiplomaticFacilities,Radford Army Ammunition Plant,,basementions_mentionee,ea677e528641e1183132143cfd93f1a2,basementions_mentionee__ea677e528641e1183132143cfd93f1a2
radford aap,Radford Army Ammunition Plant,a371,188258,Keyphrase,Radford Army Ammunition Plant,,basementions_mentionee,ea677e528641e1183132143cfd93f1a2,basementions_mentionee__ea677e528641e1183132143cfd93f1a2
the judge advocate general's legal center and school,US Army Judge Advocate General's Legal Center and School,a372,188258,Wells,US Army Judge Advocate General's Legal Center and School,,basementions_mentionee,b7a292a100a825fe9b03528c23cd6691,basementions_mentionee__b7a292a100a825fe9b03528c23cd6691
jag school,US Army Judge Advocate General's Legal Center and School,a372,188258,Pipeline,US Army Judge Advocate General's Legal Center and School,,basementions_mentionee,b7a292a100a825fe9b03528c23cd6691,basementions_mentionee__b7a292a100a825fe9b03528c23cd6691
warrenton training center,Warrenton Training Center,a373,188258,AAEntity,Warrenton Training Center,,basementions_mentionee,c456f8ae9da5fcb875c89b88a1452429,basementions_mentionee__c456f8ae9da5fcb875c89b88a1452429
warrenton tc,Warrenton Training Center,a373,188258,Wells,Warrenton Training Center,,basementions_mentionee,c456f8ae9da5fcb875c89b88a1452429,basementions_mentionee__c456f8ae9da5fcb875c89b88a1452429
camp dawson west virginia training area,US National Guard installation Camp Dawson,a374,188258,Diplomat,US National Guard installation Camp Dawson,,basementions_mentionee,2d25c53fca02de31f7caa846fe11c646,basementions_mentionee__2d25c53fca02de31f7caa846fe11c646
camp dawson,US National Guard installation Camp Dawson,a374,188258,Exec,US National Guard installation Camp Dawson,,basementions_mentionee,2d25c53fca02de31f7caa846fe11c646,basementions_mentionee__2d25c53fca02de31f7caa846fe11c646
alabama national guard,Maxwell Air Force Base and Gunter Annex,a124,188258,Refinery,Maxwell Air Force Base and Gunter Annex,,basementions_mentionee,b39aa1f58c44e856b7501b701d55defd,basementions_mentionee__b39aa1f58c44e856b7501b701d55defd
joint base camp bullis,US Joint Base Camp Bullis,a375,188258,DiplomaticFacilities,US Joint Base Camp Bullis,,basementions_mentionee,359f407ba9a940df8d49cbb849ef8214,basementions_mentionee__359f407ba9a940df8d49cbb849ef8214
information warfare training command corry station,US Navy installation IWTC Corry Station,a376,188258,CompanyKeyword,US Navy installation IWTC Corry Station,,basementions_mentionee,dc9f309b51ca6ddd31377f9c5dcf04ce,basementions_mentionee__dc9f309b51ca6ddd31377f9c5dcf04ce
henderson hall marine corps base,US Marine Corps Base Henderson Hall,a379,188258,Refinery,US Marine Corps Base Henderson Hall,,basementions_mentionee,868de111f0c9d46ae50021e028c58c08,basementions_mentionee__868de111f0c9d46ae50021e028c58c08
brooks city air force base,former Brooks City Air Force Base,a380,188258,ForeignMinistry,former Brooks City Air Force Base,,basementions_mentionee,04bae712b43ee089204bd7c4f07a6f71,basementions_mentionee__04bae712b43ee089204bd7c4f07a6f71
naes navy base,US Air Force installation Lakehurst Maxfield Field,a218,188258,Organization,US Air Force installation Lakehurst Maxfield Field,,basementions_mentionee,64697a967150c1a5a5cf8104c787d203,basementions_mentionee__64697a967150c1a5a5cf8104c787d203
mcdill air force base,MacDill Air Force Base,a225,188258,Consulates,MacDill Air Force Base,,basementions_mentionee,dd19218d2ed9b01c789b3863d890f4ce,basementions_mentionee__dd19218d2ed9b01c789b3863d890f4ce
mcclellan afb,former McClellan Air Force Base,a387,188258,Shipping,former McClellan Air Force Base,,basementions_mentionee,77d432edba3fdb555075132488d29a5e,basementions_mentionee__77d432edba3fdb555075132488d29a5e
mcclellan air force base,former McClellan Air Force Base,a387,188258,Wells,former McClellan Air Force Base,,basementions_mentionee,77d432edba3fdb555075132488d29a5e,basementions_mentionee__77d432edba3fdb555075132488d29a5e
mclb albany army base,US Marine Corps Logistics Base Albany,a240,188258,AAEntity,US Marine Corps Logistics Base Albany,,basementions_mentionee,b5d60aa390db0eda433ec8086f4ad003,basementions_mentionee__b5d60aa390db0eda433ec8086f4ad003
camp clark,US Military Training Area Camp Clark,a389,188258,Legislator,US Military Training Area Camp Clark,,basementions_mentionee,d03066e240094d8389ed6f625065fd47,basementions_mentionee__d03066e240094d8389ed6f625065fd47
natick center,US Army Garrison Natick Soldier Systems Center,a254,188258,LegislativeCommittee,US Army Garrison Natick Soldier Systems Center,,basementions_mentionee,60692f0610d45f5520eb3e82762439fc,basementions_mentionee__60692f0610d45f5520eb3e82762439fc
natick army soldiers systems center,US Army Garrison Natick Soldier Systems Center,a254,188258,Media,US Army Garrison Natick Soldier Systems Center,,basementions_mentionee,60692f0610d45f5520eb3e82762439fc,basementions_mentionee__60692f0610d45f5520eb3e82762439fc
great lakes training center,Great Lakes Training Center,a392,188258,Organization,Great Lakes Training Center,,basementions_mentionee,82b39e4cab279e53811c3faab1eb461b,basementions_mentionee__82b39e4cab279e53811c3faab1eb461b
point loma,Naval Base Point Loma,a263,188258,Pipeline,Naval Base Point Loma,,basementions_mentionee,d52a5732fa955df9cf1b464f6a49d34f,basementions_mentionee__d52a5732fa955df9cf1b464f6a49d34f
naval air warfare center navy base,Naval Air Warfare Center Training System Division,a396,188258,Consulates,Naval Air Warfare Center Training System Division,,basementions_mentionee,fcf2bd93c6a058fa7c8a2d0d388bba18,basementions_mentionee__fcf2bd93c6a058fa7c8a2d0d388bba18
kings bay,Kings Bay Naval Submarine Base,a270,188258,News,Kings Bay Naval Submarine Base,,basementions_mentionee,981e83db4a012c696551d3c51f225a66,basementions_mentionee__981e83db4a012c696551d3c51f225a66
uso pohakuloa training area,USO Pohakuloa Training Area,a278,188258,Exec,USO Pohakuloa Training Area,,basementions_mentionee,6f2e6f00ba0fcf2e5d6dcbc56076e0ec,basementions_mentionee__6f2e6f00ba0fcf2e5d6dcbc56076e0ec
parks reserve forces training area,Parks Reserve Forces Training Area,a279,188258,ForeignMinistry,Parks Reserve Forces Training Area,,basementions_mentionee,ff71b409642b921baa8ddad3570055fa,basementions_mentionee__ff71b409642b921baa8ddad3570055fa
us army pueblo chemical depot,US Army Pueblo Chemical Depot,a280,188258,LegislativeCommittee,US Army Pueblo Chemical Depot,,basementions_mentionee,b20b334dcc7448cee80d2616e5c97640,basementions_mentionee__b20b334dcc7448cee80d2616e5c97640
camp santiago joint training center,Camp Santiago Joint Training Center,a281,188258,Shipping,Camp Santiago Joint Training Center,,basementions_mentionee,b5a60b7721eeb7cdc9e1ba97297fa513,basementions_mentionee__b5a60b7721eeb7cdc9e1ba97297fa513
naval support activity charleston,Naval Support Activity Charleston,a267,188258,Exec,Naval Support Activity Charleston,,basementions_mentionee,6a2875480e67604f075f8b801b17938f,basementions_mentionee__6a2875480e67604f075f8b801b17938f
joint forces training base los alamitos,Joint Forces Training Base Los Alamitos,a397,188258,ForeignMinister,Joint Forces Training Base Los Alamitos,,basementions_mentionee,ff9b89c6807f465298d792b98ea8eafd,basementions_mentionee__ff9b89c6807f465298d792b98ea8eafd
us coast guard base kodiak,US Coast Guard Base Kodiak,a310,188258,Exec,US Coast Guard Base Kodiak,,basementions_mentionee,c23ad697f4d22c92f1c8bb42a6ca9a74,basementions_mentionee__c23ad697f4d22c92f1c8bb42a6ca9a74
us coast guard station juneau,US Coast Guard Station Juneau,a311,188258,Legislator,US Coast Guard Station Juneau,,basementions_mentionee,a2f90b78273118f5f20ac3aabe3217e7,basementions_mentionee__a2f90b78273118f5f20ac3aabe3217e7
us coast guard southeast,US Coast Guard Southeast,a399,188258,DiplomaticFacilities,US Coast Guard Southeast,,basementions_mentionee,a36020143c746c85173d3ef473ea82d6,basementions_mentionee__a36020143c746c85173d3ef473ea82d6
us coast guard base alameda,US Coast Guard Base Alameda,a400,188258,Exec,US Coast Guard Base Alameda,,basementions_mentionee,be909346bd55397532abcf22e6a4cb11,basementions_mentionee__be909346bd55397532abcf22e6a4cb11
us coast guard base honolulu,US Coast Guard Base Honolulu,a401,188258,Diplomat,US Coast Guard Base Honolulu,,basementions_mentionee,45c8ac7f645d671f65b5d4de6887e7af,basementions_mentionee__45c8ac7f645d671f65b5d4de6887e7af
us coast guard air station borinquen,US Coast Guard Air Station Borinquen,a402,188258,Consulates,US Coast Guard Air Station Borinquen,,basementions_mentionee,9cac10106d05fee413722b9f240d1cf5,basementions_mentionee__9cac10106d05fee413722b9f240d1cf5
us coast guard sector southeast new england,US Coast Guard Sector Southeast New England,a106,188258,Wells,US Coast Guard Sector Southeast New England,,basementions_mentionee,bd17359a5aec6dc38ea855447200c415,basementions_mentionee__bd17359a5aec6dc38ea855447200c415
us coast guard training center cape may,US Coast Guard Training Center Cape May,a403,188258,ForeignMinister,US Coast Guard Training Center Cape May,,basementions_mentionee,a2651a3f8b6197db69c9fa2df9d1c29d,basementions_mentionee__a2651a3f8b6197db69c9fa2df9d1c29d
us coast guard station miami beach,US Coast Guard Station Miami Beach,a404,188258,ForeignMinister,US Coast Guard Station Miami Beach,,basementions_mentionee,caad6fe209b54de21f55b538863b43db,basementions_mentionee__caad6fe209b54de21f55b538863b43db
united states military academy west point,US Military Academy West Point,a315,188258,FTO,US Military Academy West Point,,basementions_mentionee,3cd4a8b0d9a0ba4e5cb1f931086009bf,basementions_mentionee__3cd4a8b0d9a0ba4e5cb1f931086009bf
"san joaquin depot, tracy facility",San Joaquin Depot,a318,188258,AAEntity,San Joaquin Depot,,basementions_mentionee,b71aa0adc87ca379f108cb414dfe8aa2,basementions_mentionee__b71aa0adc87ca379f108cb414dfe8aa2
nsf indian head navy base,Naval Support Facility Indian Head,a325,188258,LegislativeCommittee,Naval Support Facility Indian Head,,basementions_mentionee,19d0010a70309832fb7f0fc222c0865f,basementions_mentionee__19d0010a70309832fb7f0fc222c0865f
