keyword,caption_name,location,topic_id,ENTITY_LABEL,name,description,source,source_identifier,global_identifier
us army garrison fort huachuca,US Army installation Fort Huachuca,a173,188258,Media,US Army installation Fort Huachuca,,basementions_mentionee,a89e722676f84c86a9c66e3cc57a1017,basementions_mentionee__a89e722676f84c86a9c66e3cc57a1017
ft huachuca,US Army installation Fort Huachuca,a173,188258,ForeignMinister,US Army installation Fort Huachuca,,basementions_mentionee,a89e722676f84c86a9c66e3cc57a1017,basementions_mentionee__a89e722676f84c86a9c66e3cc57a1017
fort benning army base,US Army Garrison Fort Benning,a174,188258,ForeignMinister,US Army Garrison Fort Benning,,basementions_mentionee,af2724136949ad46f139609ec85beae5,basementions_mentionee__af2724136949ad46f139609ec85beae5
fort benning,US Army Garrison Fort Benning,a174,188258,LegislativeCommittee,US Army Garrison Fort Benning,,basementions_mentionee,af2724136949ad46f139609ec85beae5,basementions_mentionee__af2724136949ad46f139609ec85beae5
u s army fort benning,US Army Garrison Fort Benning,a174,188258,Refinery,US Army Garrison Fort Benning,,basementions_mentionee,af2724136949ad46f139609ec85beae5,basementions_mentionee__af2724136949ad46f139609ec85beae5
usag fort benning,US Army Garrison Fort Benning,a174,188258,News,US Army Garrison Fort Benning,,basementions_mentionee,af2724136949ad46f139609ec85beae5,basementions_mentionee__af2724136949ad46f139609ec85beae5
us army fort benning,US Army Garrison Fort Benning,a174,188258,ForeignMinistry,US Army Garrison Fort Benning,,basementions_mentionee,af2724136949ad46f139609ec85beae5,basementions_mentionee__af2724136949ad46f139609ec85beae5
ft benning,US Army Garrison Fort Benning,a174,188258,space,US Army Garrison Fort Benning,,basementions_mentionee,af2724136949ad46f139609ec85beae5,basementions_mentionee__af2724136949ad46f139609ec85beae5
fort buchanan,US Army Garrison Fort Buchanan,a175,188258,AAEntity,US Army Garrison Fort Buchanan,,basementions_mentionee,cb779dc266eca019db4df657b0c948a0,basementions_mentionee__cb779dc266eca019db4df657b0c948a0
us army garrison fort buchanan,US Army Garrison Fort Buchanan,a175,188258,News,US Army Garrison Fort Buchanan,,basementions_mentionee,cb779dc266eca019db4df657b0c948a0,basementions_mentionee__cb779dc266eca019db4df657b0c948a0
usag ft buchanan,US Army Garrison Fort Buchanan,a175,188258,space,US Army Garrison Fort Buchanan,,basementions_mentionee,cb779dc266eca019db4df657b0c948a0,basementions_mentionee__cb779dc266eca019db4df657b0c948a0
usag fort buchanan,US Army Garrison Fort Buchanan,a175,188258,Diplomat,US Army Garrison Fort Buchanan,,basementions_mentionee,cb779dc266eca019db4df657b0c948a0,basementions_mentionee__cb779dc266eca019db4df657b0c948a0
united states army garrison fort buchanan,US Army Garrison Fort Buchanan,a175,188258,Pipeline,US Army Garrison Fort Buchanan,,basementions_mentionee,cb779dc266eca019db4df657b0c948a0,basementions_mentionee__cb779dc266eca019db4df657b0c948a0
ft buchanan,US Army Garrison Fort Buchanan,a175,188258,ForeignMinistry,US Army Garrison Fort Buchanan,,basementions_mentionee,cb779dc266eca019db4df657b0c948a0,basementions_mentionee__cb779dc266eca019db4df657b0c948a0
fort campbell,US Army installation Fort Campbell,a176,188258,Pipeline,US Army installation Fort Campbell,,basementions_mentionee,8570b129c8cec33a68030a85ff57339e,basementions_mentionee__8570b129c8cec33a68030a85ff57339e
u s army fort campbell,US Army installation Fort Campbell,a176,188258,Pipeline,US Army installation Fort Campbell,,basementions_mentionee,8570b129c8cec33a68030a85ff57339e,basementions_mentionee__8570b129c8cec33a68030a85ff57339e
us army fort campbell,US Army installation Fort Campbell,a176,188258,Pipeline,US Army installation Fort Campbell,,basementions_mentionee,8570b129c8cec33a68030a85ff57339e,basementions_mentionee__8570b129c8cec33a68030a85ff57339e
usag fort campbell,US Army installation Fort Campbell,a176,188258,Keyphrase,US Army installation Fort Campbell,,basementions_mentionee,8570b129c8cec33a68030a85ff57339e,basementions_mentionee__8570b129c8cec33a68030a85ff57339e
ft campbell,US Army installation Fort Campbell,a176,188258,ForeignMinistry,US Army installation Fort Campbell,,basementions_mentionee,8570b129c8cec33a68030a85ff57339e,basementions_mentionee__8570b129c8cec33a68030a85ff57339e
fort custer training center,US Army installation Fort Custer,a177,188258,IndustryTerm,US Army installation Fort Custer,,basementions_mentionee,f5b5c1d8861e85d1bfa5e4a36205aca5,basementions_mentionee__f5b5c1d8861e85d1bfa5e4a36205aca5
fort custer,US Army installation Fort Custer,a177,188258,CompanyKeyword,US Army installation Fort Custer,,basementions_mentionee,f5b5c1d8861e85d1bfa5e4a36205aca5,basementions_mentionee__f5b5c1d8861e85d1bfa5e4a36205aca5
us army fort custer,US Army installation Fort Custer,a177,188258,Media,US Army installation Fort Custer,,basementions_mentionee,f5b5c1d8861e85d1bfa5e4a36205aca5,basementions_mentionee__f5b5c1d8861e85d1bfa5e4a36205aca5
fort gordon army base,US Army Garrison Fort Gordon,a178,188258,Exec,US Army Garrison Fort Gordon,,basementions_mentionee,fa68a3262fb0747f48e0d09bf5706766,basementions_mentionee__fa68a3262fb0747f48e0d09bf5706766
fort gordon,US Army Garrison Fort Gordon,a178,188258,Wells,US Army Garrison Fort Gordon,,basementions_mentionee,fa68a3262fb0747f48e0d09bf5706766,basementions_mentionee__fa68a3262fb0747f48e0d09bf5706766
us army fort gordon,US Army Garrison Fort Gordon,a178,188258,ForeignMinistry,US Army Garrison Fort Gordon,,basementions_mentionee,fa68a3262fb0747f48e0d09bf5706766,basementions_mentionee__fa68a3262fb0747f48e0d09bf5706766
ft gordon,US Army Garrison Fort Gordon,a178,188258,Refinery,US Army Garrison Fort Gordon,,basementions_mentionee,fa68a3262fb0747f48e0d09bf5706766,basementions_mentionee__fa68a3262fb0747f48e0d09bf5706766
fort greely,US Army installation Fort Greely,a179,188258,space,US Army installation Fort Greely,,basementions_mentionee,22a23945462684624bac8515eb0593e8,basementions_mentionee__22a23945462684624bac8515eb0593e8
us army fort greely,US Army installation Fort Greely,a179,188258,Refinery,US Army installation Fort Greely,,basementions_mentionee,22a23945462684624bac8515eb0593e8,basementions_mentionee__22a23945462684624bac8515eb0593e8
usag fort greely,US Army installation Fort Greely,a179,188258,Legislator,US Army installation Fort Greely,,basementions_mentionee,22a23945462684624bac8515eb0593e8,basementions_mentionee__22a23945462684624bac8515eb0593e8
ft greely,US Army installation Fort Greely,a179,188258,IndustryTerm,US Army installation Fort Greely,,basementions_mentionee,22a23945462684624bac8515eb0593e8,basementions_mentionee__22a23945462684624bac8515eb0593e8
fort hood,Fort Hood,a180,188258,ForeignMinistry,Fort Hood,,basementions_mentionee,79e78905c448da43a2fe8c93c52ebdf5,basementions_mentionee__79e78905c448da43a2fe8c93c52ebdf5
u s army fort hood,Fort Hood,a180,188258,Pipeline,Fort Hood,,basementions_mentionee,79e78905c448da43a2fe8c93c52ebdf5,basementions_mentionee__79e78905c448da43a2fe8c93c52ebdf5
us army fort hood,Fort Hood,a180,188258,LegislativeCommittee,Fort Hood,,basementions_mentionee,79e78905c448da43a2fe8c93c52ebdf5,basementions_mentionee__79e78905c448da43a2fe8c93c52ebdf5
usag fort hood,Fort Hood,a180,188258,Consulates,Fort Hood,,basementions_mentionee,79e78905c448da43a2fe8c93c52ebdf5,basementions_mentionee__79e78905c448da43a2fe8c93c52ebdf5
us army garrison fort hood,Fort Hood,a180,188258,CompanyKeyword,Fort Hood,,basementions_mentionee,79e78905c448da43a2fe8c93c52ebdf5,basementions_mentionee__79e78905c448da43a2fe8c93c52ebdf5
ft hood,Fort Hood,a180,188258,Diplomat,Fort Hood,,basementions_mentionee,79e78905c448da43a2fe8c93c52ebdf5,basementions_mentionee__79e78905c448da43a2fe8c93c52ebdf5
fort jackson,US Army Garrison Fort Jackson,a181,188258,Keyphrase,US Army Garrison Fort Jackson,,basementions_mentionee,cf864c0739cd553917431ac44a5a48e4,basementions_mentionee__cf864c0739cd553917431ac44a5a48e4
united states army training center & fort jackson,US Army Garrison Fort Jackson,a181,188258,space,US Army Garrison Fort Jackson,,basementions_mentionee,cf864c0739cd553917431ac44a5a48e4,basementions_mentionee__cf864c0739cd553917431ac44a5a48e4
us army fort jackson,US Army Garrison Fort Jackson,a181,188258,space,US Army Garrison Fort Jackson,,basementions_mentionee,cf864c0739cd553917431ac44a5a48e4,basementions_mentionee__cf864c0739cd553917431ac44a5a48e4
u s army fort jackson,US Army Garrison Fort Jackson,a181,188258,Wells,US Army Garrison Fort Jackson,,basementions_mentionee,cf864c0739cd553917431ac44a5a48e4,basementions_mentionee__cf864c0739cd553917431ac44a5a48e4
ft jackson,US Army Garrison Fort Jackson,a181,188258,space,US Army Garrison Fort Jackson,,basementions_mentionee,cf864c0739cd553917431ac44a5a48e4,basementions_mentionee__cf864c0739cd553917431ac44a5a48e4
fort knox,US Army installation Fort Knox,a182,188258,space,US Army installation Fort Knox,,basementions_mentionee,824dc080f4b87213e21428dbb70e9571,basementions_mentionee__824dc080f4b87213e21428dbb70e9571
u s army fort knox,US Army installation Fort Knox,a182,188258,Refinery,US Army installation Fort Knox,,basementions_mentionee,824dc080f4b87213e21428dbb70e9571,basementions_mentionee__824dc080f4b87213e21428dbb70e9571
us army fort knox,US Army installation Fort Knox,a182,188258,Wells,US Army installation Fort Knox,,basementions_mentionee,824dc080f4b87213e21428dbb70e9571,basementions_mentionee__824dc080f4b87213e21428dbb70e9571
ft knox,US Army installation Fort Knox,a182,188258,Shipping,US Army installation Fort Knox,,basementions_mentionee,824dc080f4b87213e21428dbb70e9571,basementions_mentionee__824dc080f4b87213e21428dbb70e9571
fort leavenworth,US Army Garrison Fort Leavenworth,a183,188258,ForeignMinister,US Army Garrison Fort Leavenworth,,basementions_mentionee,f97e89f0498947670c0bc91cd7a229f0,basementions_mentionee__f97e89f0498947670c0bc91cd7a229f0
u s army fort leavenworth,US Army Garrison Fort Leavenworth,a183,188258,LegislativeCommittee,US Army Garrison Fort Leavenworth,,basementions_mentionee,f97e89f0498947670c0bc91cd7a229f0,basementions_mentionee__f97e89f0498947670c0bc91cd7a229f0
us army fort leavenworth,US Army Garrison Fort Leavenworth,a183,188258,DiplomaticFacilities,US Army Garrison Fort Leavenworth,,basementions_mentionee,f97e89f0498947670c0bc91cd7a229f0,basementions_mentionee__f97e89f0498947670c0bc91cd7a229f0
u s army combined arms center,US Army Garrison Fort Leavenworth,a183,188258,Wells,US Army Garrison Fort Leavenworth,,basementions_mentionee,f97e89f0498947670c0bc91cd7a229f0,basementions_mentionee__f97e89f0498947670c0bc91cd7a229f0
us army combined arms center,US Army Garrison Fort Leavenworth,a183,188258,News,US Army Garrison Fort Leavenworth,,basementions_mentionee,f97e89f0498947670c0bc91cd7a229f0,basementions_mentionee__f97e89f0498947670c0bc91cd7a229f0
ft leavenworth,US Army Garrison Fort Leavenworth,a183,188258,Diplomat,US Army Garrison Fort Leavenworth,,basementions_mentionee,f97e89f0498947670c0bc91cd7a229f0,basementions_mentionee__f97e89f0498947670c0bc91cd7a229f0
munson army health center,US Army Garrison Fort Leavenworth,a183,188258,Consulates,US Army Garrison Fort Leavenworth,,basementions_mentionee,f97e89f0498947670c0bc91cd7a229f0,basementions_mentionee__f97e89f0498947670c0bc91cd7a229f0
fort leonard wood army base,US Army installation Fort Leonard Wood,a184,188258,Wells,US Army installation Fort Leonard Wood,,basementions_mentionee,1b462d1bd86ecb74f6d9ad4b3dae6d16,basementions_mentionee__1b462d1bd86ecb74f6d9ad4b3dae6d16
fort leonard wood,US Army installation Fort Leonard Wood,a184,188258,Legislator,US Army installation Fort Leonard Wood,,basementions_mentionee,1b462d1bd86ecb74f6d9ad4b3dae6d16,basementions_mentionee__1b462d1bd86ecb74f6d9ad4b3dae6d16
us army fort leonard wood,US Army installation Fort Leonard Wood,a184,188258,Exec,US Army installation Fort Leonard Wood,,basementions_mentionee,1b462d1bd86ecb74f6d9ad4b3dae6d16,basementions_mentionee__1b462d1bd86ecb74f6d9ad4b3dae6d16
u s army fort leonard wood,US Army installation Fort Leonard Wood,a184,188258,Organization,US Army installation Fort Leonard Wood,,basementions_mentionee,1b462d1bd86ecb74f6d9ad4b3dae6d16,basementions_mentionee__1b462d1bd86ecb74f6d9ad4b3dae6d16
ft leanard wood,US Army installation Fort Leonard Wood,a184,188258,Shipping,US Army installation Fort Leonard Wood,,basementions_mentionee,1b462d1bd86ecb74f6d9ad4b3dae6d16,basementions_mentionee__1b462d1bd86ecb74f6d9ad4b3dae6d16
fort mccoy,US Army Garrison Fort McCoy,a185,188258,Person,US Army Garrison Fort McCoy,,basementions_mentionee,5f8b7967e560b2304cc70e6ff0a4b708,basementions_mentionee__5f8b7967e560b2304cc70e6ff0a4b708
u s army fort mccoy,US Army Garrison Fort McCoy,a185,188258,AAEntity,US Army Garrison Fort McCoy,,basementions_mentionee,5f8b7967e560b2304cc70e6ff0a4b708,basementions_mentionee__5f8b7967e560b2304cc70e6ff0a4b708
us army fort mccoy,US Army Garrison Fort McCoy,a185,188258,Person,US Army Garrison Fort McCoy,,basementions_mentionee,5f8b7967e560b2304cc70e6ff0a4b708,basementions_mentionee__5f8b7967e560b2304cc70e6ff0a4b708
usag fort mccoy,US Army Garrison Fort McCoy,a185,188258,ForeignMinistry,US Army Garrison Fort McCoy,,basementions_mentionee,5f8b7967e560b2304cc70e6ff0a4b708,basementions_mentionee__5f8b7967e560b2304cc70e6ff0a4b708
ft mccoy,US Army Garrison Fort McCoy,a185,188258,Person,US Army Garrison Fort McCoy,,basementions_mentionee,5f8b7967e560b2304cc70e6ff0a4b708,basementions_mentionee__5f8b7967e560b2304cc70e6ff0a4b708
fort riley,Us Army Garrison Fort Riley,a186,188258,IndustryTerm,Us Army Garrison Fort Riley,,basementions_mentionee,fe56a198279c7ff658a67fb43ef1af65,basementions_mentionee__fe56a198279c7ff658a67fb43ef1af65
us army fort riley,Us Army Garrison Fort Riley,a186,188258,Exec,Us Army Garrison Fort Riley,,basementions_mentionee,fe56a198279c7ff658a67fb43ef1af65,basementions_mentionee__fe56a198279c7ff658a67fb43ef1af65
u s army fort riley,Us Army Garrison Fort Riley,a186,188258,DiplomaticFacilities,Us Army Garrison Fort Riley,,basementions_mentionee,fe56a198279c7ff658a67fb43ef1af65,basementions_mentionee__fe56a198279c7ff658a67fb43ef1af65
usag fort riley,Us Army Garrison Fort Riley,a186,188258,Shipping,Us Army Garrison Fort Riley,,basementions_mentionee,fe56a198279c7ff658a67fb43ef1af65,basementions_mentionee__fe56a198279c7ff658a67fb43ef1af65
custer hill,Us Army Garrison Fort Riley,a186,188258,FTO,Us Army Garrison Fort Riley,,basementions_mentionee,fe56a198279c7ff658a67fb43ef1af65,basementions_mentionee__fe56a198279c7ff658a67fb43ef1af65
ft riley,Us Army Garrison Fort Riley,a186,188258,Media,Us Army Garrison Fort Riley,,basementions_mentionee,fe56a198279c7ff658a67fb43ef1af65,basementions_mentionee__fe56a198279c7ff658a67fb43ef1af65
fort shafter,US Army installation Fort Shafter,a187,188258,Refinery,US Army installation Fort Shafter,,basementions_mentionee,13cfc976e373ad6185353ff6fa158b72,basementions_mentionee__13cfc976e373ad6185353ff6fa158b72
us army fort shafter,US Army installation Fort Shafter,a187,188258,Exec,US Army installation Fort Shafter,,basementions_mentionee,13cfc976e373ad6185353ff6fa158b72,basementions_mentionee__13cfc976e373ad6185353ff6fa158b72
u s army fort safter,US Army installation Fort Shafter,a187,188258,Organization,US Army installation Fort Shafter,,basementions_mentionee,13cfc976e373ad6185353ff6fa158b72,basementions_mentionee__13cfc976e373ad6185353ff6fa158b72
usaf fort shafter,US Army installation Fort Shafter,a187,188258,Wells,US Army installation Fort Shafter,,basementions_mentionee,13cfc976e373ad6185353ff6fa158b72,basementions_mentionee__13cfc976e373ad6185353ff6fa158b72
ft shafter,US Army installation Fort Shafter,a187,188258,Refinery,US Army installation Fort Shafter,,basementions_mentionee,13cfc976e373ad6185353ff6fa158b72,basementions_mentionee__13cfc976e373ad6185353ff6fa158b72
fort stewart army base,US Army installation Fort Stewart,a188,188258,Keyphrase,US Army installation Fort Stewart,,basementions_mentionee,0177049202076f769e86f0257d4f4f2e,basementions_mentionee__0177049202076f769e86f0257d4f4f2e
fort stewart,US Army installation Fort Stewart,a188,188258,Person,US Army installation Fort Stewart,,basementions_mentionee,0177049202076f769e86f0257d4f4f2e,basementions_mentionee__0177049202076f769e86f0257d4f4f2e
us army fort stewart,US Army installation Fort Stewart,a188,188258,Person,US Army installation Fort Stewart,,basementions_mentionee,0177049202076f769e86f0257d4f4f2e,basementions_mentionee__0177049202076f769e86f0257d4f4f2e
u s army fort stewart,US Army installation Fort Stewart,a188,188258,News,US Army installation Fort Stewart,,basementions_mentionee,0177049202076f769e86f0257d4f4f2e,basementions_mentionee__0177049202076f769e86f0257d4f4f2e
fort stewart-hunter,US Army installation Fort Stewart,a188,188258,News,US Army installation Fort Stewart,,basementions_mentionee,0177049202076f769e86f0257d4f4f2e,basementions_mentionee__0177049202076f769e86f0257d4f4f2e
fort stewart-hunter army airfield,US Army installation Fort Stewart,a188,188258,LegislativeCommittee,US Army installation Fort Stewart,,basementions_mentionee,0177049202076f769e86f0257d4f4f2e,basementions_mentionee__0177049202076f769e86f0257d4f4f2e
usag fort stewart-hunter,US Army installation Fort Stewart,a188,188258,Shipping,US Army installation Fort Stewart,,basementions_mentionee,0177049202076f769e86f0257d4f4f2e,basementions_mentionee__0177049202076f769e86f0257d4f4f2e
us army fort stewart-hunter,US Army installation Fort Stewart,a188,188258,News,US Army installation Fort Stewart,,basementions_mentionee,0177049202076f769e86f0257d4f4f2e,basementions_mentionee__0177049202076f769e86f0257d4f4f2e
u s army fort stewart-hunter,US Army installation Fort Stewart,a188,188258,Organization,US Army installation Fort Stewart,,basementions_mentionee,0177049202076f769e86f0257d4f4f2e,basementions_mentionee__0177049202076f769e86f0257d4f4f2e
usag stewart-hunter aaf,US Army installation Fort Stewart,a188,188258,FTO,US Army installation Fort Stewart,,basementions_mentionee,0177049202076f769e86f0257d4f4f2e,basementions_mentionee__0177049202076f769e86f0257d4f4f2e
us army stewart-hunter aaf,US Army installation Fort Stewart,a188,188258,ForeignMinistry,US Army installation Fort Stewart,,basementions_mentionee,0177049202076f769e86f0257d4f4f2e,basementions_mentionee__0177049202076f769e86f0257d4f4f2e
usag stewart-hunter,US Army installation Fort Stewart,a188,188258,IndustryTerm,US Army installation Fort Stewart,,basementions_mentionee,0177049202076f769e86f0257d4f4f2e,basementions_mentionee__0177049202076f769e86f0257d4f4f2e
ft stewart-hunter,US Army installation Fort Stewart,a188,188258,Legislator,US Army installation Fort Stewart,,basementions_mentionee,0177049202076f769e86f0257d4f4f2e,basementions_mentionee__0177049202076f769e86f0257d4f4f2e
hunter army airfield,US Army installation Fort Stewart,a188,188258,Person,US Army installation Fort Stewart,,basementions_mentionee,0177049202076f769e86f0257d4f4f2e,basementions_mentionee__0177049202076f769e86f0257d4f4f2e
hunter aaf,US Army installation Fort Stewart,a188,188258,Keyphrase,US Army installation Fort Stewart,,basementions_mentionee,0177049202076f769e86f0257d4f4f2e,basementions_mentionee__0177049202076f769e86f0257d4f4f2e
ft stewart,US Army installation Fort Stewart,a188,188258,Wells,US Army installation Fort Stewart,,basementions_mentionee,0177049202076f769e86f0257d4f4f2e,basementions_mentionee__0177049202076f769e86f0257d4f4f2e
jbsa sam houston,Joint Base San Antonio,a189,188258,Pipeline,Joint Base San Antonio,,basementions_mentionee,d883ea6673d1ec7a0f2d4e1df83e8cfa,basementions_mentionee__d883ea6673d1ec7a0f2d4e1df83e8cfa
fort sam houston,Joint Base San Antonio,a189,188258,Person,Joint Base San Antonio,,basementions_mentionee,d883ea6673d1ec7a0f2d4e1df83e8cfa,basementions_mentionee__d883ea6673d1ec7a0f2d4e1df83e8cfa
ft sam houston,Joint Base San Antonio,a189,188258,IndustryTerm,Joint Base San Antonio,,basementions_mentionee,d883ea6673d1ec7a0f2d4e1df83e8cfa,basementions_mentionee__d883ea6673d1ec7a0f2d4e1df83e8cfa
fort sam,Joint Base San Antonio,a189,188258,News,Joint Base San Antonio,,basementions_mentionee,d883ea6673d1ec7a0f2d4e1df83e8cfa,basementions_mentionee__d883ea6673d1ec7a0f2d4e1df83e8cfa
lackland afb,Joint Base San Antonio,a189,188258,Refinery,Joint Base San Antonio,,basementions_mentionee,d883ea6673d1ec7a0f2d4e1df83e8cfa,basementions_mentionee__d883ea6673d1ec7a0f2d4e1df83e8cfa
lackland ab,Joint Base San Antonio,a189,188258,Person,Joint Base San Antonio,,basementions_mentionee,d883ea6673d1ec7a0f2d4e1df83e8cfa,basementions_mentionee__d883ea6673d1ec7a0f2d4e1df83e8cfa
lackland air force base,Joint Base San Antonio,a189,188258,Legislator,Joint Base San Antonio,,basementions_mentionee,d883ea6673d1ec7a0f2d4e1df83e8cfa,basementions_mentionee__d883ea6673d1ec7a0f2d4e1df83e8cfa
lackland air base,Joint Base San Antonio,a189,188258,Person,Joint Base San Antonio,,basementions_mentionee,d883ea6673d1ec7a0f2d4e1df83e8cfa,basementions_mentionee__d883ea6673d1ec7a0f2d4e1df83e8cfa
joint base san antonio-lackland,Joint Base San Antonio,a189,188258,Media,Joint Base San Antonio,,basementions_mentionee,d883ea6673d1ec7a0f2d4e1df83e8cfa,basementions_mentionee__d883ea6673d1ec7a0f2d4e1df83e8cfa
jbsa lackland,Joint Base San Antonio,a189,188258,Wells,Joint Base San Antonio,,basementions_mentionee,d883ea6673d1ec7a0f2d4e1df83e8cfa,basementions_mentionee__d883ea6673d1ec7a0f2d4e1df83e8cfa
jbsa randoloh,Joint Base San Antonio,a189,188258,Diplomat,Joint Base San Antonio,,basementions_mentionee,d883ea6673d1ec7a0f2d4e1df83e8cfa,basementions_mentionee__d883ea6673d1ec7a0f2d4e1df83e8cfa
jbsa fort sam,Joint Base San Antonio,a189,188258,DiplomaticFacilities,Joint Base San Antonio,,basementions_mentionee,d883ea6673d1ec7a0f2d4e1df83e8cfa,basementions_mentionee__d883ea6673d1ec7a0f2d4e1df83e8cfa
u s coast guard station valdez,US Coast Guard Station Valdez,a190,188258,ForeignMinister,US Coast Guard Station Valdez,,basementions_mentionee,603eb8d61dfa2f804f14319f653fbbfb,basementions_mentionee__603eb8d61dfa2f804f14319f653fbbfb
msu valdez,US Coast Guard Station Valdez,a190,188258,Person,US Coast Guard Station Valdez,,basementions_mentionee,603eb8d61dfa2f804f14319f653fbbfb,basementions_mentionee__603eb8d61dfa2f804f14319f653fbbfb
ccs valdez,US Coast Guard Station Valdez,a190,188258,CompanyKeyword,US Coast Guard Station Valdez,,basementions_mentionee,603eb8d61dfa2f804f14319f653fbbfb,basementions_mentionee__603eb8d61dfa2f804f14319f653fbbfb
fort rucker,US Army Garrison Fort Rucker,a191,188258,Consulates,US Army Garrison Fort Rucker,,basementions_mentionee,c11752f3e37e1c3a61cb7a12c2220673,basementions_mentionee__c11752f3e37e1c3a61cb7a12c2220673
us army fort rucker,US Army Garrison Fort Rucker,a191,188258,Shipping,US Army Garrison Fort Rucker,,basementions_mentionee,c11752f3e37e1c3a61cb7a12c2220673,basementions_mentionee__c11752f3e37e1c3a61cb7a12c2220673
u s army rucker,US Army Garrison Fort Rucker,a191,188258,Diplomat,US Army Garrison Fort Rucker,,basementions_mentionee,c11752f3e37e1c3a61cb7a12c2220673,basementions_mentionee__c11752f3e37e1c3a61cb7a12c2220673
ft rucker,US Army Garrison Fort Rucker,a191,188258,Organization,US Army Garrison Fort Rucker,,basementions_mentionee,c11752f3e37e1c3a61cb7a12c2220673,basementions_mentionee__c11752f3e37e1c3a61cb7a12c2220673
cairns army airfield,US Army Garrison Fort Rucker,a191,188258,Consulates,US Army Garrison Fort Rucker,,basementions_mentionee,c11752f3e37e1c3a61cb7a12c2220673,basementions_mentionee__c11752f3e37e1c3a61cb7a12c2220673
cairns aaf,US Army Garrison Fort Rucker,a191,188258,space,US Army Garrison Fort Rucker,,basementions_mentionee,c11752f3e37e1c3a61cb7a12c2220673,basementions_mentionee__c11752f3e37e1c3a61cb7a12c2220673
hanchey army heliport,US Army Garrison Fort Rucker,a191,188258,Diplomat,US Army Garrison Fort Rucker,,basementions_mentionee,c11752f3e37e1c3a61cb7a12c2220673,basementions_mentionee__c11752f3e37e1c3a61cb7a12c2220673
hanchey ahp,US Army Garrison Fort Rucker,a191,188258,Diplomat,US Army Garrison Fort Rucker,,basementions_mentionee,c11752f3e37e1c3a61cb7a12c2220673,basementions_mentionee__c11752f3e37e1c3a61cb7a12c2220673
hanchey heliport,US Army Garrison Fort Rucker,a191,188258,Diplomat,US Army Garrison Fort Rucker,,basementions_mentionee,c11752f3e37e1c3a61cb7a12c2220673,basementions_mentionee__c11752f3e37e1c3a61cb7a12c2220673
knox army heliport,US Army Garrison Fort Rucker,a191,188258,ForeignMinistry,US Army Garrison Fort Rucker,,basementions_mentionee,c11752f3e37e1c3a61cb7a12c2220673,basementions_mentionee__c11752f3e37e1c3a61cb7a12c2220673
knox ahp,US Army Garrison Fort Rucker,a191,188258,IndustryTerm,US Army Garrison Fort Rucker,,basementions_mentionee,c11752f3e37e1c3a61cb7a12c2220673,basementions_mentionee__c11752f3e37e1c3a61cb7a12c2220673
knox heliport,US Army Garrison Fort Rucker,a191,188258,Diplomat,US Army Garrison Fort Rucker,,basementions_mentionee,c11752f3e37e1c3a61cb7a12c2220673,basementions_mentionee__c11752f3e37e1c3a61cb7a12c2220673
lowe army heliport,US Army Garrison Fort Rucker,a191,188258,AAEntity,US Army Garrison Fort Rucker,,basementions_mentionee,c11752f3e37e1c3a61cb7a12c2220673,basementions_mentionee__c11752f3e37e1c3a61cb7a12c2220673
lowe ahp,US Army Garrison Fort Rucker,a191,188258,Legislator,US Army Garrison Fort Rucker,,basementions_mentionee,c11752f3e37e1c3a61cb7a12c2220673,basementions_mentionee__c11752f3e37e1c3a61cb7a12c2220673
lowe heliport,US Army Garrison Fort Rucker,a191,188258,Refinery,US Army Garrison Fort Rucker,,basementions_mentionee,c11752f3e37e1c3a61cb7a12c2220673,basementions_mentionee__c11752f3e37e1c3a61cb7a12c2220673
shell army heliport,US Army Garrison Fort Rucker,a191,188258,DiplomaticFacilities,US Army Garrison Fort Rucker,,basementions_mentionee,c11752f3e37e1c3a61cb7a12c2220673,basementions_mentionee__c11752f3e37e1c3a61cb7a12c2220673
shell ahp,US Army Garrison Fort Rucker,a191,188258,Exec,US Army Garrison Fort Rucker,,basementions_mentionee,c11752f3e37e1c3a61cb7a12c2220673,basementions_mentionee__c11752f3e37e1c3a61cb7a12c2220673
