keyword,caption_name,location,topic_id,ENTITY_LABEL,name,description,source,source_identifier,global_identifier
episkopi cantonment,UK Armed Forces Episkopi Cantonment,forbase133,188258,Shipping,UK Armed Forces Episkopi Cantonment,,basementions_mentionee,08938aa63790640b42cebd61bfbe0e73,basementions_mentionee__08938aa63790640b42cebd61bfbe0e73
episkopi garrison,UK Armed Forces Episkopi Cantonment,forbase133,188258,Refinery,UK Armed Forces Episkopi Cantonment,,basementions_mentionee,08938aa63790640b42cebd61bfbe0e73,basementions_mentionee__08938aa63790640b42cebd61bfbe0e73
étain-rouvres air base,French Army Base lieutenant Étienne Mantoux,forbase57,188258,Person,French Army Base lieutenant Étienne Mantoux,,basementions_mentionee,05c373d2b393c75f65db62e3001b0a4c,basementions_mentionee__05c373d2b393c75f65db62e3001b0a4c
évreux-fauville air base,French Air and Space Force Air Base 105,forbase23,188258;188261,Person,French Air and Space Force Air Base 105,,basementions_mentionee,b9bc634fa6b06584ee5568cc9940a6fa,basementions_mentionee__b9bc634fa6b06584ee5568cc9940a6fa
experimental station suffield,Canadian Forces Base Suffield,forbase73,188258,AAEntity,Canadian Forces Base Suffield,,basementions_mentionee,3359ebb353b877f0c0a9a426acd778b0,basementions_mentionee__3359ebb353b877f0c0a9a426acd778b0
fac6005,US Marine Corps le Shima Airfiled,forbase134,188258,IndustryTerm,US Marine Corps le Shima Airfiled,,basementions_mentionee,369add43483dbe804883a302589be908,basementions_mentionee__369add43483dbe804883a302589be908
falconara airbase,Italian Air Force Falconara Airbase,forbase16,188258,Person,Italian Air Force Falconara Airbase,,basementions_mentionee,dd7b89961199cfa539cb18b59e6d2dc4,basementions_mentionee__dd7b89961199cfa539cb18b59e6d2dc4
faßberg air base,German Army Fassberg Air Base,forbase135,188258,Exec,German Army Fassberg Air Base,,basementions_mentionee,2153320cf45694436474da2e3cd7e6d5,basementions_mentionee__2153320cf45694436474da2e3cd7e6d5
flewin field,Canadian Forces Base Shilo,forbase65,188258,AAEntity,Canadian Forces Base Shilo,,basementions_mentionee,ba12c68bc9d198ad94505557ebe27982,basementions_mentionee__ba12c68bc9d198ad94505557ebe27982
fliegerhorst büchel,German Air Force Buchel Air Base,forbase75,188258,IndustryTerm,German Air Force Buchel Air Base,,basementions_mentionee,459410e2d40220a51618b208ebe52a60,basementions_mentionee__459410e2d40220a51618b208ebe52a60
fliegerhorst diepholz,German Air Force Diepholz Air Base,forbase130,188258,IndustryTerm,German Air Force Diepholz Air Base,,basementions_mentionee,ae14f6af7543459191da0668cf7cfd1f,basementions_mentionee__ae14f6af7543459191da0668cf7cfd1f
fliegerhorst holzdorf,German Air Force Holzdorf Air Base,forbase136,188258,Keyphrase,German Air Force Holzdorf Air Base,,basementions_mentionee,e6ab7f3901b1f9bc25e80c6ee45417a4,basementions_mentionee__e6ab7f3901b1f9bc25e80c6ee45417a4
fliegerhorst kaufbeuren,German Air Force Kaufbeuren Air Base,forbase137,188258,space,German Air Force Kaufbeuren Air Base,,basementions_mentionee,51efabadfd5d412d4fb80fca59943926,basementions_mentionee__51efabadfd5d412d4fb80fca59943926
fliegerhorst landsberg/lech,German Air Force Landsberg-Lech Air Base,forbase138,188258,space,German Air Force Landsberg-Lech Air Base,,basementions_mentionee,911411ffd67138d349f0ac237b398d35,basementions_mentionee__911411ffd67138d349f0ac237b398d35
fliegerhorst lechfeld,Bundeswehr Lechfeld Air Base,forbase139,188258,Keyphrase,Bundeswehr Lechfeld Air Base,,basementions_mentionee,3ee49ca134a719179aca4d46783c401c,basementions_mentionee__3ee49ca134a719179aca4d46783c401c
fliegerhorst nordholz,German Navy Nordholz Naval Airbase,forbase140,188258,Pipeline,German Navy Nordholz Naval Airbase,,basementions_mentionee,253a67527897e82bafec899c0535b8f8,basementions_mentionee__253a67527897e82bafec899c0535b8f8
fliegerhorst nörvenich,German Air Force Norvenich Air Base,forbase141,188258,News,German Air Force Norvenich Air Base,,basementions_mentionee,040fd489b94301092f32ef31a5e31a21,basementions_mentionee__040fd489b94301092f32ef31a5e31a21
fliegerhorst schleswig,German Air Force Schleswig Air Base,forbase142,188258,Pipeline,German Air Force Schleswig Air Base,,basementions_mentionee,fcb6bb041f83910561f551951e642791,basementions_mentionee__fcb6bb041f83910561f551951e642791
fliegerhorst spangdahlem,US Air Force Spangdahlem Air Base,forbase143,188258,Pipeline,US Air Force Spangdahlem Air Base,,basementions_mentionee,34e24c441cf927d2b112163aa495a276,basementions_mentionee__34e24c441cf927d2b112163aa495a276
flugplatz grafenwöhr,US Army Grafenwohr Army Airfield,forbase144,188258,Refinery,US Army Grafenwohr Army Airfield,,basementions_mentionee,4801445f3cb24f32eea7cbcbaeac4d03,basementions_mentionee__4801445f3cb24f32eea7cbcbaeac4d03
flugplatz malmsheim,German Air Force Malmsheim Airfield,forbase145,188258,Wells,German Air Force Malmsheim Airfield,,basementions_mentionee,bc19bb67a269b5a4f41af36f7f656fea,basementions_mentionee__bc19bb67a269b5a4f41af36f7f656fea
flugplatz neuburg,German Air Force Neuburg Air Base,forbase146,188258,Keyphrase,German Air Force Neuburg Air Base,,basementions_mentionee,10236ef6ef174de9821d513ace689847,basementions_mentionee__10236ef6ef174de9821d513ace689847
flugplatz ramstein,US Air Force Ramstein Air Base,forbase147,188258,Person,US Air Force Ramstein Air Base,,basementions_mentionee,4662972d0577a41ff203c581074da198,basementions_mentionee__4662972d0577a41ff203c581074da198
flugplatz wiesbaden,US Army US Army Garrison Wiesbaden,forbase148,188258,Wells,US Army US Army Garrison Wiesbaden,,basementions_mentionee,958185aa3fbae616e046bd56b75e518e,basementions_mentionee__958185aa3fbae616e046bd56b75e518e
fréjus-saint raphaël naval aeronautical base / ban de fréjus-saint raphaël,French Naval Air Base Fréjus-Saint Raphaël,forbase59,188258,CompanyKeyword,French Naval Air Base Fréjus-Saint Raphaël,,basementions_mentionee,bc000482350159955125545a4a2435bc,basementions_mentionee__bc000482350159955125545a4a2435bc
fritzlar air base,Bundeswehr Fritzlar Air Base,forbase41,188258,Wells,Bundeswehr Fritzlar Air Base,,basementions_mentionee,13d9f5a08841d86c5f2600db12242de8,basementions_mentionee__13d9f5a08841d86c5f2600db12242de8
fuchū air base,JASDF Fuchu Airbase,forbase149,188258,CompanyKeyword,JASDF Fuchu Airbase,,basementions_mentionee,bb343a4f63f1c78c241e484908c43b2e,basementions_mentionee__bb343a4f63f1c78c241e484908c43b2e
furbara airport,Italian Air Force Furbara Airport,forbase150,188258,Refinery,Italian Air Force Furbara Airport,,basementions_mentionee,35bed5b16516b03ba72549c88af9c38d,basementions_mentionee__35bed5b16516b03ba72549c88af9c38d
fuzhou yixu airport,Chinese Air Force Fuzhou Yixu Airport,forbase151,188258,Diplomat,Chinese Air Force Fuzhou Yixu Airport,,basementions_mentionee,cc43efca870fdacc9d2dcebc82a86306,basementions_mentionee__cc43efca870fdacc9d2dcebc82a86306
gagetown range and training area,Canadian Forces Base Gagetown,forbase10,188258,DiplomaticFacilities,Canadian Forces Base Gagetown,,basementions_mentionee,d222235ccf9ea6929a04ab4a15104484,basementions_mentionee__d222235ccf9ea6929a04ab4a15104484
galatina air base,Italian Air Force Lecce Galatina Airport,forbase22,188258,DiplomaticFacilities,Italian Air Force Lecce Galatina Airport,,basementions_mentionee,6602a5780a70edf4bd511d7b0f52a78a,basementions_mentionee__6602a5780a70edf4bd511d7b0f52a78a
gallipoli barracks,Australian Army installation Gallipolli Barracks,forbase132,188258,Diplomat,Australian Army installation Gallipolli Barracks,,basementions_mentionee,b67459df36b60e10b92d9570631a8beb,basementions_mentionee__b67459df36b60e10b92d9570631a8beb
gallipolli barracks,Australian Army installation Gallipolli Barracks,forbase132,188258,LegislativeCommittee,Australian Army installation Gallipolli Barracks,,basementions_mentionee,b67459df36b60e10b92d9570631a8beb,basementions_mentionee__b67459df36b60e10b92d9570631a8beb
gangneung airbase,South Korean Air Force Gangneung Airbase,forbase152,188258,ForeignMinistry,South Korean Air Force Gangneung Airbase,,basementions_mentionee,3062af184f73b89f441e4cd69afb1759,basementions_mentionee__3062af184f73b89f441e4cd69afb1759
garrison petawawa,Canadian Forces Base Petawawa,forbase8,188258,Exec,Canadian Forces Base Petawawa,,basementions_mentionee,dad5c0cb8afdbe6d27bc8e14dc99fbff,basementions_mentionee__dad5c0cb8afdbe6d27bc8e14dc99fbff
ghedi air base,Italian Air Force Ghedi Air Base,forbase153,188258,Refinery,Italian Air Force Ghedi Air Base,,basementions_mentionee,5a55edae1214be132592c4633b3c83b7,basementions_mentionee__5a55edae1214be132592c4633b3c83b7
gimhae air base,South Korean Air Force Gimhae Air Base,forbase154,188258,Diplomat,South Korean Air Force Gimhae Air Base,,basementions_mentionee,0a28d3b3667d72447511cd762741a0a5,basementions_mentionee__0a28d3b3667d72447511cd762741a0a5
gimhae airport,South Korean Air Force Gimhae Air Base,forbase154,188258,Refinery,South Korean Air Force Gimhae Air Base,,basementions_mentionee,0a28d3b3667d72447511cd762741a0a5,basementions_mentionee__0a28d3b3667d72447511cd762741a0a5
gioia del colle air base,Italian Air Force Gioia del Colle Air Base,forbase42,188258,Consulates,Italian Air Force Gioia del Colle Air Base,,basementions_mentionee,2adc1058271c036f5c8c5312e58837df,basementions_mentionee__2adc1058271c036f5c8c5312e58837df
goose air base,Canadian Forces Base Goose Bay,forbase11,188258,ForeignMinister,Canadian Forces Base Goose Bay,,basementions_mentionee,c253379c5e946c11fcc4f9cd57c1cf07,basementions_mentionee__c253379c5e946c11fcc4f9cd57c1cf07
goose bay airport,Canadian Forces Base Goose Bay,forbase11,188258,Organization,Canadian Forces Base Goose Bay,,basementions_mentionee,c253379c5e946c11fcc4f9cd57c1cf07,basementions_mentionee__c253379c5e946c11fcc4f9cd57c1cf07
grafenwöhr army airfield,US Army Grafenwohr Army Airfield,forbase144,188258,ForeignMinistry,US Army Grafenwohr Army Airfield,,basementions_mentionee,4801445f3cb24f32eea7cbcbaeac4d03,basementions_mentionee__4801445f3cb24f32eea7cbcbaeac4d03
grafenwohr army base,US Army Grafenwohr Army Airfield,forbase144,188258,Refinery,US Army Grafenwohr Army Airfield,,basementions_mentionee,4801445f3cb24f32eea7cbcbaeac4d03,basementions_mentionee__4801445f3cb24f32eea7cbcbaeac4d03
greenwood airport,Canadian Forces Base Greenwood,forbase94,188258,Exec,Canadian Forces Base Greenwood,,basementions_mentionee,2f30515c16d805779e8a2ae713e03408,basementions_mentionee__2f30515c16d805779e8a2ae713e03408
grosseto airport,Italian Air Force Grosseto Airport,forbase19,188258,ForeignMinistry,Italian Air Force Grosseto Airport,,basementions_mentionee,8b4db2406e55553b77f26fac8ee41e5c,basementions_mentionee__8b4db2406e55553b77f26fac8ee41e5c
guidonia airport,Italian Air Force Guidonia Airport,forbase20,188258,AAEntity,Italian Air Force Guidonia Airport,,basementions_mentionee,0a3a1024a17730ce8c7f449aac2db0e5,basementions_mentionee__0a3a1024a17730ce8c7f449aac2db0e5
hamamatsu air base,JASDF Hamamatsu Airbase,forbase156,188258,DiplomaticFacilities,JASDF Hamamatsu Airbase,,basementions_mentionee,5b6365b17d6e88628bf8b3728a47f428,basementions_mentionee__5b6365b17d6e88628bf8b3728a47f428
hanshin base,JMSDF Hanshin Base Corps,forbase157,188258,space,JMSDF Hanshin Base Corps,,basementions_mentionee,9a0874f1c6628e004e213e269fb84bc4,basementions_mentionee__9a0874f1c6628e004e213e269fb84bc4
hanshin base corps,JMSDF Hanshin Base Corps,forbase157,188258,Organization,JMSDF Hanshin Base Corps,,basementions_mentionee,9a0874f1c6628e004e213e269fb84bc4,basementions_mentionee__9a0874f1c6628e004e213e269fb84bc4
haro strait range,Canadian Armed Forces installation Haro Strait Range near Saanich,forbase158,188258,Organization,Canadian Armed Forces installation Haro Strait Range near Saanich,,basementions_mentionee,8bf39cbf2a565757adee586a5bf82f4d,basementions_mentionee__8bf39cbf2a565757adee586a5bf82f4d
heeresflugplatz altenstadt,German Army Altenstadt Air Base,forbase44,188258,Organization,German Army Altenstadt Air Base,,basementions_mentionee,1fd21249594b39e814bb42d3ae364ed7,basementions_mentionee__1fd21249594b39e814bb42d3ae364ed7
heeresflugplatz bückeburg,German Army Buckeburg Air Base,forbase76,188258,Wells,German Army Buckeburg Air Base,,basementions_mentionee,ac46ceb9a31d1c7286e8b4043d125719,basementions_mentionee__ac46ceb9a31d1c7286e8b4043d125719
heeresflugplatz celle,German Army Celle Air Base,forbase106,188258,Pipeline,German Army Celle Air Base,,basementions_mentionee,7d44c78827b4314099f314cc44c71184,basementions_mentionee__7d44c78827b4314099f314cc44c71184
heeresflugplatz faßberg,German Army Fassberg Air Base,forbase135,188258,Person,German Army Fassberg Air Base,,basementions_mentionee,2153320cf45694436474da2e3cd7e6d5,basementions_mentionee__2153320cf45694436474da2e3cd7e6d5
heeresflugplatz fritzlar,Bundeswehr Fritzlar Air Base,forbase41,188258,ForeignMinister,Bundeswehr Fritzlar Air Base,,basementions_mentionee,13d9f5a08841d86c5f2600db12242de8,basementions_mentionee__13d9f5a08841d86c5f2600db12242de8
heeresflugplatz niederstetten,German Army Niederstetten Air Base,forbase159,188258,Organization,German Army Niederstetten Air Base,,basementions_mentionee,b2d7bfd2bdde301adfd4b9d5e4c63005,basementions_mentionee__b2d7bfd2bdde301adfd4b9d5e4c63005
henrichemont military radio station,French Armed Forces Pierre-sur-Haute military radio station,forbase160,188258,Exec,French Armed Forces Pierre-sur-Haute military radio station,,basementions_mentionee,8465eec16b6cc162b24c88139a7e9201,basementions_mentionee__8465eec16b6cc162b24c88139a7e9201
heweitan,PLA Heweitan border outpost,forbase161,188258,News,PLA Heweitan border outpost,,basementions_mentionee,5d0bafbd89c28a3ef6062a39011f6297,basementions_mentionee__5d0bafbd89c28a3ef6062a39011f6297
heweitan border outpost,PLA Heweitan border outpost,forbase161,188258,Legislator,PLA Heweitan border outpost,,basementions_mentionee,5d0bafbd89c28a3ef6062a39011f6297,basementions_mentionee__5d0bafbd89c28a3ef6062a39011f6297
hightown barracks,British Army Hightown Barracks,forbase162,188258,Diplomat,British Army Hightown Barracks,,basementions_mentionee,b03c2bb3bb909eb7951da50b2b69da46,basementions_mentionee__b03c2bb3bb909eb7951da50b2b69da46
hmas albatross,Royal Australian Navy installation HMAS Albatross,forbase163,188258,Wells,Royal Australian Navy installation HMAS Albatross,,basementions_mentionee,2cc6b2e4f1b353dd8d5c7c1c7953df9f,basementions_mentionee__2cc6b2e4f1b353dd8d5c7c1c7953df9f
hmas cairns,Royal Australian Navy installation HMAS Cairns,forbase164,188258,DiplomaticFacilities,Royal Australian Navy installation HMAS Cairns,,basementions_mentionee,3560a9e03947a47655ffea8d4ab1ecaa,basementions_mentionee__3560a9e03947a47655ffea8d4ab1ecaa
hmas creswell,Royal Australian Naval College,forbase165,188258,Keyphrase,Royal Australian Naval College,,basementions_mentionee,d9afd9a79ae52e98e52b6df36bf1f4d5,basementions_mentionee__d9afd9a79ae52e98e52b6df36bf1f4d5
hmas moreton,Royal Australian Navy installation HMAS Moreton,forbase166,188258,CompanyKeyword,Royal Australian Navy installation HMAS Moreton,,basementions_mentionee,9355afec5448e7227eac8697dc91bd50,basementions_mentionee__9355afec5448e7227eac8697dc91bd50
hmas penguin,Royal Australian Navy installation HMAS Penguin,forbase167,188258,Shipping,Royal Australian Navy installation HMAS Penguin,,basementions_mentionee,5b0991fd8a7fa9d25bf7eef43e452a08,basementions_mentionee__5b0991fd8a7fa9d25bf7eef43e452a08
hmas stirling,Royal Australian Navy installation HMAS Sitrling,forbase168,188258,News,Royal Australian Navy installation HMAS Sitrling,,basementions_mentionee,a218ac98dfb25a83669c0279a5817bd8,basementions_mentionee__a218ac98dfb25a83669c0279a5817bd8
hmas watson,Royal Australian Navy installation HMAS Watson,forbase169,188258,CompanyKeyword,Royal Australian Navy installation HMAS Watson,,basementions_mentionee,6bdf864ff46061ac0bc92de807c53c80,basementions_mentionee__6bdf864ff46061ac0bc92de807c53c80
hmcs aldergrove,Royal Canadian Navy installation NRS Aldergrove,forbase170,188258,Legislator,Royal Canadian Navy installation NRS Aldergrove,,basementions_mentionee,6854b84528d47fb82de259e9dc47ad2e,basementions_mentionee__6854b84528d47fb82de259e9dc47ad2e
hmcs newport corner,Royal Canadian Navy installation NRS Newport Corner,forbase171,188258,Exec,Royal Canadian Navy installation NRS Newport Corner,,basementions_mentionee,a15fcb843d8fdfa018b434a3f0ffdc4b,basementions_mentionee__a15fcb843d8fdfa018b434a3f0ffdc4b
hmnb clyde,UK Royal Navy Naval base Clyde,forbase172,188258,IndustryTerm,UK Royal Navy Naval base Clyde,,basementions_mentionee,fad868af322a36f09f8de78eac0edf58,basementions_mentionee__fad868af322a36f09f8de78eac0edf58
hmnb devonport,UK Royal Navy Base Devonport,forbase173,188258,Keyphrase,UK Royal Navy Base Devonport,,basementions_mentionee,01fe644dcdd01c51aa6dce1fe7a1a449,basementions_mentionee__01fe644dcdd01c51aa6dce1fe7a1a449
hmnb portsmouth,UK Royal Navy base Portsmouth,forbase174,188258,Media,UK Royal Navy base Portsmouth,,basementions_mentionee,5be4ad2bd72a4446cdb7ba69e31d5e68,basementions_mentionee__5be4ad2bd72a4446cdb7ba69e31d5e68
hms dalriada,UK Royal Navy Reserve base HMS Dalriada,forbase175,188258,News,UK Royal Navy Reserve base HMS Dalriada,,basementions_mentionee,16c9e1b4375bc5e89b245c28c3dcfe86,basementions_mentionee__16c9e1b4375bc5e89b245c28c3dcfe86
hms excellent,UK Royal Navy base HMS Excellent,forbase176,188258,Pipeline,UK Royal Navy base HMS Excellent,,basementions_mentionee,767d92d341783c20eb4c2a60799e8080,basementions_mentionee__767d92d341783c20eb4c2a60799e8080
hms president,UK Royal Navy Reserves base HMS President,forbase177,188258,Refinery,UK Royal Navy Reserves base HMS President,,basementions_mentionee,865488ba365e131cf32351f4fbbe51cf,basementions_mentionee__865488ba365e131cf32351f4fbbe51cf
hms raleigh,UK Royal Navy base HMS Raleigh,forbase178,188258,FTO,UK Royal Navy base HMS Raleigh,,basementions_mentionee,3f9aec5168bbb532d1cb41ac541b4a39,basementions_mentionee__3f9aec5168bbb532d1cb41ac541b4a39
holsworthy barracks,Australian Army installation Holsworthy Barracks,forbase179,188258,CompanyKeyword,Australian Army installation Holsworthy Barracks,,basementions_mentionee,fd2380bfa94c7c5f10dfa5c692c61828,basementions_mentionee__fd2380bfa94c7c5f10dfa5c692c61828
holzdorf air base,German Air Force Holzdorf Air Base,forbase136,188258,DiplomaticFacilities,German Air Force Holzdorf Air Base,,basementions_mentionee,e6ab7f3901b1f9bc25e80c6ee45417a4,basementions_mentionee__e6ab7f3901b1f9bc25e80c6ee45417a4
huairen air base,Chinese Air Force Datong Huairen Airport,forbase123,188258,CompanyKeyword,Chinese Air Force Datong Huairen Airport,,basementions_mentionee,82095f743388d80a246b2ad8a1c9b7a3,basementions_mentionee__82095f743388d80a246b2ad8a1c9b7a3
ie jima auxiliary airfield,US Marine Corps le Shima Airfiled,forbase134,188258,Diplomat,US Marine Corps le Shima Airfiled,,basementions_mentionee,369add43483dbe804883a302589be908,basementions_mentionee__369add43483dbe804883a302589be908
île longue strategic submarine base,French Navy Long Island submarine base,forbase68,188258,LegislativeCommittee,French Navy Long Island submarine base,,basementions_mentionee,52c237088745977876029008a510e41e,basementions_mentionee__52c237088745977876029008a510e41e
immelmann-barracks,German Army Celle Air Base,forbase106,188258,LegislativeCommittee,German Army Celle Air Base,,basementions_mentionee,7d44c78827b4314099f314cc44c71184,basementions_mentionee__7d44c78827b4314099f314cc44c71184
istrana air base,Italian Air Force Treviso-Istrana Air Base,forbase12,188258,Organization,Italian Air Force Treviso-Istrana Air Base,,basementions_mentionee,90b1c720ddfd0c8458228a8bbfba87c0,basementions_mentionee__90b1c720ddfd0c8458228a8bbfba87c0
istres air base,French Air and Space Force Air Base 125,forbase32,188258;188261,Diplomat,French Air and Space Force Air Base 125,,basementions_mentionee,467e754b1814ab95ddc1141a2afda6c0,basementions_mentionee__467e754b1814ab95ddc1141a2afda6c0
iwakuni air base,US Marine Corps Air Station Iwakuni,forbase180,188258,Wells,US Marine Corps Air Station Iwakuni,,basementions_mentionee,ae7f139a3326805e6158e5afe1da2baa,basementions_mentionee__ae7f139a3326805e6158e5afe1da2baa
iwo jima air base,JMSDF Iwo Jima Airfield,forbase107,188258,AAEntity,JMSDF Iwo Jima Airfield,,basementions_mentionee,e3c9c6213dd6040edae6912399110771,basementions_mentionee__e3c9c6213dd6040edae6912399110771
iwo jima airfield,JMSDF Iwo Jima Airfield,forbase107,188258,Organization,JMSDF Iwo Jima Airfield,,basementions_mentionee,e3c9c6213dd6040edae6912399110771,basementions_mentionee__e3c9c6213dd6040edae6912399110771
iwo jima communication site,US Navy Iwo-Jima Communications Site,forbase181,188258,DiplomaticFacilities,US Navy Iwo-Jima Communications Site,,basementions_mentionee,a0190a8c873cc3391613d564e0b88275,basementions_mentionee__a0190a8c873cc3391613d564e0b88275
jakjeon naval base,South Korean Navy Busan Naval Base,forbase77,188258,ForeignMinistry,South Korean Navy Busan Naval Base,,basementions_mentionee,a75d86244472e9d9a7054ba1d784a946,basementions_mentionee__a75d86244472e9d9a7054ba1d784a946
jasdf kasuga air base,JASDF Kasuga Airbase,forbase182,188258,LegislativeCommittee,JASDF Kasuga Airbase,,basementions_mentionee,2f3a52d1099c558d0b1eed7d7479034b,basementions_mentionee__2f3a52d1099c558d0b1eed7d7479034b
jasdf otakineyama sub base,JASDF Otakineyama Sub Base,forbase183,188258,Keyphrase,JASDF Otakineyama Sub Base,,basementions_mentionee,fc3fc6b2886e04f6a744b844430c4e4e,basementions_mentionee__fc3fc6b2886e04f6a744b844430c4e4e
jasdf yozadake submarine base,JASDF Yuzuoyue Airbase,forbase184,188258,ForeignMinistry,JASDF Yuzuoyue Airbase,,basementions_mentionee,5163cff4880aa2d37b6d1d11832a03d1,basementions_mentionee__5163cff4880aa2d37b6d1d11832a03d1
jdfpg,Satellite surveillance installation Joint Defence Facility Pine Gap,forbase185,188258,LegislativeCommittee,Satellite surveillance installation Joint Defence Facility Pine Gap,,basementions_mentionee,2f9d6e4d6fd56768c7bd7b29f6e8fbc4,basementions_mentionee__2f9d6e4d6fd56768c7bd7b29f6e8fbc4
jeju civilian-military complex port,South Korean Navy Jeju Civilian-Military Complex Port,forbase186,188258,Refinery,South Korean Navy Jeju Civilian-Military Complex Port,,basementions_mentionee,ccf3ab53a2592cec35060250d44f63cc,basementions_mentionee__ccf3ab53a2592cec35060250d44f63cc
jeju naval base,South Korean Navy Jeju Civilian-Military Complex Port,forbase186,188258,FTO,South Korean Navy Jeju Civilian-Military Complex Port,,basementions_mentionee,ccf3ab53a2592cec35060250d44f63cc,basementions_mentionee__ccf3ab53a2592cec35060250d44f63cc
jgsdf camp iizuka,JGSDF Camp Iizuka,forbase187,188258,DiplomaticFacilities,JGSDF Camp Iizuka,,basementions_mentionee,a2edc0d9c7adefc7cd9e82c4b1e3a22b,basementions_mentionee__a2edc0d9c7adefc7cd9e82c4b1e3a22b
jgsdf camp itazuma,JGSDF Camp Itazuma,forbase188,188258,Exec,JGSDF Camp Itazuma,,basementions_mentionee,0e296aa03aabf056699da47656b770d1,basementions_mentionee__0e296aa03aabf056699da47656b770d1
jgsdf camp katsura,JGSDF Camp Katsura,forbase189,188258,Consulates,JGSDF Camp Katsura,,basementions_mentionee,f603600ce594d2ab1b65ea887014dcf3,basementions_mentionee__f603600ce594d2ab1b65ea887014dcf3
jgsdf camp kita-fuji,JGSDF Camp Kitafuji,forbase190,188258,Consulates,JGSDF Camp Kitafuji,,basementions_mentionee,09ca49a499355c525b9c779de69635a0,basementions_mentionee__09ca49a499355c525b9c779de69635a0
jgsdf camp kitachitose,JGSDF Camp Kitachitose,forbase191,188258,DiplomaticFacilities,JGSDF Camp Kitachitose,,basementions_mentionee,fea3f9dba84994d93d758227130b11ea,basementions_mentionee__fea3f9dba84994d93d758227130b11ea
jgsdf camp komakado,JGSDF Camp Komakado,forbase192,188258,CompanyKeyword,JGSDF Camp Komakado,,basementions_mentionee,cbdd4b7ddfae89cc9a2a243ced3be091,basementions_mentionee__cbdd4b7ddfae89cc9a2a243ced3be091
jgsdf camp kurihama,JGSDF Camp Kurihama,forbase45,188258,AAEntity,JGSDF Camp Kurihama,,basementions_mentionee,3ffa800b43699604dc5bf898aa27ecfb,basementions_mentionee__3ffa800b43699604dc5bf898aa27ecfb
jgsdf camp okubo,JGSDF Camp Okubo,forbase193,188258,IndustryTerm,JGSDF Camp Okubo,,basementions_mentionee,8d1f7d85260584f9d2cb7fd893a5b3b1,basementions_mentionee__8d1f7d85260584f9d2cb7fd893a5b3b1
jgsdf camp omura,JGSDF Camp Omura,forbase194,188258,Pipeline,JGSDF Camp Omura,,basementions_mentionee,38b539c50e57dd0b4c843f4564986621,basementions_mentionee__38b539c50e57dd0b4c843f4564986621
jgsdf camp senzo,JGSDF Camp Senzo,forbase195,188258,Legislator,JGSDF Camp Senzo,,basementions_mentionee,9fb64d04189366d621a92f7d02a9be1c,basementions_mentionee__9fb64d04189366d621a92f7d02a9be1c
jgsdf camp shibata,JGSDF Camp Shibata,forbase196,188258,LegislativeCommittee,JGSDF Camp Shibata,,basementions_mentionee,cf3cfd911d6aaf3a8982c22a9222e602,basementions_mentionee__cf3cfd911d6aaf3a8982c22a9222e602
jgsdf camp sinodayama,JGSDF Camp Shinodayama,forbase197,188258,IndustryTerm,JGSDF Camp Shinodayama,,basementions_mentionee,9f3c5edd6d8cad0ab48e5f0dcfada576,basementions_mentionee__9f3c5edd6d8cad0ab48e5f0dcfada576
jgsdf camp somagahara,JGSDF Camp Somagahara,forbase198,188258,Media,JGSDF Camp Somagahara,,basementions_mentionee,c1a99be79406655e6e77e9e4ebccf7d1,basementions_mentionee__c1a99be79406655e6e77e9e4ebccf7d1
jgsdf camp tachikawa,JGSDF Camp Tachikawa,forbase199,188258,Pipeline,JGSDF Camp Tachikawa,,basementions_mentionee,3d7d8c0f632c96a0d9d14b934769816e,basementions_mentionee__3d7d8c0f632c96a0d9d14b934769816e
jgsdf camp uji,JGSDF Camp Uji,forbase200,188258,FTO,JGSDF Camp Uji,,basementions_mentionee,7ed40a8018fd572ac4a883bcb433a417,basementions_mentionee__7ed40a8018fd572ac4a883bcb433a417
jgsdf camp yonaguni,JGSDF Camp Yonaguni,forbase201,188258,Organization,JGSDF Camp Yonaguni,,basementions_mentionee,54ac5e435bfc2293bc2135b335306699,basementions_mentionee__54ac5e435bfc2293bc2135b335306699
jgsdf camp zama,US Army Camp Zama,forbase202,188258,DiplomaticFacilities,US Army Camp Zama,,basementions_mentionee,3bcaeb1038e438b88608739bef238e93,basementions_mentionee__3bcaeb1038e438b88608739bef238e93
