keyword,caption_name,groups,Location,Title,City,Organization Name (child),Organization Name (Intermediate),Twitter Handle,ENTITY_LABEL,name,description,source,source_identifier,global_identifier
stephanie sullivan,US Ambassador Stephanie Sullivan,,Ghana,Ambassador,Accra,Office of the U.S. Ambassador to Ghana,U.S. Embassy in Ghana,USEmbassyGhana,Keyphrase,US Ambassador Stephanie Sullivan,,bp_mentionee,18ec727329899a3a69e8e0bd8383deb0,bp_mentionee__18ec727329899a3a69e8e0bd8383deb0
amy swonger,US Member Amy Swonger,,USA,Member,Washington DC,J. William Fulbright Foreign Scholarship Board,Bureau of Educational and Cultural Affairs,,IndustryTerm,US Member Amy Swonger,,bp_mentionee,f3981d3d2c46d354f3e734a7ade823ec,bp_mentionee__f3981d3d2c46d354f3e734a7ade823ec
linda taglialatela,US Ambassador Linda Taglialatela,,Barbados,Ambassador,Bridgetown,Office of the U.S. Ambassador to Barbados - Eastern Caribbean,"U.S. Embassy in Barbados, the Eastern Caribbean, and the Organisation of Eastern Caribbean States",USEmbassyBtown,Organization,US Ambassador Linda Taglialatela,,bp_mentionee,b290dfb6ae87955e3d1cec8f6d409bfc,bp_mentionee__b290dfb6ae87955e3d1cec8f6d409bfc
david tamasi,US Member David Tamasi,,USA,Member,Washington DC,Cultural Property Advisory Committee,Bureau of Educational and Cultural Affairs,,IndustryTerm,US Member David Tamasi,,bp_mentionee,400ec550dd6c6e92208fe29a9458e360,bp_mentionee__400ec550dd6c6e92208fe29a9458e360
lucy tamlyn,US Ambassador Lucy Tamlyn,,Central African Republic,Ambassador,Bangui,Office of the U.S. Ambassador to the Central African Republic,U.S. Embassy in the Central African Republic,USAmbCAR,Legislator,US Ambassador Lucy Tamlyn,,bp_mentionee,8984395435d0a516d40b095fdf4e1dca,bp_mentionee__8984395435d0a516d40b095fdf4e1dca
alaina teplitz,US Ambassador Alaina Teplitz,,Sri Lanka,Ambassador,Colombo,U.S. Embassy in Sri Lanka,,USAmbSLM,Diplomat,US Ambassador Alaina Teplitz,,bp_mentionee,305acc72fcbb50b4554a61ea3999efd6,bp_mentionee__305acc72fcbb50b4554a61ea3999efd6
linda thomas-greenfield,US Permanent Representative to the United Nations Linda Thomas-Greenfield,,USA,U.S. Permanent Representative to the United Nations,New York,United States Mission to the United Nations,,USAmbUN,Shipping,US Permanent Representative to the United Nations Linda Thomas-Greenfield,,bp_mentionee,353fa565952042bf5c78e806c13c5c86,bp_mentionee__353fa565952042bf5c78e806c13c5c86
rachel thomas,US Member Rachel Thomas,,USA,Member,Washington DC,United States Advisory Council on Human Trafficking,President's Interagency Task Force To Monitor and Combat Trafficking in Persons,,ForeignMinistry,US Member Rachel Thomas,,bp_mentionee,6011be49fa8c1a64cc41ce8bb48b7b42,bp_mentionee__6011be49fa8c1a64cc41ce8bb48b7b42
dean thompson,US Assistant Secretary Dean Thompson,,USA,Assistant Secretary,Washington DC,Bureau of South and Central Asian Affairs,,deanthompson,Organization,US Assistant Secretary Dean Thompson,,bp_mentionee,74cddb1ec2261d26f06689addfa7dde9,bp_mentionee__74cddb1ec2261d26f06689addfa7dde9
lynne tracy,US Ambassador Lynne Tracy,,Armenia,Ambassador,Yerevan,Office of the U.S. Ambassador to Armenia,U.S. Embassy in Armenia,usembarmenia,Organization,US Ambassador Lynne Tracy,,bp_mentionee,04ffb9d2c0c3771f197a25dcdd3f2c25,bp_mentionee__04ffb9d2c0c3771f197a25dcdd3f2c25
leslie tsou,US Ambassador Leslie Tsou,,Oman,Ambassador,Muscat,Office of the U.S. Ambassador to Oman,U.S. Embassy in Oman,USEmbMuscat,Wells,US Ambassador Leslie Tsou,,bp_mentionee,478c43cd13d8ca9f53c0da629b07387d,bp_mentionee__478c43cd13d8ca9f53c0da629b07387d
matthew tueller,US Ambassador Matthew Tueller,,Iraq,Ambassador,Baghdad,Office of the U.S. Ambassador to Iraq,U.S. Embassy in Iraq,USAmbIraq,News,US Ambassador Matthew Tueller,,bp_mentionee,d78f8de6815f359ea0a89240b2fb802b,bp_mentionee__d78f8de6815f359ea0a89240b2fb802b
bruce turner,US Assistant Secretary Bruce Turner,,USA,Assistant Secretary,Washington DC,"Bureau of Arms Control, Verification and Compliance",Under Secretary for Arms Control and International Security,StateAVC,News,US Assistant Secretary Bruce Turner,,bp_mentionee,1f707ff355ebd7afdebcb29f041533b5,bp_mentionee__1f707ff355ebd7afdebcb29f041533b5
thomas vajda,US Ambassador Thomas Vajda,,Myanmar (Burma),Ambassador,Rangoon,Office of the U.S. Ambassador to Burma,U.S. Embassy in Burma,USEmbassyBurma,AAEntity,US Ambassador Thomas Vajda,,bp_mentionee,e14e8ee4034d43b0a21ceb42ac7d9958,bp_mentionee__e14e8ee4034d43b0a21ceb42ac7d9958
john viola,US Member John Viola,,USA,Member,Washington DC,J. William Fulbright Foreign Scholarship Board,Bureau of Educational and Cultural Affairs,JohnMViola,Consulates,US Member John Viola,,bp_mentionee,5c958bda11a27ac985450abc21865327,bp_mentionee__5c958bda11a27ac985450abc21865327
richard visek,US Legal Adviser Richard Visek,,USA,Legal Adviser,Washington DC,Office of the Legal Adviser,Office of the Secretary,,ForeignMinister,US Legal Adviser Richard Visek,,bp_mentionee,ea860789e377c69d6214aaa930c59631,bp_mentionee__ea860789e377c69d6214aaa930c59631
peter vrooman,US Ambassador Peter Vrooman,,Rwanda,Ambassador,Kigali,Office of the U.S. Ambassador to Rwanda,U.S. Embassy in Rwanda,usambrwanda,ForeignMinistry,US Ambassador Peter Vrooman,,bp_mentionee,1eae077645fc5d5f7ca40f79721978b9,bp_mentionee__1eae077645fc5d5f7ca40f79721978b9
james walsh,US Assistant Secretary James Walsh,,USA,Assistant Secretary,Washington DC,Bureau of International Narcotics and Law Enforcement Affairs,"Under Secretary for Civilian Security, Democracy, and Human Rights",jameswa10056409,Diplomat,US Assistant Secretary James Walsh,,bp_mentionee,ae382dfec96234906bc588594f58d048,bp_mentionee__ae382dfec96234906bc588594f58d048
kristin weis,US Member Kristin Weis,,USA,Member,Washington DC,Public-Private Partnership Advisory Council to End Human Trafficking,,,space,US Member Kristin Weis,,bp_mentionee,f2178834cd0cf9e8ca83cbac7db64e31,bp_mentionee__f2178834cd0cf9e8ca83cbac7db64e31
eric whitaker,US Ambassador Eric Whitaker,,Niger,Ambassador,Niamey,Office of the U.S. Ambassador to Niger,U.S. Embassy in Niger,USEmbassyNiamey,LegislativeCommittee,US Ambassador Eric Whitaker,,bp_mentionee,c7ee4f6a40724cbeb4aff32fc2c841d1,bp_mentionee__c7ee4f6a40724cbeb4aff32fc2c841d1
karol wight,US Member Karol Wight,,USA,Member,Washington DC,Cultural Property Advisory Committee,Bureau of Educational and Cultural Affairs,WightKarol,Exec,US Member Karol Wight,,bp_mentionee,8c215e02872b47f79df74c8c7c60cdee,bp_mentionee__8c215e02872b47f79df74c8c7c60cdee
karen williams,US Ambassador Karen Williams,,Suriname,Ambassador,Paramaribo,Office of the U.S. Ambassador to Suriname,U.S. Embassy in Suriname,USEmbassyParbo,Pipeline,US Ambassador Karen Williams,,bp_mentionee,f9606eae6ff58a5a26aa65e74a4999b2,bp_mentionee__f9606eae6ff58a5a26aa65e74a4999b2
paul winfree,US Chair Paul Winfree,,USA,Chair,Washington DC,J. William Fulbright Foreign Scholarship Board,Bureau of Educational and Cultural Affairs,paulwinfree,Refinery,US Chair Paul Winfree,,bp_mentionee,760a9913e77ee3153899abee508bbafb,bp_mentionee__760a9913e77ee3153899abee508bbafb
anthony wisniewski,US Member Anthony Wisniewski,,USA,Member,Washington DC,Cultural Property Advisory Committee,Bureau of Educational and Cultural Affairs,,Consulates,US Member Anthony Wisniewski,,bp_mentionee,edcc469fd6c8b52ace03ab3216cc90cd,bp_mentionee__edcc469fd6c8b52ace03ab3216cc90cd
robert wood,US U.S. Representative to the Conference on Disarmament/Special Representative of the President of the U.S. for Non-proliferation of Nuclear Weapons Robert Wood,,Switzerland,U.S. Representative to the Conference on Disarmament/Special Representative of the President of the U.S. for Non-proliferation of Nuclear Weapons,Geneva,U.S. Delegation to the Conference on Disarmament,,USAmbCD,IndustryTerm,US U.S. Representative to the Conference on Disarmament/Special Representative of the President of the U.S. for Non-proliferation of Nuclear Weapons Robert Wood,,bp_mentionee,c3d0d416a98b160d399e8f8d75363122,bp_mentionee__c3d0d416a98b160d399e8f8d75363122
henry wooster,US Ambassador Henry Wooster,,Jordan,Ambassador,Amman,Office of the U.S. Ambassador to Jordan,U.S. Embassy in Jordan,USEmbassyJordan,CompanyKeyword,US Ambassador Henry Wooster,,bp_mentionee,c9cffb6c93dd5a2a6042427e69ed127c,bp_mentionee__c9cffb6c93dd5a2a6042427e69ed127c
donald wright,US Ambassador Donald Wright,,Tanzania,Ambassador,Dar es Salaam,Office of the U.S. Ambassador to Tanzania,U.S. Embassy in Tanzania,USAmbTanzania,DiplomaticFacilities,US Ambassador Donald Wright,,bp_mentionee,c658fb1ef653b60c3efc62a40e48477d,bp_mentionee__c658fb1ef653b60c3efc62a40e48477d
donald yamamoto,US Ambassador Donald Yamamoto,,Somalia,Ambassador,Mogadishu,Office of the U.S. Ambassador to Somalia,U.S. Mission to Somalia,US2SOMALIA,Media,US Ambassador Donald Yamamoto,,bp_mentionee,e158cadc0dae8224c68f0a268f7ecd95,bp_mentionee__e158cadc0dae8224c68f0a268f7ecd95
lance yohe,US U.S. Commissioner Lance Yohe,,USA,U.S. Commissioner,Washington DC,"International Joint Commission, Canada and United States -- United States Section",Office of the Secretary,IJCsharedwaters,DiplomaticFacilities,US U.S. Commissioner Lance Yohe,,bp_mentionee,a67d6f1554297f0ccadb6a339d64944c,bp_mentionee__a67d6f1554297f0ccadb6a339d64944c
uzra zeya,US Under Secretary (Designate) Uzra Zeya,,USA,Under Secretary (Designate),Washington DC,"Under Secretary for Civilian Security, Democracy, and Human Rights",,UzraZeya,Refinery,US Under Secretary (Designate) Uzra Zeya,,bp_mentionee,c6e4408e0ca83af15784bedfd540406a,bp_mentionee__c6e4408e0ca83af15784bedfd540406a
the secretary of state,The Secretary of State,,United States,,,,,,Exec,The Secretary of State,,bp_mentionee,ab46520983ed081d1407059ce6879611,bp_mentionee__ab46520983ed081d1407059ce6879611
bureau of intelligence and research,Bureau of Intelligence and Research,,United States,,,,,,Person,Bureau of Intelligence and Research,,bp_mentionee,f2910a0acb3ee1fb5328b9b7eaeb7d9b,bp_mentionee__f2910a0acb3ee1fb5328b9b7eaeb7d9b
bureau of legislative affairs,Bureau of Legislative Affairs,,United States,,,,,,Keyphrase,Bureau of Legislative Affairs,,bp_mentionee,3130867d857569662ea9b87e0b56524e,bp_mentionee__3130867d857569662ea9b87e0b56524e
counselor of the department,Counselor of the Department,,United States,,,,,,IndustryTerm,Counselor of the Department,,bp_mentionee,af555d23181671cd2bf91c4013d9d679,bp_mentionee__af555d23181671cd2bf91c4013d9d679
executive secretariat,Executive Secretariat,,United States,,,,,,FTO,Executive Secretariat,,bp_mentionee,6c630384edd344afd432fbdc17e50c5b,bp_mentionee__6c630384edd344afd432fbdc17e50c5b
the global coalition to defeat isis,The Global Coalition To Defeat ISIS,,United States,,,,,,Refinery,The Global Coalition To Defeat ISIS,,bp_mentionee,54df38886ead76d12bc13b990ce39ac3,bp_mentionee__54df38886ead76d12bc13b990ce39ac3
office of the chief of protocol,Office of the Chief of Protocol,,United States,,,,,,Refinery,Office of the Chief of Protocol,,bp_mentionee,7635c015874e020d31e6df7b3a1d0159,bp_mentionee__7635c015874e020d31e6df7b3a1d0159
office of civil rights,Office of Civil Rights,,United States,,,,,,Keyphrase,Office of Civil Rights,,bp_mentionee,28dc68dae07b0a4aa26149ee0835921a,bp_mentionee__28dc68dae07b0a4aa26149ee0835921a
office of the coordinator for cyber issues,Office of the Coordinator for Cyber Issues,,United States,,,,,,CompanyKeyword,Office of the Coordinator for Cyber Issues,,bp_mentionee,428bafb753f24edd716e124d4a8b5138,bp_mentionee__428bafb753f24edd716e124d4a8b5138
office of foreign assistance,Office of Foreign Assistance,,United States,,,,,,space,Office of Foreign Assistance,,bp_mentionee,763d82cd242e5d3ca46be927dc976e0c,bp_mentionee__763d82cd242e5d3ca46be927dc976e0c
office of global women’s issues,Office of Global Women’s Issues,,United States,,,,,,space,Office of Global Women’s Issues,,bp_mentionee,2bc3997efc8a81e0c2a5b40d626a1aa8,bp_mentionee__2bc3997efc8a81e0c2a5b40d626a1aa8
office of the legal adviser,Office of the Legal Adviser,,United States,,,,,,Organization,Office of the Legal Adviser,,bp_mentionee,f1b75615ed56f7f560788417ca04ef2c,bp_mentionee__f1b75615ed56f7f560788417ca04ef2c
office of the ombudsman,Office of the Ombudsman,,United States,,,,,,AAEntity,Office of the Ombudsman,,bp_mentionee,94b9d1266e373f1ec770516d0309fcf2,bp_mentionee__94b9d1266e373f1ec770516d0309fcf2
office of the u.s. global aids coordinator and global health diplomacy,Office of the U.S. Global AIDS Coordinator and Global Health Diplomacy,,United States,,,,,,Person,Office of the U.S. Global AIDS Coordinator and Global Health Diplomacy,,bp_mentionee,fa75c7bd33d0a146e1fb85c236f2a2a1,bp_mentionee__fa75c7bd33d0a146e1fb85c236f2a2a1
policy planning staff,Policy Planning Staff,,United States,,,,,,IndustryTerm,Policy Planning Staff,,bp_mentionee,4d456e301f68ea23205741829b5db5f5,bp_mentionee__4d456e301f68ea23205741829b5db5f5
special presidential envoy for hostage affairs,Special Presidential Envoy for Hostage Affairs,,United States,,,,,,IndustryTerm,Special Presidential Envoy for Hostage Affairs,,bp_mentionee,55e2659f7aeb43c674fda3a43bd6e15b,bp_mentionee__55e2659f7aeb43c674fda3a43bd6e15b
special representative for afghanistan reconciliation,Special Representative for Afghanistan Reconciliation,,United States,,,,,,Refinery,Special Representative for Afghanistan Reconciliation,,bp_mentionee,c7a893ea86231a474968841ffb098f9c,bp_mentionee__c7a893ea86231a474968841ffb098f9c
special representative for iran,Special Representative for Iran,,United States,,,,,,IndustryTerm,Special Representative for Iran,,bp_mentionee,1c7944071d25f9b532434085cad58180,bp_mentionee__1c7944071d25f9b532434085cad58180
special representative for syria engagement,Special Representative for Syria Engagement,,United States,,,,,,Refinery,Special Representative for Syria Engagement,,bp_mentionee,eecdf5910f96e7412685f60d0718b0e1,bp_mentionee__eecdf5910f96e7412685f60d0718b0e1
special representative for venezuela,Special Representative for Venezuela,,United States,,,,,,Media,Special Representative for Venezuela,,bp_mentionee,293b9160193ba6a47c0d5d1de3ccb1f4,bp_mentionee__293b9160193ba6a47c0d5d1de3ccb1f4
u.s. security coordinator for israel and the palestinian authority,U.S. Security Coordinator for Israel and the Palestinian Authority,,United States,,,,,,Keyphrase,U.S. Security Coordinator for Israel and the Palestinian Authority,,bp_mentionee,79ecb23924e2d5f5073ae8a0657e42df,bp_mentionee__79ecb23924e2d5f5073ae8a0657e42df
deputy secretary of state,Deputy Secretary of State,,United States,,,,,,Consulates,Deputy Secretary of State,,bp_mentionee,4663f13dba10a3d91324af0dfdf44887,bp_mentionee__4663f13dba10a3d91324af0dfdf44887
office of small and disadvantaged business utilization,Office of Small and Disadvantaged Business Utilization,,United States,,,,,,Diplomat,Office of Small and Disadvantaged Business Utilization,,bp_mentionee,e2b702dfd526b55e0fd86195fd92828a,bp_mentionee__e2b702dfd526b55e0fd86195fd92828a
office of the u.s. coordinator for the arctic region,Office of the U.S. Coordinator for the Arctic Region,,United States,,,,,,Media,Office of the U.S. Coordinator for the Arctic Region,,bp_mentionee,82ac97ad4fbc9f241be7ab01a27f46ab,bp_mentionee__82ac97ad4fbc9f241be7ab01a27f46ab
under secretary for arms control and international security,Under Secretary for Arms Control and International Security,,United States,,,,,,News,Under Secretary for Arms Control and International Security,,bp_mentionee,5fab6f91171198eae83925cd50362a93,bp_mentionee__5fab6f91171198eae83925cd50362a93
"bureau of arms control, verification and compliance","Bureau of Arms Control, Verification and Compliance",,United States,,,,,,Wells,"Bureau of Arms Control, Verification and Compliance",,bp_mentionee,263914fa8420a41b5ff8cc9eda37bd67,bp_mentionee__263914fa8420a41b5ff8cc9eda37bd67
bureau of international security and nonproliferation,Bureau of International Security and Nonproliferation,,United States,,,,,,Legislator,Bureau of International Security and Nonproliferation,,bp_mentionee,564ce5298d50302e0bc5e861473a3854,bp_mentionee__564ce5298d50302e0bc5e861473a3854
bureau of political-military affairs,Bureau of Political-Military Affairs,,United States,,,,,,Pipeline,Bureau of Political-Military Affairs,,bp_mentionee,bf86ca0fbbbed1cb2e0688271897e1f0,bp_mentionee__bf86ca0fbbbed1cb2e0688271897e1f0
"under secretary for civilian security, democracy, and human rights","Under Secretary for Civilian Security, Democracy, and Human Rights",,United States,,,,,,Organization,"Under Secretary for Civilian Security, Democracy, and Human Rights",,bp_mentionee,5094287add011521bbf858d97f5a7794,bp_mentionee__5094287add011521bbf858d97f5a7794
bureau of conflict and stabilization operations,Bureau of Conflict and Stabilization Operations,,United States,,,,,,FTO,Bureau of Conflict and Stabilization Operations,,bp_mentionee,9f47e5ca7269090cd2d82fc3bd0abcbb,bp_mentionee__9f47e5ca7269090cd2d82fc3bd0abcbb
bureau of counterterrorism,Bureau of Counterterrorism,,United States,,,,,,Organization,Bureau of Counterterrorism,,bp_mentionee,4df2066d46f1f2e7430f1ab221ff4d55,bp_mentionee__4df2066d46f1f2e7430f1ab221ff4d55
"bureau of democracy, human rights, and labor","Bureau of Democracy, Human Rights, and Labor",,United States,,,,,,FTO,"Bureau of Democracy, Human Rights, and Labor",,bp_mentionee,b729b36ecc76f4827738a7b22e944d71,bp_mentionee__b729b36ecc76f4827738a7b22e944d71
bureau of international narcotics and law enforcement affairs,Bureau of International Narcotics and Law Enforcement Affairs,,United States,,,,,,Wells,Bureau of International Narcotics and Law Enforcement Affairs,,bp_mentionee,c2a5b898f665d59f428e40266df0e93f,bp_mentionee__c2a5b898f665d59f428e40266df0e93f
"bureau of population, refugees, and migration","Bureau of Population, Refugees, and Migration",,United States,,,,,,CompanyKeyword,"Bureau of Population, Refugees, and Migration",,bp_mentionee,8ddb66af257814d24df4d64e4ee6b00f,bp_mentionee__8ddb66af257814d24df4d64e4ee6b00f
office of global criminal justice,Office of Global Criminal Justice,,United States,,,,,,Media,Office of Global Criminal Justice,,bp_mentionee,76c6f49f1c31348fd3f8e481230bb668,bp_mentionee__76c6f49f1c31348fd3f8e481230bb668
office of international religious freedom,Office of International Religious Freedom,,United States,,,,,,FTO,Office of International Religious Freedom,,bp_mentionee,9f1db66aa3c4fcfb2a67f8c9ae713257,bp_mentionee__9f1db66aa3c4fcfb2a67f8c9ae713257
office of the special envoy to monitor and combat anti-semitism,Office of the Special Envoy To Monitor and Combat Anti-Semitism,,United States,,,,,,Keyphrase,Office of the Special Envoy To Monitor and Combat Anti-Semitism,,bp_mentionee,bed8797b804df66f6af316f98062bf6e,bp_mentionee__bed8797b804df66f6af316f98062bf6e
office of the u.s. special coordinator for tibetan issues,Office of the U.S. Special Coordinator for Tibetan Issues,,United States,,,,,,Shipping,Office of the U.S. Special Coordinator for Tibetan Issues,,bp_mentionee,46c8fc57285d7ee48090142c706595b6,bp_mentionee__46c8fc57285d7ee48090142c706595b6
office to monitor and combat trafficking in persons,Office to Monitor and Combat Trafficking in Persons,,United States,,,,,,Consulates,Office to Monitor and Combat Trafficking in Persons,,bp_mentionee,a4330a5136ecd2a2defabb77089f425b,bp_mentionee__a4330a5136ecd2a2defabb77089f425b
"under secretary for economic growth, energy, and the environment","Under Secretary for Economic Growth, Energy, and the Environment",,United States,,,,,,News,"Under Secretary for Economic Growth, Energy, and the Environment",,bp_mentionee,826c4a3491e881732a0a89007836eba0,bp_mentionee__826c4a3491e881732a0a89007836eba0
bureau of economic and business affairs,Bureau of Economic and Business Affairs,,United States,,,,,,FTO,Bureau of Economic and Business Affairs,,bp_mentionee,d2cc4390430fd730c75515b230d4a843,bp_mentionee__d2cc4390430fd730c75515b230d4a843
bureau of energy resources,Bureau of Energy Resources,,United States,,,,,,Wells,Bureau of Energy Resources,,bp_mentionee,23f7abd8d33934da84996ece7c2291ef,bp_mentionee__23f7abd8d33934da84996ece7c2291ef
bureau of oceans and international environmental and scientific affairs,Bureau of Oceans and International Environmental and Scientific Affairs,,United States,,,,,,IndustryTerm,Bureau of Oceans and International Environmental and Scientific Affairs,,bp_mentionee,690e0b507d7d539362122484060a1c30,bp_mentionee__690e0b507d7d539362122484060a1c30
office of global partnerships,Office of Global Partnerships,,United States,,,,,,Organization,Office of Global Partnerships,,bp_mentionee,3c764193bc2e29c10e35374391d74c16,bp_mentionee__3c764193bc2e29c10e35374391d74c16
office of the chief economist,Office of the Chief Economist,,United States,,,,,,Pipeline,Office of the Chief Economist,,bp_mentionee,5f766ca9cf3dd922647998496f5233aa,bp_mentionee__5f766ca9cf3dd922647998496f5233aa
office of the science and technology adviser,Office of the Science and Technology Adviser,,United States,,,,,,Exec,Office of the Science and Technology Adviser,,bp_mentionee,d52fb18e802e26608f524d755ed0e2be,bp_mentionee__d52fb18e802e26608f524d755ed0e2be
under secretary for management,Under Secretary for Management,,United States,,,,,,LegislativeCommittee,Under Secretary for Management,,bp_mentionee,26da7ede10d24de0133deedb2d21c822,bp_mentionee__26da7ede10d24de0133deedb2d21c822
bureau of administration,Bureau of Administration,,United States,,,,,,News,Bureau of Administration,,bp_mentionee,25710b921a4670c022930e4fd2a15fc3,bp_mentionee__25710b921a4670c022930e4fd2a15fc3
bureau of budget and planning,Bureau of Budget and Planning,,United States,,,,,,Wells,Bureau of Budget and Planning,,bp_mentionee,5f0ebcaccca29a36a0c7a7fefea18823,bp_mentionee__5f0ebcaccca29a36a0c7a7fefea18823
bureau of the comptroller and global financial services,Bureau of the Comptroller and Global Financial Services,,United States,,,,,,Exec,Bureau of the Comptroller and Global Financial Services,,bp_mentionee,042b5ea291320bb2b9e40c927d3f7b69,bp_mentionee__042b5ea291320bb2b9e40c927d3f7b69
bureau of consular affairs,Bureau of Consular Affairs,,United States,,,,,,Wells,Bureau of Consular Affairs,,bp_mentionee,0a6f46d4b015a98e89d5ca8ad7d12fc3,bp_mentionee__0a6f46d4b015a98e89d5ca8ad7d12fc3
bureau of diplomatic security,Bureau of Diplomatic Security,,United States,,,,,,AAEntity,Bureau of Diplomatic Security,,bp_mentionee,cff19ded56eecd4124e08be71e825626,bp_mentionee__cff19ded56eecd4124e08be71e825626
bureau of global talent management,Bureau of Global Talent Management,,United States,,,,,,Keyphrase,Bureau of Global Talent Management,,bp_mentionee,63a90a263ea746d6d51d2c931f0d0c40,bp_mentionee__63a90a263ea746d6d51d2c931f0d0c40
bureau of information resource management,Bureau of Information Resource Management,,United States,,,,,,Keyphrase,Bureau of Information Resource Management,,bp_mentionee,ccbc92ed91182db0d62a4616fed24fbf,bp_mentionee__ccbc92ed91182db0d62a4616fed24fbf
bureau of medical services,Bureau of Medical Services,,United States,,,,,,News,Bureau of Medical Services,,bp_mentionee,80cea3c72fcc36bd07818a453a99057d,bp_mentionee__80cea3c72fcc36bd07818a453a99057d
bureau of overseas buildings operations,Bureau of Overseas Buildings Operations,,United States,,,,,,ForeignMinister,Bureau of Overseas Buildings Operations,,bp_mentionee,8ff2c41f3e9b197229352253cb1681fa,bp_mentionee__8ff2c41f3e9b197229352253cb1681fa
director of diplomatic reception rooms,Director of Diplomatic Reception Rooms,,United States,,,,,,space,Director of Diplomatic Reception Rooms,,bp_mentionee,fc6afeb4b2b340f3579ad3a96fd75185,bp_mentionee__fc6afeb4b2b340f3579ad3a96fd75185
foreign service institute,Foreign Service Institute,,United States,,,,,,space,Foreign Service Institute,,bp_mentionee,b00663d6d1b612e64e844703a3cec87d,bp_mentionee__b00663d6d1b612e64e844703a3cec87d
office of foreign missions,Office of Foreign Missions,,United States,,,,,,Media,Office of Foreign Missions,,bp_mentionee,5cbb73b7f07b557177a740107e6926f4,bp_mentionee__5cbb73b7f07b557177a740107e6926f4
office of management strategy and solutions,Office of Management Strategy and Solutions,,United States,,,,,,Keyphrase,Office of Management Strategy and Solutions,,bp_mentionee,ce39b4b773e33b9dbcd8a1fbefcdf6c0,bp_mentionee__ce39b4b773e33b9dbcd8a1fbefcdf6c0
under secretary for political affairs,Under Secretary for Political Affairs,,United States,,,,,,Diplomat,Under Secretary for Political Affairs,,bp_mentionee,3e741fe6621bc0d7dd4b297ee1f62714,bp_mentionee__3e741fe6621bc0d7dd4b297ee1f62714
bureau of african affairs,Bureau of African Affairs,,United States,,,,,,Consulates,Bureau of African Affairs,,bp_mentionee,2aa1a3335a736e84e1bf3ab22075a4c8,bp_mentionee__2aa1a3335a736e84e1bf3ab22075a4c8
bureau of east asian and pacific affairs,Bureau of East Asian and Pacific Affairs,,United States,,,,,,ForeignMinistry,Bureau of East Asian and Pacific Affairs,,bp_mentionee,8ec9acb3a1f85514333012df32e64c67,bp_mentionee__8ec9acb3a1f85514333012df32e64c67
bureau of european and eurasian affairs,Bureau of European and Eurasian Affairs,,United States,,,,,,Exec,Bureau of European and Eurasian Affairs,,bp_mentionee,f31bc954eabffab83c37825d0fea2f75,bp_mentionee__f31bc954eabffab83c37825d0fea2f75
bureau of international organization affairs,Bureau of International Organization Affairs,,United States,,,,,,ForeignMinistry,Bureau of International Organization Affairs,,bp_mentionee,f156cbaa072666dabbb4eaeaffcf417c,bp_mentionee__f156cbaa072666dabbb4eaeaffcf417c
bureau of near eastern affairs,Bureau of Near Eastern Affairs,,United States,,,,,,DiplomaticFacilities,Bureau of Near Eastern Affairs,,bp_mentionee,df2307fbd6b7fbfa815dd5eb27d7fe13,bp_mentionee__df2307fbd6b7fbfa815dd5eb27d7fe13
bureau of south and central asian affairs,Bureau of South and Central Asian Affairs,,United States,,,,,,ForeignMinistry,Bureau of South and Central Asian Affairs,,bp_mentionee,b7d72372d6348d38cefc09b6e578f3b8,bp_mentionee__b7d72372d6348d38cefc09b6e578f3b8
