handle,caption_name,location,type,location_lower,exclude_groups,ENTITY_LABEL,name,description,source,source_identifier,global_identifier
5492443184,Chinese actor Wang Yibo,beijingbeijing,,beijingbeijing,,,Chinese actor Wang Yibo,,dgm_weibo_publicfigures_mentioner,b199bc2337ca3f17bb10efd43513be3d,dgm_weibo_publicfigures_mentioner__b199bc2337ca3f17bb10efd43513be3d
3623353053,Chinese singer Jackson Yee,beijingbeijing,,beijingbeijing,,,Chinese singer Jackson Yee,,dgm_weibo_publicfigures_mentioner,1dfc7fa047da72b170fe2b5900db7070,dgm_weibo_publicfigures_mentioner__1dfc7fa047da72b170fe2b5900db7070
1192329374,Chinese actor Xie Na,beijingbeijing,,beijingbeijing,,,Chinese actor Xie Na,,dgm_weibo_publicfigures_mentioner,35893be3da17e8d7c3f486e9d22994e9,dgm_weibo_publicfigures_mentioner__35893be3da17e8d7c3f486e9d22994e9
1195230310,Chinese TV presenter He Jiong,beijingbeijing,,beijingbeijing,,,Chinese TV presenter He Jiong,,dgm_weibo_publicfigures_mentioner,2a2c601a603623320538a92b5632e966,dgm_weibo_publicfigures_mentioner__2a2c601a603623320538a92b5632e966
1195242865,Chinese actor Yang Mi,beijingbeijing,,beijingbeijing,,,Chinese actor Yang Mi,,dgm_weibo_publicfigures_mentioner,de413b32d3162206f7430c1db0fc8cf4,dgm_weibo_publicfigures_mentioner__de413b32d3162206f7430c1db0fc8cf4
1642351362,Chinese singer Angelababy,beijingbeijing,,beijingbeijing,,,Chinese singer Angelababy,,dgm_weibo_publicfigures_mentioner,7bfcfb561b2d7044344fd8142e6dc255,dgm_weibo_publicfigures_mentioner__7bfcfb561b2d7044344fd8142e6dc255
1087770692,Chinese actor Chen Kun,beijingbeijing,,beijingbeijing,,,Chinese actor Chen Kun,,dgm_weibo_publicfigures_mentioner,264b7ef03bbb536164be58c51be8f6ee,dgm_weibo_publicfigures_mentioner__264b7ef03bbb536164be58c51be8f6ee
210926262,Chinese actor Zhao Yiling,beijingbeijing,,beijingbeijing,,,Chinese actor Zhao Yiling,,dgm_weibo_publicfigures_mentioner,707adc80e2cbb8f7e0d756050aa70249,dgm_weibo_publicfigures_mentioner__707adc80e2cbb8f7e0d756050aa70249
1656809190,Chinese actor Vicki Zhao,beijingbeijing,,beijingbeijing,,,Chinese actor Vicki Zhao,,dgm_weibo_publicfigures_mentioner,7e4d3f8166983ab1a185f18fdf6ff820,dgm_weibo_publicfigures_mentioner__7e4d3f8166983ab1a185f18fdf6ff820
1266321801,Chinese actor Yao Chen,beijingbeijing,,beijingbeijing,,,Chinese actor Yao Chen,,dgm_weibo_publicfigures_mentioner,ba5ed9c46c20b9f77b1d61d96f1e4b7b,dgm_weibo_publicfigures_mentioner__ba5ed9c46c20b9f77b1d61d96f1e4b7b
5187664653,Chinese actor Deng Chao,beijingbeijing,,beijingbeijing,,,Chinese actor Deng Chao,,dgm_weibo_publicfigures_mentioner,1a15d9acbfbcecc5e37649ce372cad56,dgm_weibo_publicfigures_mentioner__1a15d9acbfbcecc5e37649ce372cad56
2609400635,Chinese singer Wang Junkai,beijingbeijing,,beijingbeijing,,,Chinese singer Wang Junkai,,dgm_weibo_publicfigures_mentioner,07512a105a1ba1e6567f96fbd3950b68,dgm_weibo_publicfigures_mentioner__07512a105a1ba1e6567f96fbd3950b68
2706896955,Chinese singer Lay Zhang,beijingbeijing,,beijingbeijing,,,Chinese singer Lay Zhang,,dgm_weibo_publicfigures_mentioner,bcad087adb346692759a88dc5733cae8,dgm_weibo_publicfigures_mentioner__bcad087adb346692759a88dc5733cae8
3591355593,Chinese-Canadian singer Kris Wu,beijingbeijing,,beijingbeijing,,,Chinese-Canadian singer Kris Wu,,dgm_weibo_publicfigures_mentioner,d34dbd182febb7a084264adf9d8c9501,dgm_weibo_publicfigures_mentioner__d34dbd182febb7a084264adf9d8c9501
3952070245,Chinese actor Fan Bingbing,beijingbeijing,,beijingbeijing,,,Chinese actor Fan Bingbing,,dgm_weibo_publicfigures_mentioner,d6d0b29f8261caa23808e2281d9681d1,dgm_weibo_publicfigures_mentioner__d6d0b29f8261caa23808e2281d9681d1
1537790411,Chinese actor Lu Han,beijingbeijing,,beijingbeijing,,,Chinese actor Lu Han,,dgm_weibo_publicfigures_mentioner,0ccb2b7278bcd054b637042a35e13ce0,dgm_weibo_publicfigures_mentioner__0ccb2b7278bcd054b637042a35e13ce0
1826792401,Son of founder of Dalian Wanda Group Wang Sicong,beijingbeijing,,beijingbeijing,,,Son of founder of Dalian Wanda Group Wang Sicong,,dgm_weibo_publicfigures_mentioner,eb279e3b5b37ff115003efcb0d548e2d,dgm_weibo_publicfigures_mentioner__eb279e3b5b37ff115003efcb0d548e2d
1182391231,Soho China CEO Pan Shiyi,beijingbeijing,,beijingbeijing,,,Soho China CEO Pan Shiyi,,dgm_weibo_publicfigures_mentioner,50006c77d88b47112e920cdde977fd05,dgm_weibo_publicfigures_mentioner__50006c77d88b47112e920cdde977fd05
1749127163,Xiaomi founder Lei Jun,beijingbeijing,,beijingbeijing,,,Xiaomi founder Lei Jun,,dgm_weibo_publicfigures_mentioner,83b2067b9e46e2d3038998a257a95f8f,dgm_weibo_publicfigures_mentioner__83b2067b9e46e2d3038998a257a95f8f
2145291155,Alibaba founder Jack Ma,beijingbeijing,,beijingbeijing,,,Alibaba founder Jack Ma,,dgm_weibo_publicfigures_mentioner,bb6f15a77b5231604b8cc2dea386b442,dgm_weibo_publicfigures_mentioner__bb6f15a77b5231604b8cc2dea386b442
1866402485,JD.com founder Liu Qiangdong,beijingbeijing,,beijingbeijing,,,JD.com founder Liu Qiangdong,,dgm_weibo_publicfigures_mentioner,5d3673908faa317f3233b89f1daab582,dgm_weibo_publicfigures_mentioner__5d3673908faa317f3233b89f1daab582
3261134763,Chinese actor Liu Yifei,beijingbeijing,,beijingbeijing,,,Chinese actor Liu Yifei,,dgm_weibo_publicfigures_mentioner,69fb393d1256545dbfd51703c8ed688a,dgm_weibo_publicfigures_mentioner__69fb393d1256545dbfd51703c8ed688a
1792951112,Chinese actor Xiao Zhan,beijingbeijing,,beijingbeijing,,,Chinese actor Xiao Zhan,,dgm_weibo_publicfigures_mentioner,7e4ce3317e3c29dcadae1a7cf9ef61de,dgm_weibo_publicfigures_mentioner__7e4ce3317e3c29dcadae1a7cf9ef61de
1669879400,Chinese actor Dilraba Dilmurat,beijingbeijing,,beijingbeijing,,,Chinese actor Dilraba Dilmurat,,dgm_weibo_publicfigures_mentioner,ef1bbdb49e2faca389ab09703824eb9f,dgm_weibo_publicfigures_mentioner__ef1bbdb49e2faca389ab09703824eb9f
1705586121,Hong Kong singer G.E.M.,beijingbeijing,,beijingbeijing,,,Hong Kong singer G.E.M.,,dgm_weibo_publicfigures_mentioner,b33c32f2949a2809874963b1614c0989,dgm_weibo_publicfigures_mentioner__b33c32f2949a2809874963b1614c0989
1755370981,Taiwanese actor Eddie Peng,beijingbeijing,,beijingbeijing,,,Taiwanese actor Eddie Peng,,dgm_weibo_publicfigures_mentioner,8a09b57167db91baf940363256b7a2ee,dgm_weibo_publicfigures_mentioner__8a09b57167db91baf940363256b7a2ee
1594052081,Chinese actor Zhu Yilong,beijingbeijing,,beijingbeijing,,,Chinese actor Zhu Yilong,,dgm_weibo_publicfigures_mentioner,62de8b0b149fd8225edebf3d13ed26e1,dgm_weibo_publicfigures_mentioner__62de8b0b149fd8225edebf3d13ed26e1
2360812967,Chinese actor Li Xian,beijingbeijing,,beijingbeijing,,,Chinese actor Li Xian,,dgm_weibo_publicfigures_mentioner,7eab1e3485cd29496a2bf301fe7f0cc2,dgm_weibo_publicfigures_mentioner__7eab1e3485cd29496a2bf301fe7f0cc2
1624923463,Chinese actor Hua Chenyu,beijingbeijing,,beijingbeijing,,,Chinese actor Hua Chenyu,,dgm_weibo_publicfigures_mentioner,f248f7bb157d339626d2c1757f97259e,dgm_weibo_publicfigures_mentioner__f248f7bb157d339626d2c1757f97259e
1227368500,Chinese actor Yang Zi,beijingbeijing,,beijingbeijing,,,Chinese actor Yang Zi,,dgm_weibo_publicfigures_mentioner,3f74295eb554cd9fd1d03c3036f5bc74,dgm_weibo_publicfigures_mentioner__3f74295eb554cd9fd1d03c3036f5bc74
2713968254,Chinese singer Huang Zitao,beijingbeijing,,beijingbeijing,,,Chinese singer Huang Zitao,,dgm_weibo_publicfigures_mentioner,6ef5de1422754bd500cf68fb48e74bf8,dgm_weibo_publicfigures_mentioner__6ef5de1422754bd500cf68fb48e74bf8
1350995007,Chinese actor Gulinazha,beijingbeijing,,beijingbeijing,,,Chinese actor Gulinazha,,dgm_weibo_publicfigures_mentioner,6111cfe913b13e9d98c6b03e436a09f8,dgm_weibo_publicfigures_mentioner__6111cfe913b13e9d98c6b03e436a09f8
2751313073,Chinese athlete Ma Long,beijingbeijing,,beijingbeijing,,,Chinese athlete Ma Long,,dgm_weibo_publicfigures_mentioner,0d8d6732d06b9134fa8e4086db24d7b6,dgm_weibo_publicfigures_mentioner__0d8d6732d06b9134fa8e4086db24d7b6
1847912164,Chinese athlete Xu Xin,beijingbeijing,,beijingbeijing,,,Chinese athlete Xu Xin,,dgm_weibo_publicfigures_mentioner,7a37406cab3cb14c435a55eb06d0f856,dgm_weibo_publicfigures_mentioner__7a37406cab3cb14c435a55eb06d0f856
1878206395,Chinese athlete Zhang Jike,beijingbeijing,,beijingbeijing,,,Chinese athlete Zhang Jike,,dgm_weibo_publicfigures_mentioner,17e0c9e38e241d9c845114484b703203,dgm_weibo_publicfigures_mentioner__17e0c9e38e241d9c845114484b703203
5600102513,Chinese athlete Wang Nan,beijingbeijing,,beijingbeijing,,,Chinese athlete Wang Nan,,dgm_weibo_publicfigures_mentioner,9e1330244605e7c44332524acaf05447,dgm_weibo_publicfigures_mentioner__9e1330244605e7c44332524acaf05447
2133607385,Chinese athlete Zhang Yining,beijingbeijing,,beijingbeijing,,,Chinese athlete Zhang Yining,,dgm_weibo_publicfigures_mentioner,061706d2b99ab77705811a7cc81a448b,dgm_weibo_publicfigures_mentioner__061706d2b99ab77705811a7cc81a448b
1878247607,Chinese athlete Guo Ye,beijingbeijing,,beijingbeijing,,,Chinese athlete Guo Ye,,dgm_weibo_publicfigures_mentioner,e4f19344603dcbc73e396a6ef8ab168e,dgm_weibo_publicfigures_mentioner__e4f19344603dcbc73e396a6ef8ab168e
1814284757,Chinese athlete Ding Ning,beijingbeijing,,beijingbeijing,,,Chinese athlete Ding Ning,,dgm_weibo_publicfigures_mentioner,f6adcf60449c2945415b081906d91f53,dgm_weibo_publicfigures_mentioner__f6adcf60449c2945415b081906d91f53
1010956892,Chinese athlete Ma Lin,beijingbeijing,,beijingbeijing,,,Chinese athlete Ma Lin,,dgm_weibo_publicfigures_mentioner,74ae0687a84d305631651dea03716167,dgm_weibo_publicfigures_mentioner__74ae0687a84d305631651dea03716167
2238169980,Chinese athlete Zhang Yudong,beijingbeijing,,beijingbeijing,,,Chinese athlete Zhang Yudong,,dgm_weibo_publicfigures_mentioner,8323716bfe4b63236872c7f554dabadb,dgm_weibo_publicfigures_mentioner__8323716bfe4b63236872c7f554dabadb
2010654675,Chinese athlete Chen Meng,beijingbeijing,,beijingbeijing,,,Chinese athlete Chen Meng,,dgm_weibo_publicfigures_mentioner,8e7182d94185aecab066e03244ca34e8,dgm_weibo_publicfigures_mentioner__8e7182d94185aecab066e03244ca34e8
2267601793,Chinese athlete Wang Hao,beijingbeijing,,beijingbeijing,,,Chinese athlete Wang Hao,,dgm_weibo_publicfigures_mentioner,92501f1d8c6e87b1a632daf1286f136e,dgm_weibo_publicfigures_mentioner__92501f1d8c6e87b1a632daf1286f136e
1891453505,Chinese athlete Li Xiaoxia,beijingbeijing,,beijingbeijing,,,Chinese athlete Li Xiaoxia,,dgm_weibo_publicfigures_mentioner,649112661f0686bc43b0026885ed4450,dgm_weibo_publicfigures_mentioner__649112661f0686bc43b0026885ed4450
5051815423,Chinese athlete Shun Yingsha,beijingbeijing,,beijingbeijing,,,Chinese athlete Shun Yingsha,,dgm_weibo_publicfigures_mentioner,530d60bfb8916e204e4dfbc5caff75c0,dgm_weibo_publicfigures_mentioner__530d60bfb8916e204e4dfbc5caff75c0
1827685703,Chinese athlete Liu Shiwen,beijingbeijing,,beijingbeijing,,,Chinese athlete Liu Shiwen,,dgm_weibo_publicfigures_mentioner,6af491a394c60fc873f48814a97a8f0b,dgm_weibo_publicfigures_mentioner__6af491a394c60fc873f48814a97a8f0b
1006122093,Chinese athlete Wang Luyao,beijingbeijing,,beijingbeijing,,,Chinese athlete Wang Luyao,,dgm_weibo_publicfigures_mentioner,93565c884f78cdb9a77891e7030c9266,dgm_weibo_publicfigures_mentioner__93565c884f78cdb9a77891e7030c9266
1928240144,Chinese athlete Lang Ping,beijingbeijing,,beijingbeijing,,,Chinese athlete Lang Ping,,dgm_weibo_publicfigures_mentioner,d90bb97596e9a9ad91e21ec097976222,dgm_weibo_publicfigures_mentioner__d90bb97596e9a9ad91e21ec097976222
2619723465,Chinese athlete Zhu Ting,beijingbeijing,,beijingbeijing,,,Chinese athlete Zhu Ting,,dgm_weibo_publicfigures_mentioner,ce501e7cc789eed85db2e4fc5328d0b7,dgm_weibo_publicfigures_mentioner__ce501e7cc789eed85db2e4fc5328d0b7
3639470012,Chinese athlete Gu Ailing,beijingbeijing,,beijingbeijing,,,Chinese athlete Gu Ailing,,dgm_weibo_publicfigures_mentioner,31d7eb6c2079625bb77c9363284fbef3,dgm_weibo_publicfigures_mentioner__31d7eb6c2079625bb77c9363284fbef3
1835539930,Chinese athlete Zhang Changning,beijingbeijing,,beijingbeijing,,,Chinese athlete Zhang Changning,,dgm_weibo_publicfigures_mentioner,c6c960c694bc2684d8c28204f97eaf21,dgm_weibo_publicfigures_mentioner__c6c960c694bc2684d8c28204f97eaf21
2145369343,Chinese athlete Wu Dajing,beijingbeijing,,beijingbeijing,,,Chinese athlete Wu Dajing,,dgm_weibo_publicfigures_mentioner,523e61775a2ac7b3df3c5ecbc7469a91,dgm_weibo_publicfigures_mentioner__523e61775a2ac7b3df3c5ecbc7469a91
1787544153,Chinese athlete Gong Xiangyu,beijingbeijing,,beijingbeijing,,,Chinese athlete Gong Xiangyu,,dgm_weibo_publicfigures_mentioner,57b1a65f7b89adbb09a4b82be404f603,dgm_weibo_publicfigures_mentioner__57b1a65f7b89adbb09a4b82be404f603
1380274560,Chinese athlete Yi Jianlian,beijingbeijing,,beijingbeijing,,,Chinese athlete Yi Jianlian,,dgm_weibo_publicfigures_mentioner,d66dc5da0ccd9508b55a4f3e7030dff6,dgm_weibo_publicfigures_mentioner__d66dc5da0ccd9508b55a4f3e7030dff6
1846360445,Chinese athlete Guo Ailun,beijingbeijing,,beijingbeijing,,,Chinese athlete Guo Ailun,,dgm_weibo_publicfigures_mentioner,11b733ba1926d9cfc216429b20ad0372,dgm_weibo_publicfigures_mentioner__11b733ba1926d9cfc216429b20ad0372
3944068535,Chinese athlete Lin Dan,beijingbeijing,,beijingbeijing,,,Chinese athlete Lin Dan,,dgm_weibo_publicfigures_mentioner,8d9cbbe81f9e196bba3b17a189e48e31,dgm_weibo_publicfigures_mentioner__8d9cbbe81f9e196bba3b17a189e48e31
2342329387,Chinese athlete Sui Wenjing,beijingbeijing,,beijingbeijing,,,Chinese athlete Sui Wenjing,,dgm_weibo_publicfigures_mentioner,6a82998d668e99ece6ae2d5d6bd97a0b,dgm_weibo_publicfigures_mentioner__6a82998d668e99ece6ae2d5d6bd97a0b
3313256852,Chinese athlete Zhang Weili,beijingbeijing,,beijingbeijing,,,Chinese athlete Zhang Weili,,dgm_weibo_publicfigures_mentioner,a45994f48b4a017372ae613d17100eda,dgm_weibo_publicfigures_mentioner__a45994f48b4a017372ae613d17100eda
2452907185,Chinese athlete Wang Shuang,beijingbeijing,,beijingbeijing,,,Chinese athlete Wang Shuang,,dgm_weibo_publicfigures_mentioner,8b321fb20a2b3e60d0295c65e3313fd1,dgm_weibo_publicfigures_mentioner__8b321fb20a2b3e60d0295c65e3313fd1
2847685031,Chinese boxer Xu Can,beijingbeijing,,beijingbeijing,,,Chinese boxer Xu Can,,dgm_weibo_publicfigures_mentioner,f94034c9aed1cf9d40824692f38f08d4,dgm_weibo_publicfigures_mentioner__f94034c9aed1cf9d40824692f38f08d4
3916424386,Chinese soccer coach Li Tie,beijingbeijing,,beijingbeijing,,,Chinese soccer coach Li Tie,,dgm_weibo_publicfigures_mentioner,cf572a190e8c49030af1ccb8b3823ad0,dgm_weibo_publicfigures_mentioner__cf572a190e8c49030af1ccb8b3823ad0
5112240060,Chinese racing driver Zhou Guanyu,beijingbeijing,,beijingbeijing,,,Chinese racing driver Zhou Guanyu,,dgm_weibo_publicfigures_mentioner,f87e355e1ed16e897cfb54032c8ebcda,dgm_weibo_publicfigures_mentioner__f87e355e1ed16e897cfb54032c8ebcda
2051260445,Chinese figure skater Han Cong,beijingbeijing,,beijingbeijing,,,Chinese figure skater Han Cong,,dgm_weibo_publicfigures_mentioner,12780969953182adbfdf4d330eecba63,dgm_weibo_publicfigures_mentioner__12780969953182adbfdf4d330eecba63
1984169453,Chinese figure skater Sui Wenjing,beijingbeijing,,beijingbeijing,,,Chinese figure skater Sui Wenjing,,dgm_weibo_publicfigures_mentioner,24505cf8d1e049fbb133e710ce1fa14c,dgm_weibo_publicfigures_mentioner__24505cf8d1e049fbb133e710ce1fa14c
2029906001,Chinese athlete Su Bingtian,beijingbeijing,,beijingbeijing,,,Chinese athlete Su Bingtian,,dgm_weibo_publicfigures_mentioner,00545a179da0907e1a517ef3ffead34c,dgm_weibo_publicfigures_mentioner__00545a179da0907e1a517ef3ffead34c
3867146849,Chinese athlete Shi Tingmao,beijingbeijing,,beijingbeijing,,,Chinese athlete Shi Tingmao,,dgm_weibo_publicfigures_mentioner,4833b8e6069cde465a7f0b83ca293708,dgm_weibo_publicfigures_mentioner__4833b8e6069cde465a7f0b83ca293708
5543153302,Chinese athlete Liu Xiang,beijingbeijing,,beijingbeijing,,,Chinese athlete Liu Xiang,,dgm_weibo_publicfigures_mentioner,53ed7bfe031d8c8fa0bd06fbde44a26f,dgm_weibo_publicfigures_mentioner__53ed7bfe031d8c8fa0bd06fbde44a26f
7563937416,Chinese athlete Guo Jingjing,beijingbeijing,,beijingbeijing,,,Chinese athlete Guo Jingjing,,dgm_weibo_publicfigures_mentioner,c48082bb53bfc61182164763e4647154,dgm_weibo_publicfigures_mentioner__c48082bb53bfc61182164763e4647154
1977524360,Chinese athlete Cai Xuetong,beijingbeijing,,beijingbeijing,,,Chinese athlete Cai Xuetong,,dgm_weibo_publicfigures_mentioner,f60d3b01d1d430a124c1529f080dfc4e,dgm_weibo_publicfigures_mentioner__f60d3b01d1d430a124c1529f080dfc4e
1884277373,Chinese athlete Gao Ming,beijingbeijing,,beijingbeijing,,,Chinese athlete Gao Ming,,dgm_weibo_publicfigures_mentioner,93e6ff36eabfc0b6b447731b9d64c505,dgm_weibo_publicfigures_mentioner__93e6ff36eabfc0b6b447731b9d64c505
5489115923,Chinese former athlete and founder of Li-Ning Li Ning,beijingbeijing,,beijingbeijing,,,Chinese former athlete and founder of Li-Ning Li Ning,,dgm_weibo_publicfigures_mentioner,d5247749f3cfeef1f3ae82a79a0fb8d0,dgm_weibo_publicfigures_mentioner__d5247749f3cfeef1f3ae82a79a0fb8d0
1746274673,Chinese former tennis player Li Na,beijingbeijing,,beijingbeijing,,,Chinese former tennis player Li Na,,dgm_weibo_publicfigures_mentioner,f596b231d1c9bebea4f6e96d6c133073,dgm_weibo_publicfigures_mentioner__f596b231d1c9bebea4f6e96d6c133073
2308438637,Chinse fencer Li Na,beijingbeijing,,beijingbeijing,,,Chinse fencer Li Na,,dgm_weibo_publicfigures_mentioner,588aef7b0d381d28447fb319def56b44,dgm_weibo_publicfigures_mentioner__588aef7b0d381d28447fb319def56b44
1890308722,Chinese former swimmer Zhuang Yong,beijingbeijing,,beijingbeijing,,,Chinese former swimmer Zhuang Yong,,dgm_weibo_publicfigures_mentioner,04acd73e281f8ec0704a7135fe8e97d1,dgm_weibo_publicfigures_mentioner__04acd73e281f8ec0704a7135fe8e97d1
2865101843,Chinese Go player Ke Jie,beijingbeijing,,beijingbeijing,,,Chinese Go player Ke Jie,,dgm_weibo_publicfigures_mentioner,dcb8732a5bc369817f85745416dad6ea,dgm_weibo_publicfigures_mentioner__dcb8732a5bc369817f85745416dad6ea
2243244911,Chinese swimmer Xu Jiayu,beijingbeijing,,beijingbeijing,,,Chinese swimmer Xu Jiayu,,dgm_weibo_publicfigures_mentioner,0759677f18c2583d5f3af0be57c9e845,dgm_weibo_publicfigures_mentioner__0759677f18c2583d5f3af0be57c9e845
2058784061,Chinese swimmer Yan Zibei,beijingbeijing,,beijingbeijing,,,Chinese swimmer Yan Zibei,,dgm_weibo_publicfigures_mentioner,e16453dbe815bc6ffe6787b4570ec474,dgm_weibo_publicfigures_mentioner__e16453dbe815bc6ffe6787b4570ec474
2663051441,Chinese swimmer Zhang Yufei,beijingbeijing,,beijingbeijing,,,Chinese swimmer Zhang Yufei,,dgm_weibo_publicfigures_mentioner,819b3855a7daf06307206dd340b17016,dgm_weibo_publicfigures_mentioner__819b3855a7daf06307206dd340b17016
5663935782,Chinese swimmer Yang Junxuan,beijingbeijing,,beijingbeijing,,,Chinese swimmer Yang Junxuan,,dgm_weibo_publicfigures_mentioner,731b96a7ed480cda201917b46a09bcc4,dgm_weibo_publicfigures_mentioner__731b96a7ed480cda201917b46a09bcc4
2106855375,Taiwanese-American basketball player Jeremy Lin,beijingbeijing,,beijingbeijing,,,Taiwanese-American basketball player Jeremy Lin,,dgm_weibo_publicfigures_mentioner,b7e11c8b3d46e492356b9b14ef0f3d29,dgm_weibo_publicfigures_mentioner__b7e11c8b3d46e492356b9b14ef0f3d29