handle,caption_name,location,location_lower,type,exclude_groups,ENTITY_LABEL,name,description,source,source_identifier,global_identifier
dr_zhaoqinghua,Chinese Consul General in Zurich,Switzerland,switzerland,Ambassadors & Representatives,,Ambassadors&Representatives,Chinese Consul General in Zurich,,dgm_mining_mentioner,5da46fbf894572c273d5839a1070a52c,dgm_mining_mentioner__5da46fbf894572c273d5839a1070a52c
amb_chenxu,Chinese Ambassador to UN,Switzerland,switzerland,Ambassadors & Representatives,,Ambassadors&Representatives,Chinese Ambassador to UN,,dgm_mining_mentioner,9fc9d59f521f06bf2ef8dcd28254ac14,dgm_mining_mentioner__9fc9d59f521f06bf2ef8dcd28254ac14
ddfaisalm,Malaysian Representative to UN,Switzerland,switzerland,Ambassadors & Representatives,,Ambassadors&Representatives,Malaysian Representative to UN,,dgm_mining_mentioner,e11d637ffeb5ac89b7d4e224aa3470a1,dgm_mining_mentioner__e11d637ffeb5ac89b7d4e224aa3470a1
bhatiaumej,Singaporean Representative to UN,Switzerland,switzerland,Ambassadors & Representatives,,Ambassadors&Representatives,Singaporean Representative to UN,,dgm_mining_mentioner,6990e26af752610ae5eab4ed3cad2364,dgm_mining_mentioner__6990e26af752610ae5eab4ed3cad2364
baghaeie,Iranian Representative to UN,Switzerland,switzerland,Ambassadors & Representatives,,Ambassadors&Representatives,Iranian Representative to UN,,dgm_mining_mentioner,d73574366a3f7eade9144c8bd7eeb533,dgm_mining_mentioner__d73574366a3f7eade9144c8bd7eeb533
janeowenfcdo,UK Ambassador to Switzerland,Switzerland,switzerland,Ambassadors & Representatives,,Ambassadors&Representatives,UK Ambassador to Switzerland,,dgm_mining_mentioner,888cf3b9e4412913479aeccf542f44ec,dgm_mining_mentioner__888cf3b9e4412913479aeccf542f44ec
robgabrielse,"Dutch Permanent Representative to Conference on Disarmament in Geneva, Switzerland",Switzerland,switzerland,Ambassadors & Representatives,,Ambassadors&Representatives,"Dutch Permanent Representative to Conference on Disarmament in Geneva, Switzerland",,dgm_mining_mentioner,180acb0b71014194189531ab4b1c7c6a,dgm_mining_mentioner__180acb0b71014194189531ab4b1c7c6a
nazhatskhan,"Fijian Representative to UN in Geneva, Switzerland",Switzerland,switzerland,Ambassadors & Representatives,,Ambassadors&Representatives,"Fijian Representative to UN in Geneva, Switzerland",,dgm_mining_mentioner,6afdc19939f65e60ae8ab88e17d91b68,dgm_mining_mentioner__6afdc19939f65e60ae8ab88e17d91b68
aalahussam,"Syrian Representative to UN in Geneva, Switzerland",Switzerland,switzerland,Ambassadors & Representatives,,Ambassadors&Representatives,"Syrian Representative to UN in Geneva, Switzerland",,dgm_mining_mentioner,0c414b97bc46a9480ed9cff56bbb8e61,dgm_mining_mentioner__0c414b97bc46a9480ed9cff56bbb8e61
swissmfaafrica,Head of Africa Division at Swiss Foreign Ministry,Switzerland,switzerland,Ambassadors & Representatives,,Ambassadors&Representatives,Head of Africa Division at Swiss Foreign Ministry,,dgm_mining_mentioner,4fe369431507f679904ad5a7a1fd12fd,dgm_mining_mentioner__4fe369431507f679904ad5a7a1fd12fd
kos_vesna,Croatian Permanent Representative to UN,Switzerland,switzerland,Ambassadors & Representatives,,Ambassadors&Representatives,Croatian Permanent Representative to UN,,dgm_mining_mentioner,4b06e7a5e4579d25da83dd09d7e6a410,dgm_mining_mentioner__4b06e7a5e4579d25da83dd09d7e6a410
revazlominadze,Georgian Ambassador to Switzerland and Liechtenstein,Switzerland,switzerland,Ambassadors & Representatives,,Ambassadors&Representatives,Georgian Ambassador to Switzerland and Liechtenstein,,dgm_mining_mentioner,a39890d3e8a505436c140862d2fecc4d,dgm_mining_mentioner__a39890d3e8a505436c140862d2fecc4d
carolelanteri,Monacan Ambassador to UN,Switzerland,switzerland,Ambassadors & Representatives,,Ambassadors&Representatives,Monacan Ambassador to UN,,dgm_mining_mentioner,10a869c8d7643eed14ce7d942e741216,dgm_mining_mentioner__10a869c8d7643eed14ce7d942e741216
gjmdhoop,Austrian Permanent Representative to UN,Switzerland,switzerland,Ambassadors & Representatives,,Ambassadors&Representatives,Austrian Permanent Representative to UN,,dgm_mining_mentioner,be49e990d23daab594d1bd8b39a804c9,dgm_mining_mentioner__be49e990d23daab594d1bd8b39a804c9
sdb_dip,Canadian Ambassador and Permanent Representative to WTO,Switzerland,switzerland,Ambassadors & Representatives,,Ambassadors&Representatives,Canadian Ambassador and Permanent Representative to WTO,,dgm_mining_mentioner,aae3c77c679f1edd813e3f6de74897bd,dgm_mining_mentioner__aae3c77c679f1edd813e3f6de74897bd
floresliera,Mexican Ambassador to UN in Geneva,Switzerland,switzerland,Ambassadors & Representatives,,Ambassadors&Representatives,Mexican Ambassador to UN in Geneva,,dgm_mining_mentioner,ddfc0480fc96e0fe46a80bb17c44b26e,dgm_mining_mentioner__ddfc0480fc96e0fe46a80bb17c44b26e
erikforner,Norwegian Ambassador to Switzerland,Switzerland,switzerland,Ambassadors & Representatives,,Ambassadors&Representatives,Norwegian Ambassador to Switzerland,,dgm_mining_mentioner,0dc65f956cb113c74d1058de95017062,dgm_mining_mentioner__0dc65f956cb113c74d1058de95017062
usambcd,US Permanent Representative to the Conference on Disarmament,Switzerland,switzerland,Ambassadors & Representatives,,Ambassadors&Representatives,US Permanent Representative to the Conference on Disarmament,,dgm_mining_mentioner,7d3c254ece20f2c54b391c2c41a87d3c,dgm_mining_mentioner__7d3c254ece20f2c54b391c2c41a87d3c
norwayambwto,Norwegian Ambassador to WTO and EFTA,Switzerland,switzerland,Ambassadors & Representatives,,Ambassadors&Representatives,Norwegian Ambassador to WTO and EFTA,,dgm_mining_mentioner,9e55bcc372795f8ced9b49840fc1542a,dgm_mining_mentioner__9e55bcc372795f8ced9b49840fc1542a
aidanliddle,UK Ambassador to Conference on Disarmament,Switzerland,switzerland,Ambassadors & Representatives,,Ambassadors&Representatives,UK Ambassador to Conference on Disarmament,,dgm_mining_mentioner,37b3aa134d4273c9cd7959dd68e6c6d7,dgm_mining_mentioner__37b3aa134d4273c9cd7959dd68e6c6d7
jabkanira,Marshall Islands Permanent Representative to UN in Geneva,Switzerland,switzerland,Ambassadors & Representatives,,Ambassadors&Representatives,Marshall Islands Permanent Representative to UN in Geneva,,dgm_mining_mentioner,48c4b1064e3a77e182b328e329918cde,dgm_mining_mentioner__48c4b1064e3a77e182b328e329918cde
valzell,Swiss Permanent Representative to UN in Geneva,Switzerland,switzerland,Ambassadors & Representatives,,Ambassadors&Representatives,Swiss Permanent Representative to UN in Geneva,,dgm_mining_mentioner,c785337f78138fe05f56c5418d41f4dd,dgm_mining_mentioner__c785337f78138fe05f56c5418d41f4dd
nathalieolij,Dutch Ambassador to UN,Switzerland,switzerland,Ambassadors & Representatives,,Ambassadors&Representatives,Dutch Ambassador to UN,,dgm_mining_mentioner,2c6678a033b118441a023aa7886b76d6,dgm_mining_mentioner__2c6678a033b118441a023aa7886b76d6
francoispythoud,Chair of UN Federal Office of Agriculture,Switzerland,switzerland,Ambassadors & Representatives,,Ambassadors&Representatives,Chair of UN Federal Office of Agriculture,,dgm_mining_mentioner,2424eb7e1a3294dd81b670df529837ad,dgm_mining_mentioner__2424eb7e1a3294dd81b670df529837ad
jaimedebourbon,Senior Advisor at UNHCR,Switzerland,switzerland,Ambassadors & Representatives,,Ambassadors&Representatives,Senior Advisor at UNHCR,,dgm_mining_mentioner,30e92e157016f7388c9b8b71b143409a,dgm_mining_mentioner__30e92e157016f7388c9b8b71b143409a
yusufbucheeri,Bahraini Ambassador to UN,Switzerland,switzerland,Ambassadors & Representatives,,Ambassadors&Representatives,Bahraini Ambassador to UN,,dgm_mining_mentioner,e888067cf0add3e9c17fac3f98c92811,dgm_mining_mentioner__e888067cf0add3e9c17fac3f98c92811
ggatilov,Russian Permanent Representative to UN,Switzerland,switzerland,Ambassadors & Representatives,,Ambassadors&Representatives,Russian Permanent Representative to UN,,dgm_mining_mentioner,fff8b9439c7c46926f6459efbd02fc99,dgm_mining_mentioner__fff8b9439c7c46926f6459efbd02fc99
nicolasbideau,Swiss Amabassador,Switzerland,switzerland,Ambassadors & Representatives,,Ambassadors&Representatives,Swiss Amabassador,,dgm_mining_mentioner,7dffd93d87c498980802fe4fb6fee168,dgm_mining_mentioner__7dffd93d87c498980802fe4fb6fee168
h_constant,Venezuelan Ambassador to UN,Switzerland,switzerland,Ambassadors & Representatives,,Ambassadors&Representatives,Venezuelan Ambassador to UN,,dgm_mining_mentioner,a1ff582c6ba0abd6daba407301a3ac3a,dgm_mining_mentioner__a1ff582c6ba0abd6daba407301a3ac3a
vaqifs,Azerbaijani Permanent Respresentative to UN,Switzerland,switzerland,Ambassadors & Representatives,,Ambassadors&Representatives,Azerbaijani Permanent Respresentative to UN,,dgm_mining_mentioner,bc63e0cf722d8603eaa4b6d1da78dc43,dgm_mining_mentioner__bc63e0cf722d8603eaa4b6d1da78dc43
domatshering,Bhutanese Permanent Representative to UN,Switzerland,switzerland,Ambassadors & Representatives,,Ambassadors&Representatives,Bhutanese Permanent Representative to UN,,dgm_mining_mentioner,4526b6529aff3681b178773860602047,dgm_mining_mentioner__4526b6529aff3681b178773860602047
hmacdo8444,Suriname Permanent Representative to UN Mac,Switzerland,switzerland,Ambassadors & Representatives,,Ambassadors&Representatives,Suriname Permanent Representative to UN Mac,,dgm_mining_mentioner,ac92d8b764d84756d91dc59b32168948,dgm_mining_mentioner__ac92d8b764d84756d91dc59b32168948
amouallimi,Saudi Permanent Representative to UN,Switzerland,switzerland,Ambassadors & Representatives,,Ambassadors&Representatives,Saudi Permanent Representative to UN,,dgm_mining_mentioner,048e539a7349e4ddea35c6759047f126,dgm_mining_mentioner__048e539a7349e4ddea35c6759047f126
swissambun_gva,Swiss Permanent Representative to UN,Switzerland,switzerland,Ambassadors & Representatives,,Ambassadors&Representatives,Swiss Permanent Representative to UN,,dgm_mining_mentioner,7a23ee2680d155443e20d39c0ac54239,dgm_mining_mentioner__7a23ee2680d155443e20d39c0ac54239
martins_kr,Latvian Permanent Representative to WTO,Switzerland,switzerland,Ambassadors & Representatives,,Ambassadors&Representatives,Latvian Permanent Representative to WTO,,dgm_mining_mentioner,4a5eb30d91383110e96b494596fe0ac8,dgm_mining_mentioner__4a5eb30d91383110e96b494596fe0ac8
yckasoulides,Cypriot Permanent Representative to UN,Switzerland,switzerland,Ambassadors & Representatives,,Ambassadors&Representatives,Cypriot Permanent Representative to UN,,dgm_mining_mentioner,c987c482c3cc2e8bcf83df71b594ca13,dgm_mining_mentioner__c987c482c3cc2e8bcf83df71b594ca13
ausofficetpe,Australian Representative to Taiwan,Taiwan,taiwan,Ambassadors & Representatives,,Ambassadors&Representatives,Australian Representative to Taiwan,,dgm_mining_mentioner,6f05ee81ecf986457ab318085442a168,dgm_mining_mentioner__6f05ee81ecf986457ab318085442a168
jordan_j_reeves,Canadian Trade Officer to Taiwan,Taiwan,taiwan,Ambassadors & Representatives,,Ambassadors&Representatives,Canadian Trade Officer to Taiwan,,dgm_mining_mentioner,0fa215cc50d4335c92cfe6a2ae75a1b9,dgm_mining_mentioner__0fa215cc50d4335c92cfe6a2ae75a1b9
h_zadah,Azerbaijani Ambassador to Tajikistan,Tajikistan,tajikistan,Ambassadors & Representatives,,Ambassadors&Representatives,Azerbaijani Ambassador to Tajikistan,,dgm_mining_mentioner,16c184c34730098ac21f8b6489e84bc0,dgm_mining_mentioner__16c184c34730098ac21f8b6489e84bc0
viktornikitiuk,Ukrainian Ambassador to Tajikistan and Afghanistan,"Tajikistan, Afghanistan","tajikistan, afghanistan",Ambassadors & Representatives,,Ambassadors&Representatives,Ukrainian Ambassador to Tajikistan and Afghanistan,,dgm_mining_mentioner,bac8c7290d7e63ced4db5e41e7ce8804,dgm_mining_mentioner__bac8c7290d7e63ced4db5e41e7ce8804
usambtanzania,US Ambassador to Tanzania,Tanzania,tanzania,Ambassadors & Representatives,,Ambassadors&Representatives,US Ambassador to Tanzania,,dgm_mining_mentioner,cb91934c6d26c8c6a97b017dea7b0659,dgm_mining_mentioner__cb91934c6d26c8c6a97b017dea7b0659
danmkazungu,Kenyan High Commissioner to Tanzania,Tanzania,tanzania,Ambassadors & Representatives,,Ambassadors&Representatives,Kenyan High Commissioner to Tanzania,,dgm_mining_mentioner,56a07e9dcd45dd2f96a8c56ff5cbf4c0,dgm_mining_mentioner__56a07e9dcd45dd2f96a8c56ff5cbf4c0
hcpamelao,Canadian High Commissioner to Tanzania,Tanzania,tanzania,Ambassadors & Representatives,,Ambassadors&Representatives,Canadian High Commissioner to Tanzania,,dgm_mining_mentioner,61289476e44d7ef5cb8ba9ff026dda75,dgm_mining_mentioner__61289476e44d7ef5cb8ba9ff026dda75
dkambtanzania,Danish Ambassador to Tanzania Norgaard,Tanzania,tanzania,Ambassadors & Representatives,,Ambassadors&Representatives,Danish Ambassador to Tanzania Norgaard,,dgm_mining_mentioner,07e583d30aae58aff50a464df65e57b4,dgm_mining_mentioner__07e583d30aae58aff50a464df65e57b4
usambthailand,US Charge d'Affaires to Thailand,Thailand,thailand,Ambassadors & Representatives,,Ambassadors&Representatives,US Charge d'Affaires to Thailand,,dgm_mining_mentioner,6270e1034be32b8f17ed66dc0ce8122c,dgm_mining_mentioner__6270e1034be32b8f17ed66dc0ce8122c
chutintorn_sam,Thai Foreign Ministry Deputy Permanent Secretary,Thailand,thailand,Ambassadors & Representatives,,Ambassadors&Representatives,Thai Foreign Ministry Deputy Permanent Secretary,,dgm_mining_mentioner,08021c5c691fad2518542897998db62a,dgm_mining_mentioner__08021c5c691fad2518542897998db62a
germanambtha,German Ambassador to Thailand,Thailand,thailand,Ambassadors & Representatives,,Ambassadors&Representatives,German Ambassador to Thailand,,dgm_mining_mentioner,917966c8755363169e7ef33b44eed465,dgm_mining_mentioner__917966c8755363169e7ef33b44eed465
sibillecartier,Belgian Ambassador to Thailand,Thailand,thailand,Ambassadors & Representatives,,Ambassadors&Representatives,Belgian Ambassador to Thailand,,dgm_mining_mentioner,2d01578b5be333369b83dfc6cc1f630b,dgm_mining_mentioner__2d01578b5be333369b83dfc6cc1f630b
ausambbkk,Australian Ambassador to Thailand,Thailand,thailand,Ambassadors & Representatives,,Ambassadors&Representatives,Australian Ambassador to Thailand,,dgm_mining_mentioner,dbc9b4e7efb9af6d0ad9db3df3815b7b,dgm_mining_mentioner__dbc9b4e7efb9af6d0ad9db3df3815b7b
dkambinthailand,Danish Ambassador to Thailand,Thailand,thailand,Ambassadors & Representatives,,Ambassadors&Representatives,Danish Ambassador to Thailand,,dgm_mining_mentioner,5f68f5362b3f1b276b74b799a7b93878,dgm_mining_mentioner__5f68f5362b3f1b276b74b799a7b93878
sarahdicksonuk,UK High Commissioner to Bahamas,The Bahamas,the bahamas,Ambassadors & Representatives,,Ambassadors&Representatives,UK High Commissioner to Bahamas,,dgm_mining_mentioner,4e233cb815761dbbfbe525ec81aa5d69,dgm_mining_mentioner__4e233cb815761dbbfbe525ec81aa5d69
paivikaukoranta,Finnish Ambassador to Netherlands,The Netherlands,the netherlands,Ambassadors & Representatives,,Ambassadors&Representatives,Finnish Ambassador to Netherlands,,dgm_mining_mentioner,84e3bb44735ffffe8c6adce7596f4ba2,dgm_mining_mentioner__84e3bb44735ffffe8c6adce7596f4ba2
ausambdili,Australian Ambassador to Timor-Leste,Timor-Leste,timor-leste,Ambassadors & Representatives,,Ambassadors&Representatives,Australian Ambassador to Timor-Leste,,dgm_mining_mentioner,6cc1790910170739b19da85feff145e3,dgm_mining_mentioner__6cc1790910170739b19da85feff145e3
andrew_jacobseu,EU Ambassador to Timor-Leste,Timor-Leste,timor-leste,Ambassadors & Representatives,,Ambassadors&Representatives,EU Ambassador to Timor-Leste,,dgm_mining_mentioner,d1ac0b7404e97072cee4d8b7179f3511,dgm_mining_mentioner__d1ac0b7404e97072cee4d8b7179f3511
austhctonga,Australian High Commissioner to Tonga,Tonga,tonga,Ambassadors & Representatives,,Ambassadors&Representatives,Australian High Commissioner to Tonga,,dgm_mining_mentioner,d00ac848355b41e5e944fd8c89c6fe4d,dgm_mining_mentioner__d00ac848355b41e5e944fd8c89c6fe4d
embsuarezsalvia,Argentine Ambassador to Trinidad and Tobago,Trinidad and Tobago,trinidad and tobago,Ambassadors & Representatives,,Ambassadors&Representatives,Argentine Ambassador to Trinidad and Tobago,,dgm_mining_mentioner,5a47dafb616e08975061344215852503,dgm_mining_mentioner__5a47dafb616e08975061344215852503
carla_h_rufelds,Canadian High Commissioner to Trinidad and Tobago,Trinidad and Tobago,trinidad and tobago,Ambassadors & Representatives,,Ambassadors&Representatives,Canadian High Commissioner to Trinidad and Tobago,,dgm_mining_mentioner,22c7b152462bf32f49c3e27eb7d60c6d,dgm_mining_mentioner__22c7b152462bf32f49c3e27eb7d60c6d
edwardoakden,UK Ambassador to Tunisia,Tunisia,tunisia,Ambassadors & Representatives,,Ambassadors&Representatives,UK Ambassador to Tunisia,,dgm_mining_mentioner,302a1e6fdaa9af7fad525a7ebacea699,dgm_mining_mentioner__302a1e6fdaa9af7fad525a7ebacea699
marcuscornaro,EU Ambassador to Tunisia,Tunisia,tunisia,Ambassadors & Representatives,,Ambassadors&Representatives,EU Ambassador to Tunisia,,dgm_mining_mentioner,10f3195d044f38621e103327679b72ac,dgm_mining_mentioner__10f3195d044f38621e103327679b72ac
fredrikpfloren,Swedish Ambassador to Tunisia and Libya,Tunisia and Libya,tunisia and libya,Ambassadors & Representatives,,Ambassadors&Representatives,Swedish Ambassador to Tunisia and Libya,,dgm_mining_mentioner,23f16a6330269b2f6e913c6f28256b15,dgm_mining_mentioner__23f16a6330269b2f6e913c6f28256b15
gamanoleksandr,"Ukrainian Consul General in Istanbul, Turkey",Turkey,turkey,Ambassadors & Representatives,,Ambassadors&Representatives,"Ukrainian Consul General in Istanbul, Turkey",,dgm_mining_mentioner,1274000647bc8d197ec7446e67c2b353,dgm_mining_mentioner__1274000647bc8d197ec7446e67c2b353
georgejanjgava,Georgian Ambassador to Turkey,Turkey,turkey,Ambassadors & Representatives,,Ambassadors&Representatives,Georgian Ambassador to Turkey,,dgm_mining_mentioner,f5f9ebcf83b1b3930a505b616602aef6,dgm_mining_mentioner__f5f9ebcf83b1b3930a505b616602aef6
hintonwendynz,"New Zealandic Ambassador to Turkey, Israel, Jordan, and Azerbaijan",Turkey,turkey,Ambassadors & Representatives,,Ambassadors&Representatives,"New Zealandic Ambassador to Turkey, Israel, Jordan, and Azerbaijan",,dgm_mining_mentioner,a87c867ee5aff7328262f69ae53ecc3c,dgm_mining_mentioner__a87c867ee5aff7328262f69ae53ecc3c
dkcginturkey,Danish Consul General to Turkey,Turkey,turkey,Ambassadors & Representatives,,Ambassadors&Representatives,Danish Consul General to Turkey,,dgm_mining_mentioner,f604994d16868d15456df620d0aa5229,dgm_mining_mentioner__f604994d16868d15456df620d0aa5229
ausambturkey,Australian Ambassador to Turkey,Turkey,turkey,Ambassadors & Representatives,,Ambassadors&Representatives,Australian Ambassador to Turkey,,dgm_mining_mentioner,e63d9a15cc56a11737c1af19b025732a,dgm_mining_mentioner__e63d9a15cc56a11737c1af19b025732a
dchilcottfcdo,UK Ambassador to Turkey,Turkey,turkey,Ambassadors & Representatives,,Ambassadors&Representatives,UK Ambassador to Turkey,,dgm_mining_mentioner,6fbc92c4ca5ed7cedc2806b90a8bf8c9,dgm_mining_mentioner__6fbc92c4ca5ed7cedc2806b90a8bf8c9
lacinmirza,"Belarusian Honorary Consul in Antalya, Turkey",Turkey,turkey,Ambassadors & Representatives,,Ambassadors&Representatives,"Belarusian Honorary Consul in Antalya, Turkey",,dgm_mining_mentioner,848443566fdddd42629f3638e93804f6,dgm_mining_mentioner__848443566fdddd42629f3638e93804f6
hmconsulturkey,UK Consul to Turkey,Turkey,turkey,Ambassadors & Representatives,,Ambassadors&Representatives,UK Consul to Turkey,,dgm_mining_mentioner,7b7055cd346f615930186ead214768c4,dgm_mining_mentioner__7b7055cd346f615930186ead214768c4
swedambinturkey,Swedish Ambassador to Turkey,Turkey,turkey,Ambassadors & Representatives,,Ambassadors&Representatives,Swedish Ambassador to Turkey,,dgm_mining_mentioner,ca217d88ef70dd1d92eb89be8ac2305c,dgm_mining_mentioner__ca217d88ef70dd1d92eb89be8ac2305c
dkambturkey,Danish Ambassador to Turkey,Turkey,turkey,Ambassadors & Representatives,,Ambassadors&Representatives,Danish Ambassador to Turkey,,dgm_mining_mentioner,c1d679037fd3a5a86a84a7a360b50312,dgm_mining_mentioner__c1d679037fd3a5a86a84a7a360b50312
karalashvilig,Georgian Ambassador to Turkmenistan,Turkmenistan,turkmenistan,Ambassadors & Representatives,,Ambassadors&Representatives,Georgian Ambassador to Turkmenistan,,dgm_mining_mentioner,1b6681d70abc587a0462174f7cb4a010,dgm_mining_mentioner__1b6681d70abc587a0462174f7cb4a010
hughphilpott,UK Ambassador to Turkmenistan,Turkmenistan,turkmenistan,Ambassadors & Representatives,,Ambassadors&Representatives,UK Ambassador to Turkmenistan,,dgm_mining_mentioner,46363a0a94679cff4d47a0de60bc7c59,dgm_mining_mentioner__46363a0a94679cff4d47a0de60bc7c59
ilan_sztulman,Israeli Consulate Head of Mission in Dubai,UAE,uae,Ambassadors & Representatives,,Ambassadors&Representatives,Israeli Consulate Head of Mission in Dubai,,dgm_mining_mentioner,e9387ff76c8d184e063995ef056099b9,dgm_mining_mentioner__e9387ff76c8d184e063995ef056099b9
nzinuae,New Zealandic Ambassador to UAE,UAE,uae,Ambassadors & Representatives,,Ambassadors&Representatives,New Zealandic Ambassador to UAE,,dgm_mining_mentioner,6a9210d3f4c726cdb3be18e8d0ae999d,dgm_mining_mentioner__6a9210d3f4c726cdb3be18e8d0ae999d
ausambuae,Australian Ambassador to UAE,UAE,uae,Ambassadors & Representatives,,Ambassadors&Representatives,Australian Ambassador to UAE,,dgm_mining_mentioner,b06bb6ca911da0102b48e562f31fd0d2,dgm_mining_mentioner__b06bb6ca911da0102b48e562f31fd0d2
j_daccarett,Chilean Ambassador to UAE,UAE,uae,Ambassadors & Representatives,,Ambassadors&Representatives,Chilean Ambassador to UAE,,dgm_mining_mentioner,9898e43f4dd6567b55798ca38eb33575,dgm_mining_mentioner__9898e43f4dd6567b55798ca38eb33575
safiraleaf,US Ambassador to UAE,UAE,uae,Ambassadors & Representatives,,Ambassadors&Representatives,US Ambassador to UAE,,dgm_mining_mentioner,1a2732f83efe90f6a170d2b618891541,dgm_mining_mentioner__1a2732f83efe90f6a170d2b618891541
hlanderholm,"Swedish Ambassador to UAE, Bahrain, and Kuwait",UAE,uae,Ambassadors & Representatives,,Ambassadors&Representatives,"Swedish Ambassador to UAE, Bahrain, and Kuwait",,dgm_mining_mentioner,7a23fa111bc2d83d1b09353aa4c8af94,dgm_mining_mentioner__7a23fa111bc2d83d1b09353aa4c8af94
andreafontanaeu,EU Ambassador to the UAE,UAE,uae,Ambassadors & Representatives,,Ambassadors&Representatives,EU Ambassador to the UAE,,dgm_mining_mentioner,177336e93c2ca6f7a0f4f0aafe627c90,dgm_mining_mentioner__177336e93c2ca6f7a0f4f0aafe627c90
ambmellbin,Danish Ambassador to UAE and Qatar,UAE and Qatar,uae and qatar,Ambassadors & Representatives,,Ambassadors&Representatives,Danish Ambassador to UAE and Qatar,,dgm_mining_mentioner,93e1b0cb48663553a8231abf8dfdae60,dgm_mining_mentioner__93e1b0cb48663553a8231abf8dfdae60
ambmellbin,Danish Ambassador to UAE and Qatar,"UAE, Qatar","uae, qatar",Ambassadors & Representatives,,Ambassadors&Representatives,Danish Ambassador to UAE and Qatar,,dgm_mining_mentioner,93e1b0cb48663553a8231abf8dfdae60,dgm_mining_mentioner__93e1b0cb48663553a8231abf8dfdae60
chinaambuganda,Chinese Ambassador to Uganda,Uganda,uganda,Ambassadors & Representatives,,Ambassadors&Representatives,Chinese Ambassador to Uganda,,dgm_mining_mentioner,8e596108bc0ff563b6980abf8b3e8404,dgm_mining_mentioner__8e596108bc0ff563b6980abf8b3e8404
apacificieu,EU Ambassador to Uganda,Uganda,uganda,Ambassadors & Representatives,,Ambassadors&Representatives,EU Ambassador to Uganda,,dgm_mining_mentioner,284c8152e3bbf75df8eec4191605a3ef,dgm_mining_mentioner__284c8152e3bbf75df8eec4191605a3ef
karin_boven,Dutch Ambassador to Uganda,Uganda,uganda,Ambassadors & Representatives,,Ambassadors&Representatives,Dutch Ambassador to Uganda,,dgm_mining_mentioner,a8ce8ae7bb9248161d8dfe106cd1c061,dgm_mining_mentioner__a8ce8ae7bb9248161d8dfe106cd1c061
dkambuganda,Danish Ambassador to Uganda,Uganda,uganda,Ambassadors & Representatives,,Ambassadors&Representatives,Danish Ambassador to Uganda,,dgm_mining_mentioner,fdd3f043bb24f61480dcbd042162cf3a,dgm_mining_mentioner__fdd3f043bb24f61480dcbd042162cf3a
kate_airey,UK High Commissioner to Uganda,Uganda,uganda,Ambassadors & Representatives,,Ambassadors&Representatives,UK High Commissioner to Uganda,,dgm_mining_mentioner,772a3b5ca2c22a2da306c1ca6e45feea,dgm_mining_mentioner__772a3b5ca2c22a2da306c1ca6e45feea
swedenvoyuganda,"Swedish Ambassador to Uganda, Central African Republic, and Chad","Uganda, Central African Republic, and Chad","uganda, central african republic, and chad",Ambassadors & Representatives,,Ambassadors&Representatives,"Swedish Ambassador to Uganda, Central African Republic, and Chad",,dgm_mining_mentioner,e062c71ecf57c5b04e503c15296a1e5e,dgm_mining_mentioner__e062c71ecf57c5b04e503c15296a1e5e
bwoodward_un,UK Representative to UN,UK,uk,Ambassadors & Representatives,,Ambassadors&Representatives,UK Representative to UN,,dgm_mining_mentioner,22eb65ce8ca6a84e35359945ce41e356,dgm_mining_mentioner__22eb65ce8ca6a84e35359945ce41e356
jaafaralsadr,Iraqi Ambassador to UK,UK,uk,Ambassadors & Representatives,,Ambassadors&Representatives,Iraqi Ambassador to UK,,dgm_mining_mentioner,5ffd8ed92b680144375c82c68e22aab9,dgm_mining_mentioner__5ffd8ed92b680144375c82c68e22aab9
vanja_filip,Bosnian Ambassador to UK and Ireland,UK,uk,Ambassadors & Representatives,,Ambassadors&Representatives,Bosnian Ambassador to UK and Ireland,,dgm_mining_mentioner,a2e2bf75fed3ad430c2b92c1237cc2d1,dgm_mining_mentioner__a2e2bf75fed3ad430c2b92c1237cc2d1
dkambuk,Danish Ambassador to UK,UK,uk,Ambassadors & Representatives,,Ambassadors&Representatives,Danish Ambassador to UK,,dgm_mining_mentioner,52d22cfda481e02001a5934ad0df1e6c,dgm_mining_mentioner__52d22cfda481e02001a5934ad0df1e6c
igorpokaz,Croatian Ambassador to UK,UK,uk,Ambassadors & Representatives,,Ambassadors&Representatives,Croatian Ambassador to UK,,dgm_mining_mentioner,76f8755c097e6c361cbad412b5031fcd,dgm_mining_mentioner__76f8755c097e6c361cbad412b5031fcd
a_miovska,North Macedonian Ambassador to UK,UK,uk,Ambassadors & Representatives,,Ambassadors&Representatives,North Macedonian Ambassador to UK,,dgm_mining_mentioner,bbff21c9bfe05f7e38aa444ebb116ab9,dgm_mining_mentioner__bbff21c9bfe05f7e38aa444ebb116ab9
