handle,caption_name,location,location_lower,type,exclude_groups,ENTITY_LABEL,name,description,source,source_identifier,global_identifier
_lekanadegbite,Nigeria Mines and Steel Development Minister,Nigeria,nigeria,mining minister,,MiningMinister,Nigeria Mines and Steel Development Minister,,dgm_mining_mentioner,b182d4eea76d558e966dd7ab3387a0de,dgm_mining_mentioner__b182d4eea76d558e966dd7ab3387a0de
abdoulayemagass,Guinean Mines and Geology Minister,Guinea,guinea,mining minister,,MiningMinister,Guinean Mines and Geology Minister,,dgm_mining_mentioner,fb61343394bc8cbb1b4957135c055017,dgm_mining_mentioner__fb61343394bc8cbb1b4957135c055017
andreameza76,"Costa Rican Environment, Energy and Telecommunications Minister",Costa Rica,costa rica,mining minister,,MiningMinister,"Costa Rican Environment, Energy and Telecommunications Minister",,dgm_mining_mentioner,b9e9888f921a68e56c269632ef3a017c,dgm_mining_mentioner__b9e9888f921a68e56c269632ef3a017c
arturstoms,Latvia Environmental and Regional Development Minister,Latvia,latvia,mining minister,,MiningMinister,Latvia Environmental and Regional Development Minister,,dgm_mining_mentioner,96c1428a49711bdcc546d204c0c84726,dgm_mining_mentioner__96c1428a49711bdcc546d204c0c84726
aziz_rabbah,"Moroccan Minister of Energy, Mines and Environment",Morocco,morocco,mining minister,,MiningMinister,"Moroccan Minister of Energy, Mines and Environment",,dgm_mining_mentioner,813e8b86aa9a4bb0f9bd312c029ac981,dgm_mining_mentioner__813e8b86aa9a4bb0f9bd312c029ac981
bachirismael,Burkinabe Mines and Quarries Minister,Burkina Faso,burkina faso,mining minister,,MiningMinister,Burkinabe Mines and Quarries Minister,,dgm_mining_mentioner,0a8940a3d8be9a585c5a6891745a7166,dgm_mining_mentioner__0a8940a3d8be9a585c5a6891745a7166
beisgovuk,"UK Department of Business, Energy and Industrial Strategy",United Kingdom,united kingdom,mining ministry,,MiningMinistry,"UK Department of Business, Energy and Industrial Strategy",,dgm_mining_mentioner,80e7a0340c23c3529111b9852de109ad,dgm_mining_mentioner__80e7a0340c23c3529111b9852de109ad
bolund,Sweden Environment and Climate Minister,Sweden,sweden,mining minister,,MiningMinister,Sweden Environment and Climate Minister,,dgm_mining_mentioner,8055d36446528dca87d3ac99c35fdb12,dgm_mining_mentioner__8055d36446528dca87d3ac99c35fdb12
br_sprecher,Switzerland Department of Energy,Switzerland,switzerland,mining ministry,,MiningMinistry,Switzerland Department of Energy,,dgm_mining_mentioner,cca4760823be571be34511dee360a66e,dgm_mining_mentioner__cca4760823be571be34511dee360a66e
brothershawkeye,Industry and Mineral Resources Minister,Saudi Arabia,saudi arabia,mining minister,,MiningMinister,Industry and Mineral Resources Minister,,dgm_mining_mentioner,45e3b11484eef191c88832754e0fbe65,dgm_mining_mentioner__45e3b11484eef191c88832754e0fbe65
dainiuskreivys,Lithuania Energy Minister,Lithuania,lithuania,mining minister,,MiningMinister,Lithuania Energy Minister,,dgm_mining_mentioner,1abd68d61a12e689a18c97152a968339,dgm_mining_mentioner__1abd68d61a12e689a18c97152a968339
dan_kersch,"Labour, Employment and Solidarity Economy Minister",Luxembourg,luxembourg,mining minister,,MiningMinister,"Labour, Employment and Solidarity Economy Minister",,dgm_mining_mentioner,501ff82a432e2949ff11ba1dfa192bc2,dgm_mining_mentioner__501ff82a432e2949ff11ba1dfa192bc2
dgmmoea,Bhutanese Director General of Geology and Mines,Bhutan,bhutan,mining minister,,MiningMinister,Bhutanese Director General of Geology and Mines,,dgm_mining_mentioner,ed05c9f3911095895abd8ad5f73ef06b,dgm_mining_mentioner__ed05c9f3911095895abd8ad5f73ef06b
diegomesap,Colombian Minister of Mines and Energy,Colombia,colombia,mining minister,,MiningMinister,Colombian Minister of Mines and Energy,,dgm_mining_mentioner,aa11834fb1a670cc0939b58e84723125,dgm_mining_mentioner__aa11834fb1a670cc0939b58e84723125
dmre_za,South Africa Mineral Resources and Energy Department,South Africa,south africa,mining ministry,,MiningMinistry,South Africa Mineral Resources and Energy Department,,dgm_mining_mentioner,9b4ab6f6592c98692f71a2d3389df6fc,dgm_mining_mentioner__9b4ab6f6592c98692f71a2d3389df6fc
drkitutu,Ugandan Minister of Energy and Mineral Development,Uganda,uganda,mining minister,,MiningMinister,Ugandan Minister of Energy and Mineral Development,,dgm_mining_mentioner,29230c8dee044131fc0bdb1b532847fe,dgm_mining_mentioner__29230c8dee044131fc0bdb1b532847fe
drshamsulanuar,Malaysian Minister of Energy and Natural Resources,Malaysia,malaysia,mining minister,,MiningMinister,Malaysian Minister of Energy and Natural Resources,,dgm_mining_mentioner,78f720c6c6bb2e9e9715a5d8de3102bf,dgm_mining_mentioner__78f720c6c6bb2e9e9715a5d8de3102bf
ecologie_gouv,"French Ecology, Sustainable Development and Energy Minister",France,france,mining minister,,MiningMinister,"French Ecology, Sustainable Development and Energy Minister",,dgm_mining_mentioner,a172ef3f15ef1016456efa8c9cc045a0,dgm_mining_mentioner__a172ef3f15ef1016456efa8c9cc045a0
energjiagoval,Albanian Infrastructure and Energy Minister Balluku,Albania,albania,mining minister,,MiningMinister,Albanian Infrastructure and Energy Minister Balluku,,dgm_mining_mentioner,d2bf27d5b3cff33bf96456b7d10b1960,dgm_mining_mentioner__d2bf27d5b3cff33bf96456b7d10b1960
energy,US Department of Energy,United States,united states,mining ministry,,MiningMinistry,US Department of Energy,,dgm_mining_mentioner,5d8b19ec34585d0618d99c465f23d8e5,dgm_mining_mentioner__5d8b19ec34585d0618d99c465f23d8e5
energy_gov_dz,Algerian Ministry of Energy of Mines,Algeria,algeria,mining ministry,,MiningMinistry,Algerian Ministry of Energy of Mines,,dgm_mining_mentioner,8065a31fa3abd18e7fce12b66b927713,dgm_mining_mentioner__8065a31fa3abd18e7fce12b66b927713
energyministry,Uganda Ministry of Energy and Mineral Development,Uganda,uganda,mining ministry,,MiningMinistry,Uganda Ministry of Energy and Mineral Development,,dgm_mining_mentioner,9b654b4a095f95b86894bf751aad1949,dgm_mining_mentioner__9b654b4a095f95b86894bf751aad1949
engabdirashidd,Petroleum and Mineral Resources Minister,Somalia,somalia,mining minister,,MiningMinister,Petroleum and Mineral Resources Minister,,dgm_mining_mentioner,12d1cb1e4087efa90d58d8914749cd35,dgm_mining_mentioner__12d1cb1e4087efa90d58d8914749cd35
farrugiaaaron,"Malta Environment, Climate Change and Planning Ministry",Malta,malta,mining minister,,MiningMinister,"Malta Environment, Climate Change and Planning Ministry",,dgm_mining_mentioner,b211683c8e46d429e8354a5ed57d609d,dgm_mining_mentioner__b211683c8e46d429e8354a5ed57d609d
fmmsdngr,Niger Ministry of Industry,Niger,niger,mining ministry,,MiningMinistry,Niger Ministry of Industry,,dgm_mining_mentioner,f39d9e96488a2f70c7d3162407b36e89,dgm_mining_mentioner__f39d9e96488a2f70c7d3162407b36e89
francis_gatare,"Rwanda Mines, Petroleum and Gas Board Minister",Rwanda,rwanda,mining minister,,MiningMinister,"Rwanda Mines, Petroleum and Gas Board Minister",,dgm_mining_mentioner,42b45f95162fb2edd883162df7bf6861,dgm_mining_mentioner__42b45f95162fb2edd883162df7bf6861
gabrielobiang,Equatorial Guinea Mines and Hydrocarbons Minister,Equatorial Guinea,equatorial guinea,mining minister,,MiningMinister,Equatorial Guinea Mines and Hydrocarbons Minister,,dgm_mining_mentioner,5b69943298441327fd3b45fa64cc7915,dgm_mining_mentioner__5b69943298441327fd3b45fa64cc7915
gankimyong,Singapore Trade and Industry Minister,Singapore,singapore,mining minister,,MiningMinister,Singapore Trade and Industry Minister,,dgm_mining_mentioner,c2ce403dbc59a749bcd4cabb2f6c9c03,dgm_mining_mentioner__c2ce403dbc59a749bcd4cabb2f6c9c03
geraleconomia,Portugal Minstry of Economy,Portugal,portugal,mining ministry,,MiningMinistry,Portugal Minstry of Economy,,dgm_mining_mentioner,065d1903f266de63d75dd3212aef691e,dgm_mining_mentioner__065d1903f266de63d75dd3212aef691e
ghajarraymond,Lebanon Energy and Water Minister,Lebanon,lebanon,mining minister,,MiningMinister,Lebanon Energy and Water Minister,,dgm_mining_mentioner,a329458b454fe06c981dcebad1e77f4c,dgm_mining_mentioner__a329458b454fe06c981dcebad1e77f4c
gic1919,Sri Lanka Geological Survey and Mines Bureau,Sri Lanka,sri lanka,mining ministry,,MiningMinistry,Sri Lanka Geological Survey and Mines Bureau,,dgm_mining_mentioner,89aa6ad2fbfae5dad09cb98d945c9b57,dgm_mining_mentioner__89aa6ad2fbfae5dad09cb98d945c9b57
gisgrenada,Grenadian Infrastructure Development Minister,Grenada,grenada,mining minister,,MiningMinister,Grenadian Infrastructure Development Minister,,dgm_mining_mentioner,8e8330e903f9356c55cf2e992176107d,dgm_mining_mentioner__8e8330e903f9356c55cf2e992176107d
gladimasophie,Mines and Geology Minister,Senegal,senegal,mining minister,,MiningMinister,Mines and Geology Minister,,dgm_mining_mentioner,3dd0c18ff71932f8e79d8db7f4fcfd44,dgm_mining_mentioner__3dd0c18ff71932f8e79d8db7f4fcfd44
gwedemantashe1,South African Minister of Mineral Resources and Energy,South Africa,south africa,mining minister,,MiningMinister,South African Minister of Mineral Resources and Energy,,dgm_mining_mentioner,461953eef21cb2c585cd3664ef2a5b54,dgm_mining_mentioner__461953eef21cb2c585cd3664ef2a5b54
hchakhansuri,Afghan Minister of Mines and Petroleum,Afghanistan,afghanistan,mining minister,,MiningMinister,Afghan Minister of Mines and Petroleum,,dgm_mining_mentioner,6b05d0df7e14ae71759f5087c4a33011,dgm_mining_mentioner__6b05d0df7e14ae71759f5087c4a33011
hesuhail,UAE Energy and Infrastructure Minister,United Arab Emirates,united arab emirates,mining minister,,MiningMinister,UAE Energy and Infrastructure Minister,,dgm_mining_mentioner,fbcffb900475fc11806214efc1ce8021,dgm_mining_mentioner__fbcffb900475fc11806214efc1ce8021
hjinapor,Ghanian Lands and Natural Resources Minister,Ghana,ghana,mining minister,,MiningMinister,Ghanian Lands and Natural Resources Minister,,dgm_mining_mentioner,ec85f6c256e992565fe7d7ca38418bf8,dgm_mining_mentioner__ec85f6c256e992565fe7d7ca38418bf8
hzawati,Jordanian Minister of Energy and Mineral Resources,Jordan,jordan,mining minister,,MiningMinister,Jordanian Minister of Energy and Mineral Resources,,dgm_mining_mentioner,b59a87fe12450c41548dd866f2d7dbf7,dgm_mining_mentioner__b59a87fe12450c41548dd866f2d7dbf7
jaarreaza,Venezuela Mining Minister,Venezuela,venezuela,mining minister,,MiningMinister,Venezuela Mining Minister,,dgm_mining_mentioner,2ceded99be81ab66db7a47c47868c22c,dgm_mining_mentioner__2ceded99be81ab66db7a47c47868c22c
jamahmohamoud,Somaliland Energy and Minerals Minister,Somalia,somalia,mining minister,,MiningMinister,Somaliland Energy and Minerals Minister,,dgm_mining_mentioner,77e2fb29e7613f54f26067c05e4f07bc,dgm_mining_mentioner__77e2fb29e7613f54f26067c05e4f07bc
jengranholm,United States Department of Energy Secretary,United States,united states,mining minister,,MiningMinister,United States Department of Energy Secretary,,dgm_mining_mentioner,6e263059e646f12c23c250c797781a0a,dgm_mining_mentioner__6e263059e646f12c23c250c797781a0a
joneusamate,Fijian Lands and Mineral Resources Minister,Fiji,fiji,mining minister,,MiningMinister,Fijian Lands and Mineral Resources Minister,,dgm_mining_mentioner,11e57b9cf4b2f275097f3a265ebcb371,dgm_mining_mentioner__11e57b9cf4b2f275097f3a265ebcb371
josearangurenok,Argentine Energy Minister,Argentina,argentina,mining minister,,MiningMinister,Argentine Energy Minister,,dgm_mining_mentioner,20b246551fe81c8c0d6b5b64d70fb493,dgm_mining_mentioner__20b246551fe81c8c0d6b5b64d70fb493
joshipralhad,India Minister of Mines,India,india,mining minister,,MiningMinister,India Minister of Mines,,dgm_mining_mentioner,d90233033e99f6c0f6f787f39634fcfe,dgm_mining_mentioner__d90233033e99f6c0f6f787f39634fcfe
juanruizquinta1,Cuban Energy and Mines Minister,Cuba,cuba,mining minister,,MiningMinister,Cuban Energy and Mines Minister,,dgm_mining_mentioner,5554a9d930a0d2d39c6db26b1ff927c6,dgm_mining_mentioner__5554a9d930a0d2d39c6db26b1ff927c6
kajiyamahiroshi,Japan Natural Resources and Energy Minister,Japan,japan,mining minister,,MiningMinister,Japan Natural Resources and Energy Minister,,dgm_mining_mentioner,3a91f22bd00c8f1f0c3d5b514546da25,dgm_mining_mentioner__3a91f22bd00c8f1f0c3d5b514546da25
kelharrar,Israel Minister of Energy,Israel,israel,mining minister,,MiningMinister,Israel Minister of Energy,,dgm_mining_mentioner,a0695bfea7e003f938686f526b097d5b,dgm_mining_mentioner__a0695bfea7e003f938686f526b097d5b
ketsamalaysia,Malaysia Ministry of Energy and Natural Resources,Malaysia,malaysia,mining ministry,,MiningMinistry,Malaysia Ministry of Energy and Natural Resources,,dgm_mining_mentioner,74bfc2098f9ac2ed3d386de970a2ee1e,dgm_mining_mentioner__74bfc2098f9ac2ed3d386de970a2ee1e
kfocre,Qatar Commerce and Industry Minister,Qatar,qatar,mining minister,,MiningMinister,Qatar Commerce and Industry Minister,,dgm_mining_mentioner,3a6e16db3d323a5f0cd2ea4599c2a05c,dgm_mining_mentioner__3a6e16db3d323a5f0cd2ea4599c2a05c
kostasskrekas,Greek Environment and Energy Minister,Greece,greece,mining minister,,MiningMinister,Greek Environment and Energy Minister,,dgm_mining_mentioner,21e1a64f495180a399cbfe542c4309c8,dgm_mining_mentioner__21e1a64f495180a399cbfe542c4309c8
kwasikwarteng,"Business, Energy and Industrial Strategy Minister",United Kingdom,united kingdom,mining minister,,MiningMinister,"Business, Energy and Industrial Strategy Minister",,dgm_mining_mentioner,debf536ef9699e36eb5e03b6acfb60e7,dgm_mining_mentioner__debf536ef9699e36eb5e03b6acfb60e7
larsclilleholt,"Danish Climate, Energy and Utilities Ministry",Denmark,denmark,mining minister,,MiningMinister,"Danish Climate, Energy and Utilities Ministry",,dgm_mining_mentioner,b1bd88fa69c3abac138b84edd169a56f,dgm_mining_mentioner__b1bd88fa69c3abac138b84edd169a56f
lgewessler,"Austrian Minister for Climate Action, Environment, Energy, Mobility, Innovation and Technology",Austria,austria,mining minister,,MiningMinister,"Austrian Minister for Climate Action, Environment, Energy, Mobility, Innovation and Technology",,dgm_mining_mentioner,9bc3f654b6f648e93f295ff2225accd7,dgm_mining_mentioner__9bc3f654b6f648e93f295ff2225accd7
m_amaraweera,Sri Lanka Environment Minister,Sri Lanka,sri lanka,mining minister,,MiningMinister,Sri Lanka Environment Minister,,dgm_mining_mentioner,da4f561fceb20f17565535b41e661fd7,dgm_mining_mentioner__da4f561fceb20f17565535b41e661fd7
madinitanzania,Tanzania Ministry of Mineral,Tanzania,tanzania,mining ministry,,MiningMinistry,Tanzania Ministry of Mineral,,dgm_mining_mentioner,9e3e9a2e8621f42771b6d23f5a828449,dgm_mining_mentioner__9e3e9a2e8621f42771b6d23f5a828449
marialuisahayem,El Savadoran Economic Minister,El Salvador,el salvador,mining minister,,MiningMinister,El Savadoran Economic Minister,,dgm_mining_mentioner,ada13748805bdb4795cba5b31eeed78d,dgm_mining_mentioner__ada13748805bdb4795cba5b31eeed78d
marotoreyes,Spain Industry Minister,Spain,spain,mining minister,,MiningMinister,Spain Industry Minister,,dgm_mining_mentioner,efc373bceb43b6a8f9b8b8f84fe80d55,dgm_mining_mentioner__efc373bceb43b6a8f9b8b8f84fe80d55
mbiegovtnz,New Zealand Ministry of Energy and Resources,New Zealand,new zealand,mining ministry,,MiningMinistry,New Zealand Ministry of Energy and Resources,,dgm_mining_mentioner,14f8108b11c8d9b5b0ff9ee3bf71f4ef,dgm_mining_mentioner__14f8108b11c8d9b5b0ff9ee3bf71f4ef
med_abdelvetah,"Mauritanian Minister of Petroleum, Energy and Mines",Mauritania,mauritania,mining minister,,MiningMinister,"Mauritanian Minister of Petroleum, Energy and Mines",,dgm_mining_mentioner,a5dd2ebad87915e6fbc4c9d4d66b6e98,dgm_mining_mentioner__a5dd2ebad87915e6fbc4c9d4d66b6e98
megan_woods,Energy and Resources MinisterNew ZEaland,New Zealand,new zealand,mining minister,,MiningMinister,Energy and Resources MinisterNew ZEaland,,dgm_mining_mentioner,f087646249f8f943315b192ca7f20be3,dgm_mining_mentioner__f087646249f8f943315b192ca7f20be3
memrd,Dominican Republic Energy and Mines Minister,Dominican Republic,dominican republic,mining minister,,MiningMinister,Dominican Republic Energy and Mines Minister,,dgm_mining_mentioner,abb58a0075dbbe5306480170b4f10aba,dgm_mining_mentioner__abb58a0075dbbe5306480170b4f10aba
meti_jpn,Japan Ministry of Natural Resources and Energy,Japan,japan,mining ministry,,MiningMinistry,Japan Ministry of Natural Resources and Energy,,dgm_mining_mentioner,4220bfc757b58d5f28fceacf91cb5a3a,dgm_mining_mentioner__4220bfc757b58d5f28fceacf91cb5a3a
mgb_denr,Philippines Mines and Geosciences Bureau,Philippines,philippines,mining ministry,,MiningMinistry,Philippines Mines and Geosciences Bureau,,dgm_mining_mentioner,8d3ebfd7e81089c0327fde7b1fc6cbcf,dgm_mining_mentioner__8d3ebfd7e81089c0327fde7b1fc6cbcf
micipma,Panama Ministry of Commerce and Industries,Panama,panama,mining ministry,,MiningMinistry,Panama Ministry of Commerce and Industries,,dgm_mining_mentioner,4cdb04daa94b48f087f8f49b38bf2e35,dgm_mining_mentioner__4cdb04daa94b48f087f8f49b38bf2e35
miem_uruguay,"Uruguay Ministry of Industry, Energy and Mining",Uruguay,uruguay,mining ministry,,MiningMinistry,"Uruguay Ministry of Industry, Energy and Mining",,dgm_mining_mentioner,b76a928857e976a8fc15cd8603378e42,dgm_mining_mentioner__b76a928857e976a8fc15cd8603378e42
mikkonenkrista,Finnish Environmental Minister,Finland,finland,mining minister,,MiningMinister,Finnish Environmental Minister,,dgm_mining_mentioner,9b72626d7c17468c802b054ec5705c1d,dgm_mining_mentioner__9b72626d7c17468c802b054ec5705c1d
minas_energia,Brazilian Mines and Energy Minister,Brazil,brazil,mining minister,,MiningMinister,Brazilian Mines and Energy Minister,,dgm_mining_mentioner,ce432170c27d9eacfc72a58ccbd0aa4c,dgm_mining_mentioner__ce432170c27d9eacfc72a58ccbd0aa4c
minenergo_ua,Ukriane Ministry of Energy and Coal Industry,Ukraine,ukraine,mining ministry,,MiningMinistry,Ukriane Ministry of Energy and Coal Industry,,dgm_mining_mentioner,db9c988b8348d4e6e2df4542b0245f68,dgm_mining_mentioner__db9c988b8348d4e6e2df4542b0245f68
minenergylt,Lithuania Ministry of Energy,Lithuania,lithuania,mining ministry,,MiningMinistry,Lithuania Ministry of Energy,,dgm_mining_mentioner,17b5393e9c920adc5bfbbe6af403d69a,dgm_mining_mentioner__17b5393e9c920adc5bfbbe6af403d69a
mineralssd,Sudan Ministry of Energy and Oil,Sudan,sudan,mining ministry,,MiningMinistry,Sudan Ministry of Energy and Oil,,dgm_mining_mentioner,639d0f3e21ea8e88405ba0686de4eb1d,dgm_mining_mentioner__639d0f3e21ea8e88405ba0686de4eb1d
mines_rwanda,Rwanda Mining Board,Rwanda,rwanda,mining ministry,,MiningMinistry,Rwanda Mining Board,,dgm_mining_mentioner,96622d8b43c7471bb1bee24edf2992ed,dgm_mining_mentioner__96622d8b43c7471bb1bee24edf2992ed
minesminindia,India Ministry of Mines,India,india,mining ministry,,MiningMinistry,India Ministry of Mines,,dgm_mining_mentioner,a8b54f4ba973c5b9299d781aab601be8,dgm_mining_mentioner__a8b54f4ba973c5b9299d781aab601be8
ministerblok,Netherlands Economic Affairs and Climate Policy Minister,Netherlands,netherlands,mining minister,,MiningMinister,Netherlands Economic Affairs and Climate Policy Minister,,dgm_mining_mentioner,3b485a7a623e2e4b891c01aa63bd1058,dgm_mining_mentioner__3b485a7a623e2e4b891c01aa63bd1058
minminesmali,Mali Ministry of Mines,Mali,mali,mining ministry,,MiningMinistry,Mali Ministry of Mines,,dgm_mining_mentioner,ef23b19affae65d94ca8226e7af67551,dgm_mining_mentioner__ef23b19affae65d94ca8226e7af67551
mitecogob,Spain Minstry of Ecological Transition,Spain,spain,mining ministry,,MiningMinistry,Spain Minstry of Ecological Transition,,dgm_mining_mentioner,87c1acd9bef6c7fd242a77dffb4cc771,dgm_mining_mentioner__87c1acd9bef6c7fd242a77dffb4cc771
mkis_gov_pl,Poland Ministry of Climate and Environment,Poland,poland,mining ministry,,MiningMinistry,Poland Ministry of Climate and Environment,,dgm_mining_mentioner,ce0cf878b9fc39832d43c8a3995c8221,dgm_mining_mentioner__ce0cf878b9fc39832d43c8a3995c8221
mmmdzim,Zimbabwe Ministry of Mines and Mining Development,Zimbabwe,zimbabwe,mining ministry,,MiningMinistry,Zimbabwe Ministry of Mines and Mining Development,,dgm_mining_mentioner,6c797ee5b982fefaed02fc23abba61fa,dgm_mining_mentioner__6c797ee5b982fefaed02fc23abba61fa
mmtp_lu,Luxembourg Ministry of Public Works,Luxembourg,luxembourg,mining ministry,,MiningMinistry,Luxembourg Ministry of Public Works,,dgm_mining_mentioner,ef6ca7e3d3cfffb09085c26165ef3fa0,dgm_mining_mentioner__ef6ca7e3d3cfffb09085c26165ef3fa0
mnr_government,Russia Ministry of Natural Resources and Environment,Russia,russia,mining ministry,,MiningMinistry,Russia Ministry of Natural Resources and Environment,,dgm_mining_mentioner,f7975ddf3aaa272bbac06c8d5d682c09,dgm_mining_mentioner__f7975ddf3aaa272bbac06c8d5d682c09
mociqatar,Qatar Ministry of Commerce and Industry,Qatar,qatar,mining ministry,,MiningMinistry,Qatar Ministry of Commerce and Industry,,dgm_mining_mentioner,522f9df31d53a259c59af3d0ec57b2fc,dgm_mining_mentioner__522f9df31d53a259c59af3d0ec57b2fc
moeiuae,UAE Ministry of Energy and Infrastructure,United Arab Emirates,united arab emirates,mining ministry,,MiningMinistry,UAE Ministry of Energy and Infrastructure,,dgm_mining_mentioner,5ea6fe35e1e79afd4585b44f00501fd8,dgm_mining_mentioner__5ea6fe35e1e79afd4585b44f00501fd8
moenvmv,Maldives Ministry of Environment and Energy,Maldives,maldives,mining ministry,,MiningMinistry,Maldives Ministry of Environment and Energy,,dgm_mining_mentioner,47ca36ef75f91fc5b1f315403612a3ef,dgm_mining_mentioner__47ca36ef75f91fc5b1f315403612a3ef
mog_oman,Oman Ministry of Energy and Minerals,Oman,oman,mining ministry,,MiningMinistry,Oman Ministry of Energy and Minerals,,dgm_mining_mentioner,b82966d61c1547b192ca40adae9d2df8,dgm_mining_mentioner__b82966d61c1547b192ca40adae9d2df8
moo_kw,Kuwait Ministry of Oil,Kuwait,kuwait,mining ministry,,MiningMinistry,Kuwait Ministry of Oil,,dgm_mining_mentioner,898d871f7259b04fafaff5d8ec3c78cc,dgm_mining_mentioner__898d871f7259b04fafaff5d8ec3c78cc
motiekoreaeng,"South Korea Ministry of Trade, Industry and Energy",South Korea,south korea,mining ministry,,MiningMinistry,"South Korea Ministry of Trade, Industry and Energy",,dgm_mining_mentioner,d93ac9badd30ffd4bf5d92690b745de9,dgm_mining_mentioner__d93ac9badd30ffd4bf5d92690b745de9
mrtme,"Montenegro Ministry of Ecology, Spatial and Urbanism",Montenegro,montenegro,mining ministry,,MiningMinistry,"Montenegro Ministry of Ecology, Spatial and Urbanism",,dgm_mining_mentioner,1e37367452c126cf6afa238739da0dca,dgm_mining_mentioner__1e37367452c126cf6afa238739da0dca
msetgovjm,"Jamaica Department of Science, Energy and Technology",Jamaica,jamaica,mining ministry,,MiningMinistry,"Jamaica Department of Science, Energy and Technology",,dgm_mining_mentioner,e73e6a8d992829a6c9b6e5b206b3d89f,dgm_mining_mentioner__e73e6a8d992829a6c9b6e5b206b3d89f
mti_sg,Singapore Ministry of Trade & Industry,Singapore,singapore,mining ministry,,MiningMinistry,Singapore Ministry of Trade & Industry,,dgm_mining_mentioner,e897ba7857c77cd0be2d600318d80e12,dgm_mining_mentioner__e897ba7857c77cd0be2d600318d80e12
mtptce,"Haitian Public Works, Transport and Communications Minister",Haiti,haiti,mining minister,,MiningMinister,"Haitian Public Works, Transport and Communications Minister",,dgm_mining_mentioner,3914a61b32dca087a66f1b7f8023f937,dgm_mining_mentioner__3914a61b32dca087a66f1b7f8023f937
mygovsa,Saudi Arabia Ministry of Industry and Mineral Resources,Saudi Arabia,saudi arabia,mining ministry,,MiningMinistry,Saudi Arabia Ministry of Industry and Mineral Resources,,dgm_mining_mentioner,c76f952fa6cc835121df3d5aa5362062,dgm_mining_mentioner__c76f952fa6cc835121df3d5aa5362062
nasrulhamid_mp,"Bangladeshi Minister of Power, Energy and Mineral Resources",Bangladesh,bangladesh,mining minister,,MiningMinister,"Bangladeshi Minister of Power, Energy and Mineral Resources",,dgm_mining_mentioner,b6aedc2ec4d7ed77cdb4250e6ea1be57,dgm_mining_mentioner__b6aedc2ec4d7ed77cdb4250e6ea1be57
nmaslinfo,Sierra Leone National Minerals Agency,Sierra Leone,sierra leone,mining ministry,,MiningMinistry,Sierra Leone National Minerals Agency,,dgm_mining_mentioner,cc4dcdfd08065479d110cbe0d52e2ae5,dgm_mining_mentioner__cc4dcdfd08065479d110cbe0d52e2ae5
omarpaganini,"Industry, Energy and Mining Minister",Uruguay,uruguay,mining minister,,MiningMinister,"Industry, Energy and Mining Minister",,dgm_mining_mentioner,5d13653c6654b1032c081ff1e0d1ef3c,dgm_mining_mentioner__5d13653c6654b1032c081ff1e0d1ef3c
ottatdoe,US Office of Technology Transitions,United States,united states,mining ministry,,MiningMinistry,US Office of Technology Transitions,,dgm_mining_mentioner,f9560dcef017ebeaf2dbf28a24e3e1c2,dgm_mining_mentioner__f9560dcef017ebeaf2dbf28a24e3e1c2
pedrosizavieira,Portugal Economy Minister,Portugal,portugal,mining minister,,MiningMinister,Portugal Economy Minister,,dgm_mining_mentioner,df62277a6de4927223bbf9a7178e2887,dgm_mining_mentioner__df62277a6de4927223bbf9a7178e2887
petro_miningke,Kenya Ministry of Petrolrum and Mining,Kenya,kenya,mining ministry,,MiningMinistry,Kenya Ministry of Petrolrum and Mining,,dgm_mining_mentioner,1f0ec520612dcadcc913b42f580169f0,dgm_mining_mentioner__1f0ec520612dcadcc913b42f580169f0
petroenermines,"Mauritania Ministry of Petroleum, Energy and Mines",Mauritania,mauritania,mining ministry,,MiningMinistry,"Mauritania Ministry of Petroleum, Energy and Mines",,dgm_mining_mentioner,a79ac7bbebae62bcfc4fa1df494de6af,dgm_mining_mentioner__a79ac7bbebae62bcfc4fa1df494de6af
pm_juliennkoghe,Gabonese Energy and Hydraulic Resources Minister,Gabon,gabon,mining minister,,MiningMinister,Gabonese Energy and Hydraulic Resources Minister,,dgm_mining_mentioner,473d7efd5dde6c80d6c59602605fe7cd,dgm_mining_mentioner__473d7efd5dde6c80d6c59602605fe7cd
rocionahle,Mexico Secretariat of Energy,Mexico,mexico,mining minister,,MiningMinister,Mexico Secretariat of Energy,,dgm_mining_mentioner,fe43e3fe09f67d5f7ec90d1f172d26ae,dgm_mining_mentioner__fe43e3fe09f67d5f7ec90d1f172d26ae
s_sommaruga,"Switzerland Environment, Transport, Energy and Communications Minister",Switzerland,switzerland,mining minister,,MiningMinister,"Switzerland Environment, Transport, Energy and Communications Minister",,dgm_mining_mentioner,b18df1d8a929c4fdebe6edcaac2326e4,dgm_mining_mentioner__b18df1d8a929c4fdebe6edcaac2326e4
