handle,caption_name,location,location_lower,type,exclude_groups,ENTITY_LABEL,name,description,source,source_identifier,global_identifier
hanneeskjaer,Danish Ambassador to Canada,Canada,canada,Ambassadors & Representatives,,Ambassadors&Representatives,Danish Ambassador to Canada,,dgm_mining_mentioner,670a2b914ecca23da0387b829c75e98a,dgm_mining_mentioner__670a2b914ecca23da0387b829c75e98a
cgnickbaker,UK Consul General to Canada,Canada,canada,Ambassadors & Representatives,,Ambassadors&Representatives,UK Consul General to Canada,,dgm_mining_mentioner,55d556ded219a55a27226b77e755bc9e,dgm_mining_mentioner__55d556ded219a55a27226b77e755bc9e
susanlejeuneuk,UK High Commissioner to Canada,Canada,canada,Ambassadors & Representatives,,Ambassadors&Representatives,UK High Commissioner to Canada,,dgm_mining_mentioner,f332ca8afd229a2c0469aee2ba9dd29e,dgm_mining_mentioner__f332ca8afd229a2c0469aee2ba9dd29e
nzinottawa,New Zealander High Commissioner to Canada,Canada,canada,Ambassadors & Representatives,,Ambassadors&Representatives,New Zealander High Commissioner to Canada,,dgm_mining_mentioner,2ca47bbc1db0530d4448aadf21e57bc9,dgm_mining_mentioner__2ca47bbc1db0530d4448aadf21e57bc9
mgrant_canada,Canadian Assistant Deputy Minister,Canada,canada,Ambassadors & Representatives,,Ambassadors&Representatives,Canadian Assistant Deputy Minister,,dgm_mining_mentioner,60e97c194c90e1d6079ac5bca36c71de,dgm_mining_mentioner__60e97c194c90e1d6079ac5bca36c71de
marianickt,Director General Engaging Canadians and Global Affairs,Canada,canada,Ambassadors & Representatives,,Ambassadors&Representatives,Director General Engaging Canadians and Global Affairs,,dgm_mining_mentioner,d20572bc2e0e1478ee7088d37d8d4166,dgm_mining_mentioner__d20572bc2e0e1478ee7088d37d8d4166
andreffrenette,Director General at Global Affairs Canada,Canada,canada,Ambassadors & Representatives,,Ambassadors&Representatives,Director General at Global Affairs Canada,,dgm_mining_mentioner,0eb2d6f5a12719e5cfb1a7e500d5fb28,dgm_mining_mentioner__0eb2d6f5a12719e5cfb1a7e500d5fb28
ambassador_bze,Belizean High Commissioner to Canada,Canada,canada,Ambassadors & Representatives,,Ambassadors&Representatives,Belizean High Commissioner to Canada,,dgm_mining_mentioner,e001d98c4f4bf97bd21e711b3ac05910,dgm_mining_mentioner__e001d98c4f4bf97bd21e711b3ac05910
hannan_ml,Executive Director & Chief of Staff to Canadian Deputy Minister Foreign Affairs,Canada,canada,Ambassadors & Representatives,,Ambassadors&Representatives,Executive Director & Chief of Staff to Canadian Deputy Minister Foreign Affairs,,dgm_mining_mentioner,3c7b97e0a32d19e623494e77288ff5be,dgm_mining_mentioner__3c7b97e0a32d19e623494e77288ff5be
elhijodedora,"Panamanian Consul General in Vancouver, Canada",Canada,canada,Ambassadors & Representatives,,Ambassadors&Representatives,"Panamanian Consul General in Vancouver, Canada",,dgm_mining_mentioner,4b3cc83ab3ac6ab46b97e745cd9316f7,dgm_mining_mentioner__4b3cc83ab3ac6ab46b97e745cd9316f7
zaib_shaikh,"Canadian Consul General to Los Angeles, CA",Canada,canada,Ambassadors & Representatives,,Ambassadors&Representatives,"Canadian Consul General to Los Angeles, CA",,dgm_mining_mentioner,52a993273134c6fe089fdf688187553c,dgm_mining_mentioner__52a993273134c6fe089fdf688187553c
hendrik_velde,Belgian Consul General to Canada,Canada,canada,Ambassadors & Representatives,,Ambassadors&Representatives,Belgian Consul General to Canada,,dgm_mining_mentioner,3ec43c6cf7ad484321fa3bb43e567214,dgm_mining_mentioner__3ec43c6cf7ad484321fa3bb43e567214
jacqui_oneill,"Canadian Ambassador for Women, Peace, and Security",Canada,canada,Ambassadors & Representatives,,Ambassadors&Representatives,"Canadian Ambassador for Women, Peace, and Security",,dgm_mining_mentioner,a61b59170596c21d3f3bf026a610b456,dgm_mining_mentioner__a61b59170596c21d3f3bf026a610b456
janicecharette,Interim Canadian Privy Council Clerk,Canada,canada,Ambassadors & Representatives,,Ambassadors&Representatives,Interim Canadian Privy Council Clerk,,dgm_mining_mentioner,88a829aa902a45c99003ca584f3b569f,dgm_mining_mentioner__88a829aa902a45c99003ca584f3b569f
jjgomezcamacho,Mexican Ambassador to Canada,Canada,canada,Ambassadors & Representatives,,Ambassadors&Representatives,Mexican Ambassador to Canada,,dgm_mining_mentioner,f114ff2c5d06b38298d7747d59e53fe6,dgm_mining_mentioner__f114ff2c5d06b38298d7747d59e53fe6
ashevch,Ukrainian Ambassador to Canada,Canada,canada,Ambassadors & Representatives,,Ambassadors&Representatives,Ukrainian Ambassador to Canada,,dgm_mining_mentioner,16b2cda2754e20f7e333d46772ca4c84,dgm_mining_mentioner__16b2cda2754e20f7e333d46772ca4c84
skusev,Lithuanian Ambassador to Canada,Canada,canada,Ambassadors & Representatives,,Ambassadors&Representatives,Lithuanian Ambassador to Canada,,dgm_mining_mentioner,aaa2fbb0723061dd43a6facfcb26aa7c,dgm_mining_mentioner__aaa2fbb0723061dd43a6facfcb26aa7c
susanbincoletto,Canadian Ambassador to to Switzerland and Liechtenstein,Canada,canada,Ambassadors & Representatives,,Ambassadors&Representatives,Canadian Ambassador to to Switzerland and Liechtenstein,,dgm_mining_mentioner,6d7b2ca1b59f38525373827ed4cf272d,dgm_mining_mentioner__6d7b2ca1b59f38525373827ed4cf272d
elisabetheklund,Swedish Ambassador to Caribbean,Caribbean,caribbean,Ambassadors & Representatives,,Ambassadors&Representatives,Swedish Ambassador to Caribbean,,dgm_mining_mentioner,461f27797ade39d8640f410f0054d23a,dgm_mining_mentioner__461f27797ade39d8640f410f0054d23a
gregquinnfcdo,"Head of Foreign, Commonwealth and Development Office in Carribbean",Carribbean,carribbean,Ambassadors & Representatives,,Ambassadors&Representatives,"Head of Foreign, Commonwealth and Development Office in Carribbean",,dgm_mining_mentioner,02886e2f5ccc4c9ee82d508a686c1583,dgm_mining_mentioner__02886e2f5ccc4c9ee82d508a686c1583
pertti_ikonen,Finnish Ambassador to the Carribean,Carribean,carribean,Ambassadors & Representatives,,Ambassadors&Representatives,Finnish Ambassador to the Carribean,,dgm_mining_mentioner,d7ecac30003aa5f1f76afa5f8ea26c51,dgm_mining_mentioner__d7ecac30003aa5f1f76afa5f8ea26c51
samuelaisopieu,EU Ambassador to Central African Republic,Central African Republic,central african republic,Ambassadors & Representatives,,Ambassadors&Representatives,EU Ambassador to Central African Republic,,dgm_mining_mentioner,2d3f8bb5d8bfe6cf260a19284ffa52df,dgm_mining_mentioner__2d3f8bb5d8bfe6cf260a19284ffa52df
mmatthewsfcdo,UK Ambassador to Chad,Chad,chad,Ambassadors & Representatives,,Ambassadors&Representatives,UK Ambassador to Chad,,dgm_mining_mentioner,2d31d513051f8f471e54f4ff25991ca6,dgm_mining_mentioner__2d31d513051f8f471e54f4ff25991ca6
_marinaros,Israeli Ambassador to Chile,Chile,chile,Ambassadors & Representatives,,Ambassadors&Representatives,Israeli Ambassador to Chile,,dgm_mining_mentioner,6e946e1f199b614170ac8df779bd3d4e,dgm_mining_mentioner__6e946e1f199b614170ac8df779bd3d4e
arivaspalacios,Paraguayan Ambassador to Chile,Chile,chile,Ambassadors & Representatives,,Ambassadors&Representatives,Paraguayan Ambassador to Chile,,dgm_mining_mentioner,48589b6afe55e8d86e8964767bcf3a87,dgm_mining_mentioner__48589b6afe55e8d86e8964767bcf3a87
mricci_it,Italian Ambassador to Chile,Chile,chile,Ambassadors & Representatives,,Ambassadors&Representatives,Italian Ambassador to Chile,,dgm_mining_mentioner,75db9357cf6e1871133bbc87df07590b,dgm_mining_mentioner__75db9357cf6e1871133bbc87df07590b
dkambchile,Danish Ambassador to Chile,Chile,chile,Ambassadors & Representatives,,Ambassadors&Representatives,Danish Ambassador to Chile,,dgm_mining_mentioner,ce18efe10e8f837335e5b85eb9300ee1,dgm_mining_mentioner__ce18efe10e8f837335e5b85eb9300ee1
ianduddyuk,UK Ambassador to Chile,Chile,chile,Ambassadors & Representatives,,Ambassadors&Representatives,UK Ambassador to Chile,,dgm_mining_mentioner,8e33cac07fe2d3e1e0255046730e67c1,dgm_mining_mentioner__8e33cac07fe2d3e1e0255046730e67c1
maurobattocchi,Italian Ambassador to Chile,Chile,chile,Ambassadors & Representatives,,Ambassadors&Representatives,Italian Ambassador to Chile,,dgm_mining_mentioner,75db9357cf6e1871133bbc87df07590b,dgm_mining_mentioner__75db9357cf6e1871133bbc87df07590b
johanvdwerff,Dutch Ambassador to Chile,Chile,chile,Ambassadors & Representatives,,Ambassadors&Representatives,Dutch Ambassador to Chile,,dgm_mining_mentioner,cda14eeec59489f71fd49baee43291fd,dgm_mining_mentioner__cda14eeec59489f71fd49baee43291fd
louiseadesousa,UK Ambassador to Chile,Chile,chile,Ambassadors & Representatives,,Ambassadors&Representatives,UK Ambassador to Chile,,dgm_mining_mentioner,8e33cac07fe2d3e1e0255046730e67c1,dgm_mining_mentioner__8e33cac07fe2d3e1e0255046730e67c1
harmaninchile,Dutch Ambassador to Chile,Chile,chile,Ambassadors & Representatives,,Ambassadors&Representatives,Dutch Ambassador to Chile,,dgm_mining_mentioner,cda14eeec59489f71fd49baee43291fd,dgm_mining_mentioner__cda14eeec59489f71fd49baee43291fd
ambliuguangyuan,Chinese Foreign Ministry Commissioner,China,china,Ambassadors & Representatives,,Ambassadors&Representatives,Chinese Foreign Ministry Commissioner,,dgm_mining_mentioner,64fdbf79acec66638423ff755f164821,dgm_mining_mentioner__64fdbf79acec66638423ff755f164821
consulcubash,Cuban Consul General in China,China,china,Ambassadors & Representatives,,Ambassadors&Representatives,Cuban Consul General in China,,dgm_mining_mentioner,3a3b4e1371b7704f0ee5606b4e6dd317,dgm_mining_mentioner__3a3b4e1371b7704f0ee5606b4e6dd317
ambliuxiaoming,Chinese Special Representative on Korean Affairs,China,china,Ambassadors & Representatives,,Ambassadors&Representatives,Chinese Special Representative on Korean Affairs,,dgm_mining_mentioner,0d624525b21634d923784db7e2a5ccc9,dgm_mining_mentioner__0d624525b21634d923784db7e2a5ccc9
cmphcuba,Cuban Ambassador to China,China,china,Ambassadors & Representatives,,Ambassadors&Representatives,Cuban Ambassador to China,,dgm_mining_mentioner,b435849ac4f6522f9a4012a61e529424,dgm_mining_mentioner__b435849ac4f6522f9a4012a61e529424
ekaiyamo,Namibian Ambassador to China,China,china,Ambassadors & Representatives,,Ambassadors&Representatives,Namibian Ambassador to China,,dgm_mining_mentioner,ff33a5b05255f8a7be9f8805b531e53e,dgm_mining_mentioner__ff33a5b05255f8a7be9f8805b531e53e
pakambchina,Pakistani Ambassador to China,China,china,Ambassadors & Representatives,,Ambassadors&Representatives,Pakistani Ambassador to China,,dgm_mining_mentioner,25bce05714b0a5f91f942cb5831191ec,dgm_mining_mentioner__25bce05714b0a5f91f942cb5831191ec
cscottfcdo,Deputy Head of UK Mission in China,China,china,Ambassadors & Representatives,,Ambassadors&Representatives,Deputy Head of UK Mission in China,,dgm_mining_mentioner,15839b318acbefcc90e6a3b4a008aa49,dgm_mining_mentioner__15839b318acbefcc90e6a3b4a008aa49
francoisrivest1,Executive Director of Greater China Division at Canadian Foreign Affairs Ministry,China,china,Ambassadors & Representatives,,Ambassadors&Representatives,Executive Director of Greater China Division at Canadian Foreign Affairs Ministry,,dgm_mining_mentioner,8efb28259ea5f94fc8293566f61b752a,dgm_mining_mentioner__8efb28259ea5f94fc8293566f61b752a
helenasangeland,Swedish Ambassador to China,China,china,Ambassadors & Representatives,,Ambassadors&Representatives,Swedish Ambassador to China,,dgm_mining_mentioner,b69758c79b931fadae1c654f57f2f867,dgm_mining_mentioner__b69758c79b931fadae1c654f57f2f867
awalekullane,Somalian Ambassador to China,China,china,Ambassadors & Representatives,,Ambassadors&Representatives,Somalian Ambassador to China,,dgm_mining_mentioner,c8e65ffabfa82b85dcfe5e34d78939ee,dgm_mining_mentioner__c8e65ffabfa82b85dcfe5e34d78939ee
teshometoga,Ethiopian Ambassador to China,China,china,Ambassadors & Representatives,,Ambassadors&Representatives,Ethiopian Ambassador to China,,dgm_mining_mentioner,8ef4918fa34cd505522a747467a33149,dgm_mining_mentioner__8ef4918fa34cd505522a747467a33149
faridaloudaya,Moroccan Ambassador to Colombia and Ecuador,Colombia,colombia,Ambassadors & Representatives,,Ambassadors&Representatives,Moroccan Ambassador to Colombia and Ecuador,,dgm_mining_mentioner,f244a2024c19402e8607f5bdbce5e0c0,dgm_mining_mentioner__f244a2024c19402e8607f5bdbce5e0c0
alemembajador,German Ambassador to Colombia,Colombia,colombia,Ambassadors & Representatives,,Ambassadors&Representatives,German Ambassador to Colombia,,dgm_mining_mentioner,4c6629e2df0b1d9559b24ac797bcc3ba,dgm_mining_mentioner__4c6629e2df0b1d9559b24ac797bcc3ba
llombartpatue,EU Ambassador to Colombia,Colombia,colombia,Ambassadors & Representatives,,Ambassadors&Representatives,EU Ambassador to Colombia,,dgm_mining_mentioner,70322c4010111655ff1925a775bd8d0e,dgm_mining_mentioner__70322c4010111655ff1925a775bd8d0e
marcel_lebleu,Canadian Ambassador to Colombia,Colombia,colombia,Ambassadors & Representatives,,Ambassadors&Representatives,Canadian Ambassador to Colombia,,dgm_mining_mentioner,14124959ea8d4a55fd280674791548c3,dgm_mining_mentioner__14124959ea8d4a55fd280674791548c3
dkambcolombia,Danish Ambassador to Colombia,Colombia,colombia,Ambassadors & Representatives,,Ambassadors&Representatives,Danish Ambassador to Colombia,,dgm_mining_mentioner,c2da90135396c4c560b19d44145417ab,dgm_mining_mentioner__c2da90135396c4c560b19d44145417ab
jeanlucdelvert,French Consul General in Republic of Congo,Congo,congo,Ambassadors & Representatives,,Ambassadors&Representatives,French Consul General in Republic of Congo,,dgm_mining_mentioner,8708dfbf56e98740456855e17ee3967c,dgm_mining_mentioner__8708dfbf56e98740456855e17ee3967c
amborenbarel,Israeli Ambassador to Costa Rica,Costa Rica,costa rica,Ambassadors & Representatives,,Ambassadors&Representatives,Israeli Ambassador to Costa Rica,,dgm_mining_mentioner,d961fa5cece15f0e40d870d6eaa7bb7c,dgm_mining_mentioner__d961fa5cece15f0e40d870d6eaa7bb7c
antoniacalvoeu,EU Ambassador to Costa Rica,Costa Rica,costa rica,Ambassadors & Representatives,,Ambassadors&Representatives,EU Ambassador to Costa Rica,,dgm_mining_mentioner,9fce1901f9d3b24057a91ff554d26116,dgm_mining_mentioner__9fce1901f9d3b24057a91ff554d26116
jkhillcda,Canadian Ambassador to Costa Rica,Costa Rica,costa rica,Ambassadors & Representatives,,Ambassadors&Representatives,Canadian Ambassador to Costa Rica,,dgm_mining_mentioner,f55a2c7ff16a62772507deb00d6287ba,dgm_mining_mentioner__f55a2c7ff16a62772507deb00d6287ba
belgiumabidjan,Belgian Ambassador to Cote d'Ivoire,Cote d'Ivoire,cote d'ivoire,Ambassadors & Representatives,,Ambassadors&Representatives,Belgian Ambassador to Cote d'Ivoire,,dgm_mining_mentioner,28e2210fb3c2eb2f36564f4d576e4c44,dgm_mining_mentioner__28e2210fb3c2eb2f36564f4d576e4c44
binkhadaan,Saudi Ambassador to Cote d'Ivoire,Cote d'Ivoire,cote d'ivoire,Ambassadors & Representatives,,Ambassadors&Representatives,Saudi Ambassador to Cote d'Ivoire,,dgm_mining_mentioner,ec6daaddf4fcf62f52d56907564fe461,dgm_mining_mentioner__ec6daaddf4fcf62f52d56907564fe461
petersusko1,Slovakian Ambassador to Croatia,Croatia,croatia,Ambassadors & Representatives,,Ambassadors&Representatives,Slovakian Ambassador to Croatia,,dgm_mining_mentioner,96bdd23219342f93f37cc8a1f0854a25,dgm_mining_mentioner__96bdd23219342f93f37cc8a1f0854a25
dkambcroatia,Danish Ambassador to Croatia,Croatia,croatia,Ambassadors & Representatives,,Ambassadors&Representatives,Danish Ambassador to Croatia,,dgm_mining_mentioner,819cc8a9954e4990b2ca18f2d8019970,dgm_mining_mentioner__819cc8a9954e4990b2ca18f2d8019970
usambcroatia,US Deputy Ambassador to Croatia,Croatia,croatia,Ambassadors & Representatives,,Ambassadors&Representatives,US Deputy Ambassador to Croatia,,dgm_mining_mentioner,6423b08f1a6d96f80fe4ba9f84f2a2c3,dgm_mining_mentioner__6423b08f1a6d96f80fe4ba9f84f2a2c3
ambassadormor,Israeli Ambassador to Croatia,Croatia,croatia,Ambassadors & Representatives,,Ambassadors&Representatives,Israeli Ambassador to Croatia,,dgm_mining_mentioner,2164d3401a4c8e304ae5ab81d3b007d2,dgm_mining_mentioner__2164d3401a4c8e304ae5ab81d3b007d2
a_dalgleish,British Ambassador to Croatia,Croatia,croatia,Ambassadors & Representatives,,Ambassadors&Representatives,British Ambassador to Croatia,,dgm_mining_mentioner,e275b0e5f3dc6f5cda09bc93010fdce8,dgm_mining_mentioner__e275b0e5f3dc6f5cda09bc93010fdce8
ognianzlatev,European Commission Representative to Croatia,Croatia,croatia,Ambassadors & Representatives,,Ambassadors&Representatives,European Commission Representative to Croatia,,dgm_mining_mentioner,9296273aebaa4d4fd10a60f4e380bc7d,dgm_mining_mentioner__9296273aebaa4d4fd10a60f4e380bc7d
bshagdar,Mongolian Ambassador to Cuba,Cuba,cuba,Ambassadors & Representatives,,Ambassadors&Representatives,Mongolian Ambassador to Cuba,,dgm_mining_mentioner,48b8a00ea6c4ac84241eb7587727bc15,dgm_mining_mentioner__48b8a00ea6c4ac84241eb7587727bc15
annieloubunz,Belizean Ambassador to Cuba,Cuba,cuba,Ambassadors & Representatives,,Ambassadors&Representatives,Belizean Ambassador to Cuba,,dgm_mining_mentioner,f0200ce1918c0d8cd1992b59d84f20e7,dgm_mining_mentioner__f0200ce1918c0d8cd1992b59d84f20e7
embantony,UK Ambassador to Cuba,Cuba,cuba,Ambassadors & Representatives,,Ambassadors&Representatives,UK Ambassador to Cuba,,dgm_mining_mentioner,b9630007329e773f40b8d7fa2aadff8a,dgm_mining_mentioner__b9630007329e773f40b8d7fa2aadff8a
rvellano,Italian Ambassador to Cuba,Cuba,cuba,Ambassadors & Representatives,,Ambassadors&Representatives,Italian Ambassador to Cuba,,dgm_mining_mentioner,0f1e82823646a17484832b0166a75298,dgm_mining_mentioner__0f1e82823646a17484832b0166a75298
georgechacalli,Cypriot Ambassador to UNESCO,Cuyprus,cuyprus,Ambassadors & Representatives,,Ambassadors&Representatives,Cypriot Ambassador to UNESCO,,dgm_mining_mentioner,72e498b81aad2f6c1cf5bde18eb1c4fe,dgm_mining_mentioner__72e498b81aad2f6c1cf5bde18eb1c4fe
pifux,Swiss Ambassador to Cyprus,Cyprus,cyprus,Ambassadors & Representatives,,Ambassadors&Representatives,Swiss Ambassador to Cyprus,,dgm_mining_mentioner,d6ef52e05e24eed91b11465197fcaa85,dgm_mining_mentioner__d6ef52e05e24eed91b11465197fcaa85
aushccyprus,Australian High Commissioner to Cyprus,Cyprus,cyprus,Ambassadors & Representatives,,Ambassadors&Representatives,Australian High Commissioner to Cyprus,,dgm_mining_mentioner,2cfe5f11db1f50a1e0af1a3c1707a738,dgm_mining_mentioner__2cfe5f11db1f50a1e0af1a3c1707a738
amavroyiannis,Cypriot Permanent Representative to UN,Cyprus,cyprus,Ambassadors & Representatives,,Ambassadors&Representatives,Cypriot Permanent Representative to UN,,dgm_mining_mentioner,c987c482c3cc2e8bcf83df71b594ca13,dgm_mining_mentioner__c987c482c3cc2e8bcf83df71b594ca13
salinagrenet,French Ambassador to Cyprus,Cyprus,cyprus,Ambassadors & Representatives,,Ambassadors&Representatives,French Ambassador to Cyprus,,dgm_mining_mentioner,83d237783f7044269cbb8132ccf77bc4,dgm_mining_mentioner__83d237783f7044269cbb8132ccf77bc4
nickarcherfcdo,UK Ambassador to Czech Republic,Czech Republic,czech republic,Ambassadors & Representatives,,Ambassadors&Representatives,UK Ambassador to Czech Republic,,dgm_mining_mentioner,4ad405e54ded3450d1f562f49fd40fc2,dgm_mining_mentioner__4ad405e54ded3450d1f562f49fd40fc2
ambswisscz,Swiss Ambassador to Czech Republic,Czech Republic,czech republic,Ambassadors & Representatives,,Ambassadors&Representatives,Swiss Ambassador to Czech Republic,,dgm_mining_mentioner,637584227979e30745ba31f0af4ad19a,dgm_mining_mentioner__637584227979e30745ba31f0af4ad19a
dkambczechia,Danish Ambassador to Czech Republic,Czech Republic,czech republic,Ambassadors & Representatives,,Ambassadors&Representatives,Danish Ambassador to Czech Republic,,dgm_mining_mentioner,af36f59543679e49123288e4cbc93055,dgm_mining_mentioner__af36f59543679e49123288e4cbc93055
inestroha,Croatian Ambassador to Czech Republic,Czech Republic,czech republic,Ambassadors & Representatives,,Ambassadors&Representatives,Croatian Ambassador to Czech Republic,,dgm_mining_mentioner,7ddefe9f622a60cc720d3b863cf81a66,dgm_mining_mentioner__7ddefe9f622a60cc720d3b863cf81a66
yperebyinis,Ukrainian Ambassador to Czech Republic,Czech Republic,czech republic,Ambassadors & Representatives,,Ambassadors&Representatives,Ukrainian Ambassador to Czech Republic,,dgm_mining_mentioner,93ee8dc7fdc7bd305520f4a5edb304ec,dgm_mining_mentioner__93ee8dc7fdc7bd305520f4a5edb304ec
velvyslanec_srn,German Ambassador to Czech Republic,Czech Republic,czech republic,Ambassadors & Representatives,,Ambassadors&Representatives,German Ambassador to Czech Republic,,dgm_mining_mentioner,b08296e0a6aee48e89f03ac2e9fa3ebd,dgm_mining_mentioner__b08296e0a6aee48e89f03ac2e9fa3ebd
cmanahanirl,Irish Ambassador to Czech Republic,Czech Republic,czech republic,Ambassadors & Representatives,,Ambassadors&Representatives,Irish Ambassador to Czech Republic,,dgm_mining_mentioner,c2f05151e2933ed1d8b615e5de91be09,dgm_mining_mentioner__c2f05151e2933ed1d8b615e5de91be09
mszbernatowicz,Polish Ambassador to Czech Republic,Czech Republic,czech republic,Ambassadors & Representatives,,Ambassadors&Representatives,Polish Ambassador to Czech Republic,,dgm_mining_mentioner,be08b0a7d0a747e5fc98984fd333387d,dgm_mining_mentioner__be08b0a7d0a747e5fc98984fd333387d
ambmeron,Israeli Ambassador to Czech Republic,Czech Republic,czech republic,Ambassadors & Representatives,,Ambassadors&Representatives,Israeli Ambassador to Czech Republic,,dgm_mining_mentioner,6d7ab57e492070794bed6cd3ca6dad30,dgm_mining_mentioner__6d7ab57e492070794bed6cd3ca6dad30
ayesharekhi,Canadian Ambassador to Czechia,Czechia,czechia,Ambassadors & Representatives,,Ambassadors&Representatives,Canadian Ambassador to Czechia,,dgm_mining_mentioner,1ff80a334a214afd9311e45bde2eca58,dgm_mining_mentioner__1ff80a334a214afd9311e45bde2eca58
usambdenmark,US Charge d'Affaires to Denmark,Denmark,denmark,Ambassadors & Representatives,,Ambassadors&Representatives,US Charge d'Affaires to Denmark,,dgm_mining_mentioner,3f70991e8b820637e15921a08e418117,dgm_mining_mentioner__3f70991e8b820637e15921a08e418117
dschroederuk,UK Ambassador to Denmark,Denmark,denmark,Ambassadors & Representatives,,Ambassadors&Representatives,UK Ambassador to Denmark,,dgm_mining_mentioner,0903eb43c0b4a6b575ed13df4873796d,dgm_mining_mentioner__0903eb43c0b4a6b575ed13df4873796d
oveullerup,Danish Ambassador to Nordic Cooperation and Baltic Sea Council,Denmark,denmark,Ambassadors & Representatives,,Ambassadors&Representatives,Danish Ambassador to Nordic Cooperation and Baltic Sea Council,,dgm_mining_mentioner,3ee9a3c2ea7d2b006a291b77336110f7,dgm_mining_mentioner__3ee9a3c2ea7d2b006a291b77336110f7
ehopkinsfcdo,Danish Ambassador to Denmark,Denmark,denmark,Ambassadors & Representatives,,Ambassadors&Representatives,Danish Ambassador to Denmark,,dgm_mining_mentioner,ff91aa3cabb8cdf4ab1c7ab1f9b28021,dgm_mining_mentioner__ff91aa3cabb8cdf4ab1c7ab1f9b28021
ausambdk,Australian Ambassador to Denmark,Denmark,denmark,Ambassadors & Representatives,,Ambassadors&Representatives,Australian Ambassador to Denmark,,dgm_mining_mentioner,8d37388d14b5dd50072a8988f7238c61,dgm_mining_mentioner__8d37388d14b5dd50072a8988f7238c61
mwlachovsky,Slovakian Ambassador to Denmark,Denmark,denmark,Ambassadors & Representatives,,Ambassadors&Representatives,Slovakian Ambassador to Denmark,,dgm_mining_mentioner,c1feb4404beb1cb163d0739cfa23052d,dgm_mining_mentioner__c1feb4404beb1cb163d0739cfa23052d
pooja_kapur,Indian Ambassador to Denmark,Denmark,denmark,Ambassadors & Representatives,,Ambassadors&Representatives,Indian Ambassador to Denmark,,dgm_mining_mentioner,f96bee49b84fafc6a46f26949d2333ff,dgm_mining_mentioner__f96bee49b84fafc6a46f26949d2333ff
amengtoft,Danish Tech Ambassador,Denmark,denmark,Ambassadors & Representatives,,Ambassadors&Representatives,Danish Tech Ambassador,,dgm_mining_mentioner,747bad29b7601cbdfe8fea8fe3a54804,dgm_mining_mentioner__747bad29b7601cbdfe8fea8fe3a54804
robzaagman,Dutch Ambassador to Denmark,Denmark,denmark,Ambassadors & Representatives,,Ambassadors&Representatives,Dutch Ambassador to Denmark,,dgm_mining_mentioner,df892940fd69b3683ce5b700d48ce0dd,dgm_mining_mentioner__df892940fd69b3683ce5b700d48ce0dd
larsandelars,Norwegian Deputy Head of Mission in Denmark,Denmark,denmark,Ambassadors & Representatives,,Ambassadors&Representatives,Norwegian Deputy Head of Mission in Denmark,,dgm_mining_mentioner,5bd719f275084c46b10575e7adc1fdc5,dgm_mining_mentioner__5bd719f275084c46b10575e7adc1fdc5
embzhangrun,Chinese Ambassador to Dominican Republic,Dominican Republic,dominican republic,Ambassadors & Representatives,,Ambassadors&Representatives,Chinese Ambassador to Dominican Republic,,dgm_mining_mentioner,6781587cad461a5ab80995bf4e4a84cc,dgm_mining_mentioner__6781587cad461a5ab80995bf4e4a84cc
averrijp,Dutch Ambassador to the Dominican Republic and Haiti,Dominican Republic,dominican republic,Ambassadors & Representatives,,Ambassadors&Representatives,Dutch Ambassador to the Dominican Republic and Haiti,,dgm_mining_mentioner,edce6878eb4facb4d4d12a8f6c3f1fb6,dgm_mining_mentioner__edce6878eb4facb4d4d12a8f6c3f1fb6
ggrippaue,EU Ambassador to Dominican Republic,Dominican Republic,dominican republic,Ambassadors & Representatives,,Ambassadors&Representatives,EU Ambassador to Dominican Republic,,dgm_mining_mentioner,f78819890b4aa8bc302fd696a78b1a63,dgm_mining_mentioner__f78819890b4aa8bc302fd696a78b1a63
mockbulali,UK Ambassador to Dominican Republic and Haiti,Dominican Republic and Haiti,dominican republic and haiti,Ambassadors & Representatives,,Ambassadors&Representatives,UK Ambassador to Dominican Republic and Haiti,,dgm_mining_mentioner,0debb15726353be0a38b8feaa574ee1f,dgm_mining_mentioner__0debb15726353be0a38b8feaa574ee1f
jmchataigner,EU Ambassador to DRC,DRC,drc,Ambassadors & Representatives,,Ambassadors&Representatives,EU Ambassador to DRC,,dgm_mining_mentioner,de166092b4a5a769777dee52cfdff6a0,dgm_mining_mentioner__de166092b4a5a769777dee52cfdff6a0
jolkeoppewal,"Dutch Ambassador to DRC, Republic of Congo, and Central African Republic","DRC, Republic of Congo, Central African Republic","drc, republic of congo, central african republic",Ambassadors & Representatives,,Ambassadors&Representatives,"Dutch Ambassador to DRC, Republic of Congo, and Central African Republic",,dgm_mining_mentioner,aa3a322d02043c116a64555a7f419ce3,dgm_mining_mentioner__aa3a322d02043c116a64555a7f419ce3
