german_text,caption_text,lat,lon,ranking,default location,default_lat,default_lon,.1,.2,.3,ENTITY_LABEL,name,description,source,source_identifier,global_identifier
illtalstr.,"Illtalstr. in Eppelborn, Germany",49.4115637,6.9445848,1,,,,,,,Wells,"Illtalstr. in Eppelborn, Germany",,german_fires_eppelborn_locations,8a5cddc5b76dd3ec1f3121947294ef85,german_fires_eppelborn_locations__8a5cddc5b76dd3ec1f3121947294ef85
im aronsfeld,"Im Aronsfeld in Eppelborn, Germany",49.3917815,7.0067959,1,,,,,,,Legislator,"Im Aronsfeld in Eppelborn, Germany",,german_fires_eppelborn_locations,32caf4150994e89f6ffcc295fb4134ee,german_fires_eppelborn_locations__32caf4150994e89f6ffcc295fb4134ee
im emesgarten,"Im Emesgarten in Eppelborn, Germany",49.4128723,7.0122541,1,,,,,,,FTO,"Im Emesgarten in Eppelborn, Germany",,german_fires_eppelborn_locations,9bdb97fb1622329e24d8f1385ee4e72d,german_fires_eppelborn_locations__9bdb97fb1622329e24d8f1385ee4e72d
im eschwald,"Im Eschwald in Eppelborn, Germany",49.3645869,6.9821122,1,,,,,,,Keyphrase,"Im Eschwald in Eppelborn, Germany",,german_fires_eppelborn_locations,2033f55120d53819c457ab7686170ee9,german_fires_eppelborn_locations__2033f55120d53819c457ab7686170ee9
im flurchen,"Im Flurchen in Eppelborn, Germany",49.4145323,6.9299787,1,,,,,,,Pipeline,"Im Flurchen in Eppelborn, Germany",,german_fires_eppelborn_locations,f282dab50fd485fd2cd201a9fce44758,german_fires_eppelborn_locations__f282dab50fd485fd2cd201a9fce44758
im fritzeeck,"Im Fritzeeck in Eppelborn, Germany",49.4156812,7.0149287,1,,,,,,,CompanyKeyword,"Im Fritzeeck in Eppelborn, Germany",,german_fires_eppelborn_locations,ebec95730ea85cd9f685aeafdfeae69b,german_fires_eppelborn_locations__ebec95730ea85cd9f685aeafdfeae69b
im froschengarten,"Im Froschengarten in Eppelborn, Germany",49.4106765,6.9669664,1,,,,,,,DiplomaticFacilities,"Im Froschengarten in Eppelborn, Germany",,german_fires_eppelborn_locations,00467e0461373450ce12077ce6d4cbd1,german_fires_eppelborn_locations__00467e0461373450ce12077ce6d4cbd1
im halben mond,"Im Halben Mond in Eppelborn, Germany",49.4005135,6.9701258,1,,,,,,,Diplomat,"Im Halben Mond in Eppelborn, Germany",,german_fires_eppelborn_locations,d4e0fd5d6b4f1f0c01d46995dc6d1a0d,german_fires_eppelborn_locations__d4e0fd5d6b4f1f0c01d46995dc6d1a0d
im hirtenland,"Im Hirtenland in Eppelborn, Germany",49.3990517,6.9704562,1,,,,,,,Pipeline,"Im Hirtenland in Eppelborn, Germany",,german_fires_eppelborn_locations,8d636a8048db785f9714be5094016127,german_fires_eppelborn_locations__8d636a8048db785f9714be5094016127
im kirchenfeld,"Im Kirchenfeld in Eppelborn, Germany",49.4112441,6.9542665,1,,,,,,,LegislativeCommittee,"Im Kirchenfeld in Eppelborn, Germany",,german_fires_eppelborn_locations,db30589e6d69af549e62ced9dd8a1ce6,german_fires_eppelborn_locations__db30589e6d69af549e62ced9dd8a1ce6
im kleegarten,"Im Kleegarten in Eppelborn, Germany",49.4124701,6.9542721,1,,,,,,,Shipping,"Im Kleegarten in Eppelborn, Germany",,german_fires_eppelborn_locations,9d4598c46d89763d3fd86bcb2b5b4a45,german_fires_eppelborn_locations__9d4598c46d89763d3fd86bcb2b5b4a45
im loss,"Im Loss in Eppelborn, Germany",49.4104093,7.0181979,1,,,,,,,FTO,"Im Loss in Eppelborn, Germany",,german_fires_eppelborn_locations,5698fcdf80d0e07a27fbf4273bd5292c,german_fires_eppelborn_locations__5698fcdf80d0e07a27fbf4273bd5292c
in baden,"In Baden in Eppelborn, Germany",49.4179414,7.0024007,1,,,,,,,CompanyKeyword,"In Baden in Eppelborn, Germany",,german_fires_eppelborn_locations,bb384e628dbcf31205d0a4e29ff7b449,german_fires_eppelborn_locations__bb384e628dbcf31205d0a4e29ff7b449
in der allwies,"In der Allwies in Eppelborn, Germany",49.4020407,6.9752046,1,,,,,,,LegislativeCommittee,"In der Allwies in Eppelborn, Germany",,german_fires_eppelborn_locations,a49bd8ce6f3968f8303e697c014fc2b4,german_fires_eppelborn_locations__a49bd8ce6f3968f8303e697c014fc2b4
in der humes,"In der Humes in Eppelborn, Germany",49.388455,6.9974279,1,,,,,,,Person,"In der Humes in Eppelborn, Germany",,german_fires_eppelborn_locations,0853c9fb411a45bcdeca5bbd0530decc,german_fires_eppelborn_locations__0853c9fb411a45bcdeca5bbd0530decc
in der panz,"In der Panz in Eppelborn, Germany",49.3621583,6.9863409,1,,,,,,,Media,"In der Panz in Eppelborn, Germany",,german_fires_eppelborn_locations,e7ccb41dc89ccb7a2cd96297496833e3,german_fires_eppelborn_locations__e7ccb41dc89ccb7a2cd96297496833e3
in der waldwies,"In der Waldwies in Eppelborn, Germany",49.4097362,6.9793391,1,,,,,,,space,"In der Waldwies in Eppelborn, Germany",,german_fires_eppelborn_locations,c5b9d0daf66dbbd1aa4c6b2afabac73e,german_fires_eppelborn_locations__c5b9d0daf66dbbd1aa4c6b2afabac73e
in macherbach,"In Macherbach in Eppelborn, Germany",49.4224885,6.9572207,1,,,,,,,Wells,"In Macherbach in Eppelborn, Germany",,german_fires_eppelborn_locations,b271ffed6cbfe4d845e6b3ee31e530e8,german_fires_eppelborn_locations__b271ffed6cbfe4d845e6b3ee31e530e8
josefstr.,"Josefstr. in Eppelborn, Germany",49.3689971,6.9892637,1,,,,,,,ForeignMinister,"Josefstr. in Eppelborn, Germany",,german_fires_eppelborn_locations,374847bd202a9298ce95f3d8f8ca6d73,german_fires_eppelborn_locations__374847bd202a9298ce95f3d8f8ca6d73
juchem-str.,"Juchem-Str. in Eppelborn, Germany",49.4078854,6.9633356,1,,,,,,,Consulates,"Juchem-Str. in Eppelborn, Germany",,german_fires_eppelborn_locations,b1697a4882189c5e5b202b4044e73157,german_fires_eppelborn_locations__b1697a4882189c5e5b202b4044e73157
jagerbergstr.,"Jagerbergstr. in Eppelborn, Germany",49.3673227,6.9822849,1,,,,,,,Refinery,"Jagerbergstr. in Eppelborn, Germany",,german_fires_eppelborn_locations,5679885882796481991d528ea32d25a3,german_fires_eppelborn_locations__5679885882796481991d528ea32d25a3
keppstr.,"Keppstr. in Eppelborn, Germany",49.4010917,6.969943,1,,,,,,,Exec,"Keppstr. in Eppelborn, Germany",,german_fires_eppelborn_locations,465daf314fd86dd7f187ccdac78a97e9,german_fires_eppelborn_locations__465daf314fd86dd7f187ccdac78a97e9
kirchenstr.,"Kirchenstr. in Eppelborn, Germany",49.370262,6.9807459,1,,,,,,,ForeignMinister,"Kirchenstr. in Eppelborn, Germany",,german_fires_eppelborn_locations,67a2b95745f0dcb1d9e770e56dff37de,german_fires_eppelborn_locations__67a2b95745f0dcb1d9e770e56dff37de
kirchplatz,"Kirchplatz in Eppelborn, Germany",49.4066263,6.9668709,1,,,,,,,Organization,"Kirchplatz in Eppelborn, Germany",,german_fires_eppelborn_locations,cd011ddfe0a0fdfbf23d2f2f9944770a,german_fires_eppelborn_locations__cd011ddfe0a0fdfbf23d2f2f9944770a
kirchstr.,"Kirchstr. in Eppelborn, Germany",49.4097603,6.9442874,1,,,,,,,Person,"Kirchstr. in Eppelborn, Germany",,german_fires_eppelborn_locations,1471cff11b4e1aafe3a6589e7af79310,german_fires_eppelborn_locations__1471cff11b4e1aafe3a6589e7af79310
kossmannstr.,"Kossmannstr. in Eppelborn, Germany",49.3996703,6.9646435,1,,,,,,,Pipeline,"Kossmannstr. in Eppelborn, Germany",,german_fires_eppelborn_locations,0e2b55e6f909bae54772ac4189a8040d,german_fires_eppelborn_locations__0e2b55e6f909bae54772ac4189a8040d
krummer weg,"Krummer Weg in Eppelborn, Germany",49.3990825,6.9694493,1,,,,,,,News,"Krummer Weg in Eppelborn, Germany",,german_fires_eppelborn_locations,606cd0e3bce3a2a457adf524f93f70e6,german_fires_eppelborn_locations__606cd0e3bce3a2a457adf524f93f70e6
lachwies,"Lachwies in Eppelborn, Germany",49.4133882,7.0165614,1,,,,,,,Media,"Lachwies in Eppelborn, Germany",,german_fires_eppelborn_locations,0920d50e604b084a9c587741e8947fcc,german_fires_eppelborn_locations__0920d50e604b084a9c587741e8947fcc
landstuhlstr.,"Landstuhlstr. in Eppelborn, Germany",49.3740157,6.9864455,1,,,,,,,ForeignMinister,"Landstuhlstr. in Eppelborn, Germany",,german_fires_eppelborn_locations,31dcb50f371c529812e1a448510e6f0a,german_fires_eppelborn_locations__31dcb50f371c529812e1a448510e6f0a
lebacher str.,"Lebacher Str. in Eppelborn, Germany",49.419392,7.0050004,1,,,,,,,Media,"Lebacher Str. in Eppelborn, Germany",,german_fires_eppelborn_locations,25d19d3c11c6f10a37029578be3ca54b,german_fires_eppelborn_locations__25d19d3c11c6f10a37029578be3ca54b
lindenweg,"Lindenweg in Eppelborn, Germany",49.3733886,6.9682124,1,,,,,,,Refinery,"Lindenweg in Eppelborn, Germany",,german_fires_eppelborn_locations,6d0ea8ed54eed42c090d636aaa926d84,german_fires_eppelborn_locations__6d0ea8ed54eed42c090d636aaa926d84
marienstr.,"Marienstr. in Eppelborn, Germany",49.3693339,6.9868466,1,,,,,,,Media,"Marienstr. in Eppelborn, Germany",,german_fires_eppelborn_locations,13a50470160c8eedaad612be60c46101,german_fires_eppelborn_locations__13a50470160c8eedaad612be60c46101
marktplatz,"Marktplatz in Eppelborn, Germany",49.4174779,7.0141879,1,,,,,,,FTO,"Marktplatz in Eppelborn, Germany",,german_fires_eppelborn_locations,672860a2bb35c58fc05919f5271c9148,german_fires_eppelborn_locations__672860a2bb35c58fc05919f5271c9148
matzenberg,"Matzenberg in Eppelborn, Germany",49.4066205,6.9733886,1,,,,,,,Legislator,"Matzenberg in Eppelborn, Germany",,german_fires_eppelborn_locations,104631dfea66f4249e987e5d85337d77,german_fires_eppelborn_locations__104631dfea66f4249e987e5d85337d77
mittelstr.,"Mittelstr. in Eppelborn, Germany",49.3831507,6.9559842,1,,,,,,,LegislativeCommittee,"Mittelstr. in Eppelborn, Germany",,german_fires_eppelborn_locations,cbbec0515b18bdcdf118d5cfc6c06b13,german_fires_eppelborn_locations__cbbec0515b18bdcdf118d5cfc6c06b13
mozartstr.,"Mozartstr. in Eppelborn, Germany",49.4188634,7.0220592,1,,,,,,,ForeignMinistry,"Mozartstr. in Eppelborn, Germany",,german_fires_eppelborn_locations,d72acd1debe1006e9e7e4b953acf9e05,german_fires_eppelborn_locations__d72acd1debe1006e9e7e4b953acf9e05
muhlenweg,"Muhlenweg in Eppelborn, Germany",49.4087561,6.961949,1,,,,,,,Keyphrase,"Muhlenweg in Eppelborn, Germany",,german_fires_eppelborn_locations,0e27f05d4936f851c829c137e7eebe9e,german_fires_eppelborn_locations__0e27f05d4936f851c829c137e7eebe9e
nassenbusch,"Nassenbusch in Eppelborn, Germany",49.4083866,7.0205329,1,,,,,,,Refinery,"Nassenbusch in Eppelborn, Germany",,german_fires_eppelborn_locations,d389e8fbe703b72e832f1cc3e45a6d61,german_fires_eppelborn_locations__d389e8fbe703b72e832f1cc3e45a6d61
obere hohlstr.,"Obere Hohlstr. in Eppelborn, Germany",49.3711864,6.9726465,1,,,,,,,Shipping,"Obere Hohlstr. in Eppelborn, Germany",,german_fires_eppelborn_locations,a610ec50946c5dd37a0f6f3c38d36cf9,german_fires_eppelborn_locations__a610ec50946c5dd37a0f6f3c38d36cf9
obere landstuhlstr.,"Obere Landstuhlstr. in Eppelborn, Germany",49.3752124,6.9882681,1,,,,,,,Media,"Obere Landstuhlstr. in Eppelborn, Germany",,german_fires_eppelborn_locations,cae81cc73f756203c33c656ddca47846,german_fires_eppelborn_locations__cae81cc73f756203c33c656ddca47846
oberer schangengarten,"Oberer Schangengarten in Eppelborn, Germany",49.3897997,6.9904251,1,,,,,,,Exec,"Oberer Schangengarten in Eppelborn, Germany",,german_fires_eppelborn_locations,ec1d05cc2314c8da3e726461eab0c89b,german_fires_eppelborn_locations__ec1d05cc2314c8da3e726461eab0c89b
ortsstr.,"Ortsstr. in Eppelborn, Germany",49.3975531,6.9838341,1,,,,,,,Person,"Ortsstr. in Eppelborn, Germany",,german_fires_eppelborn_locations,f407fd55a733ae954b3cb1359ab55ed5,german_fires_eppelborn_locations__f407fd55a733ae954b3cb1359ab55ed5
pastor-pfeil-str.,"Pastor-Pfeil-Str. in Eppelborn, Germany",49.3890902,6.9965899,1,,,,,,,Media,"Pastor-Pfeil-Str. in Eppelborn, Germany",,german_fires_eppelborn_locations,ce46b8d3cca9699559d730dafb345c24,german_fires_eppelborn_locations__ce46b8d3cca9699559d730dafb345c24
pastor-vogt-str.,"Pastor-Vogt-Str. in Eppelborn, Germany",49.4036607,6.9559533,1,,,,,,,Organization,"Pastor-Vogt-Str. in Eppelborn, Germany",,german_fires_eppelborn_locations,2ead8c3d972823d83a17ef9da01ee68a,german_fires_eppelborn_locations__2ead8c3d972823d83a17ef9da01ee68a
paul-marien-str.,"Paul-Marien-Str. in Eppelborn, Germany",49.4107369,6.9567481,1,,,,,,,Consulates,"Paul-Marien-Str. in Eppelborn, Germany",,german_fires_eppelborn_locations,36e43fa0fedb03b818ab05f52a40e26d,german_fires_eppelborn_locations__36e43fa0fedb03b818ab05f52a40e26d
prumburgstr.,"Prumburgstr. in Eppelborn, Germany",49.4090061,6.9614869,1,,,,,,,Diplomat,"Prumburgstr. in Eppelborn, Germany",,german_fires_eppelborn_locations,bb1d89a26b1edcc27dca8e65820ba6e1,german_fires_eppelborn_locations__bb1d89a26b1edcc27dca8e65820ba6e1
raiffeisenstr.,"Raiffeisenstr. in Eppelborn, Germany",49.37433,6.97792,1,,,,,,,Consulates,"Raiffeisenstr. in Eppelborn, Germany",,german_fires_eppelborn_locations,2bf6c93d06acb66f29f5cbcdde5bc39d,german_fires_eppelborn_locations__2bf6c93d06acb66f29f5cbcdde5bc39d
rathausstr.,"Rathausstr. in Eppelborn, Germany",49.4055706,6.9595305,1,,,,,,,News,"Rathausstr. in Eppelborn, Germany",,german_fires_eppelborn_locations,ec0be9d531f45a78452fa70f02626dd0,german_fires_eppelborn_locations__ec0be9d531f45a78452fa70f02626dd0
ringstr.,"Ringstr. in Eppelborn, Germany",49.4065225,6.9510135,1,,,,,,,IndustryTerm,"Ringstr. in Eppelborn, Germany",,german_fires_eppelborn_locations,398048758096b950400f9ebe22ef39ff,german_fires_eppelborn_locations__398048758096b950400f9ebe22ef39ff
rothstr.,"Rothstr. in Eppelborn, Germany",49.4154637,6.9532871,1,,,,,,,Media,"Rothstr. in Eppelborn, Germany",,german_fires_eppelborn_locations,6c5f1f891b11d84687d1f807eab7817b,german_fires_eppelborn_locations__6c5f1f891b11d84687d1f807eab7817b
romerstr.,"Romerstr. in Eppelborn, Germany",49.3597218,6.9767519,1,,,,,,,FTO,"Romerstr. in Eppelborn, Germany",,german_fires_eppelborn_locations,9a52d13010f629916c7aad02e1a2f740,german_fires_eppelborn_locations__9a52d13010f629916c7aad02e1a2f740
sandbergstr.,"Sandbergstr. in Eppelborn, Germany",49.3643486,6.9820777,1,,,,,,,Exec,"Sandbergstr. in Eppelborn, Germany",,german_fires_eppelborn_locations,7ffe0e91d5f16861d468085b93a4a008,german_fires_eppelborn_locations__7ffe0e91d5f16861d468085b93a4a008
schau ins land,"Schau Ins Land in Eppelborn, Germany",49.3983487,6.9908268,1,,,,,,,Pipeline,"Schau Ins Land in Eppelborn, Germany",,german_fires_eppelborn_locations,12db569a92d0f4d3f7058086d248fd63,german_fires_eppelborn_locations__12db569a92d0f4d3f7058086d248fd63
schillerstr.,"Schillerstr. in Eppelborn, Germany",49.41802,7.0223382,1,,,,,,,ForeignMinister,"Schillerstr. in Eppelborn, Germany",,german_fires_eppelborn_locations,5fb2f4d89d21320f0f4a6d818f506094,german_fires_eppelborn_locations__5fb2f4d89d21320f0f4a6d818f506094
schleidstr.,"Schleidstr. in Eppelborn, Germany",49.3998206,6.9696119,1,,,,,,,DiplomaticFacilities,"Schleidstr. in Eppelborn, Germany",,german_fires_eppelborn_locations,19038b4c5bbac47a367a24c06cbc60fd,german_fires_eppelborn_locations__19038b4c5bbac47a367a24c06cbc60fd
schlossstr.,"Schlossstr. in Eppelborn, Germany",49.4032564,6.9727832,1,,,,,,,Exec,"Schlossstr. in Eppelborn, Germany",,german_fires_eppelborn_locations,b0b160c362ad053b3bb0093de4a2bf03,german_fires_eppelborn_locations__b0b160c362ad053b3bb0093de4a2bf03
schulstr.,"Schulstr. in Eppelborn, Germany",49.3919826,6.9959089,1,,,,,,,Refinery,"Schulstr. in Eppelborn, Germany",,german_fires_eppelborn_locations,c40278320d4e07d47c64b6952c0d196e,german_fires_eppelborn_locations__c40278320d4e07d47c64b6952c0d196e
seitersstr.,"Seitersstr. in Eppelborn, Germany",49.3920148,7.0048985,1,,,,,,,CompanyKeyword,"Seitersstr. in Eppelborn, Germany",,german_fires_eppelborn_locations,579ce7546c6d6f5cfc2d69886a2702bf,german_fires_eppelborn_locations__579ce7546c6d6f5cfc2d69886a2702bf
siebertstr.,"Siebertstr. in Eppelborn, Germany",49.3728463,6.991804,1,,,,,,,Media,"Siebertstr. in Eppelborn, Germany",,german_fires_eppelborn_locations,4df6a60b8c7d55dd05d0ed131923aa53,german_fires_eppelborn_locations__4df6a60b8c7d55dd05d0ed131923aa53
sonnenweg,"Sonnenweg in Eppelborn, Germany",49.4098903,6.9608666,1,,,,,,,Consulates,"Sonnenweg in Eppelborn, Germany",,german_fires_eppelborn_locations,8015b7f5545f982037537aa2f895c310,german_fires_eppelborn_locations__8015b7f5545f982037537aa2f895c310
st.barbarastr.,"St.Barbarastr. in Eppelborn, Germany",49.4074756,6.9485244,1,,,,,,,IndustryTerm,"St.Barbarastr. in Eppelborn, Germany",,german_fires_eppelborn_locations,b63928b21a5ff3d2b6d1a1b154a2f40f,german_fires_eppelborn_locations__b63928b21a5ff3d2b6d1a1b154a2f40f
st.laurentiusstr.,"St.Laurentiusstr. in Eppelborn, Germany",49.4103398,6.9458123,1,,,,,,,Organization,"St.Laurentiusstr. in Eppelborn, Germany",,german_fires_eppelborn_locations,8e5baa5706bec71dddeadf625ebf20fe,german_fires_eppelborn_locations__8e5baa5706bec71dddeadf625ebf20fe
st.martin-str.,"St.Martin-Str. in Eppelborn, Germany",49.4069183,6.9483762,1,,,,,,,ForeignMinistry,"St.Martin-Str. in Eppelborn, Germany",,german_fires_eppelborn_locations,f1c5b8a3f63393aeebc3bd1092ab3ec5,german_fires_eppelborn_locations__f1c5b8a3f63393aeebc3bd1092ab3ec5
st.sebastianstr.,"St.Sebastianstr. in Eppelborn, Germany",49.4037705,6.9631632,1,,,,,,,LegislativeCommittee,"St.Sebastianstr. in Eppelborn, Germany",,german_fires_eppelborn_locations,04f87261bd295f68728e67c8c33b3190,german_fires_eppelborn_locations__04f87261bd295f68728e67c8c33b3190
steinackerstr.,"Steinackerstr. in Eppelborn, Germany",49.3924902,7.0036366,1,,,,,,,FTO,"Steinackerstr. in Eppelborn, Germany",,german_fires_eppelborn_locations,85bb365d8b3f63d186f1251ae35503f5,german_fires_eppelborn_locations__85bb365d8b3f63d186f1251ae35503f5
steinstr.,"Steinstr. in Eppelborn, Germany",49.3847976,6.9517973,1,,,,,,,Pipeline,"Steinstr. in Eppelborn, Germany",,german_fires_eppelborn_locations,270196a7fb1a6cbe9ed8de7bcacd2e4a,german_fires_eppelborn_locations__270196a7fb1a6cbe9ed8de7bcacd2e4a
talstr.,"Talstr. in Eppelborn, Germany",49.3738361,6.9688387,1,,,,,,,Legislator,"Talstr. in Eppelborn, Germany",,german_fires_eppelborn_locations,633c06dbfdbfb501cad73d61349ac000,german_fires_eppelborn_locations__633c06dbfdbfb501cad73d61349ac000
tannenhof,"Tannenhof in Eppelborn, Germany",49.3970904,6.9747033,1,,,,,,,Exec,"Tannenhof in Eppelborn, Germany",,german_fires_eppelborn_locations,0ba8b9dce291190c87a38de04b8c5e9b,german_fires_eppelborn_locations__0ba8b9dce291190c87a38de04b8c5e9b
tannenweg,"Tannenweg in Eppelborn, Germany",49.3735709,6.9677526,1,,,,,,,Shipping,"Tannenweg in Eppelborn, Germany",,german_fires_eppelborn_locations,9893d8e184c1c1e7b8df485e8b40943b,german_fires_eppelborn_locations__9893d8e184c1c1e7b8df485e8b40943b
thalexweilerstr.,"Thalexweilerstr. in Eppelborn, Germany",49.4220371,7.002801,1,,,,,,,space,"Thalexweilerstr. in Eppelborn, Germany",,german_fires_eppelborn_locations,7e14251ffafb031713f43051f5f3e835,german_fires_eppelborn_locations__7e14251ffafb031713f43051f5f3e835
theelweg,"Theelweg in Eppelborn, Germany",49.413589,6.9288837,1,,,,,,,Media,"Theelweg in Eppelborn, Germany",,german_fires_eppelborn_locations,28d872376248a1d692a49ac02d692b22,german_fires_eppelborn_locations__28d872376248a1d692a49ac02d692b22
tholeyer str.,"Tholeyer Str. in Eppelborn, Germany",49.4216553,7.0108764,1,,,,,,,Keyphrase,"Tholeyer Str. in Eppelborn, Germany",,german_fires_eppelborn_locations,13a9727b582a907647448002c42a4e07,german_fires_eppelborn_locations__13a9727b582a907647448002c42a4e07
uchtelfanger str.,"Uchtelfanger Str. in Eppelborn, Germany",49.3883558,7.0035936,1,,,,,,,Organization,"Uchtelfanger Str. in Eppelborn, Germany",,german_fires_eppelborn_locations,2f631568b2d24e5d479b89f0cb2d90af,german_fires_eppelborn_locations__2f631568b2d24e5d479b89f0cb2d90af
ulmenweg,"Ulmenweg in Eppelborn, Germany",49.3986866,6.9886376,1,,,,,,,Keyphrase,"Ulmenweg in Eppelborn, Germany",,german_fires_eppelborn_locations,de290cd3c03e83790eb89e8f9ed6a74b,german_fires_eppelborn_locations__de290cd3c03e83790eb89e8f9ed6a74b
unter der illwies,"Unter der Illwies in Eppelborn, Germany",49.4115085,6.9630281,1,,,,,,,Consulates,"Unter der Illwies in Eppelborn, Germany",,german_fires_eppelborn_locations,6f62de2a1ca3f2418540dab065a49df8,german_fires_eppelborn_locations__6f62de2a1ca3f2418540dab065a49df8
unterer schangengarten,"Unterer Schangengarten in Eppelborn, Germany",49.3905585,6.9901059,1,,,,,,,Refinery,"Unterer Schangengarten in Eppelborn, Germany",,german_fires_eppelborn_locations,7f4c1ffed8c649136a0200fa12c7e47b,german_fires_eppelborn_locations__7f4c1ffed8c649136a0200fa12c7e47b
urexweilerstr.,"Urexweilerstr. in Eppelborn, Germany",49.4180345,7.0193641,1,,,,,,,AAEntity,"Urexweilerstr. in Eppelborn, Germany",,german_fires_eppelborn_locations,6cef6abbeee5ee6b2bc75684a7339db3,german_fires_eppelborn_locations__6cef6abbeee5ee6b2bc75684a7339db3
valeriusstr.,"Valeriusstr. in Eppelborn, Germany",49.3711094,6.9808563,1,,,,,,,space,"Valeriusstr. in Eppelborn, Germany",,german_fires_eppelborn_locations,8e4095f351872ba95858836a1dd5cf71,german_fires_eppelborn_locations__8e4095f351872ba95858836a1dd5cf71
verbindungsweg,"Verbindungsweg in Eppelborn, Germany",49.4204224,7.0038533,1,,,,,,,Shipping,"Verbindungsweg in Eppelborn, Germany",,german_fires_eppelborn_locations,4714b0bf1ed2e81a3c16dee880bc2fa8,german_fires_eppelborn_locations__4714b0bf1ed2e81a3c16dee880bc2fa8
vor der hub,"Vor der Hub in Eppelborn, Germany",49.3772366,6.954341,1,,,,,,,Organization,"Vor der Hub in Eppelborn, Germany",,german_fires_eppelborn_locations,421fd1d041e2b5cd1272e4065015166e,german_fires_eppelborn_locations__421fd1d041e2b5cd1272e4065015166e
vorm waldchen,"Vorm Waldchen in Eppelborn, Germany",49.415936,6.9491399,1,,,,,,,Wells,"Vorm Waldchen in Eppelborn, Germany",,german_fires_eppelborn_locations,38b3601e69f80fbc55f038a04b665f9d,german_fires_eppelborn_locations__38b3601e69f80fbc55f038a04b665f9d
waldfriedstr.,"Waldfriedstr. in Eppelborn, Germany",49.4107315,6.9780826,1,,,,,,,ForeignMinistry,"Waldfriedstr. in Eppelborn, Germany",,german_fires_eppelborn_locations,6cc05ee85af406f836050f743f53efdb,german_fires_eppelborn_locations__6cc05ee85af406f836050f743f53efdb
waldstr.,"Waldstr. in Eppelborn, Germany",49.4111033,7.010767,1,,,,,,,Diplomat,"Waldstr. in Eppelborn, Germany",,german_fires_eppelborn_locations,766ebe981320719a0afede327fe1c8fe,german_fires_eppelborn_locations__766ebe981320719a0afede327fe1c8fe
wallenbornstr.,"Wallenbornstr. in Eppelborn, Germany",49.3747848,6.9810517,1,,,,,,,FTO,"Wallenbornstr. in Eppelborn, Germany",,german_fires_eppelborn_locations,919baf97b790fbb26bb221c40799e995,german_fires_eppelborn_locations__919baf97b790fbb26bb221c40799e995
weihereckstr.,"Weihereckstr. in Eppelborn, Germany",49.4174589,6.9529562,1,,,,,,,Consulates,"Weihereckstr. in Eppelborn, Germany",,german_fires_eppelborn_locations,01bf08af2f8255341231572c5664817f,german_fires_eppelborn_locations__01bf08af2f8255341231572c5664817f
welschseite,"Welschseite in Eppelborn, Germany",49.3890664,6.9941395,1,,,,,,,Person,"Welschseite in Eppelborn, Germany",,german_fires_eppelborn_locations,7b006e17f704c81ccb86b2351f00ad79,german_fires_eppelborn_locations__7b006e17f704c81ccb86b2351f00ad79
wendelinusstr.,"Wendelinusstr. in Eppelborn, Germany",49.3760279,6.9735184,1,,,,,,,Wells,"Wendelinusstr. in Eppelborn, Germany",,german_fires_eppelborn_locations,7420547439e51e3cdc9d5b2c1a7a71f8,german_fires_eppelborn_locations__7420547439e51e3cdc9d5b2c1a7a71f8
wiesenstr.,"Wiesenstr. in Eppelborn, Germany",49.3922467,7.0058596,1,,,,,,,Person,"Wiesenstr. in Eppelborn, Germany",,german_fires_eppelborn_locations,f4116a6c7141029a23464b468059b47d,german_fires_eppelborn_locations__f4116a6c7141029a23464b468059b47d
ziegelhutte,"Ziegelhutte in Eppelborn, Germany",49.4155007,7.0192997,1,,,,,,,Wells,"Ziegelhutte in Eppelborn, Germany",,german_fires_eppelborn_locations,2c41608cfb3380328056a29941895337,german_fires_eppelborn_locations__2c41608cfb3380328056a29941895337
zu den eichenstangen,"Zu den Eichenstangen in Eppelborn, Germany",49.3839494,6.9513584,1,,,,,,,LegislativeCommittee,"Zu den Eichenstangen in Eppelborn, Germany",,german_fires_eppelborn_locations,28a6e1da7b4a31d8daa231d1103c7874,german_fires_eppelborn_locations__28a6e1da7b4a31d8daa231d1103c7874
zum bach,"Zum Bach in Eppelborn, Germany",49.3847677,6.9626969,1,,,,,,,News,"Zum Bach in Eppelborn, Germany",,german_fires_eppelborn_locations,0f906f8305646cbf4f1d972e410fdee1,german_fires_eppelborn_locations__0f906f8305646cbf4f1d972e410fdee1
zum hettelwald,"Zum Hettelwald in Eppelborn, Germany",49.3799518,6.9548014,1,,,,,,,space,"Zum Hettelwald in Eppelborn, Germany",,german_fires_eppelborn_locations,c61594d11567c84221950d1d190a7430,german_fires_eppelborn_locations__c61594d11567c84221950d1d190a7430
zum hirschberg,"Zum Hirschberg in Eppelborn, Germany",49.4068316,6.9446717,1,,,,,,,ForeignMinistry,"Zum Hirschberg in Eppelborn, Germany",,german_fires_eppelborn_locations,ec7f1d20837b986053e7266b448157f5,german_fires_eppelborn_locations__ec7f1d20837b986053e7266b448157f5
zum hirtenbrunnen,"Zum Hirtenbrunnen in Eppelborn, Germany",49.3915714,6.9954649,1,,,,,,,Refinery,"Zum Hirtenbrunnen in Eppelborn, Germany",,german_fires_eppelborn_locations,c6fe85558520c9e390ace0bb10723560,german_fires_eppelborn_locations__c6fe85558520c9e390ace0bb10723560
zum muhlenberg,"Zum Muhlenberg in Eppelborn, Germany",49.4159667,7.0104988,1,,,,,,,space,"Zum Muhlenberg in Eppelborn, Germany",,german_fires_eppelborn_locations,d39b70dbf81dc270f8a4a9640997b909,german_fires_eppelborn_locations__d39b70dbf81dc270f8a4a9640997b909
zum spatzenberg,"Zum Spatzenberg in Eppelborn, Germany",49.3746151,6.9771005,1,,,,,,,Wells,"Zum Spatzenberg in Eppelborn, Germany",,german_fires_eppelborn_locations,24218eea28fba5fd3572c4f0ebe24e2b,german_fires_eppelborn_locations__24218eea28fba5fd3572c4f0ebe24e2b
zum steinhaus,"Zum Steinhaus in Eppelborn, Germany",49.3823466,6.9522021,1,,,,,,,LegislativeCommittee,"Zum Steinhaus in Eppelborn, Germany",,german_fires_eppelborn_locations,ea35d28aa189e4ddfcf866e8118d480d,german_fires_eppelborn_locations__ea35d28aa189e4ddfcf866e8118d480d
zur alten muhle,"Zur Alten Muhle in Eppelborn, Germany",49.416266,7.0123471,1,,,,,,,Wells,"Zur Alten Muhle in Eppelborn, Germany",,german_fires_eppelborn_locations,9e23b2c83a26976b5fb0557a6a93ac77,german_fires_eppelborn_locations__9e23b2c83a26976b5fb0557a6a93ac77
zur sandkaul,"Zur Sandkaul in Eppelborn, Germany",49.4049019,6.9557144,1,,,,,,,Exec,"Zur Sandkaul in Eppelborn, Germany",,german_fires_eppelborn_locations,1e024ca12aadcb4b0d4764d87bba33da,german_fires_eppelborn_locations__1e024ca12aadcb4b0d4764d87bba33da
