german_text,caption_text,lat,lon,ranking,default location,default_lat,default_lon,.1,.2,.3,ENTITY_LABEL,name,description,source,source_identifier,global_identifier
altehufe,"Altehufe in Odenthal, Germany",51.0150381,7.1729576,2,"Odenthal, Germany",51.03220845,7.116281468,,,,Pipeline,"Altehufe in Odenthal, Germany",,german_fires_odenthal_locations,5aede868568d35034c7e527642ab0611,german_fires_odenthal_locations__5aede868568d35034c7e527642ab0611
altenberg,"Altenberg in Odenthal, Germany",51.055954,7.1318075,2,,,,,,,Person,"Altenberg in Odenthal, Germany",,german_fires_odenthal_locations,d3b47b016b56e351262fc38cd2303b84,german_fires_odenthal_locations__d3b47b016b56e351262fc38cd2303b84
blecher,"Blecher in Odenthal, Germany",51.063407,7.1225218,2,,,,,,,Media,"Blecher in Odenthal, Germany",,german_fires_odenthal_locations,5d71ecd324df4da8c4c3c0d57f5edc5d,german_fires_odenthal_locations__5d71ecd324df4da8c4c3c0d57f5edc5d
bomerich,"Bomerich in Odenthal, Germany",51.0587572,7.1721927,2,,,,,,ss,Pipeline,"Bomerich in Odenthal, Germany",,german_fires_odenthal_locations,6046e2443746ee51f82bd26260f04c12,german_fires_odenthal_locations__6046e2443746ee51f82bd26260f04c12
bulsberg,"Bulsberg in Odenthal, Germany",51.0477576,7.1371696,2,,,,,,u,DiplomaticFacilities,"Bulsberg in Odenthal, Germany",,german_fires_odenthal_locations,b2d418eaa4369c43ef454c4cddd85046,german_fires_odenthal_locations__b2d418eaa4369c43ef454c4cddd85046
busch,"Busch in Odenthal, Germany",51.0443068,7.1800214,2,,,,,,a,space,"Busch in Odenthal, Germany",,german_fires_odenthal_locations,a9a22739c194a8b67483ad5c22272ab2,german_fires_odenthal_locations__a9a22739c194a8b67483ad5c22272ab2
durchmarsch,"Durchmarsch in Odenthal, Germany",51.0212525,7.1913096,2,,,,,,o,Consulates,"Durchmarsch in Odenthal, Germany",,german_fires_odenthal_locations,50bf068a2b93a147e0b1e0b6a9bed12b,german_fires_odenthal_locations__50bf068a2b93a147e0b1e0b6a9bed12b
eikamp,"Eikamp in Odenthal, Germany",51.019478,7.1866809,2,,,,,,,FTO,"Eikamp in Odenthal, Germany",,german_fires_odenthal_locations,e85d0ca8088de81970e2dc92153fb2df,german_fires_odenthal_locations__e85d0ca8088de81970e2dc92153fb2df
erberich,"Erberich in Odenthal, Germany",51.0504956,7.1084505,2,,,,,,,Refinery,"Erberich in Odenthal, Germany",,german_fires_odenthal_locations,cb88a07cf42ebffdff629d6e9735c94e,german_fires_odenthal_locations__cb88a07cf42ebffdff629d6e9735c94e
funkenhof,"Funkenhof in Odenthal, Germany",51.02677,7.118045,2,,,,,,,Keyphrase,"Funkenhof in Odenthal, Germany",,german_fires_odenthal_locations,927c3b5bd47e889ef302e7e614e59837,german_fires_odenthal_locations__927c3b5bd47e889ef302e7e614e59837
ackerstr.,"Ackerstr. in Odenthal, Germany",51.0471418,7.1065309,1,,,,,,,ForeignMinistry,"Ackerstr. in Odenthal, Germany",,german_fires_odenthal_locations,8f9ab4e88d37dd02a8936d99e5a7f1c0,german_fires_odenthal_locations__8f9ab4e88d37dd02a8936d99e5a7f1c0
adolf-kolping-str.,"Adolf-Kolping-Str. in Odenthal, Germany",51.0367812,7.1140444,1,,,,,,,FTO,"Adolf-Kolping-Str. in Odenthal, Germany",,german_fires_odenthal_locations,a5aa2a25342ca84f684b955f15740f92,german_fires_odenthal_locations__a5aa2a25342ca84f684b955f15740f92
alfred-delp-weg,"Alfred-Delp-Weg in Odenthal, Germany",51.0152828,7.1189038,1,,,,,,,FTO,"Alfred-Delp-Weg in Odenthal, Germany",,german_fires_odenthal_locations,6400868fe953e90000e11c7570ab01ca,german_fires_odenthal_locations__6400868fe953e90000e11c7570ab01ca
alte-wipperfurther-str.,"Alte-Wipperfurther-Str. in Odenthal, Germany",51.0177432,7.1840815,1,,,,,,,ForeignMinistry,"Alte-Wipperfurther-Str. in Odenthal, Germany",,german_fires_odenthal_locations,2dae8b5a51ee2104609d0489d1e96a30,german_fires_odenthal_locations__2dae8b5a51ee2104609d0489d1e96a30
altenberger-dom-str.,"Altenberger-Dom-Str. in Odenthal, Germany",51.0424064,7.1228162,1,,,,,,,Refinery,"Altenberger-Dom-Str. in Odenthal, Germany",,german_fires_odenthal_locations,49d98840e0ff5a54aa0c9b983efb8d37,german_fires_odenthal_locations__49d98840e0ff5a54aa0c9b983efb8d37
am alten hof,"Am Alten Hof in Odenthal, Germany",51.0450418,7.1090215,1,,,,,,,Media,"Am Alten Hof in Odenthal, Germany",,german_fires_odenthal_locations,5305fe8d23cba7b21bd9c0fbb9e74fe7,german_fires_odenthal_locations__5305fe8d23cba7b21bd9c0fbb9e74fe7
am alten turm,"Am Alten Turm in Odenthal, Germany",51.0622878,7.1244452,1,,,,,,,space,"Am Alten Turm in Odenthal, Germany",,german_fires_odenthal_locations,a4864fa6b7466d1536b6aa56348803df,german_fires_odenthal_locations__a4864fa6b7466d1536b6aa56348803df
am berg,"Am Berg in Odenthal, Germany",51.0330642,7.0992128,1,,,,,,,Shipping,"Am Berg in Odenthal, Germany",,german_fires_odenthal_locations,b1d99cd43ec822c9aafc11be0b2fae5a,german_fires_odenthal_locations__b1d99cd43ec822c9aafc11be0b2fae5a
am brunnen,"Am Brunnen in Odenthal, Germany",51.0211628,7.1161651,1,,,,,,,CompanyKeyword,"Am Brunnen in Odenthal, Germany",,german_fires_odenthal_locations,5ea3689d38eb0c66da51e967d3e1d87d,german_fires_odenthal_locations__5ea3689d38eb0c66da51e967d3e1d87d
am buchenhang,"Am Buchenhang in Odenthal, Germany",51.0173589,7.1873367,1,,,,,,,Organization,"Am Buchenhang in Odenthal, Germany",,german_fires_odenthal_locations,cb7e98960e9728b991a44d61d19c5901,german_fires_odenthal_locations__cb7e98960e9728b991a44d61d19c5901
am buschfeld,"Am Buschfeld in Odenthal, Germany",51.0438572,7.1070361,1,,,,,,,DiplomaticFacilities,"Am Buschfeld in Odenthal, Germany",,german_fires_odenthal_locations,23849c9c3722e92c9ed17701d838b947,german_fires_odenthal_locations__23849c9c3722e92c9ed17701d838b947
am bokenberg,"Am Bokenberg in Odenthal, Germany",51.0404604,7.1172735,1,,,,,,,Person,"Am Bokenberg in Odenthal, Germany",,german_fires_odenthal_locations,e7778773dd6d9e4ea758bbc53a621b49,german_fires_odenthal_locations__e7778773dd6d9e4ea758bbc53a621b49
am erlenfeld,"Am Erlenfeld in Odenthal, Germany",51.0164827,7.1877696,1,,,,,,,FTO,"Am Erlenfeld in Odenthal, Germany",,german_fires_odenthal_locations,e949142a5f747bc3f0b436112c2685f1,german_fires_odenthal_locations__e949142a5f747bc3f0b436112c2685f1
am gartenfeld,"Am Gartenfeld in Odenthal, Germany",51.0555636,7.1179442,1,,,,,,,FTO,"Am Gartenfeld in Odenthal, Germany",,german_fires_odenthal_locations,76e3f6396aad4ac1ea04b242b5e777c4,german_fires_odenthal_locations__76e3f6396aad4ac1ea04b242b5e777c4
am geus garten,"Am Geus Garten in Odenthal, Germany",51.0312436,7.1009766,1,,,,,,,Keyphrase,"Am Geus Garten in Odenthal, Germany",,german_fires_odenthal_locations,c5707cb0298de63e9f4fea1a126f830a,german_fires_odenthal_locations__c5707cb0298de63e9f4fea1a126f830a
am geusfelde,"Am Geusfelde in Odenthal, Germany",51.04273,7.1096469,1,,,,,,,Legislator,"Am Geusfelde in Odenthal, Germany",,german_fires_odenthal_locations,6bbd78f3edec27cd839f1a504bc0407a,german_fires_odenthal_locations__6bbd78f3edec27cd839f1a504bc0407a
am hagen,"Am Hagen in Odenthal, Germany",51.0444321,7.1099296,1,,,,,,,Consulates,"Am Hagen in Odenthal, Germany",,german_fires_odenthal_locations,b43e6db62603252c9dbf13bae585abc3,german_fires_odenthal_locations__b43e6db62603252c9dbf13bae585abc3
am hang,"Am Hang in Odenthal, Germany",51.0414478,7.1057393,1,,,,,,,AAEntity,"Am Hang in Odenthal, Germany",,german_fires_odenthal_locations,a3489838b92a7942e6d9660cb986136a,german_fires_odenthal_locations__a3489838b92a7942e6d9660cb986136a
am hohenfeld,"Am Hohenfeld in Odenthal, Germany",51.0213288,7.1193156,1,,,,,,,Wells,"Am Hohenfeld in Odenthal, Germany",,german_fires_odenthal_locations,6000db065679523e1ae3e9ae5318115b,german_fires_odenthal_locations__6000db065679523e1ae3e9ae5318115b
am kottersbach,"Am Kottersbach in Odenthal, Germany",51.0627687,7.1165812,1,,,,,,,space,"Am Kottersbach in Odenthal, Germany",,german_fires_odenthal_locations,6b2f945cc7516f36cdfd1696af776018,german_fires_odenthal_locations__6b2f945cc7516f36cdfd1696af776018
am langen siefen,"Am Langen Siefen in Odenthal, Germany",51.0513541,7.1755284,1,,,,,,,space,"Am Langen Siefen in Odenthal, Germany",,german_fires_odenthal_locations,87f2e68093c642af4f59a070f8485862,german_fires_odenthal_locations__87f2e68093c642af4f59a070f8485862
am matthiasberg,"Am Matthiasberg in Odenthal, Germany",51.0569261,7.1208567,1,,,,,,,Legislator,"Am Matthiasberg in Odenthal, Germany",,german_fires_odenthal_locations,e7b0dad32df1c7d7a317186500513a74,german_fires_odenthal_locations__e7b0dad32df1c7d7a317186500513a74
am putzchen,"Am Putzchen in Odenthal, Germany",51.0646064,7.1248031,1,,,,,,,ForeignMinister,"Am Putzchen in Odenthal, Germany",,german_fires_odenthal_locations,475d079ea23632e25135f8087336ec59,german_fires_odenthal_locations__475d079ea23632e25135f8087336ec59
am rosberg,"Am Rosberg in Odenthal, Germany",51.0526729,7.1259837,1,,,,,,,Keyphrase,"Am Rosberg in Odenthal, Germany",,german_fires_odenthal_locations,82b5aac2d2475c3ffcedd37db65f1c6f,german_fires_odenthal_locations__82b5aac2d2475c3ffcedd37db65f1c6f
am schulberg,"Am Schulberg in Odenthal, Germany",51.0564332,7.1295602,1,,,,,,,space,"Am Schulberg in Odenthal, Germany",,german_fires_odenthal_locations,84bc63ab4b61ecd8faafedbc5c3397a2,german_fires_odenthal_locations__84bc63ab4b61ecd8faafedbc5c3397a2
am sonnenberg,"Am Sonnenberg in Odenthal, Germany",51.0162531,7.1276325,1,,,,,,,Organization,"Am Sonnenberg in Odenthal, Germany",,german_fires_odenthal_locations,523f3cd903257d81a45e37b9c4e60fda,german_fires_odenthal_locations__523f3cd903257d81a45e37b9c4e60fda
am steinberg,"Am Steinberg in Odenthal, Germany",51.0335019,7.1009722,1,,,,,,,Legislator,"Am Steinberg in Odenthal, Germany",,german_fires_odenthal_locations,9532abee4f483ed64a0b253f8904b066,german_fires_odenthal_locations__9532abee4f483ed64a0b253f8904b066
am steinhauser busch,"Am Steinhauser Busch in Odenthal, Germany",51.0351297,7.1704022,1,,,,,,,DiplomaticFacilities,"Am Steinhauser Busch in Odenthal, Germany",,german_fires_odenthal_locations,0a50845f513ee2e78e05657e83d96213,german_fires_odenthal_locations__0a50845f513ee2e78e05657e83d96213
am stragholzer kreuz,"Am Stragholzer Kreuz in Odenthal, Germany",51.0598772,7.1660539,1,,,,,,,DiplomaticFacilities,"Am Stragholzer Kreuz in Odenthal, Germany",,german_fires_odenthal_locations,fefdc254c81fdd1efff0a7fe53e28f3b,german_fires_odenthal_locations__fefdc254c81fdd1efff0a7fe53e28f3b
am telegraf,"Am Telegraf in Odenthal, Germany",51.0643214,7.1197521,1,,,,,,,Diplomat,"Am Telegraf in Odenthal, Germany",,german_fires_odenthal_locations,b912a0d31215718adff6b97ea9e48fce,german_fires_odenthal_locations__b912a0d31215718adff6b97ea9e48fce
am thelen siefen,"Am Thelen Siefen in Odenthal, Germany",51.0337703,7.0974959,1,,,,,,,DiplomaticFacilities,"Am Thelen Siefen in Odenthal, Germany",,german_fires_odenthal_locations,30ab67c3449a033c2e8881a9fd570308,german_fires_odenthal_locations__30ab67c3449a033c2e8881a9fd570308
am wasserturm,"Am Wasserturm in Odenthal, Germany",51.0496082,7.1101846,1,,,,,,,ForeignMinister,"Am Wasserturm in Odenthal, Germany",,german_fires_odenthal_locations,a00a03a393f9f29e57feb771bdbcbe92,german_fires_odenthal_locations__a00a03a393f9f29e57feb771bdbcbe92
amselweg,"Amselweg in Odenthal, Germany",51.0161389,7.1775848,1,,,,,,,News,"Amselweg in Odenthal, Germany",,german_fires_odenthal_locations,5229a4109d721cf968b90c5e88796db0,german_fires_odenthal_locations__5229a4109d721cf968b90c5e88796db0
an der alten schule,"An der Alten Schule in Odenthal, Germany",51.0448938,7.1695165,1,,,,,,,space,"An der Alten Schule in Odenthal, Germany",,german_fires_odenthal_locations,d2d7ce616a787231cf512df7f9d96a09,german_fires_odenthal_locations__d2d7ce616a787231cf512df7f9d96a09
an der buchmuhle,"An der Buchmuhle in Odenthal, Germany",51.0305207,7.1126938,1,,,,,,,IndustryTerm,"An der Buchmuhle in Odenthal, Germany",,german_fires_odenthal_locations,569e2218cea226ae4f6866164b044dc6,german_fires_odenthal_locations__569e2218cea226ae4f6866164b044dc6
an der dhunn,"An der Dhunn in Odenthal, Germany",51.0301962,7.1086851,1,,,,,,,Consulates,"An der Dhunn in Odenthal, Germany",,german_fires_odenthal_locations,04a96c6d4776f274752a86f7244d3411,german_fires_odenthal_locations__04a96c6d4776f274752a86f7244d3411
an der scherf,"An der Scherf in Odenthal, Germany",51.033929,7.1626522,1,,,,,,,Legislator,"An der Scherf in Odenthal, Germany",,german_fires_odenthal_locations,6ba5a826ba5ff77b60f907cd1ee57f20,german_fires_odenthal_locations__6ba5a826ba5ff77b60f907cd1ee57f20
angersiefen,"Angersiefen in Odenthal, Germany",51.0326615,7.1171485,1,,,,,,,ForeignMinistry,"Angersiefen in Odenthal, Germany",,german_fires_odenthal_locations,68afc6003c299d180c1703735bd6127a,german_fires_odenthal_locations__68afc6003c299d180c1703735bd6127a
angerweg,"Angerweg in Odenthal, Germany",51.0516553,7.1788041,1,,,,,,,LegislativeCommittee,"Angerweg in Odenthal, Germany",,german_fires_odenthal_locations,a28845a67ce450f07ffa13fe556ca346,german_fires_odenthal_locations__a28845a67ce450f07ffa13fe556ca346
anne-frank-str.,"Anne-Frank-Str. in Odenthal, Germany",51.0224483,7.1926634,1,,,,,,,Media,"Anne-Frank-Str. in Odenthal, Germany",,german_fires_odenthal_locations,bdf749ee530fa85ec40e3eb871ec4257,german_fires_odenthal_locations__bdf749ee530fa85ec40e3eb871ec4257
annette-kolb-str.,"Annette-Kolb-Str. in Odenthal, Germany",51.0217143,7.1902648,1,,,,,,,News,"Annette-Kolb-Str. in Odenthal, Germany",,german_fires_odenthal_locations,5e89a7e5b0e44041edd5e21e607479b4,german_fires_odenthal_locations__5e89a7e5b0e44041edd5e21e607479b4
arndtstr.,"Arndtstr. in Odenthal, Germany",51.0370534,7.1119086,1,,,,,,,LegislativeCommittee,"Arndtstr. in Odenthal, Germany",,german_fires_odenthal_locations,322b3e8b9097df1dc1802cb32c382175,german_fires_odenthal_locations__322b3e8b9097df1dc1802cb32c382175
auenweg,"Auenweg in Odenthal, Germany",51.0309535,7.1026429,1,,,,,,,CompanyKeyword,"Auenweg in Odenthal, Germany",,german_fires_odenthal_locations,4f65759fd610b42d6079040bdadadf7c,german_fires_odenthal_locations__4f65759fd610b42d6079040bdadadf7c
auf dem broich,"Auf dem Broich in Odenthal, Germany",51.0460604,7.1097593,1,,,,,,,Pipeline,"Auf dem Broich in Odenthal, Germany",,german_fires_odenthal_locations,314e1f03aa82932b40ec86601ce41d79,german_fires_odenthal_locations__314e1f03aa82932b40ec86601ce41d79
auf dem gleichen,"Auf dem Gleichen in Odenthal, Germany",51.0160474,7.1719089,1,,,,,,,Wells,"Auf dem Gleichen in Odenthal, Germany",,german_fires_odenthal_locations,d0f4ad2178c50a6669ddc42f796b74dc,german_fires_odenthal_locations__d0f4ad2178c50a6669ddc42f796b74dc
auf dem heidchen,"Auf dem Heidchen in Odenthal, Germany",51.0452711,7.1046105,1,,,,,,,LegislativeCommittee,"Auf dem Heidchen in Odenthal, Germany",,german_fires_odenthal_locations,91418e112c36660ba319e50f38607c8e,german_fires_odenthal_locations__91418e112c36660ba319e50f38607c8e
auf dem krahwinkel,"Auf dem Krahwinkel in Odenthal, Germany",51.039806,7.1087965,1,,,,,,,Organization,"Auf dem Krahwinkel in Odenthal, Germany",,german_fires_odenthal_locations,26062d5eb35cab6a0809239622402f29,german_fires_odenthal_locations__26062d5eb35cab6a0809239622402f29
auf dem rottfeld,"Auf dem Rottfeld in Odenthal, Germany",51.0206513,7.1298569,1,,,,,,,Wells,"Auf dem Rottfeld in Odenthal, Germany",,german_fires_odenthal_locations,bf1d83e8bc67a0a0a771fd4ca8f4b29d,german_fires_odenthal_locations__bf1d83e8bc67a0a0a771fd4ca8f4b29d
auf dem winkel,"Auf dem Winkel in Odenthal, Germany",51.0559206,7.1154209,1,,,,,,,Keyphrase,"Auf dem Winkel in Odenthal, Germany",,german_fires_odenthal_locations,c2d40486b31b2d4677d25ff90fe74b7a,german_fires_odenthal_locations__c2d40486b31b2d4677d25ff90fe74b7a
auf der hohe,"Auf der Hohe in Odenthal, Germany",51.0230711,7.1197319,1,,,,,,,DiplomaticFacilities,"Auf der Hohe in Odenthal, Germany",,german_fires_odenthal_locations,d643317e99ea262e14f1079471efb3d3,german_fires_odenthal_locations__d643317e99ea262e14f1079471efb3d3
bergisch gladbacher str.,"Bergisch Gladbacher Str. in Odenthal, Germany",51.0260444,7.1207739,1,,,,,,,Media,"Bergisch Gladbacher Str. in Odenthal, Germany",,german_fires_odenthal_locations,4c6ec6e3ae23932cedcf555e547134dc,german_fires_odenthal_locations__4c6ec6e3ae23932cedcf555e547134dc
bergstr.,"Bergstr. in Odenthal, Germany",51.0517283,7.1120826,1,,,,,,,AAEntity,"Bergstr. in Odenthal, Germany",,german_fires_odenthal_locations,904d2850015832f21a37ee570e32e29e,german_fires_odenthal_locations__904d2850015832f21a37ee570e32e29e
bertha-von-suttner-str.,"Bertha-von-Suttner-Str. in Odenthal, Germany",51.0227797,7.1923341,1,,,,,,,Exec,"Bertha-von-Suttner-Str. in Odenthal, Germany",,german_fires_odenthal_locations,2a3cc8b63f8155ed5cb1bf518ff1fcbe,german_fires_odenthal_locations__2a3cc8b63f8155ed5cb1bf518ff1fcbe
bienenhof,"Bienenhof in Odenthal, Germany",51.0222826,7.1418167,1,,,,,,,Wells,"Bienenhof in Odenthal, Germany",,german_fires_odenthal_locations,2fb03e9106a59ca6f09fc11f3c996eed,german_fires_odenthal_locations__2fb03e9106a59ca6f09fc11f3c996eed
birkenhohe,"Birkenhohe in Odenthal, Germany",51.0593739,7.1514302,1,,,,,,,DiplomaticFacilities,"Birkenhohe in Odenthal, Germany",,german_fires_odenthal_locations,81f2735021d545bed1fdd666309a0ab0,german_fires_odenthal_locations__81f2735021d545bed1fdd666309a0ab0
blumenweg,"Blumenweg in Odenthal, Germany",51.0587354,7.1224583,1,,,,,,,DiplomaticFacilities,"Blumenweg in Odenthal, Germany",,german_fires_odenthal_locations,4a92b81dac3d18fe6c5b86cb25725eed,german_fires_odenthal_locations__4a92b81dac3d18fe6c5b86cb25725eed
bohn,"Bohn in Odenthal, Germany",51.0634326,7.1189155,1,,,,,,,FTO,"Bohn in Odenthal, Germany",,german_fires_odenthal_locations,838deb1d08048f833d0818c4a7238f29,german_fires_odenthal_locations__838deb1d08048f833d0818c4a7238f29
breibacher feld,"Breibacher Feld in Odenthal, Germany",51.0515895,7.1737602,1,,,,,,,CompanyKeyword,"Breibacher Feld in Odenthal, Germany",,german_fires_odenthal_locations,95853e8ce4ccfd172d746c540b81bf60,german_fires_odenthal_locations__95853e8ce4ccfd172d746c540b81bf60
breidbacher hohe,"Breidbacher Hohe in Odenthal, Germany",51.0473476,7.171273,1,,,,,,,IndustryTerm,"Breidbacher Hohe in Odenthal, Germany",,german_fires_odenthal_locations,6ea4e94c0e7d6713e055b5504bb1d1e3,german_fires_odenthal_locations__6ea4e94c0e7d6713e055b5504bb1d1e3
brombeerweg,"Brombeerweg in Odenthal, Germany",51.0432457,7.106489,1,,,,,,,Diplomat,"Brombeerweg in Odenthal, Germany",,german_fires_odenthal_locations,cfa84ffe770225762f3163877b8d0cd3,german_fires_odenthal_locations__cfa84ffe770225762f3163877b8d0cd3
brunnenweg,"Brunnenweg in Odenthal, Germany",51.0181265,7.1834433,1,,,,,,,Organization,"Brunnenweg in Odenthal, Germany",,german_fires_odenthal_locations,cc3086d6de9d2581543f06d41660f186,german_fires_odenthal_locations__cc3086d6de9d2581543f06d41660f186
busch,"Busch in Odenthal, Germany",51.0443068,7.1800214,1,,,,,,,CompanyKeyword,"Busch in Odenthal, Germany",,german_fires_odenthal_locations,a9a22739c194a8b67483ad5c22272ab2,german_fires_odenthal_locations__a9a22739c194a8b67483ad5c22272ab2
buschweg,"Buschweg in Odenthal, Germany",51.0187426,7.1106259,1,,,,,,,Diplomat,"Buschweg in Odenthal, Germany",,german_fires_odenthal_locations,f965e6cad6b1b4ee9580c815e2d9a0a4,german_fires_odenthal_locations__f965e6cad6b1b4ee9580c815e2d9a0a4
bomericher weg,"Bomericher Weg in Odenthal, Germany",51.0566372,7.1699574,1,,,,,,,Legislator,"Bomericher Weg in Odenthal, Germany",,german_fires_odenthal_locations,7d0b9454a25af8ec3c6f9e92fd24f2c4,german_fires_odenthal_locations__7d0b9454a25af8ec3c6f9e92fd24f2c4
bulsberger hohe,"Bulsberger Hohe in Odenthal, Germany",51.0479666,7.1376915,1,,,,,,,FTO,"Bulsberger Hohe in Odenthal, Germany",,german_fires_odenthal_locations,063bf1fe0833daa54a81d811d43d9670,german_fires_odenthal_locations__063bf1fe0833daa54a81d811d43d9670
bulsberger weg,"Bulsberger Weg in Odenthal, Germany",51.0506166,7.1368603,1,,,,,,,CompanyKeyword,"Bulsberger Weg in Odenthal, Germany",,german_fires_odenthal_locations,4d39f56b7ffec7752f9ed95ec00e3bb2,german_fires_odenthal_locations__4d39f56b7ffec7752f9ed95ec00e3bb2
carl-leverkus-str.,"Carl-Leverkus-Str. in Odenthal, Germany",51.0344696,7.1139232,1,,,,,,,LegislativeCommittee,"Carl-Leverkus-Str. in Odenthal, Germany",,german_fires_odenthal_locations,e2cf2ac1982b5500011affbc9660ef16,german_fires_odenthal_locations__e2cf2ac1982b5500011affbc9660ef16
carl-mosterts-str.,"Carl-Mosterts-Str. in Odenthal, Germany",51.05637,7.1335943,1,,,,,,,LegislativeCommittee,"Carl-Mosterts-Str. in Odenthal, Germany",,german_fires_odenthal_locations,7a80b1685cea5e1081e91f5ecdbf3615,german_fires_odenthal_locations__7a80b1685cea5e1081e91f5ecdbf3615
dhunner aue,"Dhunner Aue in Odenthal, Germany",51.0298673,7.1069553,1,,,,,,,Wells,"Dhunner Aue in Odenthal, Germany",,german_fires_odenthal_locations,f18885e400da17dac4034a583cb77f6a,german_fires_odenthal_locations__f18885e400da17dac4034a583cb77f6a
dietrich-bonhoeffer-weg,"Dietrich-Bonhoeffer-Weg in Odenthal, Germany",51.0161112,7.1200949,1,,,,,,,FTO,"Dietrich-Bonhoeffer-Weg in Odenthal, Germany",,german_fires_odenthal_locations,97aac080f47f75bd710fe61b2f0e9695,german_fires_odenthal_locations__97aac080f47f75bd710fe61b2f0e9695
dorfstr.,"Dorfstr. in Odenthal, Germany",51.0334569,7.1163271,1,,,,,,,Legislator,"Dorfstr. in Odenthal, Germany",,german_fires_odenthal_locations,e96d42fff19aaec6e7ce59a13ce357ac,german_fires_odenthal_locations__e96d42fff19aaec6e7ce59a13ce357ac
droste-hulshoff-str.,"Droste-Hulshoff-Str. in Odenthal, Germany",51.0386346,7.1107795,1,,,,,,,News,"Droste-Hulshoff-Str. in Odenthal, Germany",,german_fires_odenthal_locations,bf961f66777f94dafc1b021ac54f920c,german_fires_odenthal_locations__bf961f66777f94dafc1b021ac54f920c
dulmener weg,"Dulmener Weg in Odenthal, Germany",51.0517307,7.1068115,1,,,,,,,News,"Dulmener Weg in Odenthal, Germany",,german_fires_odenthal_locations,89f2a191b6a95c76cfe6f76ad9844787,german_fires_odenthal_locations__89f2a191b6a95c76cfe6f76ad9844787
dunnerhofe,"Dunnerhofe in Odenthal, Germany",51.0289298,7.1040416,1,,,,,,,Legislator,"Dunnerhofe in Odenthal, Germany",,german_fires_odenthal_locations,69b6ca361d8274fc5ad8485dc6f83fc5,german_fires_odenthal_locations__69b6ca361d8274fc5ad8485dc6f83fc5
edith-stein-str.,"Edith-Stein-Str. in Odenthal, Germany",51.0221043,7.1933387,1,,,,,,,Legislator,"Edith-Stein-Str. in Odenthal, Germany",,german_fires_odenthal_locations,696ef72b8c8a015e6ab924f33783a01c,german_fires_odenthal_locations__696ef72b8c8a015e6ab924f33783a01c
eichendorffweg,"Eichendorffweg in Odenthal, Germany",51.0352478,7.1133593,1,,,,,,,Shipping,"Eichendorffweg in Odenthal, Germany",,german_fires_odenthal_locations,9da9f959e2fa32c892137332c26f2e0b,german_fires_odenthal_locations__9da9f959e2fa32c892137332c26f2e0b
eichholzer weg,"Eichholzer Weg in Odenthal, Germany",51.0550707,7.1819636,1,,,,,,,Legislator,"Eichholzer Weg in Odenthal, Germany",,german_fires_odenthal_locations,646c887c466833b9c779231e7a392595,german_fires_odenthal_locations__646c887c466833b9c779231e7a392595
eifgenstr.,"Eifgenstr. in Odenthal, Germany",51.0623167,7.1255595,1,,,,,,,DiplomaticFacilities,"Eifgenstr. in Odenthal, Germany",,german_fires_odenthal_locations,395a39331416e4ddad4f16f94e8768f3,german_fires_odenthal_locations__395a39331416e4ddad4f16f94e8768f3
eikamper feld,"Eikamper Feld in Odenthal, Germany",51.0206255,7.1858765,1,,,,,,,Consulates,"Eikamper Feld in Odenthal, Germany",,german_fires_odenthal_locations,65391c9cdc3859f45e88fbad5fa091cd,german_fires_odenthal_locations__65391c9cdc3859f45e88fbad5fa091cd
engstenberger hohe,"Engstenberger Hohe in Odenthal, Germany",51.0356195,7.0980514,1,,,,,,,ForeignMinistry,"Engstenberger Hohe in Odenthal, Germany",,german_fires_odenthal_locations,0c28ab5d4e72f176eb5a20883247dc59,german_fires_odenthal_locations__0c28ab5d4e72f176eb5a20883247dc59
erbericher kirchweg,"Erbericher Kirchweg in Odenthal, Germany",51.0522781,7.1142023,1,,,,,,,IndustryTerm,"Erbericher Kirchweg in Odenthal, Germany",,german_fires_odenthal_locations,156009bc16c7b1cd10aae5dae15a1b9a,german_fires_odenthal_locations__156009bc16c7b1cd10aae5dae15a1b9a
eschenweg,"Eschenweg in Odenthal, Germany",51.0488864,7.1092509,1,,,,,,,CompanyKeyword,"Eschenweg in Odenthal, Germany",,german_fires_odenthal_locations,99d163b3f6dd5b5ca85ad542c9a62c21,german_fires_odenthal_locations__99d163b3f6dd5b5ca85ad542c9a62c21
eugen-heinen-platz,"Eugen-Heinen-Platz in Odenthal, Germany",51.0548314,7.1320312,1,,,,,,,Exec,"Eugen-Heinen-Platz in Odenthal, Germany",,german_fires_odenthal_locations,5f19b34e6ecb46c92edcd8dc2213fb47,german_fires_odenthal_locations__5f19b34e6ecb46c92edcd8dc2213fb47
farnweg,"Farnweg in Odenthal, Germany",51.0179508,7.1187762,1,,,,,,,ForeignMinister,"Farnweg in Odenthal, Germany",,german_fires_odenthal_locations,334c2f275c98e5b72501936bb06bc0a0,german_fires_odenthal_locations__334c2f275c98e5b72501936bb06bc0a0
fasanenweg,"Fasanenweg in Odenthal, Germany",51.0169062,7.1150168,1,,,,,,,ForeignMinistry,"Fasanenweg in Odenthal, Germany",,german_fires_odenthal_locations,57b804416ecaa5789faf317d71ed349e,german_fires_odenthal_locations__57b804416ecaa5789faf317d71ed349e
feld,"Feld in Odenthal, Germany",51.0544234,7.164792,1,,,,,,,Organization,"Feld in Odenthal, Germany",,german_fires_odenthal_locations,49479550b32be5cd95edf3915a6da632,german_fires_odenthal_locations__49479550b32be5cd95edf3915a6da632
feldrain,"Feldrain in Odenthal, Germany",51.0546965,7.1162546,1,,,,,,,Pipeline,"Feldrain in Odenthal, Germany",,german_fires_odenthal_locations,b969ca85ed5ba82c848485222432b569,german_fires_odenthal_locations__b969ca85ed5ba82c848485222432b569
feldstr.,"Feldstr. in Odenthal, Germany",51.0630284,7.1245965,1,,,,,,,LegislativeCommittee,"Feldstr. in Odenthal, Germany",,german_fires_odenthal_locations,2290e8db16dc43e9f9221048f61ddd8f,german_fires_odenthal_locations__2290e8db16dc43e9f9221048f61ddd8f
ferdinand-schafer-str.,"Ferdinand-Schafer-Str. in Odenthal, Germany",51.0303193,7.1106176,1,,,,,,,Shipping,"Ferdinand-Schafer-Str. in Odenthal, Germany",,german_fires_odenthal_locations,fa3abcb832af832df9d176f63f9fc3ba,german_fires_odenthal_locations__fa3abcb832af832df9d176f63f9fc3ba
