german_text,caption_text,lat,lon,ranking,default location,default_lat,default_lon,.1,.2,.3,.4,.5,ENTITY_LABEL,name,description,source,source_identifier,global_identifier
katharinenstrasse,"Katharinenstrasse in Solingen, Germany",51.2051956,7.0780703,1,,,,,,,,,FTO,"Katharinenstrasse in Solingen, Germany",,german_fires_solingen_locations,55da82be1434100010bc157a8da03009,german_fires_solingen_locations__55da82be1434100010bc157a8da03009
kathe-kollwitz-weg,"Kathe-Kollwitz-Weg in Solingen, Germany",51.1848728,7.0266508,1,,,,,,,,,News,"Kathe-Kollwitz-Weg in Solingen, Germany",,german_fires_solingen_locations,3cce440eb273ac177276aaa3e63bd448,german_fires_solingen_locations__3cce440eb273ac177276aaa3e63bd448
katternberger strasse,"Katternberger Strasse in Solingen, Germany",51.1639228,7.0711306,1,,,,,,,,,FTO,"Katternberger Strasse in Solingen, Germany",,german_fires_solingen_locations,0eb825d0811f65e54a56975f67525876,german_fires_solingen_locations__0eb825d0811f65e54a56975f67525876
katzbach,"Katzbach in Solingen, Germany",51.1580907,7.0866766,1,,,,,,,,,ForeignMinistry,"Katzbach in Solingen, Germany",,german_fires_solingen_locations,e33966a4f3f64384dd5eb6dd03bd6cdb,german_fires_solingen_locations__e33966a4f3f64384dd5eb6dd03bd6cdb
kauffunger weg,"Kauffunger Weg in Solingen, Germany",51.145345,7.0100922,1,,,,,,,,,Consulates,"Kauffunger Weg in Solingen, Germany",,german_fires_solingen_locations,fc00e9eb4f44ccc0771ed1e427459043,german_fires_solingen_locations__fc00e9eb4f44ccc0771ed1e427459043
keldersstrasse,"Keldersstrasse in Solingen, Germany",51.1603131,7.002039,1,,,,,,,,,Organization,"Keldersstrasse in Solingen, Germany",,german_fires_solingen_locations,9db36ef5a89c1e0c6372c9f2c56afbb5,german_fires_solingen_locations__9db36ef5a89c1e0c6372c9f2c56afbb5
kellerstrasse,"Kellerstrasse in Solingen, Germany",51.1548061,7.1621292,1,,,,,,,,,CompanyKeyword,"Kellerstrasse in Solingen, Germany",,german_fires_solingen_locations,ef8f963b38f2ff788fec57f48307a9c5,german_fires_solingen_locations__ef8f963b38f2ff788fec57f48307a9c5
keplerweg,"Keplerweg in Solingen, Germany",51.1520649,7.104228,1,,,,,,,,,ForeignMinistry,"Keplerweg in Solingen, Germany",,german_fires_solingen_locations,8c4176d0e2e48ebc5657fb8a0a2ad92c,german_fires_solingen_locations__8c4176d0e2e48ebc5657fb8a0a2ad92c
ketzberger strasse,"Ketzberger Strasse in Solingen, Germany",51.1935317,7.0800954,1,,,,,,,,,Wells,"Ketzberger Strasse in Solingen, Germany",,german_fires_solingen_locations,8766ebbffbe8c5ddef432bbb67386a32,german_fires_solingen_locations__8766ebbffbe8c5ddef432bbb67386a32
keusenhof,"Keusenhof in Solingen, Germany",51.1692018,6.9985707,1,,,,,,,,,ForeignMinistry,"Keusenhof in Solingen, Germany",,german_fires_solingen_locations,27f4c0f70e79fb340f792f5fcbd19794,german_fires_solingen_locations__27f4c0f70e79fb340f792f5fcbd19794
kiebitzweg,"Kiebitzweg in Solingen, Germany",51.1528135,7.0856151,1,,,,,,,,,space,"Kiebitzweg in Solingen, Germany",,german_fires_solingen_locations,d2244218466e3c2759cbe25525fd1218,german_fires_solingen_locations__d2244218466e3c2759cbe25525fd1218
kiefernstrasse,"Kiefernstrasse in Solingen, Germany",51.153189,7.0019334,1,,,,,,,,,Shipping,"Kiefernstrasse in Solingen, Germany",,german_fires_solingen_locations,036b4165028b91728b77ecee1e2771d1,german_fires_solingen_locations__036b4165028b91728b77ecee1e2771d1
kieler strasse,"Kieler Strasse in Solingen, Germany",51.1596642,7.003566,1,,,,,,,,,Exec,"Kieler Strasse in Solingen, Germany",,german_fires_solingen_locations,c9920368533419f481e3bbc18dc9c6c0,german_fires_solingen_locations__c9920368533419f481e3bbc18dc9c6c0
kiesbuckel,"Kiesbuckel in Solingen, Germany",51.1625096,6.9908371,1,,,,,,,,,ForeignMinistry,"Kiesbuckel in Solingen, Germany",,german_fires_solingen_locations,63d73e0e2d76d4d04cec58dfaef335e6,german_fires_solingen_locations__63d73e0e2d76d4d04cec58dfaef335e6
kirberger strasse,"Kirberger Strasse in Solingen, Germany",51.1627049,7.0934776,1,,,,,,,,,News,"Kirberger Strasse in Solingen, Germany",,german_fires_solingen_locations,8d5760da41c8a85c2a7cb80db5a46309,german_fires_solingen_locations__8d5760da41c8a85c2a7cb80db5a46309
kirchgasse,"Kirchgasse in Solingen, Germany",51.1618393,7.0022142,1,,,,,,,,,DiplomaticFacilities,"Kirchgasse in Solingen, Germany",,german_fires_solingen_locations,a31686d8156278f1cd24e59e47c3099c,german_fires_solingen_locations__a31686d8156278f1cd24e59e47c3099c
kirchplatz,"Kirchplatz in Solingen, Germany",51.1718987,7.0849292,1,,,,,,,,,ForeignMinistry,"Kirchplatz in Solingen, Germany",,german_fires_solingen_locations,e2672085bf5970ac7408dbcb7150e07d,german_fires_solingen_locations__e2672085bf5970ac7408dbcb7150e07d
kirchstrasse,"Kirchstrasse in Solingen, Germany",51.1707974,7.0833356,1,,,,,,,,,FTO,"Kirchstrasse in Solingen, Germany",,german_fires_solingen_locations,da4b89bccf110ceb758926356e658574,german_fires_solingen_locations__da4b89bccf110ceb758926356e658574
kirschbaumer hof,"Kirschbaumer Hof in Solingen, Germany",51.1679495,7.0766845,1,,,,,,,,,LegislativeCommittee,"Kirschbaumer Hof in Solingen, Germany",,german_fires_solingen_locations,6af508897a20437eda62353dcc79a4e7,german_fires_solingen_locations__6af508897a20437eda62353dcc79a4e7
kirschbaumer strasse,"Kirschbaumer Strasse in Solingen, Germany",51.1683438,7.0728622,1,,,,,,,,,News,"Kirschbaumer Strasse in Solingen, Germany",,german_fires_solingen_locations,23967aa2d91cb3d05f248fafee3131ea,german_fires_solingen_locations__23967aa2d91cb3d05f248fafee3131ea
kirschheider strasse,"Kirschheider Strasse in Solingen, Germany",51.1541133,7.0655337,1,,,,,,,,,Exec,"Kirschheider Strasse in Solingen, Germany",,german_fires_solingen_locations,8dc3cbc5c883a80b7f8fb7326d16ff10,german_fires_solingen_locations__8dc3cbc5c883a80b7f8fb7326d16ff10
klauberg,"Klauberg in Solingen, Germany",51.1772275,7.0958205,1,,,,,,,,,FTO,"Klauberg in Solingen, Germany",,german_fires_solingen_locations,da05a90ce6bedfd25add9101f847d2a4,german_fires_solingen_locations__da05a90ce6bedfd25add9101f847d2a4
klauberger strasse,"Klauberger Strasse in Solingen, Germany",51.1762786,7.0918759,1,,,,,,,,,IndustryTerm,"Klauberger Strasse in Solingen, Germany",,german_fires_solingen_locations,ae844292b0c1eee63ac3873e55cf75d4,german_fires_solingen_locations__ae844292b0c1eee63ac3873e55cf75d4
kleiberweg,"Kleiberweg in Solingen, Germany",51.1527647,7.0835649,1,,,,,,,,,ForeignMinistry,"Kleiberweg in Solingen, Germany",,german_fires_solingen_locations,14aec06137873f6480fb7029fa782535,german_fires_solingen_locations__14aec06137873f6480fb7029fa782535
klein-heipertz,"Klein-Heipertz in Solingen, Germany",51.1604725,7.0291235,1,,,,,,,,,space,"Klein-Heipertz in Solingen, Germany",,german_fires_solingen_locations,2dc1d9524956d555867fa3a3c5df5892,german_fires_solingen_locations__2dc1d9524956d555867fa3a3c5df5892
kleine kamper strasse,"Kleine Kamper Strasse in Solingen, Germany",51.1594416,7.0046602,1,,,,,,,,,ForeignMinister,"Kleine Kamper Strasse in Solingen, Germany",,german_fires_solingen_locations,f2661b0156a1ed30db78f82aea73c007,german_fires_solingen_locations__f2661b0156a1ed30db78f82aea73c007
kleine strasse,"Kleine Strasse in Solingen, Germany",51.1838869,7.0778184,1,,,,,,,,,DiplomaticFacilities,"Kleine Strasse in Solingen, Germany",,german_fires_solingen_locations,8dca746f1b80196f5e32c8e1f62a6f0d,german_fires_solingen_locations__8dca746f1b80196f5e32c8e1f62a6f0d
kleinenberg,"Kleinenberg in Solingen, Germany",51.1774649,7.0559081,1,,,,,,,,,FTO,"Kleinenberg in Solingen, Germany",,german_fires_solingen_locations,bc6490e5f78e72afc116d3990b85bfc6,german_fires_solingen_locations__bc6490e5f78e72afc116d3990b85bfc6
kleinenberger strasse,"Kleinenberger Strasse in Solingen, Germany",51.1773465,7.0569259,1,,,,,,,,,Organization,"Kleinenberger Strasse in Solingen, Germany",,german_fires_solingen_locations,76f2c51f4a511831e14297b91e63d4a4,german_fires_solingen_locations__76f2c51f4a511831e14297b91e63d4a4
kleiststrasse,"Kleiststrasse in Solingen, Germany",51.1528351,7.0118984,1,,,,,,,,,Shipping,"Kleiststrasse in Solingen, Germany",,german_fires_solingen_locations,9f231fbf1e345fa8347b9afca9810e08,german_fires_solingen_locations__9f231fbf1e345fa8347b9afca9810e08
klemens-horn-strasse,"Klemens-Horn-Strasse in Solingen, Germany",51.1768197,7.0813181,1,,,,,,,,,Legislator,"Klemens-Horn-Strasse in Solingen, Germany",,german_fires_solingen_locations,157fb9c5141ac77fc9404542755dab5a,german_fires_solingen_locations__157fb9c5141ac77fc9404542755dab5a
klingenstrasse,"Klingenstrasse in Solingen, Germany",51.1661213,7.102738,1,,,,,,,,,Diplomat,"Klingenstrasse in Solingen, Germany",,german_fires_solingen_locations,c1e39c7f5046ce2c64823d092d146421,german_fires_solingen_locations__c1e39c7f5046ce2c64823d092d146421
klommenberg,"Klommenberg in Solingen, Germany",51.1865826,7.027729,1,,,,,,,,,Refinery,"Klommenberg in Solingen, Germany",,german_fires_solingen_locations,b1a98fc2b8fa531508da39f89b15efa4,german_fires_solingen_locations__b1a98fc2b8fa531508da39f89b15efa4
klosterwall,"Klosterwall in Solingen, Germany",51.1725033,7.0846748,1,,,,,,,,,CompanyKeyword,"Klosterwall in Solingen, Germany",,german_fires_solingen_locations,66c5cc011bf1aa70bae2275ae879c9df,german_fires_solingen_locations__66c5cc011bf1aa70bae2275ae879c9df
knappenstrasse,"Knappenstrasse in Solingen, Germany",51.1591993,7.0994593,1,,,,,,,,,Consulates,"Knappenstrasse in Solingen, Germany",,german_fires_solingen_locations,8d90dffabcfd41eb75137c7662c0f934,german_fires_solingen_locations__8d90dffabcfd41eb75137c7662c0f934
kocherstrasse,"Kocherstrasse in Solingen, Germany",51.1632175,7.0740039,1,,,,,,,,,CompanyKeyword,"Kocherstrasse in Solingen, Germany",,german_fires_solingen_locations,dbdce2fcee78a3417f41367a45b26c87,german_fires_solingen_locations__dbdce2fcee78a3417f41367a45b26c87
kohlbusch,"Kohlbusch in Solingen, Germany",51.1404442,7.0639179,1,,,,,,,,,Diplomat,"Kohlbusch in Solingen, Germany",,german_fires_solingen_locations,94bd72c5a92ad9bcc10b233cfa68d3bf,german_fires_solingen_locations__94bd72c5a92ad9bcc10b233cfa68d3bf
kohlerfeld,"Kohlerfeld in Solingen, Germany",51.1505633,7.0537028,1,,,,,,,,,AAEntity,"Kohlerfeld in Solingen, Germany",,german_fires_solingen_locations,4de6790a815facb5afc54111feaf7521,german_fires_solingen_locations__4de6790a815facb5afc54111feaf7521
kohlfurth,"Kohlfurth in Solingen, Germany",51.1898197,7.1061683,1,,,,,,,,,News,"Kohlfurth in Solingen, Germany",,german_fires_solingen_locations,f65e090a007d8c49c7f4f4cdfcc0100b,german_fires_solingen_locations__f65e090a007d8c49c7f4f4cdfcc0100b
kohlfurther strasse,"Kohlfurther Strasse in Solingen, Germany",51.1898022,7.10769,1,,,,,,,,,CompanyKeyword,"Kohlfurther Strasse in Solingen, Germany",,german_fires_solingen_locations,e6bc0ba699a24a6272b80c523c870b7c,german_fires_solingen_locations__e6bc0ba699a24a6272b80c523c870b7c
kohlsberg,"Kohlsberg in Solingen, Germany",51.1419751,7.0334149,1,,,,,,,,,Wells,"Kohlsberg in Solingen, Germany",,german_fires_solingen_locations,a644acb7e2dc570d112f5e1ebcc7d2e0,german_fires_solingen_locations__a644acb7e2dc570d112f5e1ebcc7d2e0
kohlsberger hohe,"Kohlsberger Hohe in Solingen, Germany",51.1437482,7.0316885,1,,,,,,,,,CompanyKeyword,"Kohlsberger Hohe in Solingen, Germany",,german_fires_solingen_locations,6497c0793229cfecc11ed91f4fce9e1b,german_fires_solingen_locations__6497c0793229cfecc11ed91f4fce9e1b
kohlsberger strasse,"Kohlsberger Strasse in Solingen, Germany",51.1411824,7.0314741,1,,,,,,,,,News,"Kohlsberger Strasse in Solingen, Germany",,german_fires_solingen_locations,14037766d0cff44e451ae1bbbc9292e8,german_fires_solingen_locations__14037766d0cff44e451ae1bbbc9292e8
kolner strasse,"Kolner Strasse in Solingen, Germany",51.1691816,7.0819228,1,,,,,,,,,DiplomaticFacilities,"Kolner Strasse in Solingen, Germany",,german_fires_solingen_locations,2004634ebc785aeb69d58b3a6ab41916,german_fires_solingen_locations__2004634ebc785aeb69d58b3a6ab41916
kolumbusstrasse,"Kolumbusstrasse in Solingen, Germany",51.1791206,7.0751882,1,,,,,,,,,ForeignMinister,"Kolumbusstrasse in Solingen, Germany",,german_fires_solingen_locations,5745bb7f4c7254368af1470c7eac5a67,german_fires_solingen_locations__5745bb7f4c7254368af1470c7eac5a67
koniggratzer strasse,"Koniggratzer Strasse in Solingen, Germany",51.1628315,7.0225194,1,,,,,,,,,Diplomat,"Koniggratzer Strasse in Solingen, Germany",,german_fires_solingen_locations,8642ccc8ca98da0831343f2d5888ef55,german_fires_solingen_locations__8642ccc8ca98da0831343f2d5888ef55
konigsberger strasse,"Konigsberger Strasse in Solingen, Germany",51.1816243,7.022251,1,,,,,,,,,CompanyKeyword,"Konigsberger Strasse in Solingen, Germany",,german_fires_solingen_locations,e01c3cbbd038f081e2b719a1d4c918d7,german_fires_solingen_locations__e01c3cbbd038f081e2b719a1d4c918d7
konigsmuhle,"Konigsmuhle in Solingen, Germany",51.1528335,7.0762335,1,,,,,,,,,CompanyKeyword,"Konigsmuhle in Solingen, Germany",,german_fires_solingen_locations,e2990530aa7768de480a84309ca17446,german_fires_solingen_locations__e2990530aa7768de480a84309ca17446
konigsmuhler weg,"Konigsmuhler Weg in Solingen, Germany",51.1523919,7.0782192,1,,,,,,,,,Refinery,"Konigsmuhler Weg in Solingen, Germany",,german_fires_solingen_locations,a8b77ba89afd1d7e9b789e6319e74814,german_fires_solingen_locations__a8b77ba89afd1d7e9b789e6319e74814
konrad-adenauer-strasse,"Konrad-Adenauer-Strasse in Solingen, Germany",51.1779472,7.0831672,1,,,,,,,,,Pipeline,"Konrad-Adenauer-Strasse in Solingen, Germany",,german_fires_solingen_locations,7b8db8c64e2ccde0e59a3b8a2a5469b1,german_fires_solingen_locations__7b8db8c64e2ccde0e59a3b8a2a5469b1
kopernikusweg,"Kopernikusweg in Solingen, Germany",51.1515018,7.1051669,1,,,,,,,,,Exec,"Kopernikusweg in Solingen, Germany",,german_fires_solingen_locations,76a08feebd707ee54a07e66407e5a488,german_fires_solingen_locations__76a08feebd707ee54a07e66407e5a488
kornerstrasse,"Kornerstrasse in Solingen, Germany",51.1598,7.0967394,1,,,,,,,,,Shipping,"Kornerstrasse in Solingen, Germany",,german_fires_solingen_locations,8a93808c731ea344564d6a566b44477a,german_fires_solingen_locations__8a93808c731ea344564d6a566b44477a
kornstrasse,"Kornstrasse in Solingen, Germany",51.1737998,7.0252333,1,,,,,,,,,Media,"Kornstrasse in Solingen, Germany",,german_fires_solingen_locations,5dcb0d8265e6fecd23e4efc314140d3f,german_fires_solingen_locations__5dcb0d8265e6fecd23e4efc314140d3f
kotten,"Kotten in Solingen, Germany",51.1661034,7.0586328,1,,,,,,,,,Exec,"Kotten in Solingen, Germany",,german_fires_solingen_locations,beb943d04c508da236e0bbc382f4f8d6,german_fires_solingen_locations__beb943d04c508da236e0bbc382f4f8d6
kottendorfer strasse,"Kottendorfer Strasse in Solingen, Germany",51.168373,7.0005979,1,,,,,,,,,Pipeline,"Kottendorfer Strasse in Solingen, Germany",,german_fires_solingen_locations,ceaa2c2039404140dc1bc947b9b44cd0,german_fires_solingen_locations__ceaa2c2039404140dc1bc947b9b44cd0
kotter feldweg,"Kotter Feldweg in Solingen, Germany",51.1623007,7.0592862,1,,,,,,,,,AAEntity,"Kotter Feldweg in Solingen, Germany",,german_fires_solingen_locations,b4c775335d523cea08c65ef646becbf2,german_fires_solingen_locations__b4c775335d523cea08c65ef646becbf2
kotter strasse,"Kotter Strasse in Solingen, Germany",51.1705376,7.0703279,1,,,,,,,,,Organization,"Kotter Strasse in Solingen, Germany",,german_fires_solingen_locations,7097d35d86ca74f99b203a0cbdb89c6a,german_fires_solingen_locations__7097d35d86ca74f99b203a0cbdb89c6a
kotterheidberg,"Kotterheidberg in Solingen, Germany",51.1658818,7.0646406,1,,,,,,,,,Exec,"Kotterheidberg in Solingen, Germany",,german_fires_solingen_locations,b8836c1e54e33c772db95b71e9354a4a,german_fires_solingen_locations__b8836c1e54e33c772db95b71e9354a4a
kottermuhlenstrasse,"Kottermuhlenstrasse in Solingen, Germany",51.1640369,7.0667598,1,,,,,,,,,DiplomaticFacilities,"Kottermuhlenstrasse in Solingen, Germany",,german_fires_solingen_locations,aefa61056f4903b96191b1d4319031b9,german_fires_solingen_locations__aefa61056f4903b96191b1d4319031b9
kotzerter strasse,"Kotzerter Strasse in Solingen, Germany",51.1970316,7.0438507,1,,,,,,,,,ForeignMinistry,"Kotzerter Strasse in Solingen, Germany",,german_fires_solingen_locations,c84fc40c1d95d9bab531102649764bad,german_fires_solingen_locations__c84fc40c1d95d9bab531102649764bad
kovelenberg,"Kovelenberg in Solingen, Germany",51.1640306,6.9777277,1,,,,,,,,,Legislator,"Kovelenberg in Solingen, Germany",,german_fires_solingen_locations,428eee8f54d8da6b14f061f982515c67,german_fires_solingen_locations__428eee8f54d8da6b14f061f982515c67
krahenhoher weg,"Krahenhoher Weg in Solingen, Germany",51.1618095,7.1230926,1,,,,,,,,,Wells,"Krahenhoher Weg in Solingen, Germany",,german_fires_solingen_locations,59a477d8652e0bbda8e6785d40b2b762,german_fires_solingen_locations__59a477d8652e0bbda8e6785d40b2b762
kranichweg,"Kranichweg in Solingen, Germany",51.1506357,7.0737964,1,,,,,,,,,ForeignMinistry,"Kranichweg in Solingen, Germany",,german_fires_solingen_locations,b402f3b6d5e48d0e50212bcdd8a614dd,german_fires_solingen_locations__b402f3b6d5e48d0e50212bcdd8a614dd
krausen,"Krausen in Solingen, Germany",51.1828517,7.0296043,1,,,,,,,,,Diplomat,"Krausen in Solingen, Germany",,german_fires_solingen_locations,e2c8b1788e9370ec6458727aa7ae7ba2,german_fires_solingen_locations__e2c8b1788e9370ec6458727aa7ae7ba2
krausener strasse,"Krausener Strasse in Solingen, Germany",51.1817839,7.0286596,1,,,,,,,,,CompanyKeyword,"Krausener Strasse in Solingen, Germany",,german_fires_solingen_locations,02de664f6c39bafd05e76a3956f82568,german_fires_solingen_locations__02de664f6c39bafd05e76a3956f82568
krautstrasse,"Krautstrasse in Solingen, Germany",51.1852519,7.0317279,1,,,,,,,,,IndustryTerm,"Krautstrasse in Solingen, Germany",,german_fires_solingen_locations,823bb40b5cea4c71c3283c1167bcfb37,german_fires_solingen_locations__823bb40b5cea4c71c3283c1167bcfb37
kreuzstrasse,"Kreuzstrasse in Solingen, Germany",51.1762289,7.0809383,1,,,,,,,,,Media,"Kreuzstrasse in Solingen, Germany",,german_fires_solingen_locations,fa20fa9990c96694f2f66ad8a1c6a9f4,german_fires_solingen_locations__fa20fa9990c96694f2f66ad8a1c6a9f4
kreuzweger strasse,"Kreuzweger Strasse in Solingen, Germany",51.1756882,7.0634617,1,,,,,,,,,Shipping,"Kreuzweger Strasse in Solingen, Germany",,german_fires_solingen_locations,506ac590ae6ab12c7cfcaa53ab8e1cb6,german_fires_solingen_locations__506ac590ae6ab12c7cfcaa53ab8e1cb6
kriemhildenstrasse,"Kriemhildenstrasse in Solingen, Germany",51.1909775,7.0775068,1,,,,,,,,,News,"Kriemhildenstrasse in Solingen, Germany",,german_fires_solingen_locations,d2bc1e560d7bac3c2058a66064f15ef5,german_fires_solingen_locations__d2bc1e560d7bac3c2058a66064f15ef5
kronenstrasse,"Kronenstrasse in Solingen, Germany",51.1625519,7.0126789,1,,,,,,,,,Diplomat,"Kronenstrasse in Solingen, Germany",,german_fires_solingen_locations,3f582ce0d7589e6d62b536a059e1e00a,german_fires_solingen_locations__3f582ce0d7589e6d62b536a059e1e00a
kronprinzenstrasse,"Kronprinzenstrasse in Solingen, Germany",51.1781686,7.0769276,1,,,,,,,,,Organization,"Kronprinzenstrasse in Solingen, Germany",,german_fires_solingen_locations,e3100456b96a8372877091e61bfe9064,german_fires_solingen_locations__e3100456b96a8372877091e61bfe9064
krudersheide,"Krudersheide in Solingen, Germany",51.14775,6.978723,1,,,,,,,,,Refinery,"Krudersheide in Solingen, Germany",,german_fires_solingen_locations,9bd5cd16d920bfa70128e2ddbaf25dc0,german_fires_solingen_locations__9bd5cd16d920bfa70128e2ddbaf25dc0
kuckesberger weg,"Kuckesberger Weg in Solingen, Germany",51.1740103,6.9984697,1,,,,,,,,,ForeignMinister,"Kuckesberger Weg in Solingen, Germany",,german_fires_solingen_locations,bc9d82f31462ea869f0c75774cf87fd3,german_fires_solingen_locations__bc9d82f31462ea869f0c75774cf87fd3
kulle,"Kulle in Solingen, Germany",51.1384678,7.0617379,1,,,,,,,,,Pipeline,"Kulle in Solingen, Germany",,german_fires_solingen_locations,593d03347f5e64436884fc94f8421bff,german_fires_solingen_locations__593d03347f5e64436884fc94f8421bff
kuller strasse,"Kuller Strasse in Solingen, Germany",51.1824676,7.0855991,1,,,,,,,,,Media,"Kuller Strasse in Solingen, Germany",,german_fires_solingen_locations,182513d063eefeb99ece8c1dce4c2116,german_fires_solingen_locations__182513d063eefeb99ece8c1dce4c2116
kullersberg,"Kullersberg in Solingen, Germany",51.2091542,7.0708263,1,,,,,,,,,Wells,"Kullersberg in Solingen, Germany",,german_fires_solingen_locations,21df19404bcd5e784f7e6560da8a370e,german_fires_solingen_locations__21df19404bcd5e784f7e6560da8a370e
kuppersfeld,"Kuppersfeld in Solingen, Germany",51.1740826,7.0967041,1,,,,,,,,,Exec,"Kuppersfeld in Solingen, Germany",,german_fires_solingen_locations,74581edaf0b31e8f5af7bbb0d4e655be,german_fires_solingen_locations__74581edaf0b31e8f5af7bbb0d4e655be
kurfurstenstrasse,"Kurfurstenstrasse in Solingen, Germany",51.1765895,7.0822662,1,,,,,,,,,IndustryTerm,"Kurfurstenstrasse in Solingen, Germany",,german_fires_solingen_locations,7a5f6420c5d3e45e89cc31dbee7bb534,german_fires_solingen_locations__7a5f6420c5d3e45e89cc31dbee7bb534
kurze strasse,"Kurze Strasse in Solingen, Germany",51.1803137,7.0920281,1,,,,,,,,,FTO,"Kurze Strasse in Solingen, Germany",,german_fires_solingen_locations,3d3b07e66d8436802088c5687347078b,german_fires_solingen_locations__3d3b07e66d8436802088c5687347078b
kustergasse,"Kustergasse in Solingen, Germany",51.1713358,7.0842718,1,,,,,,,,,Wells,"Kustergasse in Solingen, Germany",,german_fires_solingen_locations,c85cb34dea5da8c390f2d09ac6a81099,german_fires_solingen_locations__c85cb34dea5da8c390f2d09ac6a81099
kyffhauserstrasse,"Kyffhauserstrasse in Solingen, Germany",51.1735684,7.0875253,1,,,,,,,,,AAEntity,"Kyffhauserstrasse in Solingen, Germany",,german_fires_solingen_locations,9536cb4d3faa6be389f14ebc44e6048f,german_fires_solingen_locations__9536cb4d3faa6be389f14ebc44e6048f
kyllmannweg,"Kyllmannweg in Solingen, Germany",51.169374,7.0364028,1,,,,,,,,,Pipeline,"Kyllmannweg in Solingen, Germany",,german_fires_solingen_locations,6b2e9aa53cf07206779d8374ea4c6be2,german_fires_solingen_locations__6b2e9aa53cf07206779d8374ea4c6be2
lacher feld,"Lacher Feld in Solingen, Germany",51.1391303,7.0667639,1,,,,,,,,,Wells,"Lacher Feld in Solingen, Germany",,german_fires_solingen_locations,31b40b5898c324652f8cfbda78995945,german_fires_solingen_locations__31b40b5898c324652f8cfbda78995945
lacher strasse,"Lacher Strasse in Solingen, Germany",51.1388289,7.0506075,1,,,,,,,,,AAEntity,"Lacher Strasse in Solingen, Germany",,german_fires_solingen_locations,eea2653f51304672d027a47833bba585,german_fires_solingen_locations__eea2653f51304672d027a47833bba585
lahnstrasse,"Lahnstrasse in Solingen, Germany",51.157965,6.996378,1,,,,,,,,,LegislativeCommittee,"Lahnstrasse in Solingen, Germany",,german_fires_solingen_locations,c47ee4c4e0348c81721ccb2148944ad8,german_fires_solingen_locations__c47ee4c4e0348c81721ccb2148944ad8
laibacher strasse,"Laibacher Strasse in Solingen, Germany",51.1691592,6.9870711,1,,,,,,,,,FTO,"Laibacher Strasse in Solingen, Germany",,german_fires_solingen_locations,02117944b589a8f12184d997106a5eb0,german_fires_solingen_locations__02117944b589a8f12184d997106a5eb0
laiken,"Laiken in Solingen, Germany",51.2079886,7.0881838,1,,,,,,,,,Media,"Laiken in Solingen, Germany",,german_fires_solingen_locations,be13738224f602295c42c1ee33e9c74f,german_fires_solingen_locations__be13738224f602295c42c1ee33e9c74f
landhausstrasse,"Landhausstrasse in Solingen, Germany",51.1906208,7.0839736,1,,,,,,,,,Wells,"Landhausstrasse in Solingen, Germany",,german_fires_solingen_locations,8cc103ff70c3bec4b89192c6cc12d769,german_fires_solingen_locations__8cc103ff70c3bec4b89192c6cc12d769
landwehr,"Landwehr in Solingen, Germany",51.1318153,6.9975644,1,,,,,,,,,Refinery,"Landwehr in Solingen, Germany",,german_fires_solingen_locations,31cf25c4a106a70d3c2d861a949179c7,german_fires_solingen_locations__31cf25c4a106a70d3c2d861a949179c7
landwehrstrasse,"Landwehrstrasse in Solingen, Germany",51.1349033,7.0035551,1,,,,,,,,,ForeignMinistry,"Landwehrstrasse in Solingen, Germany",,german_fires_solingen_locations,b2cede9fb46e991d3ecf360c289368bf,german_fires_solingen_locations__b2cede9fb46e991d3ecf360c289368bf
langhansstrasse,"Langhansstrasse in Solingen, Germany",51.1533728,6.9867392,1,,,,,,,,,LegislativeCommittee,"Langhansstrasse in Solingen, Germany",,german_fires_solingen_locations,c8033c861943ec409c2a3cb82c1452e2,german_fires_solingen_locations__c8033c861943ec409c2a3cb82c1452e2
lehmbruckstrasse,"Lehmbruckstrasse in Solingen, Germany",51.1825083,7.028011,1,,,,,,,,,Legislator,"Lehmbruckstrasse in Solingen, Germany",,german_fires_solingen_locations,38f36d884fe175f5729b2ed2033e55f3,german_fires_solingen_locations__38f36d884fe175f5729b2ed2033e55f3
lehmkuhle,"Lehmkuhle in Solingen, Germany",51.140751,7.1442938,1,,,,,,,,,News,"Lehmkuhle in Solingen, Germany",,german_fires_solingen_locations,cf76427bca44e138ce332758f1fe961e,german_fires_solingen_locations__cf76427bca44e138ce332758f1fe961e
lehn,"Lehn in Solingen, Germany",51.1809205,7.0640077,1,,,,,,,,,Keyphrase,"Lehn in Solingen, Germany",,german_fires_solingen_locations,aae8b0ee54f1a2b1a1956a4b62e2cdc9,german_fires_solingen_locations__aae8b0ee54f1a2b1a1956a4b62e2cdc9
lehner strasse,"Lehner Strasse in Solingen, Germany",51.1795602,7.0619719,1,,,,,,,,,AAEntity,"Lehner Strasse in Solingen, Germany",,german_fires_solingen_locations,07b4a6adbb814740fe13fed18dab8048,german_fires_solingen_locations__07b4a6adbb814740fe13fed18dab8048
leibnizstrasse,"Leibnizstrasse in Solingen, Germany",51.1689138,7.0181092,1,,,,,,,,,ForeignMinister,"Leibnizstrasse in Solingen, Germany",,german_fires_solingen_locations,f61a98d156308708f7b46b3d009c62bb,german_fires_solingen_locations__f61a98d156308708f7b46b3d009c62bb
leichlinger strasse,"Leichlinger Strasse in Solingen, Germany",51.1378285,7.0263046,1,,,,,,,,,Person,"Leichlinger Strasse in Solingen, Germany",,german_fires_solingen_locations,3a60eda1dfe1bb2956647af7b5620655,german_fires_solingen_locations__3a60eda1dfe1bb2956647af7b5620655
leipziger strasse,"Leipziger Strasse in Solingen, Germany",51.1689807,7.0079521,1,,,,,,,,,Wells,"Leipziger Strasse in Solingen, Germany",,german_fires_solingen_locations,da496b4e5ac6d789e20bad59c570c985,german_fires_solingen_locations__da496b4e5ac6d789e20bad59c570c985
