german_text,caption_text,lat,lon,ranking,default location,default_lat,default_lon,.1,.2,.3,.4,.5,ENTITY_LABEL,name,description,source,source_identifier,global_identifier
pfaffenberg,"Pfaffenberg in Solingen, Germany",51.1388844,7.115746,1,,,,,,,,,DiplomaticFacilities,"Pfaffenberg in Solingen, Germany",,german_fires_solingen_locations,1254bc2a3fc195e5382c79b0655e86d3,german_fires_solingen_locations__1254bc2a3fc195e5382c79b0655e86d3
pfaffenberger weg,"Pfaffenberger Weg in Solingen, Germany",51.1462908,7.1095596,1,,,,,,,,,ForeignMinister,"Pfaffenberger Weg in Solingen, Germany",,german_fires_solingen_locations,7642180d1070fdf169cbc3793ad73c4a,german_fires_solingen_locations__7642180d1070fdf169cbc3793ad73c4a
pfalzstrasse,"Pfalzstrasse in Solingen, Germany",51.1651553,7.1042863,1,,,,,,,,,Keyphrase,"Pfalzstrasse in Solingen, Germany",,german_fires_solingen_locations,250fdac05fb3c9df68afa26cffae144b,german_fires_solingen_locations__250fdac05fb3c9df68afa26cffae144b
pfeilstrasse,"Pfeilstrasse in Solingen, Germany",51.1617118,7.0187477,1,,,,,,,,,Keyphrase,"Pfeilstrasse in Solingen, Germany",,german_fires_solingen_locations,a278969dcc86a75b8dd28290223e5a52,german_fires_solingen_locations__a278969dcc86a75b8dd28290223e5a52
pfitznerweg,"Pfitznerweg in Solingen, Germany",51.1838576,7.0612732,1,,,,,,,,,Diplomat,"Pfitznerweg in Solingen, Germany",,german_fires_solingen_locations,6c2f740bfe7a0f310d5f5b3c19006872,german_fires_solingen_locations__6c2f740bfe7a0f310d5f5b3c19006872
pflugweg,"Pflugweg in Solingen, Germany",51.1555422,7.043709,1,,,,,,,,,Shipping,"Pflugweg in Solingen, Germany",,german_fires_solingen_locations,bdf353ec40801eb6ebb782a7975ea079,german_fires_solingen_locations__bdf353ec40801eb6ebb782a7975ea079
piepersberg,"Piepersberg in Solingen, Germany",51.2129481,7.066213,1,,,,,,,,,LegislativeCommittee,"Piepersberg in Solingen, Germany",,german_fires_solingen_locations,fd9dfacbb1aa740decb3bcf90193a3f8,german_fires_solingen_locations__fd9dfacbb1aa740decb3bcf90193a3f8
pilghauser strasse,"Pilghauser Strasse in Solingen, Germany",51.1601307,7.0646866,1,,,,,,,,,IndustryTerm,"Pilghauser Strasse in Solingen, Germany",,german_fires_solingen_locations,2a254d4f464c607eae64a42aa89534bb,german_fires_solingen_locations__2a254d4f464c607eae64a42aa89534bb
pina-bausch-strasse,"Pina-Bausch-Strasse in Solingen, Germany",51.1917822,7.0667406,1,,,,,,,,,Exec,"Pina-Bausch-Strasse in Solingen, Germany",,german_fires_solingen_locations,a1d20b8e5217f67f5070df697f1a5b57,german_fires_solingen_locations__a1d20b8e5217f67f5070df697f1a5b57
pirolweg,"Pirolweg in Solingen, Germany",51.1499385,7.0747522,1,,,,,,,,,LegislativeCommittee,"Pirolweg in Solingen, Germany",,german_fires_solingen_locations,ead512918c7246922f7f458604497bb0,german_fires_solingen_locations__ead512918c7246922f7f458604497bb0
platzhof,"Platzhof in Solingen, Germany",51.151274,7.0699199,1,,,,,,,,,Wells,"Platzhof in Solingen, Germany",,german_fires_solingen_locations,a54094e047249b5c9fc73ba28516245b,german_fires_solingen_locations__a54094e047249b5c9fc73ba28516245b
platzhofstrasse,"Platzhofstrasse in Solingen, Germany",51.1523618,7.0729621,1,,,,,,,,,FTO,"Platzhofstrasse in Solingen, Germany",,german_fires_solingen_locations,30cd4d326b6785af5e63b2a6d598752c,german_fires_solingen_locations__30cd4d326b6785af5e63b2a6d598752c
plutoweg,"Plutoweg in Solingen, Germany",51.1673039,7.0089851,1,,,,,,,,,Pipeline,"Plutoweg in Solingen, Germany",,german_fires_solingen_locations,c7949bb41eaaf92018a667ed61953b54,german_fires_solingen_locations__c7949bb41eaaf92018a667ed61953b54
pommernweg,"Pommernweg in Solingen, Germany",51.1651033,7.1087026,1,,,,,,,,,Shipping,"Pommernweg in Solingen, Germany",,german_fires_solingen_locations,2ce1905d64a95ce017b8574dc8a81c46,german_fires_solingen_locations__2ce1905d64a95ce017b8574dc8a81c46
poschheider strasse,"Poschheider Strasse in Solingen, Germany",51.1648077,7.0122212,1,,,,,,,,,Wells,"Poschheider Strasse in Solingen, Germany",,german_fires_solingen_locations,5bcbec5cfd79545978e3adc18d636ff5,german_fires_solingen_locations__5bcbec5cfd79545978e3adc18d636ff5
poststrasse,"Poststrasse in Solingen, Germany",51.1832548,7.0441645,1,,,,,,,,,News,"Poststrasse in Solingen, Germany",,german_fires_solingen_locations,bb6c9ea032038a72d169333c7b789c68,german_fires_solingen_locations__bb6c9ea032038a72d169333c7b789c68
potsdamer strasse,"Potsdamer Strasse in Solingen, Germany",51.1779501,7.0849756,1,,,,,,,,,Consulates,"Potsdamer Strasse in Solingen, Germany",,german_fires_solingen_locations,13434493ba779ba145b2755ee37e83b6,german_fires_solingen_locations__13434493ba779ba145b2755ee37e83b6
potshauser strasse,"Potshauser Strasse in Solingen, Germany",51.1782199,7.0894545,1,,,,,,,,,ForeignMinister,"Potshauser Strasse in Solingen, Germany",,german_fires_solingen_locations,b012e8e55d73ac8b646592b19eaa628a,german_fires_solingen_locations__b012e8e55d73ac8b646592b19eaa628a
pottweg,"Pottweg in Solingen, Germany",51.1548739,7.0883832,1,,,,,,,,,space,"Pottweg in Solingen, Germany",,german_fires_solingen_locations,40a7ebdcca93c1483e4f8310bc7382bc,german_fires_solingen_locations__40a7ebdcca93c1483e4f8310bc7382bc
potzhofer strasse,"Potzhofer Strasse in Solingen, Germany",51.1642115,6.9920096,1,,,,,,,,,CompanyKeyword,"Potzhofer Strasse in Solingen, Germany",,german_fires_solingen_locations,e6918886258914599a7d53b335c5af4c,german_fires_solingen_locations__e6918886258914599a7d53b335c5af4c
prinzenstrasse,"Prinzenstrasse in Solingen, Germany",51.1716667,7.0072492,1,,,,,,,,,Keyphrase,"Prinzenstrasse in Solingen, Germany",,german_fires_solingen_locations,c544d40ea434c32f76424458c17052d1,german_fires_solingen_locations__c544d40ea434c32f76424458c17052d1
propstweg,"Propstweg in Solingen, Germany",51.2053354,7.0790201,1,,,,,,,,,DiplomaticFacilities,"Propstweg in Solingen, Germany",,german_fires_solingen_locations,775ac4a75983aeaf3c777fdab48cbd22,german_fires_solingen_locations__775ac4a75983aeaf3c777fdab48cbd22
putzfeld,"Putzfeld in Solingen, Germany",51.1532375,7.0374683,1,,,,,,,,,Person,"Putzfeld in Solingen, Germany",,german_fires_solingen_locations,a071dc633afb7f63f55478909adb5dbe,german_fires_solingen_locations__a071dc633afb7f63f55478909adb5dbe
putzgasse,"Putzgasse in Solingen, Germany",51.1840086,7.0407835,1,,,,,,,,,Shipping,"Putzgasse in Solingen, Germany",,german_fires_solingen_locations,fe253d33d8d8fc6da1383e5b1186fb20,german_fires_solingen_locations__fe253d33d8d8fc6da1383e5b1186fb20
querstrasse,"Querstrasse in Solingen, Germany",51.1602997,7.0120913,1,,,,,,,,,Media,"Querstrasse in Solingen, Germany",,german_fires_solingen_locations,9d191eddebad53dcb8a9f994289a6e97,german_fires_solingen_locations__9d191eddebad53dcb8a9f994289a6e97
raabestrasse,"Raabestrasse in Solingen, Germany",51.1672013,7.0731975,1,,,,,,,,,IndustryTerm,"Raabestrasse in Solingen, Germany",,german_fires_solingen_locations,8c4519fda501b2f9aac1736a496b648e,german_fires_solingen_locations__8c4519fda501b2f9aac1736a496b648e
raffaelstrasse,"Raffaelstrasse in Solingen, Germany",51.1846599,7.0495632,1,,,,,,,,,FTO,"Raffaelstrasse in Solingen, Germany",,german_fires_solingen_locations,a579005ac01b40d8120895f6ef1a3389,german_fires_solingen_locations__a579005ac01b40d8120895f6ef1a3389
rankestrasse,"Rankestrasse in Solingen, Germany",51.1933055,7.0546002,1,,,,,,,,,Diplomat,"Rankestrasse in Solingen, Germany",,german_fires_solingen_locations,29db54ecd1c08a2042edec75a572e3b6,german_fires_solingen_locations__29db54ecd1c08a2042edec75a572e3b6
rathausstrasse,"Rathausstrasse in Solingen, Germany",51.1645467,7.089507,1,,,,,,,,,Pipeline,"Rathausstrasse in Solingen, Germany",,german_fires_solingen_locations,ccaf37bc21f43a1ba87122e3e19f4c5f,german_fires_solingen_locations__ccaf37bc21f43a1ba87122e3e19f4c5f
rathland,"Rathland in Solingen, Germany",51.1949609,7.0933746,1,,,,,,,,,Consulates,"Rathland in Solingen, Germany",,german_fires_solingen_locations,cfc8a4a87a250ffc7340fcc514566805,german_fires_solingen_locations__cfc8a4a87a250ffc7340fcc514566805
ratinger weg,"Ratinger Weg in Solingen, Germany",51.1676678,6.9882781,1,,,,,,,,,CompanyKeyword,"Ratinger Weg in Solingen, Germany",,german_fires_solingen_locations,3b70c770fcb97f06f0f23049f9090660,german_fires_solingen_locations__3b70c770fcb97f06f0f23049f9090660
rechenweg,"Rechenweg in Solingen, Germany",51.1566261,7.044852,1,,,,,,,,,ForeignMinistry,"Rechenweg in Solingen, Germany",,german_fires_solingen_locations,3d54c217f21b4f4760380b65009bffe3,german_fires_solingen_locations__3d54c217f21b4f4760380b65009bffe3
rechtweg,"Rechtweg in Solingen, Germany",51.1689619,7.0337405,1,,,,,,,,,Media,"Rechtweg in Solingen, Germany",,german_fires_solingen_locations,0fcef8e599e410a40192407120d9a7c8,german_fires_solingen_locations__0fcef8e599e410a40192407120d9a7c8
regerstrasse,"Regerstrasse in Solingen, Germany",51.1501086,7.0673223,1,,,,,,,,,FTO,"Regerstrasse in Solingen, Germany",,german_fires_solingen_locations,83fc4b7ea39d34bd6a2c5bacf5c85eed,german_fires_solingen_locations__83fc4b7ea39d34bd6a2c5bacf5c85eed
rehpfad,"Rehpfad in Solingen, Germany",51.1472461,7.1267671,1,,,,,,,,,FTO,"Rehpfad in Solingen, Germany",,german_fires_solingen_locations,e11976e55f249f22b23cba7a4182e429,german_fires_solingen_locations__e11976e55f249f22b23cba7a4182e429
reiderstrasse,"Reiderstrasse in Solingen, Germany",51.1674612,7.0584539,1,,,,,,,,,Pipeline,"Reiderstrasse in Solingen, Germany",,german_fires_solingen_locations,ff628b99fd3f89bdfc727ed1b2e99b32,german_fires_solingen_locations__ff628b99fd3f89bdfc727ed1b2e99b32
reinekeweg,"Reinekeweg in Solingen, Germany",51.1965748,7.0660477,1,,,,,,,,,FTO,"Reinekeweg in Solingen, Germany",,german_fires_solingen_locations,f129bfe136c01d6191d171e4555a2da3,german_fires_solingen_locations__f129bfe136c01d6191d171e4555a2da3
reisstrasse,"Reisstrasse in Solingen, Germany",51.1800016,7.0215547,1,,,,,,,,,Diplomat,"Reisstrasse in Solingen, Germany",,german_fires_solingen_locations,faa028681b3394d6f1b387e8980ccba4,german_fires_solingen_locations__faa028681b3394d6f1b387e8980ccba4
rembrandtstrasse,"Rembrandtstrasse in Solingen, Germany",51.1802197,7.0420241,1,,,,,,,,,Shipping,"Rembrandtstrasse in Solingen, Germany",,german_fires_solingen_locations,b49ae6909502a8ba836d531b690e8f4d,german_fires_solingen_locations__b49ae6909502a8ba836d531b690e8f4d
remscheider strasse,"Remscheider Strasse in Solingen, Germany",51.1681428,7.1265182,1,,,,,,,,,Wells,"Remscheider Strasse in Solingen, Germany",,german_fires_solingen_locations,1af2b54e0c76747d337123bf1bfa0e01,german_fires_solingen_locations__1af2b54e0c76747d337123bf1bfa0e01
rennpatt,"Rennpatt in Solingen, Germany",51.1652156,7.0017295,1,,,,,,,,,Media,"Rennpatt in Solingen, Germany",,german_fires_solingen_locations,402a97444903bbc6a0dd2613aa3a45b5,german_fires_solingen_locations__402a97444903bbc6a0dd2613aa3a45b5
rheinstrasse,"Rheinstrasse in Solingen, Germany",51.1595458,6.998012,1,,,,,,,,,IndustryTerm,"Rheinstrasse in Solingen, Germany",,german_fires_solingen_locations,6437d1d569da8866d2e87896b15f37e6,german_fires_solingen_locations__6437d1d569da8866d2e87896b15f37e6
richard-wagner-strasse,"Richard-Wagner-Strasse in Solingen, Germany",51.1810811,7.0727105,1,,,,,,,,,IndustryTerm,"Richard-Wagner-Strasse in Solingen, Germany",,german_fires_solingen_locations,db8e781e7c202dd25b6b9fe7b20f0a0c,german_fires_solingen_locations__db8e781e7c202dd25b6b9fe7b20f0a0c
richrather strasse,"Richrather Strasse in Solingen, Germany",51.1662899,6.9848243,1,,,,,,,,,Organization,"Richrather Strasse in Solingen, Germany",,german_fires_solingen_locations,8e81a3c387a12978802b60641cba4b28,german_fires_solingen_locations__8e81a3c387a12978802b60641cba4b28
richterweg,"Richterweg in Solingen, Germany",51.1684833,7.0353172,1,,,,,,,,,Exec,"Richterweg in Solingen, Germany",,german_fires_solingen_locations,5d5b800650a81de0fbf2a1d79f01d640,german_fires_solingen_locations__5d5b800650a81de0fbf2a1d79f01d640
riefnacken,"Riefnacken in Solingen, Germany",51.1542438,7.0176237,1,,,,,,,,,AAEntity,"Riefnacken in Solingen, Germany",,german_fires_solingen_locations,b10d9e2f5e200f5c6c6a0993a5501e19,german_fires_solingen_locations__b10d9e2f5e200f5c6c6a0993a5501e19
rilkestrasse,"Rilkestrasse in Solingen, Germany",51.1534073,7.0106131,1,,,,,,,,,Organization,"Rilkestrasse in Solingen, Germany",,german_fires_solingen_locations,efffa6a25e02b2591985c562aedb2b9d,german_fires_solingen_locations__efffa6a25e02b2591985c562aedb2b9d
ringelshauschen,"Ringelshauschen in Solingen, Germany",51.1953796,7.0888002,1,,,,,,,,,Exec,"Ringelshauschen in Solingen, Germany",,german_fires_solingen_locations,53c103a4817d4058e4d0b7287c562b42,german_fires_solingen_locations__53c103a4817d4058e4d0b7287c562b42
ringelstrasse,"Ringelstrasse in Solingen, Germany",51.1962369,7.0771688,1,,,,,,,,,Wells,"Ringelstrasse in Solingen, Germany",,german_fires_solingen_locations,601436c245630ed526187985bc304e69,german_fires_solingen_locations__601436c245630ed526187985bc304e69
ringstrasse,"Ringstrasse in Solingen, Germany",51.1775971,7.0280712,1,,,,,,,,,Refinery,"Ringstrasse in Solingen, Germany",,german_fires_solingen_locations,a72550aeb9e44b7ca594e0f65f17a381,german_fires_solingen_locations__a72550aeb9e44b7ca594e0f65f17a381
ritaweg,"Ritaweg in Solingen, Germany",51.1808117,7.0934658,1,,,,,,,,,DiplomaticFacilities,"Ritaweg in Solingen, Germany",,german_fires_solingen_locations,626a6070226616a511b0c0f02f633cd1,german_fires_solingen_locations__626a6070226616a511b0c0f02f633cd1
ritterstrasse,"Ritterstrasse in Solingen, Germany",51.1581239,7.0991191,1,,,,,,,,,Diplomat,"Ritterstrasse in Solingen, Germany",,german_fires_solingen_locations,806ae596ad8e0b3d0bba70eaa401b842,german_fires_solingen_locations__806ae596ad8e0b3d0bba70eaa401b842
robert-blum-weg,"Robert-Blum-Weg in Solingen, Germany",51.1578615,7.0778091,1,,,,,,,,,Refinery,"Robert-Blum-Weg in Solingen, Germany",,german_fires_solingen_locations,a8dc0e7ce6b2e9c7f29a99ab0886127a,german_fires_solingen_locations__a8dc0e7ce6b2e9c7f29a99ab0886127a
robert-klaas-strasse,"Robert-Klaas-Strasse in Solingen, Germany",51.1624745,7.0192565,1,,,,,,,,,Pipeline,"Robert-Klaas-Strasse in Solingen, Germany",,german_fires_solingen_locations,7b4268e461c928189bff0837a896091f,german_fires_solingen_locations__7b4268e461c928189bff0837a896091f
robert-koch-strasse,"Robert-Koch-Strasse in Solingen, Germany",51.1759216,7.1003834,1,,,,,,,,,Refinery,"Robert-Koch-Strasse in Solingen, Germany",,german_fires_solingen_locations,4e6d3d16a5214024e58ce686a304cf3e,german_fires_solingen_locations__4e6d3d16a5214024e58ce686a304cf3e
roggenkamp,"Roggenkamp in Solingen, Germany",51.2108189,7.062088,1,,,,,,,,,Refinery,"Roggenkamp in Solingen, Germany",,german_fires_solingen_locations,affb7c035bfd138adec619c137259638,german_fires_solingen_locations__affb7c035bfd138adec619c137259638
rolandstrasse,"Rolandstrasse in Solingen, Germany",51.1802739,7.1056989,1,,,,,,,,,Exec,"Rolandstrasse in Solingen, Germany",,german_fires_solingen_locations,33be39a32da03f0156d8244ed7e6b333,german_fires_solingen_locations__33be39a32da03f0156d8244ed7e6b333
rolsberg,"Rolsberg in Solingen, Germany",51.1857254,7.02351,1,,,,,,,,,Refinery,"Rolsberg in Solingen, Germany",,german_fires_solingen_locations,127e14f7027182c5078ffff83b34dc00,german_fires_solingen_locations__127e14f7027182c5078ffff83b34dc00
rolsberger strasse,"Rolsberger Strasse in Solingen, Germany",51.1846927,7.0255668,1,,,,,,,,,DiplomaticFacilities,"Rolsberger Strasse in Solingen, Germany",,german_fires_solingen_locations,4387df1dd03427f0358ffb66cf5c82b4,german_fires_solingen_locations__4387df1dd03427f0358ffb66cf5c82b4
rolscheider strasse,"Rolscheider Strasse in Solingen, Germany",51.1356918,7.06881,1,,,,,,,,,News,"Rolscheider Strasse in Solingen, Germany",,german_fires_solingen_locations,81adff98522c6693da1837d46bc21a98,german_fires_solingen_locations__81adff98522c6693da1837d46bc21a98
rontgenstrasse,"Rontgenstrasse in Solingen, Germany",51.1716924,7.0237311,1,,,,,,,,,Organization,"Rontgenstrasse in Solingen, Germany",,german_fires_solingen_locations,1fb541395141266b0377b822a4c11c06,german_fires_solingen_locations__1fb541395141266b0377b822a4c11c06
roonstrasse,"Roonstrasse in Solingen, Germany",51.1678221,7.025218,1,,,,,,,,,ForeignMinistry,"Roonstrasse in Solingen, Germany",,german_fires_solingen_locations,ecce1622ab65bec8b8be02a6542d7e52,german_fires_solingen_locations__ecce1622ab65bec8b8be02a6542d7e52
roseggerstrasse,"Roseggerstrasse in Solingen, Germany",51.1605961,7.0580554,1,,,,,,,,,News,"Roseggerstrasse in Solingen, Germany",,german_fires_solingen_locations,83f9e952ee16fe8221c51f1ba06dc5ef,german_fires_solingen_locations__83f9e952ee16fe8221c51f1ba06dc5ef
rosenkamper strasse,"Rosenkamper Strasse in Solingen, Germany",51.178357,7.0381462,1,,,,,,,,,Exec,"Rosenkamper Strasse in Solingen, Germany",,german_fires_solingen_locations,c580ca7b75e06ded0548b16695def9dd,german_fires_solingen_locations__c580ca7b75e06ded0548b16695def9dd
rosenstrasse,"Rosenstrasse in Solingen, Germany",51.1605703,7.0164338,1,,,,,,,,,Wells,"Rosenstrasse in Solingen, Germany",,german_fires_solingen_locations,cf257ac14e67e599a393ce297f06a84e,german_fires_solingen_locations__cf257ac14e67e599a393ce297f06a84e
rosenzweigstrasse,"Rosenzweigstrasse in Solingen, Germany",51.1928952,7.0713866,1,,,,,,,,,Diplomat,"Rosenzweigstrasse in Solingen, Germany",,german_fires_solingen_locations,b08ba9c16f47b160f1101010f60b125e,german_fires_solingen_locations__b08ba9c16f47b160f1101010f60b125e
rotdornweg,"Rotdornweg in Solingen, Germany",51.1811085,7.0961831,1,,,,,,,,,Pipeline,"Rotdornweg in Solingen, Germany",,german_fires_solingen_locations,19193c7e991a2aa63e50cb1c37a50676,german_fires_solingen_locations__19193c7e991a2aa63e50cb1c37a50676
rubensstrasse,"Rubensstrasse in Solingen, Germany",51.1822281,7.0304804,1,,,,,,,,,Shipping,"Rubensstrasse in Solingen, Germany",,german_fires_solingen_locations,aee6286b6bfb1afb30ca2ba406840b8d,german_fires_solingen_locations__aee6286b6bfb1afb30ca2ba406840b8d
rubezahlstrasse,"Rubezahlstrasse in Solingen, Germany",51.1731425,7.0599554,1,,,,,,,,,Consulates,"Rubezahlstrasse in Solingen, Germany",,german_fires_solingen_locations,6efccba718d8a1fe4f8106bc159f717d,german_fires_solingen_locations__6efccba718d8a1fe4f8106bc159f717d
ruckertstrasse,"Ruckertstrasse in Solingen, Germany",51.1545894,7.0126477,1,,,,,,,,,Organization,"Ruckertstrasse in Solingen, Germany",,german_fires_solingen_locations,27db962b4642e1b99b54f1ad677ffc00,german_fires_solingen_locations__27db962b4642e1b99b54f1ad677ffc00
rudener strasse,"Rudener Strasse in Solingen, Germany",51.131081,7.0634566,1,,,,,,,,,FTO,"Rudener Strasse in Solingen, Germany",,german_fires_solingen_locations,fc704a0f6a5e4f2ab17847d49d102f3d,german_fires_solingen_locations__fc704a0f6a5e4f2ab17847d49d102f3d
rudigerstrasse,"Rudigerstrasse in Solingen, Germany",51.1956788,7.0752174,1,,,,,,,,,Consulates,"Rudigerstrasse in Solingen, Germany",,german_fires_solingen_locations,8f9c87814aef32b553d67511bbfd573a,german_fires_solingen_locations__8f9c87814aef32b553d67511bbfd573a
rudolf-kronenberg-weg,"Rudolf-Kronenberg-Weg in Solingen, Germany",51.175405,7.0122404,1,,,,,,,,,FTO,"Rudolf-Kronenberg-Weg in Solingen, Germany",,german_fires_solingen_locations,405bff6393a0fee8676c021010d6119e,german_fires_solingen_locations__405bff6393a0fee8676c021010d6119e
rudolf-schwarz-strasse,"Rudolf-Schwarz-Strasse in Solingen, Germany",51.1708079,7.0679122,1,,,,,,,,,space,"Rudolf-Schwarz-Strasse in Solingen, Germany",,german_fires_solingen_locations,fdaa97f56f05cd1a71fed8ef542fff8f,german_fires_solingen_locations__fdaa97f56f05cd1a71fed8ef542fff8f
ruhrstrasse,"Ruhrstrasse in Solingen, Germany",51.1603488,6.995764,1,,,,,,,,,CompanyKeyword,"Ruhrstrasse in Solingen, Germany",,german_fires_solingen_locations,9f0cf87af63a5254148df9f5139d5bce,german_fires_solingen_locations__9f0cf87af63a5254148df9f5139d5bce
rupelrath,"Rupelrath in Solingen, Germany",51.1242043,7.0001421,1,,,,,,,,,Exec,"Rupelrath in Solingen, Germany",,german_fires_solingen_locations,2ef2ce35b670b005c4bb732dcd70d4f3,german_fires_solingen_locations__2ef2ce35b670b005c4bb732dcd70d4f3
saarstrasse,"Saarstrasse in Solingen, Germany",51.1695056,7.0751637,1,,,,,,,,,Consulates,"Saarstrasse in Solingen, Germany",,german_fires_solingen_locations,988c46dc4fb0b4f90886f216804d6f26,german_fires_solingen_locations__988c46dc4fb0b4f90886f216804d6f26
sachsenstrasse,"Sachsenstrasse in Solingen, Germany",51.1868236,7.0669416,1,,,,,,,,,Shipping,"Sachsenstrasse in Solingen, Germany",,german_fires_solingen_locations,e1349ac52c4ae2c252e3423270dc52db,german_fires_solingen_locations__e1349ac52c4ae2c252e3423270dc52db
sandstrasse,"Sandstrasse in Solingen, Germany",51.1771974,7.0717442,1,,,,,,,,,FTO,"Sandstrasse in Solingen, Germany",,german_fires_solingen_locations,1d93423c73013edfe1c60417d48b09da,german_fires_solingen_locations__1d93423c73013edfe1c60417d48b09da
sangerweg,"Sangerweg in Solingen, Germany",51.1689118,7.1102321,1,,,,,,,,,Media,"Sangerweg in Solingen, Germany",,german_fires_solingen_locations,928e2d5cee6be5c0ab3f985b6db43f9d,german_fires_solingen_locations__928e2d5cee6be5c0ab3f985b6db43f9d
saturnstrasse,"Saturnstrasse in Solingen, Germany",51.1619851,7.0177875,1,,,,,,,,,IndustryTerm,"Saturnstrasse in Solingen, Germany",,german_fires_solingen_locations,450d5f36c28b98a43788cf7633d8afff,german_fires_solingen_locations__450d5f36c28b98a43788cf7633d8afff
sauerbreystrasse,"Sauerbreystrasse in Solingen, Germany",51.1610563,7.0072145,1,,,,,,,,,Refinery,"Sauerbreystrasse in Solingen, Germany",,german_fires_solingen_locations,47816ac2cea38a1a8209d52b76db6751,german_fires_solingen_locations__47816ac2cea38a1a8209d52b76db6751
sauerlandstrasse,"Sauerlandstrasse in Solingen, Germany",51.1674775,7.0947675,1,,,,,,,,,DiplomaticFacilities,"Sauerlandstrasse in Solingen, Germany",,german_fires_solingen_locations,dbd4ec6e45623a1cabe2cb234a734f92,german_fires_solingen_locations__dbd4ec6e45623a1cabe2cb234a734f92
schaberfeld,"Schaberfeld in Solingen, Germany",51.165195,7.1217895,1,,,,,,,,,Shipping,"Schaberfeld in Solingen, Germany",,german_fires_solingen_locations,d398a52b07440ce39798dc051c82e002,german_fires_solingen_locations__d398a52b07440ce39798dc051c82e002
schaberg,"Schaberg in Solingen, Germany",51.1628667,7.1311269,1,,,,,,,,,AAEntity,"Schaberg in Solingen, Germany",,german_fires_solingen_locations,4d3f07a7a2538957db4fdccd9c9cf88e,german_fires_solingen_locations__4d3f07a7a2538957db4fdccd9c9cf88e
schaberger strasse,"Schaberger Strasse in Solingen, Germany",51.163823,7.1218811,1,,,,,,,,,DiplomaticFacilities,"Schaberger Strasse in Solingen, Germany",,german_fires_solingen_locations,92d24c3ae1ffd27a4812082362d44217,german_fires_solingen_locations__92d24c3ae1ffd27a4812082362d44217
schafenhaus,"Schafenhaus in Solingen, Germany",51.1964045,7.0999133,1,,,,,,,,,Organization,"Schafenhaus in Solingen, Germany",,german_fires_solingen_locations,2fefc15a67931aabca4d3c7055452992,german_fires_solingen_locations__2fefc15a67931aabca4d3c7055452992
scharfhausen,"Scharfhausen in Solingen, Germany",51.1483875,7.1091395,1,,,,,,,,,Consulates,"Scharfhausen in Solingen, Germany",,german_fires_solingen_locations,61374fbff35edd805c3402d651021a56,german_fires_solingen_locations__61374fbff35edd805c3402d651021a56
scharnhorststrasse,"Scharnhorststrasse in Solingen, Germany",51.1626637,7.0955481,1,,,,,,,,,News,"Scharnhorststrasse in Solingen, Germany",,german_fires_solingen_locations,0fded929fa60c6d0072029e88c5dc5a4,german_fires_solingen_locations__0fded929fa60c6d0072029e88c5dc5a4
scharrenberg,"Scharrenberg in Solingen, Germany",51.1571861,7.0107515,1,,,,,,,,,Organization,"Scharrenberg in Solingen, Germany",,german_fires_solingen_locations,28df13491d25b226668c3417d97019ee,german_fires_solingen_locations__28df13491d25b226668c3417d97019ee
scharrenberger damm,"Scharrenberger Damm in Solingen, Germany",51.1574196,7.0082011,1,,,,,,,,,Media,"Scharrenberger Damm in Solingen, Germany",,german_fires_solingen_locations,cc662f1cf817594095415a1fecb3a027,german_fires_solingen_locations__cc662f1cf817594095415a1fecb3a027
scharrenberger strasse,"Scharrenberger Strasse in Solingen, Germany",51.1593002,7.0101291,1,,,,,,,,,Media,"Scharrenberger Strasse in Solingen, Germany",,german_fires_solingen_locations,24dc7c18982ae6e376b3f5a8af9adabc,german_fires_solingen_locations__24dc7c18982ae6e376b3f5a8af9adabc
scheffelstrasse,"Scheffelstrasse in Solingen, Germany",51.1529445,7.0132487,1,,,,,,,,,Exec,"Scheffelstrasse in Solingen, Germany",,german_fires_solingen_locations,2fb83171a7f90f7da9fd0f9fadb62263,german_fires_solingen_locations__2fb83171a7f90f7da9fd0f9fadb62263
scheider muhlenweg,"Scheider Muhlenweg in Solingen, Germany",51.1794914,7.0535704,1,,,,,,,,,FTO,"Scheider Muhlenweg in Solingen, Germany",,german_fires_solingen_locations,61572572e3219fe6b67d1e685ce7b6d2,german_fires_solingen_locations__61572572e3219fe6b67d1e685ce7b6d2
scheidter feld,"Scheidter Feld in Solingen, Germany",51.1819195,7.0795337,1,,,,,,,,,IndustryTerm,"Scheidter Feld in Solingen, Germany",,german_fires_solingen_locations,3bcc0cb4c2a2c57cdda939a673cce58f,german_fires_solingen_locations__3bcc0cb4c2a2c57cdda939a673cce58f
scheidter strasse,"Scheidter Strasse in Solingen, Germany",51.1823849,7.0769249,1,,,,,,,,,Person,"Scheidter Strasse in Solingen, Germany",,german_fires_solingen_locations,34a89d9ba0af296e622c79c41d6e9ace,german_fires_solingen_locations__34a89d9ba0af296e622c79c41d6e9ace
scheidterbachstrasse,"Scheidterbachstrasse in Solingen, Germany",51.1830619,7.0740927,1,,,,,,,,,ForeignMinistry,"Scheidterbachstrasse in Solingen, Germany",,german_fires_solingen_locations,3aa5de5331bd34e7b641d278d7fd995f,german_fires_solingen_locations__3aa5de5331bd34e7b641d278d7fd995f
schelerstrasse,"Schelerstrasse in Solingen, Germany",51.1952459,7.056629,1,,,,,,,,,Legislator,"Schelerstrasse in Solingen, Germany",,german_fires_solingen_locations,69d34acba54b763da703c96d61f04b00,german_fires_solingen_locations__69d34acba54b763da703c96d61f04b00
