german_text,caption_text,lat,lon,ranking,default location,default_lat,default_lon,.1,.2,.3,.4,.5,ENTITY_LABEL,name,description,source,source_identifier,global_identifier
erbenhauschen,"Erbenhauschen in Solingen, Germany",51.181592,7.099788,1,,,,,,,,,AAEntity,"Erbenhauschen in Solingen, Germany",,german_fires_solingen_locations,cc96b4c81dea033fac8bffe642976436,german_fires_solingen_locations__cc96b4c81dea033fac8bffe642976436
erbslohstrasse,"Erbslohstrasse in Solingen, Germany",51.1790952,7.0372329,1,,,,,,,,,Legislator,"Erbslohstrasse in Solingen, Germany",,german_fires_solingen_locations,9a5c56b6cdef146de528da1f8c4592fb,german_fires_solingen_locations__9a5c56b6cdef146de528da1f8c4592fb
erf,"Erf in Solingen, Germany",51.1544696,7.0755172,1,,,,,,,,,Legislator,"Erf in Solingen, Germany",,german_fires_solingen_locations,68988da5c844ee8a6b949274bbd7a49d,german_fires_solingen_locations__68988da5c844ee8a6b949274bbd7a49d
erfer strasse,"Erfer Strasse in Solingen, Germany",51.1558415,7.0729496,1,,,,,,,,,FTO,"Erfer Strasse in Solingen, Germany",,german_fires_solingen_locations,921c380d2df0d5c695b8fcfb42f2503f,german_fires_solingen_locations__921c380d2df0d5c695b8fcfb42f2503f
erholungstrasse,"Erholungstrasse in Solingen, Germany",51.1675479,7.0325356,1,,,,,,,,,Diplomat,"Erholungstrasse in Solingen, Germany",,german_fires_solingen_locations,5eb4534411a5697201b24e80406bf64f,german_fires_solingen_locations__5eb4534411a5697201b24e80406bf64f
erich-kastner-weg,"Erich-Kastner-Weg in Solingen, Germany",51.1571425,7.0091683,1,,,,,,,,,Legislator,"Erich-Kastner-Weg in Solingen, Germany",,german_fires_solingen_locations,1c5d0c55ca8cce30ed9cc331fc3f1277,german_fires_solingen_locations__1c5d0c55ca8cce30ed9cc331fc3f1277
erikaweg,"Erikaweg in Solingen, Germany",51.1382697,7.0004654,1,,,,,,,,,Keyphrase,"Erikaweg in Solingen, Germany",,german_fires_solingen_locations,0d5c4db1514cb85875282e280c6cf777,german_fires_solingen_locations__0d5c4db1514cb85875282e280c6cf777
erlenstrasse,"Erlenstrasse in Solingen, Germany",51.1624576,6.9919101,1,,,,,,,,,ForeignMinister,"Erlenstrasse in Solingen, Germany",,german_fires_solingen_locations,457fe8a5688319fc80951d6fc05ab77e,german_fires_solingen_locations__457fe8a5688319fc80951d6fc05ab77e
ernst-barlach-strasse,"Ernst-Barlach-Strasse in Solingen, Germany",51.1840983,7.051703,1,,,,,,,,,Legislator,"Ernst-Barlach-Strasse in Solingen, Germany",,german_fires_solingen_locations,56d4b90c1d388e4cac9355cf96201e7e,german_fires_solingen_locations__56d4b90c1d388e4cac9355cf96201e7e
ernst-moritz-arndt-weg,"Ernst-Moritz-Arndt-Weg in Solingen, Germany",51.1573058,7.0756488,1,,,,,,,,,Exec,"Ernst-Moritz-Arndt-Weg in Solingen, Germany",,german_fires_solingen_locations,ac276b99825e61e2dc25e955b68227e0,german_fires_solingen_locations__ac276b99825e61e2dc25e955b68227e0
ernst-moritz-franzen-strasse,"Ernst-Moritz-Franzen-Strasse in Solingen, Germany",51.1837743,7.0433508,1,,,,,,,,,space,"Ernst-Moritz-Franzen-Strasse in Solingen, Germany",,german_fires_solingen_locations,bdd3286571a1d4b3422a4a57ce7c2e8e,german_fires_solingen_locations__bdd3286571a1d4b3422a4a57ce7c2e8e
ernst-walsken-weg,"Ernst-Walsken-Weg in Solingen, Germany",51.1547606,7.1215385,1,,,,,,,,,CompanyKeyword,"Ernst-Walsken-Weg in Solingen, Germany",,german_fires_solingen_locations,d5b799f1c8a7453f9a64d6c50f0d28bd,german_fires_solingen_locations__d5b799f1c8a7453f9a64d6c50f0d28bd
ernst-woltmann-strasse,"Ernst-Woltmann-Strasse in Solingen, Germany",51.1721849,7.0733695,1,,,,,,,,,Consulates,"Ernst-Woltmann-Strasse in Solingen, Germany",,german_fires_solingen_locations,bffc0a5d112831f46068e7312a277a60,german_fires_solingen_locations__bffc0a5d112831f46068e7312a277a60
erzgebirgestrasse,"Erzgebirgestrasse in Solingen, Germany",51.1718952,7.035433,1,,,,,,,,,space,"Erzgebirgestrasse in Solingen, Germany",,german_fires_solingen_locations,c2d9e24fb2a3f258ea49923b1d54cb3a,german_fires_solingen_locations__c2d9e24fb2a3f258ea49923b1d54cb3a
eschbach,"Eschbach in Solingen, Germany",51.1985587,7.0508402,1,,,,,,,,,Exec,"Eschbach in Solingen, Germany",,german_fires_solingen_locations,bfb2347381d4833ea6a21b0d9d6af1b3,german_fires_solingen_locations__bfb2347381d4833ea6a21b0d9d6af1b3
eschbachstrasse,"Eschbachstrasse in Solingen, Germany",51.1462489,7.1540914,1,,,,,,,,,ForeignMinister,"Eschbachstrasse in Solingen, Germany",,german_fires_solingen_locations,28e6c6f717b17a0b75013b5621fe0b21,german_fires_solingen_locations__28e6c6f717b17a0b75013b5621fe0b21
eschenweg,"Eschenweg in Solingen, Germany",51.1667192,7.0285781,1,,,,,,,,,Legislator,"Eschenweg in Solingen, Germany",,german_fires_solingen_locations,aedd4307c17fdf7b0ae509798c9d6a97,german_fires_solingen_locations__aedd4307c17fdf7b0ae509798c9d6a97
espenweg,"Espenweg in Solingen, Germany",51.1696211,7.1103699,1,,,,,,,,,LegislativeCommittee,"Espenweg in Solingen, Germany",,german_fires_solingen_locations,02a0faa9a09f3df020fa12394c0af179,german_fires_solingen_locations__02a0faa9a09f3df020fa12394c0af179
estherweg,"Estherweg in Solingen, Germany",51.1823556,7.0927806,1,,,,,,,,,Keyphrase,"Estherweg in Solingen, Germany",,german_fires_solingen_locations,47c2cedadd6e6196d5160cb26870b7e5,german_fires_solingen_locations__47c2cedadd6e6196d5160cb26870b7e5
eulerweg,"Eulerweg in Solingen, Germany",51.1502239,7.0959221,1,,,,,,,,,Refinery,"Eulerweg in Solingen, Germany",,german_fires_solingen_locations,8b158e5bfd2dfbfaaaeffcd5ca9d41e2,german_fires_solingen_locations__8b158e5bfd2dfbfaaaeffcd5ca9d41e2
falkenstrasse,"Falkenstrasse in Solingen, Germany",51.1600467,6.9933821,1,,,,,,,,,Organization,"Falkenstrasse in Solingen, Germany",,german_fires_solingen_locations,7c766c8523c36c660f7ed186b9538e80,german_fires_solingen_locations__7c766c8523c36c660f7ed186b9538e80
fallerslebenweg,"Fallerslebenweg in Solingen, Germany",51.1900752,7.0507205,1,,,,,,,,,Diplomat,"Fallerslebenweg in Solingen, Germany",,german_fires_solingen_locations,ee7886ed64911ebae899ad291518c0f0,german_fires_solingen_locations__ee7886ed64911ebae899ad291518c0f0
fasanenstrasse,"Fasanenstrasse in Solingen, Germany",51.176839,7.0412702,1,,,,,,,,,Consulates,"Fasanenstrasse in Solingen, Germany",,german_fires_solingen_locations,bc80a995adbe785389509dc876f43ae2,german_fires_solingen_locations__bc80a995adbe785389509dc876f43ae2
feldbergstrasse,"Feldbergstrasse in Solingen, Germany",51.1544219,7.02962,1,,,,,,,,,space,"Feldbergstrasse in Solingen, Germany",,german_fires_solingen_locations,6d54677f3c15897060946d092ece0c63,german_fires_solingen_locations__6d54677f3c15897060946d092ece0c63
felder hof,"Felder Hof in Solingen, Germany",51.188734,7.0426085,1,,,,,,,,,Organization,"Felder Hof in Solingen, Germany",,german_fires_solingen_locations,19f0911cab69e0dd159341fe0358893c,german_fires_solingen_locations__19f0911cab69e0dd159341fe0358893c
felder strasse,"Felder Strasse in Solingen, Germany",51.1683581,7.0942975,1,,,,,,,,,Consulates,"Felder Strasse in Solingen, Germany",,german_fires_solingen_locations,66857996c7726c6e6bd3f05f5c1a0846,german_fires_solingen_locations__66857996c7726c6e6bd3f05f5c1a0846
feldstrasse,"Feldstrasse in Solingen, Germany",51.1383635,7.1572845,1,,,,,,,,,Consulates,"Feldstrasse in Solingen, Germany",,german_fires_solingen_locations,e1d8b6342b125bdf57d8d10b077e9402,german_fires_solingen_locations__e1d8b6342b125bdf57d8d10b077e9402
feuerbachstrasse,"Feuerbachstrasse in Solingen, Germany",51.1811552,7.03613,1,,,,,,,,,News,"Feuerbachstrasse in Solingen, Germany",,german_fires_solingen_locations,6c9dee54d24e5606eb14d2f0d2d8b968,german_fires_solingen_locations__6c9dee54d24e5606eb14d2f0d2d8b968
fichtestrasse,"Fichtestrasse in Solingen, Germany",51.1802142,7.0779656,1,,,,,,,,,DiplomaticFacilities,"Fichtestrasse in Solingen, Germany",,german_fires_solingen_locations,2ae124b7782cf024e824c34f3dd07767,german_fires_solingen_locations__2ae124b7782cf024e824c34f3dd07767
finkenstrasse,"Finkenstrasse in Solingen, Germany",51.1575697,7.0882725,1,,,,,,,,,Media,"Finkenstrasse in Solingen, Germany",,german_fires_solingen_locations,d3bba717fa5113e9b1e8dadb47a16ed7,german_fires_solingen_locations__d3bba717fa5113e9b1e8dadb47a16ed7
flensburger strasse,"Flensburger Strasse in Solingen, Germany",51.1791633,7.0755179,1,,,,,,,,,Legislator,"Flensburger Strasse in Solingen, Germany",,german_fires_solingen_locations,9ad691b685687cf22db768b55a33b95a,german_fires_solingen_locations__9ad691b685687cf22db768b55a33b95a
fliederweg,"Fliederweg in Solingen, Germany",51.1402125,7.0163525,1,,,,,,,,,FTO,"Fliederweg in Solingen, Germany",,german_fires_solingen_locations,6ebc38c01f51201794b3c8a10d76fea0,german_fires_solingen_locations__6ebc38c01f51201794b3c8a10d76fea0
flockertsholzer weg,"Flockertsholzer Weg in Solingen, Germany",51.2122423,7.0906212,1,,,,,,,,,IndustryTerm,"Flockertsholzer Weg in Solingen, Germany",,german_fires_solingen_locations,7d2bdac3e073172b770e7266b82f0d9e,german_fires_solingen_locations__7d2bdac3e073172b770e7266b82f0d9e
florastrasse,"Florastrasse in Solingen, Germany",51.173039,7.0886424,1,,,,,,,,,FTO,"Florastrasse in Solingen, Germany",,german_fires_solingen_locations,e1870c1ac8da08f275a4a1655b937ee1,german_fires_solingen_locations__e1870c1ac8da08f275a4a1655b937ee1
florettweg,"Florettweg in Solingen, Germany",51.1693295,7.1049424,1,,,,,,,,,LegislativeCommittee,"Florettweg in Solingen, Germany",,german_fires_solingen_locations,cd220815841bb47d770bdb15ae7195b9,german_fires_solingen_locations__cd220815841bb47d770bdb15ae7195b9
flurstrasse,"Flurstrasse in Solingen, Germany",51.1673062,7.0829265,1,,,,,,,,,CompanyKeyword,"Flurstrasse in Solingen, Germany",,german_fires_solingen_locations,b1b10739f93601a59a2a6423c01c5764,german_fires_solingen_locations__b1b10739f93601a59a2a6423c01c5764
focher dahl,"Focher Dahl in Solingen, Germany",51.1977729,7.0715154,1,,,,,,,,,Diplomat,"Focher Dahl in Solingen, Germany",,german_fires_solingen_locations,36eebab31efd35a362cda29a9c0125fd,german_fires_solingen_locations__36eebab31efd35a362cda29a9c0125fd
focher strasse,"Focher Strasse in Solingen, Germany",51.189934,7.0641422,1,,,,,,,,,Pipeline,"Focher Strasse in Solingen, Germany",,german_fires_solingen_locations,a3ff6975b88af124db9ab0383f830ef7,german_fires_solingen_locations__a3ff6975b88af124db9ab0383f830ef7
fohrenstrasse,"Fohrenstrasse in Solingen, Germany",51.1730377,7.0901501,1,,,,,,,,,Person,"Fohrenstrasse in Solingen, Germany",,german_fires_solingen_locations,4b84e333c05ae43b9a3119537666a71f,german_fires_solingen_locations__4b84e333c05ae43b9a3119537666a71f
fontanestrasse,"Fontanestrasse in Solingen, Germany",51.1604891,7.0589544,1,,,,,,,,,Keyphrase,"Fontanestrasse in Solingen, Germany",,german_fires_solingen_locations,b30282c1f788bc820d0db67796fe2092,german_fires_solingen_locations__b30282c1f788bc820d0db67796fe2092
forststrasse,"Forststrasse in Solingen, Germany",51.1587463,6.9990862,1,,,,,,,,,FTO,"Forststrasse in Solingen, Germany",,german_fires_solingen_locations,7042e8a036c8be4986caf9f0ad27fc27,german_fires_solingen_locations__7042e8a036c8be4986caf9f0ad27fc27
frankenplatz,"Frankenplatz in Solingen, Germany",51.1864076,7.0691222,1,,,,,,,,,Legislator,"Frankenplatz in Solingen, Germany",,german_fires_solingen_locations,7e2780d9a385baa7ae9019f04a4e61d8,german_fires_solingen_locations__7e2780d9a385baa7ae9019f04a4e61d8
frankenstrasse,"Frankenstrasse in Solingen, Germany",51.1863271,7.0706666,1,,,,,,,,,Pipeline,"Frankenstrasse in Solingen, Germany",,german_fires_solingen_locations,719418eaa2d1de4c58d4f65c91c532a2,german_fires_solingen_locations__719418eaa2d1de4c58d4f65c91c532a2
frankfurter damm,"Frankfurter Damm in Solingen, Germany",51.1836878,7.0639133,1,,,,,,,,,Diplomat,"Frankfurter Damm in Solingen, Germany",,german_fires_solingen_locations,e5ba568f1445ab138a32e175c726af24,german_fires_solingen_locations__e5ba568f1445ab138a32e175c726af24
franklinplatz,"Franklinplatz in Solingen, Germany",51.1686852,7.0186114,1,,,,,,,,,Shipping,"Franklinplatz in Solingen, Germany",,german_fires_solingen_locations,2d198045f8d232ae0114930c561fb41c,german_fires_solingen_locations__2d198045f8d232ae0114930c561fb41c
fraunhoferstrasse,"Fraunhoferstrasse in Solingen, Germany",51.1679794,7.01726,1,,,,,,,,,DiplomaticFacilities,"Fraunhoferstrasse in Solingen, Germany",,german_fires_solingen_locations,b9cc5f483974e1f4c4fe5215897f6161,german_fires_solingen_locations__b9cc5f483974e1f4c4fe5215897f6161
freiheitstrasse,"Freiheitstrasse in Solingen, Germany",51.1772111,7.0246998,1,,,,,,,,,Refinery,"Freiheitstrasse in Solingen, Germany",,german_fires_solingen_locations,e67bc2887381664b02b1c5687ab8a05a,german_fires_solingen_locations__e67bc2887381664b02b1c5687ab8a05a
freiligrathstrasse,"Freiligrathstrasse in Solingen, Germany",51.1798483,7.0766869,1,,,,,,,,,IndustryTerm,"Freiligrathstrasse in Solingen, Germany",,german_fires_solingen_locations,0637ee1ac4f56e4828b97fe5827bbe6e,german_fires_solingen_locations__0637ee1ac4f56e4828b97fe5827bbe6e
friedenstrasse,"Friedenstrasse in Solingen, Germany",51.1526583,7.0211293,1,,,,,,,,,CompanyKeyword,"Friedenstrasse in Solingen, Germany",,german_fires_solingen_locations,5f4481ba2909d924855f86734ff69ca3,german_fires_solingen_locations__5f4481ba2909d924855f86734ff69ca3
friedrich-albert-lange-strasse,"Friedrich-Albert-Lange-Strasse in Solingen, Germany",51.1835907,7.038025,1,,,,,,,,,Organization,"Friedrich-Albert-Lange-Strasse in Solingen, Germany",,german_fires_solingen_locations,3018d736b3fbf8302494a22dd02c0723,german_fires_solingen_locations__3018d736b3fbf8302494a22dd02c0723
friedrich-ebert-strasse,"Friedrich-Ebert-Strasse in Solingen, Germany",51.184215,7.0464561,1,,,,,,,,,Pipeline,"Friedrich-Ebert-Strasse in Solingen, Germany",,german_fires_solingen_locations,3650e39b6d1e16e319d2cd8e07acb37a,german_fires_solingen_locations__3650e39b6d1e16e319d2cd8e07acb37a
friedrich-engels-weg,"Friedrich-Engels-Weg in Solingen, Germany",51.1588488,7.0764766,1,,,,,,,,,Shipping,"Friedrich-Engels-Weg in Solingen, Germany",,german_fires_solingen_locations,52c5dae05f8f2a28fed32dbeb7b2f5b7,german_fires_solingen_locations__52c5dae05f8f2a28fed32dbeb7b2f5b7
friedrich-wilhelm-strasse,"Friedrich-Wilhelm-Strasse in Solingen, Germany",51.1743049,7.0583082,1,,,,,,,,,FTO,"Friedrich-Wilhelm-Strasse in Solingen, Germany",,german_fires_solingen_locations,1c10d4ced88d1bdb75f1dd2ce8d03806,german_fires_solingen_locations__1c10d4ced88d1bdb75f1dd2ce8d03806
friedrichsaue,"Friedrichsaue in Solingen, Germany",51.1298459,7.0500052,1,,,,,,,,,Media,"Friedrichsaue in Solingen, Germany",,german_fires_solingen_locations,a526aa9a677d73b7c557986f6425d87a,german_fires_solingen_locations__a526aa9a677d73b7c557986f6425d87a
friedrichstal,"Friedrichstal in Solingen, Germany",51.127514,7.0554798,1,,,,,,,,,Wells,"Friedrichstal in Solingen, Germany",,german_fires_solingen_locations,d7a1f3b1f25dd09d93ab9a045167687c,german_fires_solingen_locations__d7a1f3b1f25dd09d93ab9a045167687c
friedrichstaler strasse,"Friedrichstaler Strasse in Solingen, Germany",51.1299289,7.0591063,1,,,,,,,,,space,"Friedrichstaler Strasse in Solingen, Germany",,german_fires_solingen_locations,d948b2efe653fef261d34e7512daf36e,german_fires_solingen_locations__d948b2efe653fef261d34e7512daf36e
friedrichstrasse,"Friedrichstrasse in Solingen, Germany",51.1703949,7.0770915,1,,,,,,,,,DiplomaticFacilities,"Friedrichstrasse in Solingen, Germany",,german_fires_solingen_locations,fb6004d43b9bf5560147bd251efbbe0f,german_fires_solingen_locations__fb6004d43b9bf5560147bd251efbbe0f
friesenstrasse,"Friesenstrasse in Solingen, Germany",51.1848205,7.0294813,1,,,,,,,,,Wells,"Friesenstrasse in Solingen, Germany",,german_fires_solingen_locations,d7041e28662617fc200bda9f02bb398b,german_fires_solingen_locations__d7041e28662617fc200bda9f02bb398b
fritz-grabe-strasse,"Fritz-Grabe-Strasse in Solingen, Germany",51.2079327,7.0817851,1,,,,,,,,,CompanyKeyword,"Fritz-Grabe-Strasse in Solingen, Germany",,german_fires_solingen_locations,e8cb9da5d58431be8b482cad46ce6f74,german_fires_solingen_locations__e8cb9da5d58431be8b482cad46ce6f74
fritz-haber-strasse,"Fritz-Haber-Strasse in Solingen, Germany",51.1731655,7.1004328,1,,,,,,,,,Media,"Fritz-Haber-Strasse in Solingen, Germany",,german_fires_solingen_locations,1fc9481255d6f678200b76f332974ddc,german_fires_solingen_locations__1fc9481255d6f678200b76f332974ddc
fritz-reuter-strasse,"Fritz-Reuter-Strasse in Solingen, Germany",51.1564574,7.0755832,1,,,,,,,,,ForeignMinistry,"Fritz-Reuter-Strasse in Solingen, Germany",,german_fires_solingen_locations,adf8a9d51bf5d35d9c49da38554c014a,german_fires_solingen_locations__adf8a9d51bf5d35d9c49da38554c014a
fronhof,"Fronhof in Solingen, Germany",51.1718811,7.0844245,1,,,,,,,,,Shipping,"Fronhof in Solingen, Germany",,german_fires_solingen_locations,e888198b087505299c521d922bfa222f,german_fires_solingen_locations__e888198b087505299c521d922bfa222f
fruhlingstrasse,"Fruhlingstrasse in Solingen, Germany",51.1569064,7.020158,1,,,,,,,,,Organization,"Fruhlingstrasse in Solingen, Germany",,german_fires_solingen_locations,1a743592b40270d24cab95fbd545212c,german_fires_solingen_locations__1a743592b40270d24cab95fbd545212c
fuchsweg,"Fuchsweg in Solingen, Germany",51.176192,7.0407914,1,,,,,,,,,space,"Fuchsweg in Solingen, Germany",,german_fires_solingen_locations,0d287a16cd5bde7056496cab17967810,german_fires_solingen_locations__0d287a16cd5bde7056496cab17967810
fuhr,"Fuhr in Solingen, Germany",51.1939528,7.0538776,1,,,,,,,,,space,"Fuhr in Solingen, Germany",,german_fires_solingen_locations,df055103291a3ab82d1538306a910074,german_fires_solingen_locations__df055103291a3ab82d1538306a910074
fuhrstrasse,"Fuhrstrasse in Solingen, Germany",51.1940122,7.0556153,1,,,,,,,,,Keyphrase,"Fuhrstrasse in Solingen, Germany",,german_fires_solingen_locations,c5ec6a7ebcbba281505b012fdce07c43,german_fires_solingen_locations__c5ec6a7ebcbba281505b012fdce07c43
furk,"Furk in Solingen, Germany",51.1654447,7.0222324,1,,,,,,,,,ForeignMinistry,"Furk in Solingen, Germany",,german_fires_solingen_locations,f1d926d68bec6791ca0423ff6d99e557,german_fires_solingen_locations__f1d926d68bec6791ca0423ff6d99e557
furkeltrath,"Furkeltrath in Solingen, Germany",51.2073374,7.053622,1,,,,,,,,,Legislator,"Furkeltrath in Solingen, Germany",,german_fires_solingen_locations,dbf4e163c7f1e160446d52a814908939,german_fires_solingen_locations__dbf4e163c7f1e160446d52a814908939
furker irlen,"Furker Irlen in Solingen, Germany",51.163629,7.0233472,1,,,,,,,,,FTO,"Furker Irlen in Solingen, Germany",,german_fires_solingen_locations,d68c9c7825f9077a1583443f0819d9db,german_fires_solingen_locations__d68c9c7825f9077a1583443f0819d9db
furker strasse,"Furker Strasse in Solingen, Germany",51.1646793,7.0186207,1,,,,,,,,,ForeignMinister,"Furker Strasse in Solingen, Germany",,german_fires_solingen_locations,fe4c99f954a7a7b5a277d78fd2ebd6ca,german_fires_solingen_locations__fe4c99f954a7a7b5a277d78fd2ebd6ca
furkerfeldstrasse,"Furkerfeldstrasse in Solingen, Germany",51.1649637,7.0185989,1,,,,,,,,,Diplomat,"Furkerfeldstrasse in Solingen, Germany",,german_fires_solingen_locations,472e75d55a2ba00aa202e76e31ed022f,german_fires_solingen_locations__472e75d55a2ba00aa202e76e31ed022f
gabelsbergerstrasse,"Gabelsbergerstrasse in Solingen, Germany",51.1599214,7.0884926,1,,,,,,,,,Consulates,"Gabelsbergerstrasse in Solingen, Germany",,german_fires_solingen_locations,6d07943dec9bcf5e345a8dd37ae915cc,german_fires_solingen_locations__6d07943dec9bcf5e345a8dd37ae915cc
gabelstrasse,"Gabelstrasse in Solingen, Germany",51.1574226,7.0667075,1,,,,,,,,,Organization,"Gabelstrasse in Solingen, Germany",,german_fires_solingen_locations,72a813701fa5ee4e0b1767ec51f366a2,german_fires_solingen_locations__72a813701fa5ee4e0b1767ec51f366a2
garnisonstrasse,"Garnisonstrasse in Solingen, Germany",51.2101359,7.0707346,1,,,,,,,,,Media,"Garnisonstrasse in Solingen, Germany",,german_fires_solingen_locations,a60453a3a2a8b3ed35086af7c2eb2ed8,german_fires_solingen_locations__a60453a3a2a8b3ed35086af7c2eb2ed8
gartenstrasse,"Gartenstrasse in Solingen, Germany",51.198413,7.0712755,1,,,,,,,,,CompanyKeyword,"Gartenstrasse in Solingen, Germany",,german_fires_solingen_locations,069ef8f88bcc352c0921bd220e43d2eb,german_fires_solingen_locations__069ef8f88bcc352c0921bd220e43d2eb
gartnerstrasse,"Gartnerstrasse in Solingen, Germany",51.1662145,7.0585786,1,,,,,,,,,Diplomat,"Gartnerstrasse in Solingen, Germany",,german_fires_solingen_locations,8ff58467034b3d77a0f5f7f1c56a5937,german_fires_solingen_locations__8ff58467034b3d77a0f5f7f1c56a5937
gasstrasse,"Gasstrasse in Solingen, Germany",51.1598835,7.0803,1,,,,,,,,,Keyphrase,"Gasstrasse in Solingen, Germany",,german_fires_solingen_locations,e39574a7a353a59971b72d55d604a78c,german_fires_solingen_locations__e39574a7a353a59971b72d55d604a78c
gaussweg,"Gaussweg in Solingen, Germany",51.1520298,7.1034016,1,,,,,,,,,Pipeline,"Gaussweg in Solingen, Germany",,german_fires_solingen_locations,e8e5ae92827e11b281a854626e825136,german_fires_solingen_locations__e8e5ae92827e11b281a854626e825136
gazellenstrasse,"Gazellenstrasse in Solingen, Germany",51.1749116,7.0639565,1,,,,,,,,,News,"Gazellenstrasse in Solingen, Germany",,german_fires_solingen_locations,8c024c5c015c1c03539bd514d8d89929,german_fires_solingen_locations__8c024c5c015c1c03539bd514d8d89929
gebhardtstrasse,"Gebhardtstrasse in Solingen, Germany",51.1843588,7.0484912,1,,,,,,,,,News,"Gebhardtstrasse in Solingen, Germany",,german_fires_solingen_locations,1d87c6130320869c3db5ff45902bc4b7,german_fires_solingen_locations__1d87c6130320869c3db5ff45902bc4b7
geibelstrasse,"Geibelstrasse in Solingen, Germany",51.1649977,7.0212762,1,,,,,,,,,CompanyKeyword,"Geibelstrasse in Solingen, Germany",,german_fires_solingen_locations,edc27fddfbeb0dfa7bc9c9512fc8f152,german_fires_solingen_locations__edc27fddfbeb0dfa7bc9c9512fc8f152
geilenberg,"Geilenberg in Solingen, Germany",51.1645845,7.0524863,1,,,,,,,,,Keyphrase,"Geilenberg in Solingen, Germany",,german_fires_solingen_locations,e9a5ca63850fbeb574b3b6d3d092d4f6,german_fires_solingen_locations__e9a5ca63850fbeb574b3b6d3d092d4f6
geilenberger weg,"Geilenberger Weg in Solingen, Germany",51.1653384,7.0511395,1,,,,,,,,,Refinery,"Geilenberger Weg in Solingen, Germany",,german_fires_solingen_locations,a13348138b0190d768367b8a0ae6bbbe,german_fires_solingen_locations__a13348138b0190d768367b8a0ae6bbbe
gellertstrasse,"Gellertstrasse in Solingen, Germany",51.1661918,7.0201462,1,,,,,,,,,ForeignMinistry,"Gellertstrasse in Solingen, Germany",,german_fires_solingen_locations,d0291c5ff8da6f83893865364ced8ef2,german_fires_solingen_locations__d0291c5ff8da6f83893865364ced8ef2
georg-herwegh-strasse,"Georg-Herwegh-Strasse in Solingen, Germany",51.1577224,7.077991,1,,,,,,,,,Consulates,"Georg-Herwegh-Strasse in Solingen, Germany",,german_fires_solingen_locations,cac1a89d117381ba5d2d990b78fcfc2b,german_fires_solingen_locations__cac1a89d117381ba5d2d990b78fcfc2b
georgestrasse,"Georgestrasse in Solingen, Germany",51.1892677,7.0560614,1,,,,,,,,,Shipping,"Georgestrasse in Solingen, Germany",,german_fires_solingen_locations,05bde95a9769eb9ff2ddaa16af1181ab,german_fires_solingen_locations__05bde95a9769eb9ff2ddaa16af1181ab
geranienweg,"Geranienweg in Solingen, Germany",51.1407847,7.0165719,1,,,,,,,,,DiplomaticFacilities,"Geranienweg in Solingen, Germany",,german_fires_solingen_locations,3d41cfb6eedd64e04c2d171f638d6fcf,german_fires_solingen_locations__3d41cfb6eedd64e04c2d171f638d6fcf
gerberstrasse,"Gerberstrasse in Solingen, Germany",51.2096253,7.073123,1,,,,,,,,,ForeignMinister,"Gerberstrasse in Solingen, Germany",,german_fires_solingen_locations,eb918236c58271e3d7faa87692d83cff,german_fires_solingen_locations__eb918236c58271e3d7faa87692d83cff
gerhard-hebborn-strasse,"Gerhard-Hebborn-Strasse in Solingen, Germany",51.1456801,7.004921,1,,,,,,,,,CompanyKeyword,"Gerhard-Hebborn-Strasse in Solingen, Germany",,german_fires_solingen_locations,8c88efbd23679bbbca377c0d81f95061,german_fires_solingen_locations__8c88efbd23679bbbca377c0d81f95061
gerhart-hauptmann-strasse,"Gerhart-Hauptmann-Strasse in Solingen, Germany",51.1429074,7.0038341,1,,,,,,,,,ForeignMinister,"Gerhart-Hauptmann-Strasse in Solingen, Germany",,german_fires_solingen_locations,94f3c9f46dff8f11e53b09da879a4ac4,german_fires_solingen_locations__94f3c9f46dff8f11e53b09da879a4ac4
gerichtstrasse,"Gerichtstrasse in Solingen, Germany",51.1681271,7.0880935,1,,,,,,,,,Person,"Gerichtstrasse in Solingen, Germany",,german_fires_solingen_locations,b2481ab1246fe9f82e855eab90b7226c,german_fires_solingen_locations__b2481ab1246fe9f82e855eab90b7226c
germanenstrasse,"Germanenstrasse in Solingen, Germany",51.1882209,7.0734355,1,,,,,,,,,Pipeline,"Germanenstrasse in Solingen, Germany",,german_fires_solingen_locations,b46d7a3d39dd0c39a2d8afae5f86722a,german_fires_solingen_locations__b46d7a3d39dd0c39a2d8afae5f86722a
gernotweg,"Gernotweg in Solingen, Germany",51.1960515,7.0900047,1,,,,,,,,,Consulates,"Gernotweg in Solingen, Germany",,german_fires_solingen_locations,4026dd44a365d2cf9526abe1b1ff7215,german_fires_solingen_locations__4026dd44a365d2cf9526abe1b1ff7215
gertrudisstrasse,"Gertrudisstrasse in Solingen, Germany",51.178956,7.09044,1,,,,,,,,,Exec,"Gertrudisstrasse in Solingen, Germany",,german_fires_solingen_locations,95fab032869fedddefae65f4d0460cd9,german_fires_solingen_locations__95fab032869fedddefae65f4d0460cd9
gesundheitstrasse,"Gesundheitstrasse in Solingen, Germany",51.137836,7.0148627,1,,,,,,,,,Wells,"Gesundheitstrasse in Solingen, Germany",,german_fires_solingen_locations,210ad10de76de6af920f1aedc0c32502,german_fires_solingen_locations__210ad10de76de6af920f1aedc0c32502
gillicher strasse,"Gillicher Strasse in Solingen, Germany",51.1382571,7.0162885,1,,,,,,,,,Consulates,"Gillicher Strasse in Solingen, Germany",,german_fires_solingen_locations,c3ffb9dcb601adfa0b98966594e96f25,german_fires_solingen_locations__c3ffb9dcb601adfa0b98966594e96f25
ginsterweg,"Ginsterweg in Solingen, Germany",51.1802392,7.1010378,1,,,,,,,,,ForeignMinistry,"Ginsterweg in Solingen, Germany",,german_fires_solingen_locations,a8ad0a019b0f58c78167e01703ec5bcf,german_fires_solingen_locations__a8ad0a019b0f58c78167e01703ec5bcf
