german_text,caption_text,lat,lon,ranking,default location,default_lat,default_lon,.1,.2,.3,ENTITY_LABEL,name,description,source,source_identifier,global_identifier
bubach-calmesweiler,"Bubach-Calmesweiler in Eppelborn, Germany",49.4101855,6.9431633,2,"Eppelborn, Germany",49.40806042,6.967210068,,,,Wells,"Bubach-Calmesweiler in Eppelborn, Germany",,german_fires_eppelborn_locations,8608560de52c3a52528950f3d454692d,german_fires_eppelborn_locations__8608560de52c3a52528950f3d454692d
dirmingen,"Dirmingen in Eppelborn, Germany",49.4161283,7.0137297,2,,,,,,,Pipeline,"Dirmingen in Eppelborn, Germany",,german_fires_eppelborn_locations,70d7463c52d4c1e0e88fa2a9eba8d333,german_fires_eppelborn_locations__70d7463c52d4c1e0e88fa2a9eba8d333
eppelborn,"Eppelborn in Eppelborn, Germany",49.4085629,6.9645334,2,,,,,,ss,Exec,"Eppelborn in Eppelborn, Germany",,german_fires_eppelborn_locations,8ca57a9f14c84d7ae657b8ae5640ee6f,german_fires_eppelborn_locations__8ca57a9f14c84d7ae657b8ae5640ee6f
habach,"Habach in Eppelborn, Germany",49.385262,6.959063,2,,,,,,u,Exec,"Habach in Eppelborn, Germany",,german_fires_eppelborn_locations,3df90e3fffa51630e9d71b305c8a65f7,german_fires_eppelborn_locations__3df90e3fffa51630e9d71b305c8a65f7
hierscheid,"Hierscheid in Eppelborn, Germany",49.396118,6.985714,2,,,,,,a,Refinery,"Hierscheid in Eppelborn, Germany",,german_fires_eppelborn_locations,325cfa3e945a4f6990f066508994927b,german_fires_eppelborn_locations__325cfa3e945a4f6990f066508994927b
humes,"Humes in Eppelborn, Germany",49.3902736,6.9980967,2,,,,,,o,Diplomat,"Humes in Eppelborn, Germany",,german_fires_eppelborn_locations,6eedf0d4daa46090dfa0b6e7849412a3,german_fires_eppelborn_locations__6eedf0d4daa46090dfa0b6e7849412a3
macherbach,"Macherbach in Eppelborn, Germany",49.422481,6.957921,2,,,,,,,Person,"Macherbach in Eppelborn, Germany",,german_fires_eppelborn_locations,388aacb7b1b9ce9d328dd88480a2e2bd,german_fires_eppelborn_locations__388aacb7b1b9ce9d328dd88480a2e2bd
wiesbach,"Wiesbach in Eppelborn, Germany",49.3712474,6.9792318,2,,,,,,,Exec,"Wiesbach in Eppelborn, Germany",,german_fires_eppelborn_locations,24908f260be771f8771b95f820345268,german_fires_eppelborn_locations__24908f260be771f8771b95f820345268
ackerstr.,"Ackerstr. in Eppelborn, Germany",49.3770547,6.9711839,1,,,,,,,ForeignMinister,"Ackerstr. in Eppelborn, Germany",,german_fires_eppelborn_locations,2cc1d3e7b69c74c488ed98c9111a02dd,german_fires_eppelborn_locations__2cc1d3e7b69c74c488ed98c9111a02dd
ahornweg,"Ahornweg in Eppelborn, Germany",49.4053237,6.9483527,1,,,,,,,space,"Ahornweg in Eppelborn, Germany",,german_fires_eppelborn_locations,73db66a62b6e0d63187a4240666fe4cf,german_fires_eppelborn_locations__73db66a62b6e0d63187a4240666fe4cf
alfred-gross-str.,"Alfred-Gross-Str. in Eppelborn, Germany",49.4030777,6.970916,1,,,,,,,IndustryTerm,"Alfred-Gross-Str. in Eppelborn, Germany",,german_fires_eppelborn_locations,09d5907d28be3d5e5f8f0b232828004e,german_fires_eppelborn_locations__09d5907d28be3d5e5f8f0b232828004e
alte nachtweide,"Alte Nachtweide in Eppelborn, Germany",49.393298,7.0012116,1,,,,,,,CompanyKeyword,"Alte Nachtweide in Eppelborn, Germany",,german_fires_eppelborn_locations,bc74273a16d4edba91f61d4461b67124,german_fires_eppelborn_locations__bc74273a16d4edba91f61d4461b67124
alter weg,"Alter Weg in Eppelborn, Germany",49.4087498,6.9501665,1,,,,,,,Diplomat,"Alter Weg in Eppelborn, Germany",,german_fires_eppelborn_locations,a5b29ee57813ff7b2b533aa60a418205,german_fires_eppelborn_locations__a5b29ee57813ff7b2b533aa60a418205
am alten sportplatz,"Am Alten Sportplatz in Eppelborn, Germany",49.3914666,7.0074886,1,,,,,,,space,"Am Alten Sportplatz in Eppelborn, Germany",,german_fires_eppelborn_locations,77d8a531d3a22c4984e6923a831b4147,german_fires_eppelborn_locations__77d8a531d3a22c4984e6923a831b4147
am aspenborn,"Am Aspenborn in Eppelborn, Germany",49.4071366,6.9766659,1,,,,,,,Pipeline,"Am Aspenborn in Eppelborn, Germany",,german_fires_eppelborn_locations,c331d358fd7260ea1608822fa82203fb,german_fires_eppelborn_locations__c331d358fd7260ea1608822fa82203fb
am bolzenberg,"Am Bolzenberg in Eppelborn, Germany",49.4170921,6.9370494,1,,,,,,,News,"Am Bolzenberg in Eppelborn, Germany",,german_fires_eppelborn_locations,b99dbf73c763ca088cc515623d2fb7fd,german_fires_eppelborn_locations__b99dbf73c763ca088cc515623d2fb7fd
am brunnen,"Am Brunnen in Eppelborn, Germany",49.3956859,6.9912715,1,,,,,,,Organization,"Am Brunnen in Eppelborn, Germany",,german_fires_eppelborn_locations,d231505d1b416bb38329e6ed9b923e51,german_fires_eppelborn_locations__d231505d1b416bb38329e6ed9b923e51
am dorrwald,"Am Dorrwald in Eppelborn, Germany",49.4096418,7.0199249,1,,,,,,,Legislator,"Am Dorrwald in Eppelborn, Germany",,german_fires_eppelborn_locations,23d716a1b0360d688b3be0b601340a0f,german_fires_eppelborn_locations__23d716a1b0360d688b3be0b601340a0f
am friedhof,"Am Friedhof in Eppelborn, Germany",49.3841025,6.9945834,1,,,,,,,CompanyKeyword,"Am Friedhof in Eppelborn, Germany",,german_fires_eppelborn_locations,0945e4eda87a3c8add1544b6cb4526d9,german_fires_eppelborn_locations__0945e4eda87a3c8add1544b6cb4526d9
am gansebrunnchen,"Am Gansebrunnchen in Eppelborn, Germany",49.4218712,7.0105813,1,,,,,,,ForeignMinistry,"Am Gansebrunnchen in Eppelborn, Germany",,german_fires_eppelborn_locations,4a91d229cc3a7868da4b2edea2c53fdb,german_fires_eppelborn_locations__4a91d229cc3a7868da4b2edea2c53fdb
am guterbahnhof,"Am Guterbahnhof in Eppelborn, Germany",49.4094397,6.9696091,1,,,,,,,Legislator,"Am Guterbahnhof in Eppelborn, Germany",,german_fires_eppelborn_locations,a805c6da6f4acd6a1ef711ab8fada34e,german_fires_eppelborn_locations__a805c6da6f4acd6a1ef711ab8fada34e
am hierscheider graben,"Am Hierscheider Graben in Eppelborn, Germany",49.4085629,6.9645334,1,,,,,,,space,"Am Hierscheider Graben in Eppelborn, Germany",,german_fires_eppelborn_locations,e2ec9ccdac6e825d11857e2b9a0d5f13,german_fires_eppelborn_locations__e2ec9ccdac6e825d11857e2b9a0d5f13
am hirtenhaus,"Am Hirtenhaus in Eppelborn, Germany",49.3834276,6.9586281,1,,,,,,,Exec,"Am Hirtenhaus in Eppelborn, Germany",,german_fires_eppelborn_locations,3200d66be0cbd356bfe6e460ba59968c,german_fires_eppelborn_locations__3200d66be0cbd356bfe6e460ba59968c
am hundsberg,"Am Hundsberg in Eppelborn, Germany",49.4146515,7.0108501,1,,,,,,,space,"Am Hundsberg in Eppelborn, Germany",,german_fires_eppelborn_locations,cccbbacc6e33aac753989aa7e48410a8,german_fires_eppelborn_locations__cccbbacc6e33aac753989aa7e48410a8
am happelsberg,"Am Happelsberg in Eppelborn, Germany",49.3731569,6.971097,1,,,,,,,Media,"Am Happelsberg in Eppelborn, Germany",,german_fires_eppelborn_locations,fd6c2b4761d71d327329eb7dbbe48d6e,german_fires_eppelborn_locations__fd6c2b4761d71d327329eb7dbbe48d6e
am kalkstollen,"Am Kalkstollen in Eppelborn, Germany",49.4181044,7.0209513,1,,,,,,,Refinery,"Am Kalkstollen in Eppelborn, Germany",,german_fires_eppelborn_locations,33052d4d3c2970efa54b25250d1f428e,german_fires_eppelborn_locations__33052d4d3c2970efa54b25250d1f428e
am kindergarten,"Am Kindergarten in Eppelborn, Germany",49.4119361,6.9513968,1,,,,,,,Diplomat,"Am Kindergarten in Eppelborn, Germany",,german_fires_eppelborn_locations,71e5d683a64b476d17374254912bebd2,german_fires_eppelborn_locations__71e5d683a64b476d17374254912bebd2
am kloster,"Am Kloster in Eppelborn, Germany",49.4085577,6.9703695,1,,,,,,,FTO,"Am Kloster in Eppelborn, Germany",,german_fires_eppelborn_locations,fae43f90e1dc4dd557736fcbcb8cdd1f,german_fires_eppelborn_locations__fae43f90e1dc4dd557736fcbcb8cdd1f
am kreckelbach,"Am Kreckelbach in Eppelborn, Germany",49.3693061,6.976171,1,,,,,,,Shipping,"Am Kreckelbach in Eppelborn, Germany",,german_fires_eppelborn_locations,0998f42a2635e648ec7162b6193e4bb0,german_fires_eppelborn_locations__0998f42a2635e648ec7162b6193e4bb0
am langen weiher,"Am Langen Weiher in Eppelborn, Germany",49.2454818,7.2008134,1,,,,,,,Legislator,"Am Langen Weiher in Eppelborn, Germany",,german_fires_eppelborn_locations,cc6eeeeadc1b23608080a61379a8ff15,german_fires_eppelborn_locations__cc6eeeeadc1b23608080a61379a8ff15
am markt,"Am Markt in Eppelborn, Germany",49.4080523,6.9688774,1,,,,,,,ForeignMinistry,"Am Markt in Eppelborn, Germany",,german_fires_eppelborn_locations,1e66f1fc13a14716c938c69bd1c07485,german_fires_eppelborn_locations__1e66f1fc13a14716c938c69bd1c07485
am michelswald,"Am Michelswald in Eppelborn, Germany",49.3818446,6.9534961,1,,,,,,,Pipeline,"Am Michelswald in Eppelborn, Germany",,german_fires_eppelborn_locations,a7da9cd7fa747adb849fd83cdd4a8f77,german_fires_eppelborn_locations__a7da9cd7fa747adb849fd83cdd4a8f77
am render,"Am Render in Eppelborn, Germany",49.4186103,7.013871,1,,,,,,,FTO,"Am Render in Eppelborn, Germany",,german_fires_eppelborn_locations,a70712fe4f938197df1c95fd9ac5d7cc,german_fires_eppelborn_locations__a70712fe4f938197df1c95fd9ac5d7cc
am rotenberg,"Am Rotenberg in Eppelborn, Germany",49.4207157,7.0128512,1,,,,,,,Consulates,"Am Rotenberg in Eppelborn, Germany",,german_fires_eppelborn_locations,b3b95e3565c420ce7d6d8e66434fe967,german_fires_eppelborn_locations__b3b95e3565c420ce7d6d8e66434fe967
am scheibengraben,"Am Scheibengraben in Eppelborn, Germany",49.4058151,6.9505243,1,,,,,,,Person,"Am Scheibengraben in Eppelborn, Germany",,german_fires_eppelborn_locations,d187a8384d71a44aa9f9385c6067fe19,german_fires_eppelborn_locations__d187a8384d71a44aa9f9385c6067fe19
am schaferberg,"Am Schaferberg in Eppelborn, Germany",49.3962067,6.9937972,1,,,,,,,IndustryTerm,"Am Schaferberg in Eppelborn, Germany",,german_fires_eppelborn_locations,65d8ac5e2f195d83ef5d8679e522d5a7,german_fires_eppelborn_locations__65d8ac5e2f195d83ef5d8679e522d5a7
am steinbruch,"Am Steinbruch in Eppelborn, Germany",49.4139528,7.017314,1,,,,,,,LegislativeCommittee,"Am Steinbruch in Eppelborn, Germany",,german_fires_eppelborn_locations,1b381a0e8b733761cc76aa7dd94ea86a,german_fires_eppelborn_locations__1b381a0e8b733761cc76aa7dd94ea86a
am steinhugel,"Am Steinhugel in Eppelborn, Germany",49.409068,6.9773006,1,,,,,,,LegislativeCommittee,"Am Steinhugel in Eppelborn, Germany",,german_fires_eppelborn_locations,c27088d3717fb315cb0050caf15dcddc,german_fires_eppelborn_locations__c27088d3717fb315cb0050caf15dcddc
am wackenberg,"Am Wackenberg in Eppelborn, Germany",49.3901314,6.9922455,1,,,,,,,ForeignMinistry,"Am Wackenberg in Eppelborn, Germany",,german_fires_eppelborn_locations,d17457ec78e086dbca431ab2e9726c1d,german_fires_eppelborn_locations__d17457ec78e086dbca431ab2e9726c1d
am winnewald,"Am Winnewald in Eppelborn, Germany",49.4130584,7.0114228,1,,,,,,,CompanyKeyword,"Am Winnewald in Eppelborn, Germany",,german_fires_eppelborn_locations,d4fa2c4c46c9bb6149d91f8aad62ebb4,german_fires_eppelborn_locations__d4fa2c4c46c9bb6149d91f8aad62ebb4
an der hardt,"An der Hardt in Eppelborn, Germany",49.4079566,7.0142711,1,,,,,,,Consulates,"An der Hardt in Eppelborn, Germany",,german_fires_eppelborn_locations,fccae79d4c4b2ea1910565f851a13ac5,german_fires_eppelborn_locations__fccae79d4c4b2ea1910565f851a13ac5
auf bauerhaus,"Auf Bauerhaus in Eppelborn, Germany",49.4163978,7.0188799,1,,,,,,,Wells,"Auf Bauerhaus in Eppelborn, Germany",,german_fires_eppelborn_locations,be07c65ba27fbb4748e7aa56c8b2731f,german_fires_eppelborn_locations__be07c65ba27fbb4748e7aa56c8b2731f
auf dem echer,"Auf dem Echer in Eppelborn, Germany",49.3697823,6.9856433,1,,,,,,,ForeignMinister,"Auf dem Echer in Eppelborn, Germany",,german_fires_eppelborn_locations,8e073a82d7563aa7118b6e013eb8a2cc,german_fires_eppelborn_locations__8e073a82d7563aa7118b6e013eb8a2cc
auf dem herrenberg,"Auf dem Herrenberg in Eppelborn, Germany",49.4046789,6.9719539,1,,,,,,,Refinery,"Auf dem Herrenberg in Eppelborn, Germany",,german_fires_eppelborn_locations,f4f6984c47c77a9626e04faa45ed849c,german_fires_eppelborn_locations__f4f6984c47c77a9626e04faa45ed849c
auf dem roth,"Auf dem Roth in Eppelborn, Germany",49.4141313,6.9538835,1,,,,,,,Refinery,"Auf dem Roth in Eppelborn, Germany",,german_fires_eppelborn_locations,a72200e12132fc39866a9333768d7dd8,german_fires_eppelborn_locations__a72200e12132fc39866a9333768d7dd8
auf der dorr,"Auf der Dorr in Eppelborn, Germany",49.3674304,6.967276,1,,,,,,,space,"Auf der Dorr in Eppelborn, Germany",,german_fires_eppelborn_locations,c31873a1c07048d811d3a53728d022eb,german_fires_eppelborn_locations__c31873a1c07048d811d3a53728d022eb
auf der hohl,"Auf der Hohl in Eppelborn, Germany",49.4018751,6.9593087,1,,,,,,,space,"Auf der Hohl in Eppelborn, Germany",,german_fires_eppelborn_locations,cf89b20355976037bdab5ddd936ddf05,german_fires_eppelborn_locations__cf89b20355976037bdab5ddd936ddf05
auf drei eichen,"Auf Drei Eichen in Eppelborn, Germany",49.4042182,6.9748472,1,,,,,,,ForeignMinister,"Auf Drei Eichen in Eppelborn, Germany",,german_fires_eppelborn_locations,15d6e00519a2422ccbecfd806f678e51,german_fires_eppelborn_locations__15d6e00519a2422ccbecfd806f678e51
auf weilerland,"Auf Weilerland in Eppelborn, Germany",49.4124179,6.9603407,1,,,,,,,LegislativeCommittee,"Auf Weilerland in Eppelborn, Germany",,german_fires_eppelborn_locations,b97b1f3434e0e6421a3884dab5b7f445,german_fires_eppelborn_locations__b97b1f3434e0e6421a3884dab5b7f445
augustinusstr.,"Augustinusstr. in Eppelborn, Germany",49.3714061,6.9796268,1,,,,,,,Diplomat,"Augustinusstr. in Eppelborn, Germany",,german_fires_eppelborn_locations,405ae82bc2a2e4b6926dd5b6b063f521,german_fires_eppelborn_locations__405ae82bc2a2e4b6926dd5b6b063f521
aussiedlerhof berghof,"Aussiedlerhof Berghof in Eppelborn, Germany",49.417755,6.964492,1,,,,,,,Media,"Aussiedlerhof Berghof in Eppelborn, Germany",,german_fires_eppelborn_locations,2ea336dab5b521c68866ec245bda8dad,german_fires_eppelborn_locations__2ea336dab5b521c68866ec245bda8dad
bahnhofstr.,"Bahnhofstr. in Eppelborn, Germany",49.4078373,6.9664839,1,,,,,,,Person,"Bahnhofstr. in Eppelborn, Germany",,german_fires_eppelborn_locations,a5344db6e9ebf4829b9dc7596b407dad,german_fires_eppelborn_locations__a5344db6e9ebf4829b9dc7596b407dad
bergstr.,"Bergstr. in Eppelborn, Germany",49.4097784,6.9411324,1,,,,,,,Pipeline,"Bergstr. in Eppelborn, Germany",,german_fires_eppelborn_locations,34e4d945ef8e48b1d40aa51725094eb0,german_fires_eppelborn_locations__34e4d945ef8e48b1d40aa51725094eb0
berschweilerstr.,"Berschweilerstr. in Eppelborn, Germany",49.4208843,7.0193359,1,,,,,,,FTO,"Berschweilerstr. in Eppelborn, Germany",,german_fires_eppelborn_locations,5c4a0dd8dfb73e906e32f9cab949e260,german_fires_eppelborn_locations__5c4a0dd8dfb73e906e32f9cab949e260
birkenweg,"Birkenweg in Eppelborn, Germany",49.4116697,6.9808502,1,,,,,,,Exec,"Birkenweg in Eppelborn, Germany",,german_fires_eppelborn_locations,25bad1d1bfc29fa0ce7c231a953d91a4,german_fires_eppelborn_locations__25bad1d1bfc29fa0ce7c231a953d91a4
blumenweg,"Blumenweg in Eppelborn, Germany",49.3993401,6.9875392,1,,,,,,,IndustryTerm,"Blumenweg in Eppelborn, Germany",,german_fires_eppelborn_locations,bb18c94d3644caf80a8f0e0858b19804,german_fires_eppelborn_locations__bb18c94d3644caf80a8f0e0858b19804
bolzenbergstr.,"Bolzenbergstr. in Eppelborn, Germany",49.4148575,6.9280741,1,,,,,,,CompanyKeyword,"Bolzenbergstr. in Eppelborn, Germany",,german_fires_eppelborn_locations,b7449e4aade9224a8548c76377dab6e3,german_fires_eppelborn_locations__b7449e4aade9224a8548c76377dab6e3
borre-eck,"Borre-Eck in Eppelborn, Germany",49.4115199,6.9425981,1,,,,,,,Exec,"Borre-Eck in Eppelborn, Germany",,german_fires_eppelborn_locations,2a1a9554f242bfa5e1c936da1e76c60b,german_fires_eppelborn_locations__2a1a9554f242bfa5e1c936da1e76c60b
bruchstr.,"Bruchstr. in Eppelborn, Germany",49.4115192,6.9372095,1,,,,,,,Exec,"Bruchstr. in Eppelborn, Germany",,german_fires_eppelborn_locations,83fbd362dff1800c04a52bf16423a343,german_fires_eppelborn_locations__83fbd362dff1800c04a52bf16423a343
brunnenplatz,"Brunnenplatz in Eppelborn, Germany",49.413247,6.9510887,1,,,,,,,IndustryTerm,"Brunnenplatz in Eppelborn, Germany",,german_fires_eppelborn_locations,76168cbb497f3026173e52b27778dcb2,german_fires_eppelborn_locations__76168cbb497f3026173e52b27778dcb2
brunnenstr.,"Brunnenstr. in Eppelborn, Germany",49.3700247,6.9770428,1,,,,,,,Diplomat,"Brunnenstr. in Eppelborn, Germany",,german_fires_eppelborn_locations,01b6d53c84bc2b75f925bd683ec84eaf,german_fires_eppelborn_locations__01b6d53c84bc2b75f925bd683ec84eaf
bruhlstr.,"Bruhlstr. in Eppelborn, Germany",49.3717672,6.9788328,1,,,,,,,LegislativeCommittee,"Bruhlstr. in Eppelborn, Germany",,german_fires_eppelborn_locations,f150d285246be75d74131ba8d9eafd58,german_fires_eppelborn_locations__f150d285246be75d74131ba8d9eafd58
buchenweg,"Buchenweg in Eppelborn, Germany",49.3716471,6.9700718,1,,,,,,,DiplomaticFacilities,"Buchenweg in Eppelborn, Germany",,german_fires_eppelborn_locations,b509aa954737963ffe8cb61fed13c796,german_fires_eppelborn_locations__b509aa954737963ffe8cb61fed13c796
bollingerstr.,"Bollingerstr. in Eppelborn, Germany",49.4181832,7.017405,1,,,,,,,Exec,"Bollingerstr. in Eppelborn, Germany",,german_fires_eppelborn_locations,91b36f3cb93d41b7d6808bea6d7bbb23,german_fires_eppelborn_locations__91b36f3cb93d41b7d6808bea6d7bbb23
calmesweilerstr.,"Calmesweilerstr. in Eppelborn, Germany",49.4114413,6.9490761,1,,,,,,,LegislativeCommittee,"Calmesweilerstr. in Eppelborn, Germany",,german_fires_eppelborn_locations,16ef18a04280b9b504d86c6dbba3d084,german_fires_eppelborn_locations__16ef18a04280b9b504d86c6dbba3d084
dirminger str.,"Dirminger Str. in Eppelborn, Germany",49.4110601,6.9757915,1,,,,,,,space,"Dirminger Str. in Eppelborn, Germany",,german_fires_eppelborn_locations,3206ecde2658337dc93919b1b16e7060,german_fires_eppelborn_locations__3206ecde2658337dc93919b1b16e7060
dompstr.,"Dompstr. in Eppelborn, Germany",49.4082676,6.9411097,1,,,,,,,Consulates,"Dompstr. in Eppelborn, Germany",,german_fires_eppelborn_locations,4f8fa47715dbb510fbeae965bb85bd21,german_fires_eppelborn_locations__4f8fa47715dbb510fbeae965bb85bd21
dorfstr.,"Dorfstr. in Eppelborn, Germany",49.3722298,6.9810723,1,,,,,,,Refinery,"Dorfstr. in Eppelborn, Germany",,german_fires_eppelborn_locations,233b807f82200914b8fc3572f1ae46aa,german_fires_eppelborn_locations__233b807f82200914b8fc3572f1ae46aa
eichenweg,"Eichenweg in Eppelborn, Germany",49.4122217,6.9804257,1,,,,,,,Media,"Eichenweg in Eppelborn, Germany",,german_fires_eppelborn_locations,940460076c407c4c7fea36615d766c60,german_fires_eppelborn_locations__940460076c407c4c7fea36615d766c60
eiweilerstr.,"Eiweilerstr. in Eppelborn, Germany",49.3691488,6.9706557,1,,,,,,,Keyphrase,"Eiweilerstr. in Eppelborn, Germany",,german_fires_eppelborn_locations,b5149430c2795b5f8b45579f27fe328a,german_fires_eppelborn_locations__b5149430c2795b5f8b45579f27fe328a
eppelborner str.,"Eppelborner Str. in Eppelborn, Germany",49.3831787,6.9613285,1,,,,,,,ForeignMinister,"Eppelborner Str. in Eppelborn, Germany",,german_fires_eppelborn_locations,ae5ef1e5b2893896ecf3a695f2f34d99,german_fires_eppelborn_locations__ae5ef1e5b2893896ecf3a695f2f34d99
erlenweg,"Erlenweg in Eppelborn, Germany",49.3728149,6.9677678,1,,,,,,,Refinery,"Erlenweg in Eppelborn, Germany",,german_fires_eppelborn_locations,75d0cff6c12e8654f43ae5d42e624427,german_fires_eppelborn_locations__75d0cff6c12e8654f43ae5d42e624427
europaplatz,"Europaplatz in Eppelborn, Germany",49.407323,6.9693671,1,,,,,,,Keyphrase,"Europaplatz in Eppelborn, Germany",,german_fires_eppelborn_locations,ed39aa4a0694e6c9b23825aed8ea6945,german_fires_eppelborn_locations__ed39aa4a0694e6c9b23825aed8ea6945
feldstr.,"Feldstr. in Eppelborn, Germany",49.398013,6.9843329,1,,,,,,,DiplomaticFacilities,"Feldstr. in Eppelborn, Germany",,german_fires_eppelborn_locations,1d3c2e2246858cbf3e0ca280c030b2bd,german_fires_eppelborn_locations__1d3c2e2246858cbf3e0ca280c030b2bd
fichtenweg,"Fichtenweg in Eppelborn, Germany",49.412082,6.9818747,1,,,,,,,ForeignMinistry,"Fichtenweg in Eppelborn, Germany",,german_fires_eppelborn_locations,96064446d3cdba11d339e0bbc4c4e34b,german_fires_eppelborn_locations__96064446d3cdba11d339e0bbc4c4e34b
florianweg,"Florianweg in Eppelborn, Germany",49.3979755,6.9890084,1,,,,,,,Organization,"Florianweg in Eppelborn, Germany",,german_fires_eppelborn_locations,334555cca1b80501925cafe91731031c,german_fires_eppelborn_locations__334555cca1b80501925cafe91731031c
flurweg,"Flurweg in Eppelborn, Germany",49.4131033,6.9631807,1,,,,,,,ForeignMinister,"Flurweg in Eppelborn, Germany",,german_fires_eppelborn_locations,075d44a0ef06b21454f58fd414de4df0,german_fires_eppelborn_locations__075d44a0ef06b21454f58fd414de4df0
forststr.,"Forststr. in Eppelborn, Germany",49.3927137,7.0068745,1,,,,,,,space,"Forststr. in Eppelborn, Germany",,german_fires_eppelborn_locations,795cae4695edf4bdc19745af7f3400cf,german_fires_eppelborn_locations__795cae4695edf4bdc19745af7f3400cf
galgenbergstr.,"Galgenbergstr. in Eppelborn, Germany",49.4115444,6.9621325,1,,,,,,,AAEntity,"Galgenbergstr. in Eppelborn, Germany",,german_fires_eppelborn_locations,4bbd83c3c68959adcdf36945b9d50367,german_fires_eppelborn_locations__4bbd83c3c68959adcdf36945b9d50367
gewerbepark,"Gewerbepark in Eppelborn, Germany",49.4094586,6.9711539,1,,,,,,,Legislator,"Gewerbepark in Eppelborn, Germany",,german_fires_eppelborn_locations,e3a9bc8cb2929b6c9749d951175ef41e,german_fires_eppelborn_locations__e3a9bc8cb2929b6c9749d951175ef41e
ginsterweg,"Ginsterweg in Eppelborn, Germany",49.3988666,6.9891422,1,,,,,,,Wells,"Ginsterweg in Eppelborn, Germany",,german_fires_eppelborn_locations,79abb87a54692f623a639dee90f1777e,german_fires_eppelborn_locations__79abb87a54692f623a639dee90f1777e
grosswaldstr.,"Grosswaldstr. in Eppelborn, Germany",49.3717458,6.9436136,1,,,,,,,DiplomaticFacilities,"Grosswaldstr. in Eppelborn, Germany",,german_fires_eppelborn_locations,5d6b91ad985c6d4a3722d40774499bfc,german_fires_eppelborn_locations__5d6b91ad985c6d4a3722d40774499bfc
grosswies,"Grosswies in Eppelborn, Germany",49.3890661,6.9915886,1,,,,,,,LegislativeCommittee,"Grosswies in Eppelborn, Germany",,german_fires_eppelborn_locations,246055e86ff112720852f92037139a24,german_fires_eppelborn_locations__246055e86ff112720852f92037139a24
grubenstr.,"Grubenstr. in Eppelborn, Germany",49.370006,6.9888743,1,,,,,,,LegislativeCommittee,"Grubenstr. in Eppelborn, Germany",,german_fires_eppelborn_locations,0c080890be8b85e889fe43e4c59a2c4b,german_fires_eppelborn_locations__0c080890be8b85e889fe43e4c59a2c4b
habacher str.,"Habacher Str. in Eppelborn, Germany",49.3783861,6.9633419,1,,,,,,,FTO,"Habacher Str. in Eppelborn, Germany",,german_fires_eppelborn_locations,1d45b42059f685262864a80d8eee5d81,german_fires_eppelborn_locations__1d45b42059f685262864a80d8eee5d81
hahnenstr.,"Hahnenstr. in Eppelborn, Germany",49.4078101,6.9761457,1,,,,,,,Consulates,"Hahnenstr. in Eppelborn, Germany",,german_fires_eppelborn_locations,e2db6263b43ec8862421802c5cd187ed,german_fires_eppelborn_locations__e2db6263b43ec8862421802c5cd187ed
hanfgarten,"Hanfgarten in Eppelborn, Germany",49.4064553,6.9581662,1,,,,,,,Keyphrase,"Hanfgarten in Eppelborn, Germany",,german_fires_eppelborn_locations,26bf4c79000d3b0cd561f62b03823a7b,german_fires_eppelborn_locations__26bf4c79000d3b0cd561f62b03823a7b
hans-gross-str.,"Hans-Gross-Str. in Eppelborn, Germany",49.4089543,6.9396849,1,,,,,,,DiplomaticFacilities,"Hans-Gross-Str. in Eppelborn, Germany",,german_fires_eppelborn_locations,ad09825b67296a1282146dfd57a6be00,german_fires_eppelborn_locations__ad09825b67296a1282146dfd57a6be00
hauptstr.,"Hauptstr. in Eppelborn, Germany",49.3734828,6.9791288,1,,,,,,,Diplomat,"Hauptstr. in Eppelborn, Germany",,german_fires_eppelborn_locations,e8f4cb686b7943076bbfce95387d2f24,german_fires_eppelborn_locations__e8f4cb686b7943076bbfce95387d2f24
hellbergstr.,"Hellbergstr. in Eppelborn, Germany",49.4048987,6.9611516,1,,,,,,,Exec,"Hellbergstr. in Eppelborn, Germany",,german_fires_eppelborn_locations,12a32026534467729c52fd0e6f78cd2f,german_fires_eppelborn_locations__12a32026534467729c52fd0e6f78cd2f
henselbergstr.,"Henselbergstr. in Eppelborn, Germany",49.4167474,6.9514528,1,,,,,,,Keyphrase,"Henselbergstr. in Eppelborn, Germany",,german_fires_eppelborn_locations,028d91091b2b2689db033268601462f9,german_fires_eppelborn_locations__028d91091b2b2689db033268601462f9
herrenachtstr.,"Herrenachtstr. in Eppelborn, Germany",49.4086145,6.9484667,1,,,,,,,Wells,"Herrenachtstr. in Eppelborn, Germany",,german_fires_eppelborn_locations,b315dc04b5646df508483a1803288f7e,german_fires_eppelborn_locations__b315dc04b5646df508483a1803288f7e
herrengarten,"Herrengarten in Eppelborn, Germany",49.4144762,7.0158644,1,,,,,,,Pipeline,"Herrengarten in Eppelborn, Germany",,german_fires_eppelborn_locations,3d8bb805e971c3e3619636904f54d662,german_fires_eppelborn_locations__3d8bb805e971c3e3619636904f54d662
heusweilerstr.,"Heusweilerstr. in Eppelborn, Germany",49.3614575,6.9810735,1,,,,,,,Person,"Heusweilerstr. in Eppelborn, Germany",,german_fires_eppelborn_locations,18a191e0a8c069b2eb6132cacfb53812,german_fires_eppelborn_locations__18a191e0a8c069b2eb6132cacfb53812
hierscheider str.,"Hierscheider Str. in Eppelborn, Germany",49.4143948,7.0096384,1,,,,,,,Keyphrase,"Hierscheider Str. in Eppelborn, Germany",,german_fires_eppelborn_locations,5e21cefb9bb552b22b440485fad2da37,german_fires_eppelborn_locations__5e21cefb9bb552b22b440485fad2da37
hohlstr.,"Hohlstr. in Eppelborn, Germany",49.3731034,6.9732343,1,,,,,,,FTO,"Hohlstr. in Eppelborn, Germany",,german_fires_eppelborn_locations,51edc25585e8fd44f99491870456d198,german_fires_eppelborn_locations__51edc25585e8fd44f99491870456d198
humeser str.,"Humeser Str. in Eppelborn, Germany",49.4097592,7.0133763,1,,,,,,,Shipping,"Humeser Str. in Eppelborn, Germany",,german_fires_eppelborn_locations,ae34ee03b7a5b2286ca6e253f878b5f8,german_fires_eppelborn_locations__ae34ee03b7a5b2286ca6e253f878b5f8
hoppesbusch,"Hoppesbusch in Eppelborn, Germany",49.4207193,7.0078444,1,,,,,,,ForeignMinister,"Hoppesbusch in Eppelborn, Germany",,german_fires_eppelborn_locations,203bda9414ebecfaaf51829c0a4cad66,german_fires_eppelborn_locations__203bda9414ebecfaaf51829c0a4cad66
illinger str.,"Illinger Str. in Eppelborn, Germany",49.4118169,7.0156936,1,,,,,,,Exec,"Illinger Str. in Eppelborn, Germany",,german_fires_eppelborn_locations,5382711bcf376768c21225e39c441537,german_fires_eppelborn_locations__5382711bcf376768c21225e39c441537
