german_text,caption_text,lat,lon,ranking,default location,default_lat,default_lon,.1,.2,ENTITY_LABEL,name,description,source,source_identifier,global_identifier
holzteichstrasse,"Holzteichstrasse in Greifswald, Germany",54.1009061,13.3931592,1,,,,,,Legislator,"Holzteichstrasse in Greifswald, Germany",,german_fires_greifswald_locations,09e38df457cce68da082fc968f0e9259,german_fires_greifswald_locations__09e38df457cce68da082fc968f0e9259
hornschuchstrasse,"Hornschuchstrasse in Greifswald, Germany",54.0940234,13.4100577,1,,,,,,Shipping,"Hornschuchstrasse in Greifswald, Germany",,german_fires_greifswald_locations,e218d646f4d5e412338d69d809e88f47,german_fires_greifswald_locations__e218d646f4d5e412338d69d809e88f47
hugo-finke-strasse,"Hugo-Finke-Strasse in Greifswald, Germany",54.097433,13.4399059,1,,,,,,Organization,"Hugo-Finke-Strasse in Greifswald, Germany",,german_fires_greifswald_locations,cf066c823e625cb6be460c89aa16b029,german_fires_greifswald_locations__cf066c823e625cb6be460c89aa16b029
hugo-helfritz-strasse,"Hugo-Helfritz-Strasse in Greifswald, Germany",54.0954894,13.4024113,1,,,,,,Organization,"Hugo-Helfritz-Strasse in Greifswald, Germany",,german_fires_greifswald_locations,e6ca14bf8e77f519073a80e436b9f927,german_fires_greifswald_locations__e6ca14bf8e77f519073a80e436b9f927
hunnenstrasse,"Hunnenstrasse in Greifswald, Germany",54.0970728,13.3771746,1,,,,,,Wells,"Hunnenstrasse in Greifswald, Germany",,german_fires_greifswald_locations,5983b10841d013d6c3de40e086104f47,german_fires_greifswald_locations__5983b10841d013d6c3de40e086104f47
inselweg,"Inselweg in Greifswald, Germany",54.1634864,13.3970267,1,,,,,,ForeignMinistry,"Inselweg in Greifswald, Germany",,german_fires_greifswald_locations,839c18934b23d8c58b21a7101ffff713,german_fires_greifswald_locations__839c18934b23d8c58b21a7101ffff713
jasmunder weg,"Jasmunder Weg in Greifswald, Germany",54.0928794,13.4246353,1,,,,,,ForeignMinister,"Jasmunder Weg in Greifswald, Germany",,german_fires_greifswald_locations,f80b54286ca7978ba810b5cac498bb6b,german_fires_greifswald_locations__f80b54286ca7978ba810b5cac498bb6b
johann-sebastian-bach-strasse,"Johann-Sebastian-Bach-Strasse in Greifswald, Germany",54.0973682,13.3810777,1,,,,,,Person,"Johann-Sebastian-Bach-Strasse in Greifswald, Germany",,german_fires_greifswald_locations,afb73cc8a7682a343e00075ee50b1ecf,german_fires_greifswald_locations__afb73cc8a7682a343e00075ee50b1ecf
johann-stelling-strasse,"Johann-Stelling-Strasse in Greifswald, Germany",54.0922439,13.3966363,1,,,,,,Wells,"Johann-Stelling-Strasse in Greifswald, Germany",,german_fires_greifswald_locations,1d65db6a2a2f5a18277ff332aea4fad0,german_fires_greifswald_locations__1d65db6a2a2f5a18277ff332aea4fad0
johannes-bobrowski-strasse,"Johannes-Bobrowski-Strasse in Greifswald, Germany",54.0831535,13.3608591,1,,,,,,LegislativeCommittee,"Johannes-Bobrowski-Strasse in Greifswald, Germany",,german_fires_greifswald_locations,533b7faa3143039f31fa71ee3e6036ad,german_fires_greifswald_locations__533b7faa3143039f31fa71ee3e6036ad
joliot-curie-strasse,"Joliot-Curie-Strasse in Greifswald, Germany",54.0777639,13.4029386,1,,,,,,Wells,"Joliot-Curie-Strasse in Greifswald, Germany",,german_fires_greifswald_locations,f1cb5e08122600405dffde781081d3b8,german_fires_greifswald_locations__f1cb5e08122600405dffde781081d3b8
kathe-kollwitz-strasse,"Kathe-Kollwitz-Strasse in Greifswald, Germany",54.0942387,13.3917768,1,,,,,,Organization,"Kathe-Kollwitz-Strasse in Greifswald, Germany",,german_fires_greifswald_locations,e073f520e6dea871cda56808b79d6001,german_fires_greifswald_locations__e073f520e6dea871cda56808b79d6001
kampswiese,"Kampswiese in Greifswald, Germany",54.0941469,13.346726,1,,,,,,Pipeline,"Kampswiese in Greifswald, Germany",,german_fires_greifswald_locations,cbc6836e865e18387847a8258a1225c8,german_fires_greifswald_locations__cbc6836e865e18387847a8258a1225c8
kapaunenstrasse,"Kapaunenstrasse in Greifswald, Germany",54.0967911,13.3738377,1,,,,,,Person,"Kapaunenstrasse in Greifswald, Germany",,german_fires_greifswald_locations,05c84a3903616f908e4b6672802e7569,german_fires_greifswald_locations__05c84a3903616f908e4b6672802e7569
karl-behrendt-weg,"Karl-Behrendt-Weg in Greifswald, Germany",54.0833397,13.3984315,1,,,,,,Exec,"Karl-Behrendt-Weg in Greifswald, Germany",,german_fires_greifswald_locations,5435f8b24460256f15b30f83fe3d2f43,german_fires_greifswald_locations__5435f8b24460256f15b30f83fe3d2f43
karl-krull-strasse,"Karl-Krull-Strasse in Greifswald, Germany",54.0853704,13.402184,1,,,,,,Shipping,"Karl-Krull-Strasse in Greifswald, Germany",,german_fires_greifswald_locations,c9dd7e62f9d4d4d6ab11928412c145ab,german_fires_greifswald_locations__c9dd7e62f9d4d4d6ab11928412c145ab
karl-liebknecht-ring,"Karl-Liebknecht-Ring in Greifswald, Germany",54.0868396,13.4064929,1,,,,,,Shipping,"Karl-Liebknecht-Ring in Greifswald, Germany",,german_fires_greifswald_locations,55bb823a72c1e2c9606500428ab0057e,german_fires_greifswald_locations__55bb823a72c1e2c9606500428ab0057e
karl-marx-platz,"Karl-Marx-Platz in Greifswald, Germany",54.095336,13.3679402,1,,,,,,Refinery,"Karl-Marx-Platz in Greifswald, Germany",,german_fires_greifswald_locations,d685e6a716a9c26bedb4f0fe5784f0ba,german_fires_greifswald_locations__d685e6a716a9c26bedb4f0fe5784f0ba
karl-schildener-strasse,"Karl-Schildener-Strasse in Greifswald, Germany",54.0662519,13.4285463,1,,,,,,Pipeline,"Karl-Schildener-Strasse in Greifswald, Germany",,german_fires_greifswald_locations,d51df163732d9f345a20c3297bc3e606,german_fires_greifswald_locations__d51df163732d9f345a20c3297bc3e606
kastanienstrasse,"Kastanienstrasse in Greifswald, Germany",54.0882566,13.4419874,1,,,,,,FTO,"Kastanienstrasse in Greifswald, Germany",,german_fires_greifswald_locations,f65119fa8996ee17a7f1f8c57040813a,german_fires_greifswald_locations__f65119fa8996ee17a7f1f8c57040813a
kegelkamp,"Kegelkamp in Greifswald, Germany",54.0985897,13.4365656,1,,,,,,Refinery,"Kegelkamp in Greifswald, Germany",,german_fires_greifswald_locations,a4a416a97bac39e25efe3b5129105eb5,german_fires_greifswald_locations__a4a416a97bac39e25efe3b5129105eb5
kemnitzer wende,"Kemnitzer Wende in Greifswald, Germany",54.0781065,13.4138807,1,,,,,,ForeignMinister,"Kemnitzer Wende in Greifswald, Germany",,german_fires_greifswald_locations,4001ee92f3baae3fd989f56f9be204a7,german_fires_greifswald_locations__4001ee92f3baae3fd989f56f9be204a7
kiebitzhorn,"Kiebitzhorn in Greifswald, Germany",54.0943576,13.3508723,1,,,,,,LegislativeCommittee,"Kiebitzhorn in Greifswald, Germany",,german_fires_greifswald_locations,afcf701c873f3f132b9da6d9d2580809,german_fires_greifswald_locations__afcf701c873f3f132b9da6d9d2580809
kirchstrasse,"Kirchstrasse in Greifswald, Germany",54.0963805,13.4475504,1,,,,,,Wells,"Kirchstrasse in Greifswald, Germany",,german_fires_greifswald_locations,6fc1ebd11cff193794c3d8fcd7999aaf,german_fires_greifswald_locations__6fc1ebd11cff193794c3d8fcd7999aaf
kirschenweg,"Kirschenweg in Greifswald, Germany",54.0817594,13.3928788,1,,,,,,Diplomat,"Kirschenweg in Greifswald, Germany",,german_fires_greifswald_locations,c994c8ec3aa7875c5cdfeb467804c06a,german_fires_greifswald_locations__c994c8ec3aa7875c5cdfeb467804c06a
klaus-groth-strasse,"Klaus-Groth-Strasse in Greifswald, Germany",54.0789896,13.361168,1,,,,,,Shipping,"Klaus-Groth-Strasse in Greifswald, Germany",,german_fires_greifswald_locations,6a4bf81a43ff14fc4ce3ab52d068e9a3,german_fires_greifswald_locations__6a4bf81a43ff14fc4ce3ab52d068e9a3
kleine hafenstrasse,"Kleine Hafenstrasse in Greifswald, Germany",54.0988641,13.3997898,1,,,,,,Organization,"Kleine Hafenstrasse in Greifswald, Germany",,german_fires_greifswald_locations,27e399e7b1523b54733b9043aa38ac1b,german_fires_greifswald_locations__27e399e7b1523b54733b9043aa38ac1b
knopfstrasse,"Knopfstrasse in Greifswald, Germany",54.0973631,13.3823495,1,,,,,,CompanyKeyword,"Knopfstrasse in Greifswald, Germany",,german_fires_greifswald_locations,7e3b6379cde59782e2604b2c5c012746,german_fires_greifswald_locations__7e3b6379cde59782e2604b2c5c012746
knud-rasmussen-strasse,"Knud-Rasmussen-Strasse in Greifswald, Germany",54.0923328,13.4244027,1,,,,,,Person,"Knud-Rasmussen-Strasse in Greifswald, Germany",,german_fires_greifswald_locations,dc80d580e97e52735a4068f6e666705a,german_fires_greifswald_locations__dc80d580e97e52735a4068f6e666705a
koitenhager landstrasse,"Koitenhager Landstrasse in Greifswald, Germany",54.0821019,13.428407,1,,,,,,FTO,"Koitenhager Landstrasse in Greifswald, Germany",,german_fires_greifswald_locations,1cfc61b172bea904e8029e4eeef2d190,german_fires_greifswald_locations__1cfc61b172bea904e8029e4eeef2d190
kooser weg,"Kooser Weg in Greifswald, Germany",54.0897567,13.4313984,1,,,,,,Media,"Kooser Weg in Greifswald, Germany",,german_fires_greifswald_locations,81d4814eed06b92cba503b63352eac12,german_fires_greifswald_locations__81d4814eed06b92cba503b63352eac12
kopenhagener strasse,"Kopenhagener Strasse in Greifswald, Germany",54.0899482,13.4235413,1,,,,,,Person,"Kopenhagener Strasse in Greifswald, Germany",,german_fires_greifswald_locations,f8fd7d195657910c0a0910847e30e586,german_fires_greifswald_locations__f8fd7d195657910c0a0910847e30e586
kornblumenweg,"Kornblumenweg in Greifswald, Germany",54.0775162,13.4267953,1,,,,,,CompanyKeyword,"Kornblumenweg in Greifswald, Germany",,german_fires_greifswald_locations,bc7c8edd184e9a618a8f130fe091ee5c,german_fires_greifswald_locations__bc7c8edd184e9a618a8f130fe091ee5c
kosegartenstrasse,"Kosegartenstrasse in Greifswald, Germany",54.0858342,13.3661049,1,,,,,,News,"Kosegartenstrasse in Greifswald, Germany",,german_fires_greifswald_locations,71e690f71db078a233eb71bb27d4ee58,german_fires_greifswald_locations__71e690f71db078a233eb71bb27d4ee58
kotkaring,"Kotkaring in Greifswald, Germany",54.0884123,13.4243972,1,,,,,,LegislativeCommittee,"Kotkaring in Greifswald, Germany",,german_fires_greifswald_locations,2c661172391cf693fa5ab8905659b6e6,german_fires_greifswald_locations__2c661172391cf693fa5ab8905659b6e6
krapeliner wende,"Krapeliner Wende in Greifswald, Germany",54.0797559,13.4144166,1,,,,,,Wells,"Krapeliner Wende in Greifswald, Germany",,german_fires_greifswald_locations,67261ff67ebbef326c87100675aadbe0,german_fires_greifswald_locations__67261ff67ebbef326c87100675aadbe0
kuhstrasse,"Kuhstrasse in Greifswald, Germany",54.0968011,13.3848343,1,,,,,,Refinery,"Kuhstrasse in Greifswald, Germany",,german_fires_greifswald_locations,2ce520985ca10eecdca907cf8f3a3e7f,german_fires_greifswald_locations__2ce520985ca10eecdca907cf8f3a3e7f
kurt-tucholsky-strasse,"Kurt-Tucholsky-Strasse in Greifswald, Germany",54.0844246,13.3608091,1,,,,,,Consulates,"Kurt-Tucholsky-Strasse in Greifswald, Germany",,german_fires_greifswald_locations,b64436ce7308d788af60fe8880a0bc8a,german_fires_greifswald_locations__b64436ce7308d788af60fe8880a0bc8a
kurtschatowweg,"Kurtschatowweg in Greifswald, Germany",54.0799228,13.4097334,1,,,,,,Diplomat,"Kurtschatowweg in Greifswald, Germany",,german_fires_greifswald_locations,d1adabf43ec35125d52fddf253b3e509,german_fires_greifswald_locations__d1adabf43ec35125d52fddf253b3e509
kurzer weg,"Kurzer Weg in Greifswald, Germany",54.0852177,13.4491997,1,,,,,,Diplomat,"Kurzer Weg in Greifswald, Germany",,german_fires_greifswald_locations,95a74a799e0eae1563bc5b1b768a9990,german_fires_greifswald_locations__95a74a799e0eae1563bc5b1b768a9990
ladebower chaussee,"Ladebower Chaussee in Greifswald, Germany",54.1054998,13.4060942,1,,,,,,Exec,"Ladebower Chaussee in Greifswald, Germany",,german_fires_greifswald_locations,4e861fd9bf0fdd2e2bc0e13bc68d1a05,german_fires_greifswald_locations__4e861fd9bf0fdd2e2bc0e13bc68d1a05
langsfuhr,"Langsfuhr in Greifswald, Germany",54.0751987,13.3911463,1,,,,,,CompanyKeyword,"Langsfuhr in Greifswald, Germany",,german_fires_greifswald_locations,71c74a882fa2ba3713b231398351052c,german_fires_greifswald_locations__71c74a882fa2ba3713b231398351052c
lange reihe,"Lange Reihe in Greifswald, Germany",54.0910167,13.3847496,1,,,,,,Pipeline,"Lange Reihe in Greifswald, Germany",,german_fires_greifswald_locations,191e8c86ef4e8745379d41655f84d01c,german_fires_greifswald_locations__191e8c86ef4e8745379d41655f84d01c
lange strasse,"Lange Strasse in Greifswald, Germany",54.0959505,13.3752545,1,,,,,,FTO,"Lange Strasse in Greifswald, Germany",,german_fires_greifswald_locations,00a1ee34962bdbee8dd11e33451b80b9,german_fires_greifswald_locations__00a1ee34962bdbee8dd11e33451b80b9
lappstrasse,"Lappstrasse in Greifswald, Germany",54.0954832,13.3789515,1,,,,,,News,"Lappstrasse in Greifswald, Germany",,german_fires_greifswald_locations,d3652acadad2c965ac31b2815c08ad2b,german_fires_greifswald_locations__d3652acadad2c965ac31b2815c08ad2b
lessingstrasse,"Lessingstrasse in Greifswald, Germany",54.0806384,13.3695249,1,,,,,,space,"Lessingstrasse in Greifswald, Germany",,german_fires_greifswald_locations,ce7257bdb51795cf0af24444901635bb,german_fires_greifswald_locations__ce7257bdb51795cf0af24444901635bb
lindenstrasse,"Lindenstrasse in Greifswald, Germany",54.0855217,13.441741,1,,,,,,ForeignMinistry,"Lindenstrasse in Greifswald, Germany",,german_fires_greifswald_locations,224ccfcbc3a035f73cc74aca34d61c19,german_fires_greifswald_locations__224ccfcbc3a035f73cc74aca34d61c19
lise-meitner-strasse,"Lise-Meitner-Strasse in Greifswald, Germany",54.0772906,13.4136027,1,,,,,,Person,"Lise-Meitner-Strasse in Greifswald, Germany",,german_fires_greifswald_locations,8f3db90ed1ff02500d5b551ae92ba936,german_fires_greifswald_locations__8f3db90ed1ff02500d5b551ae92ba936
loissiner wende,"Loissiner Wende in Greifswald, Germany",54.0820209,13.4113348,1,,,,,,ForeignMinistry,"Loissiner Wende in Greifswald, Germany",,german_fires_greifswald_locations,40948021a942bedce061f5f86003c7c7,german_fires_greifswald_locations__40948021a942bedce061f5f86003c7c7
loitzer landstrasse,"Loitzer Landstrasse in Greifswald, Germany",54.0856531,13.3595713,1,,,,,,Person,"Loitzer Landstrasse in Greifswald, Germany",,german_fires_greifswald_locations,9b192b69aaa1f2dd2943cd015c395b66,german_fires_greifswald_locations__9b192b69aaa1f2dd2943cd015c395b66
loitzer strasse,"Loitzer Strasse in Greifswald, Germany",54.0921978,13.3631941,1,,,,,,Person,"Loitzer Strasse in Greifswald, Germany",,german_fires_greifswald_locations,1be64562b1a8b11f1bdda3ae954c55fe,german_fires_greifswald_locations__1be64562b1a8b11f1bdda3ae954c55fe
lomonossowallee,"Lomonossowallee in Greifswald, Germany",54.0794119,13.4058029,1,,,,,,Pipeline,"Lomonossowallee in Greifswald, Germany",,german_fires_greifswald_locations,857847d358699981005d62620b5c4eff,german_fires_greifswald_locations__857847d358699981005d62620b5c4eff
lubecker strasse,"Lubecker Strasse in Greifswald, Germany",54.0865214,13.4555192,1,,,,,,News,"Lubecker Strasse in Greifswald, Germany",,german_fires_greifswald_locations,c4593d73e2eb71657207d04b8f8420fc,german_fires_greifswald_locations__c4593d73e2eb71657207d04b8f8420fc
lubminer platz,"Lubminer Platz in Greifswald, Germany",54.0875553,13.431035,1,,,,,,Consulates,"Lubminer Platz in Greifswald, Germany",,german_fires_greifswald_locations,a47d14f16e47397a926437e5676a7a71,german_fires_greifswald_locations__a47d14f16e47397a926437e5676a7a71
ludwigsburger wende,"Ludwigsburger Wende in Greifswald, Germany",54.0823183,13.4095297,1,,,,,,Keyphrase,"Ludwigsburger Wende in Greifswald, Germany",,german_fires_greifswald_locations,9d320eb5d015a03d06a4defa276d367b,german_fires_greifswald_locations__9d320eb5d015a03d06a4defa276d367b
makarenkostrasse,"Makarenkostrasse in Greifswald, Germany",54.0842389,13.4133727,1,,,,,,FTO,"Makarenkostrasse in Greifswald, Germany",,german_fires_greifswald_locations,9c3cd24aabb283fc52397e4325d9ccda,german_fires_greifswald_locations__9c3cd24aabb283fc52397e4325d9ccda
margarethe-lachmund-strasse,"Margarethe-Lachmund-Strasse in Greifswald, Germany",54.1019069,13.4303953,1,,,,,,Refinery,"Margarethe-Lachmund-Strasse in Greifswald, Germany",,german_fires_greifswald_locations,a0d4a47c4fc16fcf383a5ba7c9c69afe,german_fires_greifswald_locations__a0d4a47c4fc16fcf383a5ba7c9c69afe
marienkirchplatz,"Marienkirchplatz in Greifswald, Germany",54.0966226,13.3835151,1,,,,,,FTO,"Marienkirchplatz in Greifswald, Germany",,german_fires_greifswald_locations,95853e4112c95811390356cc43541414,german_fires_greifswald_locations__95853e4112c95811390356cc43541414
marienstrasse,"Marienstrasse in Greifswald, Germany",54.0968686,13.3895932,1,,,,,,Refinery,"Marienstrasse in Greifswald, Germany",,german_fires_greifswald_locations,d3bc76197031d72a9ab22dd0a4163207,german_fires_greifswald_locations__d3bc76197031d72a9ab22dd0a4163207
markt,"Markt in Greifswald, Germany",54.0961268,13.3816683,1,,,,,,DiplomaticFacilities,"Markt in Greifswald, Germany",,german_fires_greifswald_locations,e060bbb0336126998cd7fb3ab0ec7bea,german_fires_greifswald_locations__e060bbb0336126998cd7fb3ab0ec7bea
martin-andersen-nexo-platz,"Martin-Andersen-Nexo-Platz in Greifswald, Germany",54.0927471,13.3877897,1,,,,,,Exec,"Martin-Andersen-Nexo-Platz in Greifswald, Germany",,german_fires_greifswald_locations,8497925fd199cef8eae2f5cbcb963cf4,german_fires_greifswald_locations__8497925fd199cef8eae2f5cbcb963cf4
martin-luther-strasse,"Martin-Luther-Strasse in Greifswald, Germany",54.0943472,13.378215,1,,,,,,ForeignMinistry,"Martin-Luther-Strasse in Greifswald, Germany",,german_fires_greifswald_locations,dac0dd3370e4159d017d5c1fc0f91827,german_fires_greifswald_locations__dac0dd3370e4159d017d5c1fc0f91827
max-born-strasse,"Max-Born-Strasse in Greifswald, Germany",54.0781325,13.4149751,1,,,,,,Diplomat,"Max-Born-Strasse in Greifswald, Germany",,german_fires_greifswald_locations,79a4570c7615b78d760ec90352bdcbdc,german_fires_greifswald_locations__79a4570c7615b78d760ec90352bdcbdc
max-hagen-weg,"Max-Hagen-Weg in Greifswald, Germany",54.0834334,13.4008117,1,,,,,,Refinery,"Max-Hagen-Weg in Greifswald, Germany",,german_fires_greifswald_locations,b7ec2817308c37f60240d6e7b494040b,german_fires_greifswald_locations__b7ec2817308c37f60240d6e7b494040b
max-planck-strasse,"Max-Planck-Strasse in Greifswald, Germany",54.0812635,13.4076959,1,,,,,,Keyphrase,"Max-Planck-Strasse in Greifswald, Germany",,german_fires_greifswald_locations,5c28a83251ec4727cd2f33fb8bb5bc83,german_fires_greifswald_locations__5c28a83251ec4727cd2f33fb8bb5bc83
max-reimann-strasse,"Max-Reimann-Strasse in Greifswald, Germany",54.0991432,13.4389696,1,,,,,,Organization,"Max-Reimann-Strasse in Greifswald, Germany",,german_fires_greifswald_locations,25cc74468f99d16223288596a2b72ef7,german_fires_greifswald_locations__25cc74468f99d16223288596a2b72ef7
maxim-gorki-strasse,"Maxim-Gorki-Strasse in Greifswald, Germany",54.0817524,13.4237122,1,,,,,,News,"Maxim-Gorki-Strasse in Greifswald, Germany",,german_fires_greifswald_locations,f3d919fe412dfbda9e43c14fa569f15a,german_fires_greifswald_locations__f3d919fe412dfbda9e43c14fa569f15a
mendelejewweg,"Mendelejewweg in Greifswald, Germany",54.0779376,13.4176892,1,,,,,,ForeignMinistry,"Mendelejewweg in Greifswald, Germany",,german_fires_greifswald_locations,2f341980881c4e6bb8613fb5efbc295e,german_fires_greifswald_locations__2f341980881c4e6bb8613fb5efbc295e
mittelstrasse,"Mittelstrasse in Greifswald, Germany",54.0905357,13.3910915,1,,,,,,ForeignMinistry,"Mittelstrasse in Greifswald, Germany",,german_fires_greifswald_locations,ed289ccf3044b2e8c471ea31cd2cf18d,german_fires_greifswald_locations__ed289ccf3044b2e8c471ea31cd2cf18d
monchguter weg,"Monchguter Weg in Greifswald, Germany",54.0925621,13.4232609,1,,,,,,DiplomaticFacilities,"Monchguter Weg in Greifswald, Germany",,german_fires_greifswald_locations,bd86847f942528f093ff9d1945b33f3e,german_fires_greifswald_locations__bd86847f942528f093ff9d1945b33f3e
moorweide,"Moorweide in Greifswald, Germany",54.0992022,13.4398655,1,,,,,,Organization,"Moorweide in Greifswald, Germany",,german_fires_greifswald_locations,96ffa70e0bfa65af23efafdf58a2111d,german_fires_greifswald_locations__96ffa70e0bfa65af23efafdf58a2111d
moritz-becherer-strasse,"Moritz-Becherer-Strasse in Greifswald, Germany",54.0625676,13.4412524,1,,,,,,Person,"Moritz-Becherer-Strasse in Greifswald, Germany",,german_fires_greifswald_locations,58605bace9189cf7f7dc0f5fa77d63e1,german_fires_greifswald_locations__58605bace9189cf7f7dc0f5fa77d63e1
muhlenstrasse,"Muhlenstrasse in Greifswald, Germany",54.0954045,13.3835705,1,,,,,,Refinery,"Muhlenstrasse in Greifswald, Germany",,german_fires_greifswald_locations,472a0ce0209275c786ecca3ad3a31b4f,german_fires_greifswald_locations__472a0ce0209275c786ecca3ad3a31b4f
muhlenweg,"Muhlenweg in Greifswald, Germany",54.0895222,13.3530236,1,,,,,,Refinery,"Muhlenweg in Greifswald, Germany",,german_fires_greifswald_locations,ed25b1ec135adfd3ea448ebd7b8cdee8,german_fires_greifswald_locations__ed25b1ec135adfd3ea448ebd7b8cdee8
munterstrasse,"Munterstrasse in Greifswald, Germany",54.0932992,13.3679128,1,,,,,,ForeignMinister,"Munterstrasse in Greifswald, Germany",,german_fires_greifswald_locations,5501fe35c0530ceb6a71f9e026c5f302,german_fires_greifswald_locations__5501fe35c0530ceb6a71f9e026c5f302
nelkenweg,"Nelkenweg in Greifswald, Germany",54.0800787,13.3944649,1,,,,,,Organization,"Nelkenweg in Greifswald, Germany",,german_fires_greifswald_locations,dc580c2ff54b6753cf900eb451618d72,german_fires_greifswald_locations__dc580c2ff54b6753cf900eb451618d72
neue strasse,"Neue Strasse in Greifswald, Germany",54.0975378,13.4491159,1,,,,,,LegislativeCommittee,"Neue Strasse in Greifswald, Germany",,german_fires_greifswald_locations,1f391c9196c794b5dd38359427e238d0,german_fires_greifswald_locations__1f391c9196c794b5dd38359427e238d0
neuendorfer wende,"Neuendorfer Wende in Greifswald, Germany",54.079587,13.4110813,1,,,,,,AAEntity,"Neuendorfer Wende in Greifswald, Germany",,german_fires_greifswald_locations,78849eb20f34b972aff967b3fef03e6e,german_fires_greifswald_locations__78849eb20f34b972aff967b3fef03e6e
neuer brinkhof,"Neuer Brinkhof in Greifswald, Germany",54.0906776,13.3861976,1,,,,,,ForeignMinistry,"Neuer Brinkhof in Greifswald, Germany",,german_fires_greifswald_locations,c4ceb396d577f3d3436e48275d619e58,german_fires_greifswald_locations__c4ceb396d577f3d3436e48275d619e58
neunmorgenstrasse,"Neunmorgenstrasse in Greifswald, Germany",54.0882038,13.3815985,1,,,,,,space,"Neunmorgenstrasse in Greifswald, Germany",,german_fires_greifswald_locations,11ef59bd0a565536f315227f68f4e2b0,german_fires_greifswald_locations__11ef59bd0a565536f315227f68f4e2b0
newtonstrasse,"Newtonstrasse in Greifswald, Germany",54.0785169,13.4158242,1,,,,,,Refinery,"Newtonstrasse in Greifswald, Germany",,german_fires_greifswald_locations,b9f6622c2031f6e58e3facb8599ebf00,german_fires_greifswald_locations__b9f6622c2031f6e58e3facb8599ebf00
niels-bohr-strasse,"Niels-Bohr-Strasse in Greifswald, Germany",54.0801652,13.3995262,1,,,,,,LegislativeCommittee,"Niels-Bohr-Strasse in Greifswald, Germany",,german_fires_greifswald_locations,15d208da3dd19b7faa48720b11b033ab,german_fires_greifswald_locations__15d208da3dd19b7faa48720b11b033ab
nikolaikirchplatz,"Nikolaikirchplatz in Greifswald, Germany",54.0957501,13.3771219,1,,,,,,Exec,"Nikolaikirchplatz in Greifswald, Germany",,german_fires_greifswald_locations,5d6344a5eb31de0a0caab822699de788,german_fires_greifswald_locations__5d6344a5eb31de0a0caab822699de788
nikolajewweg,"Nikolajewweg in Greifswald, Germany",54.0828335,13.4082587,1,,,,,,Exec,"Nikolajewweg in Greifswald, Germany",,german_fires_greifswald_locations,e1b7f29d0edc28aa2a12f2ed7d0e8dfc,german_fires_greifswald_locations__e1b7f29d0edc28aa2a12f2ed7d0e8dfc
nordstrasse,"Nordstrasse in Greifswald, Germany",54.1041765,13.4431021,1,,,,,,LegislativeCommittee,"Nordstrasse in Greifswald, Germany",,german_fires_greifswald_locations,5f6a648c6d4aa2eacb9b4dd5adda9866,german_fires_greifswald_locations__5f6a648c6d4aa2eacb9b4dd5adda9866
ochsensteg,"Ochsensteg in Greifswald, Germany",54.0950839,13.4443154,1,,,,,,News,"Ochsensteg in Greifswald, Germany",,german_fires_greifswald_locations,f3d3cea982e8c958dc9dd36f295ccd8d,german_fires_greifswald_locations__f3d3cea982e8c958dc9dd36f295ccd8d
osloer strasse,"Osloer Strasse in Greifswald, Germany",54.088853,13.4218307,1,,,,,,Wells,"Osloer Strasse in Greifswald, Germany",,german_fires_greifswald_locations,906bbbb38473de5730bd3ed961739cda,german_fires_greifswald_locations__906bbbb38473de5730bd3ed961739cda
osnabrucker strasse,"Osnabrucker Strasse in Greifswald, Germany",54.0899211,13.3745216,1,,,,,,ForeignMinister,"Osnabrucker Strasse in Greifswald, Germany",,german_fires_greifswald_locations,c4bbdec6c3f91500f988bc7767389dd6,german_fires_greifswald_locations__c4bbdec6c3f91500f988bc7767389dd6
ostrowskistrasse,"Ostrowskistrasse in Greifswald, Germany",54.0802208,13.4216163,1,,,,,,Shipping,"Ostrowskistrasse in Greifswald, Germany",,german_fires_greifswald_locations,c287836ea3ab360e576b73be50569947,german_fires_greifswald_locations__c287836ea3ab360e576b73be50569947
ostseestrasse,"Ostseestrasse in Greifswald, Germany",54.0902363,13.4218019,1,,,,,,ForeignMinister,"Ostseestrasse in Greifswald, Germany",,german_fires_greifswald_locations,f424f55583f8e4674ba14051d3da692e,german_fires_greifswald_locations__f424f55583f8e4674ba14051d3da692e
pappelallee,"Pappelallee in Greifswald, Germany",54.0850468,13.4264292,1,,,,,,Media,"Pappelallee in Greifswald, Germany",,german_fires_greifswald_locations,896d4a81fd086a448cf47104c79799b3,german_fires_greifswald_locations__896d4a81fd086a448cf47104c79799b3
paul-uhlenhuth-strasse,"Paul-Uhlenhuth-Strasse in Greifswald, Germany",54.0866728,13.3956896,1,,,,,,IndustryTerm,"Paul-Uhlenhuth-Strasse in Greifswald, Germany",,german_fires_greifswald_locations,4669025c6003fb9b275820efd1e4b0a7,german_fires_greifswald_locations__4669025c6003fb9b275820efd1e4b0a7
pestalozzistrasse,"Pestalozzistrasse in Greifswald, Germany",54.0873488,13.3831492,1,,,,,,Refinery,"Pestalozzistrasse in Greifswald, Germany",,german_fires_greifswald_locations,93d55b2a664c3c6eff08b85f721e389f,german_fires_greifswald_locations__93d55b2a664c3c6eff08b85f721e389f
